"location","source","target","id","fuzzy","context","translator_comments","developer_comments"
"","TEXT_REGROC2NOTORIOUSMONSTERHINTF1_00265_ALEXONDRE_000_000<tab>What's an adventurer like you doing in a place like this? We don't get many of your kind around these parts. Take care of yourself out there, <var 08 E905 ((lass)) ((lad)) /var>─if the wildlife don't get you, the cold will.","TEXT_REGROC2NOTORIOUSMONSTERHINTF1_00265_ALEXONDRE_000_000<tab>へぇ、こんな場所で冒険者に会うとはな。<br>珍しいこともあったもんだ。","","False","0x00000000","",""
"","TEXT_REGROC2NOTORIOUSMONSTERHINTF1_00265_ALEXONDRE_000_001<tab>Well, if it isn't a fellow member of the Clan. Welcome to Falcon's Nest, <var 08 E905 ((sister)) ((brother)) /var>. I expect you'll be wanting to learn about the local fauna.","TEXT_REGROC2NOTORIOUSMONSTERHINTF1_00265_ALEXONDRE_000_001<tab>おや、「クラン・セントリオ」の同志かい。<br>このあたりのリスキーモブの情報を知りたいんだろ？","","False","0x00000001","",""
"","TEXT_REGROC2NOTORIOUSMONSTERHINTF1_00265_ALEXONDRE_Q1_000_000<tab>What will you ask?","TEXT_REGROC2NOTORIOUSMONSTERHINTF1_00265_ALEXONDRE_Q1_000_000<tab>何を聞く？","","False","0x00000002","",""
"","TEXT_REGROC2NOTORIOUSMONSTERHINTF1_00265_ALEXONDRE_A1_000_001<tab>Tell me about the rank B elite mark. (Alteci)","TEXT_REGROC2NOTORIOUSMONSTERHINTF1_00265_ALEXONDRE_A1_000_001<tab>ランクB：孤高の野獣「アルティック」について","","False","0x00000003","",""
"","TEXT_REGROC2NOTORIOUSMONSTERHINTF1_00265_ALEXONDRE_A1_000_002<tab>Tell me about the rank B elite mark. (Kreutzet)","TEXT_REGROC2NOTORIOUSMONSTERHINTF1_00265_ALEXONDRE_A1_000_002<tab>ランクB：快速の始祖鳥「クルーゼ」について","","False","0x00000004","",""
"","TEXT_REGROC2NOTORIOUSMONSTERHINTF1_00265_ALEXONDRE_A1_000_003<tab>Tell me about the rank A elite mark. (Mirka)","TEXT_REGROC2NOTORIOUSMONSTERHINTF1_00265_ALEXONDRE_A1_000_003<tab>ランクA：一角の雪男「ミルカ」について","","False","0x00000005","",""
"","TEXT_REGROC2NOTORIOUSMONSTERHINTF1_00265_ALEXONDRE_A1_000_004<tab>Tell me about the rank A elite mark. (Lyuba)","TEXT_REGROC2NOTORIOUSMONSTERHINTF1_00265_ALEXONDRE_A1_000_004<tab>ランクA：復活の巨獣「リューバ」について","","False","0x00000006","",""
"","TEXT_REGROC2NOTORIOUSMONSTERHINTF1_00265_ALEXONDRE_A1_000_005<tab>Tell me about the rank S elite mark. (Kaiser Behemoth)","TEXT_REGROC2NOTORIOUSMONSTERHINTF1_00265_ALEXONDRE_A1_000_005<tab>ランクS：悲しき皇帝「カイザーベヒーモス」について","","False","0x00000007","",""
"","TEXT_REGROC2NOTORIOUSMONSTERHINTF1_00265_ALEXONDRE_A1_000_006<tab>Nothing.","TEXT_REGROC2NOTORIOUSMONSTERHINTF1_00265_ALEXONDRE_A1_000_006<tab>キャンセル","","False","0x00000008","",""
"","TEXT_REGROC2NOTORIOUSMONSTERHINTF1_00265_ALEXONDRE_000_010<tab>I was born and raised here in the western highlands, so I know firsthand how much the place has changed. As the climate has got colder and colder, creatures that were never native to Coerthas have come down from the mountains to find food.","TEXT_REGROC2NOTORIOUSMONSTERHINTF1_00265_ALEXONDRE_000_010<tab>俺は、この辺りが地元だから、よくわかるんだが……<br>クルザス西部高地は、寒冷化で生態も大きく変化してしまった。","","False","0x00000009","",""
"","TEXT_REGROC2NOTORIOUSMONSTERHINTF1_00265_ALEXONDRE_000_011<tab>The mylodons are one such species. Time was they made their home up in the far reaches of Abalathia's Spine, but ever since their hunting grounds were lost to the Calamity, they've found their way down here. They're fierce carnivores, who see steel-clad knights as nothing more than a packed lunch.","TEXT_REGROC2NOTORIOUSMONSTERHINTF1_00265_ALEXONDRE_000_011<tab>以前は、北アバラシアの山奥でしか見られなかったミロドンが、<br>この辺りに流入してきたのも、霊災以降のことさ。<br>こいつは肉食で、人も襲う恐ろしい野獣でな……。","","False","0x0000000A","",""
"","TEXT_REGROC2NOTORIOUSMONSTERHINTF1_00265_ALEXONDRE_000_012<tab>Alteci's the worst of the lot─a mad mylodon who's been laying waste to the local forces. At the last count, more than a dozen noble lives have been lost to that monster.","TEXT_REGROC2NOTORIOUSMONSTERHINTF1_00265_ALEXONDRE_000_012<tab>中でも「アルティック」と名付けられた、<br>はぐれミロドンには、騎兵連中も手を焼いている。<br>もうすでに、10名以上の人命がヤツに奪われたそうだ。","","False","0x0000000B","",""
"","TEXT_REGROC2NOTORIOUSMONSTERHINTF1_00265_ALEXONDRE_000_020<tab>Have you ever come across an archaeornis? At first sight you might think they were birds, what with the feathers and all, but they're actually a primitive species of scalekin, closer to raptors than they are to chocobos.","TEXT_REGROC2NOTORIOUSMONSTERHINTF1_00265_ALEXONDRE_000_020<tab>アルケオーニスという魔物を知っているか？<br>羽毛が生えているから、鳥のように思うかもしれんが、<br>その正体は、ラプトルみたいな甲鱗綱に近い、原始的な生物さ。","","False","0x0000000C","",""
"","TEXT_REGROC2NOTORIOUSMONSTERHINTF1_00265_ALEXONDRE_000_021<tab>The only thing they definitely share with birds is their brains─that combination of mental weakness and physical strength makes them perfect thralls for the dragons, who use them to launch constant attacks on the Ishgardian forces.","TEXT_REGROC2NOTORIOUSMONSTERHINTF1_00265_ALEXONDRE_000_021<tab>知性の欠片もないが、それだけに魔力に影響されやすく、<br>ドラゴン族に操られ眷属として利用されることが多い。<br>ここらの騎兵にとっては、油断ならない存在さ。","","False","0x0000000D","",""
"","TEXT_REGROC2NOTORIOUSMONSTERHINTF1_00265_ALEXONDRE_000_022<tab>The knights are particularly wary of the one they call Kreutzet. He's got such strength in those thighs of his, even the thickest snowdrift's not enough to slow him down. He races hither and thither across the snowfields, tearing apart any outpost unlucky enough to stand in his way.","TEXT_REGROC2NOTORIOUSMONSTERHINTF1_00265_ALEXONDRE_000_022<tab>特に警戒すべきは、「クルーゼ」と呼ばれる個体だ。<br>恐るべき脚力の持ち主で、氷原を自在に駆け回り、<br>度々、騎兵を奇襲しているらしいぞ。","","False","0x0000000E","",""
"","TEXT_REGROC2NOTORIOUSMONSTERHINTF1_00265_ALEXONDRE_000_030<tab>Once every hundred thousand years or so, a yeti is born with a horn atop its massy head that is imbued with an extraordinary magical power. When the creature reaches maturity, it sends out a clarion call to the rest of the yetis that unites them under the horned one's rule.","TEXT_REGROC2NOTORIOUSMONSTERHINTF1_00265_ALEXONDRE_000_030<tab>イエティには、ごく稀に角を持つ子が生まれるらしい。<br>そうした角付きは、生まれつき魔力が強く、<br>長じると群れを束ねる王になるそうだ。","","False","0x0000000F","",""
"","TEXT_REGROC2NOTORIOUSMONSTERHINTF1_00265_ALEXONDRE_000_031<tab>...Or so the old wives' tale goes. The problem is, there might just be some truth in it. The Convictors believe they may have sighted such a “horned one.”","TEXT_REGROC2NOTORIOUSMONSTERHINTF1_00265_ALEXONDRE_000_031<tab>ここまでなら、笑って聞いていられる話だが、<br>聖フィネア連隊の騎兵が、角付きイエティを目撃したそうでな。","","False","0x00000010","",""
"","TEXT_REGROC2NOTORIOUSMONSTERHINTF1_00265_ALEXONDRE_000_032<tab>The first thing they did was to name her Mirka─the second, to slap a bounty on her head. The yetis are dangerous enough as it is, but if this beast lives to maturity and brings them together as a single force, they could be nigh on unstoppable.","TEXT_REGROC2NOTORIOUSMONSTERHINTF1_00265_ALEXONDRE_000_032<tab>「ミルカ」と名付けられた、この角付きが成熟し、<br>群れを掌握すれば、イエティの脅威は格段に増すだろう。<br>だからこそ、リスキーモブに指定されたって訳だ。","","False","0x00000011","",""
"","TEXT_REGROC2NOTORIOUSMONSTERHINTF1_00265_ALEXONDRE_000_040<tab>There was once a dragonslayer who was out hunting his prey on the frozen lake of Ashpool, when he made a surprising discovery. An enormous animal was frozen solid underneath the ice.","TEXT_REGROC2NOTORIOUSMONSTERHINTF1_00265_ALEXONDRE_000_040<tab>ある時、ドラゴン族を探し求めていた騎兵が、<br>凍り付いたアッシュプールで、ひとつの発見をした……。<br>なんと氷漬けになった、巨大な魔獣を見つけたんだ。","","False","0x00000012","",""
"","TEXT_REGROC2NOTORIOUSMONSTERHINTF1_00265_ALEXONDRE_000_041<tab>Thinking that he could use the deceased creature's meat to lure the dragons into a trap, he lit a bonfire over the lake to melt its body free. A most ill-advised plan indeed...","TEXT_REGROC2NOTORIOUSMONSTERHINTF1_00265_ALEXONDRE_000_041<tab>その騎兵は、魔獣の肉を使えば、<br>ドラゴン族を誘き寄せられると考えたらしい。<br>……止せばいいのに盛大に火を焚いて、氷を溶かし始めた。","","False","0x00000013","",""
"","TEXT_REGROC2NOTORIOUSMONSTERHINTF1_00265_ALEXONDRE_000_042<tab>You see, the beast wasn't quite as dead as the knight first thought. Freed from its icy prison, it began to breathe once more, and lashed out at all around it with elemental fury. When the dragonslayer set out to hunt for dragons, I doubt he expected to meet his end at the point of a tusk.","TEXT_REGROC2NOTORIOUSMONSTERHINTF1_00265_ALEXONDRE_000_042<tab>すると驚いたことに、氷漬けになっていた魔獣が息を吹き返して、<br>大暴れし始めたというじゃないか。<br>突き飛ばされ重傷を負った騎兵は、さぞ後悔しただろうよ。","","False","0x00000014","",""
"","TEXT_REGROC2NOTORIOUSMONSTERHINTF1_00265_ALEXONDRE_000_050<tab>No doubt you've heard of the behemoths, those monstrous beasts that have been a bane on Coerthas ever since the Calamity. Adventurers like you have faced them in battle countless times, and have been meeting with more and more success of late.","TEXT_REGROC2NOTORIOUSMONSTERHINTF1_00265_ALEXONDRE_000_050<tab>霊災を境に姿を現した魔獣、ベヒーモスが、<br>クルザスの大きな脅威となっていることは知ってのとおり。<br>幾たびも討伐が行われ、成果も上げてきた。","","False","0x00000015","",""
"","TEXT_REGROC2NOTORIOUSMONSTERHINTF1_00265_ALEXONDRE_000_051<tab>However, there is one among their number that has always made good its escape, even when gravely wounded by the swords and spells of myriad adventurers. Due to its giant size and superior strength, it has become known as the king of the behemoths.","TEXT_REGROC2NOTORIOUSMONSTERHINTF1_00265_ALEXONDRE_000_051<tab>しかし、深手を負いながらも逃げ延びた個体がいる。<br>その大柄な体躯から「皇帝」と渾名されていたヤツだ。","","False","0x00000016","",""
"","TEXT_REGROC2NOTORIOUSMONSTERHINTF1_00265_ALEXONDRE_000_052<tab>They say that this kaiser behemoth, whose body is crisscrossed with the scars of a thousand battles, seeks any opportunity to avenge itself on the adventurers who defeated its brothers. If you value your life, I'd avoid doing anything to arouse its ire.","TEXT_REGROC2NOTORIOUSMONSTERHINTF1_00265_ALEXONDRE_000_052<tab>身体に無数の傷を刻まれた「皇帝」は、<br>冒険者たちに復讐の機会を狙っているという噂だ。<br>あまり目立つ行動は、取らない方が身のためだろうよ。","","False","0x00000017","",""
"","TEXT_REGROC2NOTORIOUSMONSTERHINTF1_00265_TALK_ACTOR<tab>","TEXT_REGROC2NOTORIOUSMONSTERHINTF1_00265_TALK_ACTOR<tab>（★未使用／削除予定★）","","False","0x00000018","",""
