"location","source","target","id","fuzzy","context","translator_comments","developer_comments"
"","TEXT_VOICEMAN_03200_001440_EMMANELLAIN<tab>I want to believe...I do...","TEXT_VOICEMAN_03200_001440_EMMANELLAIN<tab>……どいつもこいつも、強すぎだろ。
けど、貴方の理屈は、オレにもわかる。
ここの連中は、みんなイイ奴らなんだよ……本当はさ……。","","False","0x00000094","",""
"","TEXT_VOICEMAN_03200_001450_EMMANELLAIN<tab>Lord Commander─through my careless orders, a pall has been cast over these proceedings, and I beg the opportunity to make amends.","TEXT_VOICEMAN_03200_001450_EMMANELLAIN<tab>オレが引かせた弓が、誰かの心に影を落とした分、
今度は、みんなを笑顔にさせてやりたいんだ。","","False","0x00000095","",""
"","TEXT_VOICEMAN_03200_001460_EMMANELLAIN<tab>I, Emmanellain de Fortemps, do hereby request leave to take part in the grand melee!","TEXT_VOICEMAN_03200_001460_EMMANELLAIN<tab>このエマネラン・ド・フォルタン、
イシュガルドの明日のために、剣を捧げさせてくれ。
……どうか、頼むッ！","","False","0x00000096","",""
"","TEXT_VOICEMAN_03200_001470_AYMERIC<tab>Who am I to deny such a heartfelt plea? We would be honored to have you join the fray, my lord.","TEXT_VOICEMAN_03200_001470_AYMERIC<tab>その心意気、しかと胸に刻ませてもらった。
「合同演習」への参戦、こちらからもよろしく頼むぞ……！","","False","0x00000097","",""
"","TEXT_VOICEMAN_03200_001480_EDMONT<tab>You will take charge of the Ishgardian forces?","TEXT_VOICEMAN_03200_001480_EDMONT<tab>……イシュガルド勢の指揮は、どなたにお任せか？","","False","0x00000098","",""
"","TEXT_VOICEMAN_03200_001490_AYMERIC<tab>For all my other responsibilities, I am still lord commander of the Temple Knights, and I would not soon yield this duty to another.","TEXT_VOICEMAN_03200_001490_AYMERIC<tab>私が直接参戦し、指揮を執ろう。
教皇代行である以前に、私は神殿騎士団総長だ。
この任を、ほかの誰かに譲るつもりはない！","","False","0x00000099","",""
"","TEXT_VOICEMAN_03200_001500_EDMONT<tab>The esteemed Ser Aymeric, leading the Temple Knights and the watch into battle, along with my youngest. I could wish for no more.","TEXT_VOICEMAN_03200_001500_EDMONT<tab>威信をかけるとあらば、いよいよ負けられませんな。
総長率いる神殿騎士に、自警団、そして名家から我が息子……
今のイシュガルドらしい、最良の布陣でありましょう。","","False","0x0000009A","",""
"","TEXT_VOICEMAN_03200_001510_AYMERIC<tab>Then you wish for too little, my lord! There is another who might yet join the fray. An indispensable ally to whom we owe much and more.","TEXT_VOICEMAN_03200_001510_AYMERIC<tab>いや……。
あとひとり、欠かすことのできない盟友がいる。","","False","0x0000009B","",""
"","TEXT_VOICEMAN_03200_001520_AYMERIC<tab>An adventurer beholden to none, who nevertheless chose to champion our cause. Who has shared in our suffering, and in our glory.","TEXT_VOICEMAN_03200_001520_AYMERIC<tab>君は、自由の翼をもつ冒険者だ。
それでも今日まで、我々とともに苦難に立ち向かい、
誰よりも痛みをわかちあってきてくれた。","","False","0x0000009C","",""
"","TEXT_VOICEMAN_03200_001530_AYMERIC<tab>A warrior without equal, whom I am privileged to call a friend. There is no one I would rather have fighting by my side.","TEXT_VOICEMAN_03200_001530_AYMERIC<tab>私が君を、唯一無二の盟友だと思っているように、
君が、もし我々を友だと思ってくれているのなら……
どうか、ともに戦ってはくれないだろうか。","","False","0x0000009D","",""
"","TEXT_VOICEMAN_03200_001540_AYMERIC<tab>I ask this in full knowledge of your obligations, and will not think less of you should you refuse. But if your conscience will allow it, might you oblige me, my friend? One more time?","TEXT_VOICEMAN_03200_001540_AYMERIC<tab>君が他国のグランドカンパニーに属しているのは、承知の上だ。
盟主殿には、私から義理を通そう。
だから……もう一度、私と戦場を駆けてほしい。","","False","0x0000009E","",""
"","TEXT_VOICEMAN_03200_001550_AYMERIC<tab>Ha! Together, we shall give the people a spectacle for the ages─a celebration to mark the dawning of a new era!","TEXT_VOICEMAN_03200_001550_AYMERIC<tab>ありがとう、これほど頼もしいことはない。
必ずや勝利して、その先に見える希望を、ともにわかちあおう。","","False","0x0000009F","",""
"","TEXT_VOICEMAN_03200_001560_AYMERIC<tab>Let all here present heed well the rules of engagement!","TEXT_VOICEMAN_03200_001560_AYMERIC<tab>よし……。
今回の模擬戦について、ルールを確認しておこう。","","False","0x000000A0","",""
"","TEXT_VOICEMAN_03200_001561_SYSTEM_000<tab>The grand melee is a large-scale battle in which an allied company of Ul'dahn, Gridanian, and Lominsan forces will be pitted against a company of Ishgardian forces.","TEXT_VOICEMAN_03200_001561_SYSTEM_000<tab>これより、あなたが協力する「イシュガルド軍」と、
ウルダハ、グリダニア、リムサ・ロミンサの「三国合同軍」で、
模擬戦を行います。","","False","0x000000A1","",""
"","TEXT_VOICEMAN_03200_001561_SYSTEM_010<tab>When a combatant is incapacitated, the opposing company will be awarded <var 48 F201F4 /var><var 49 F201F5 /var>tactical points<var 49 01 /var><var 48 01 /var>.","TEXT_VOICEMAN_03200_001561_SYSTEM_010<tab>今回の模擬戦では、敵を倒すごとに、
自軍に対して「戦術点」が加算されます。","","False","0x000000A2","",""
"","TEXT_VOICEMAN_03200_001561_SYSTEM_020<tab>The first company to attain the designated tactical rating of <var 48 F201F4 /var><var 49 F201F5 /var>100 points<var 49 01 /var><var 48 01 /var> is declared the victor.","TEXT_VOICEMAN_03200_001561_SYSTEM_020<tab>この場合、「イシュガルド軍」に戦術点が加算されます。
多くの敵を倒し、先に「100点」稼いだ方の勝利です。","","False","0x000000A3","",""
"","TEXT_VOICEMAN_03200_001561_SYSTEM_030<tab>During the grand melee, officiants may mark certain combatants with the <var 48 F201F4 /var><var 49 F201F5 /var>Fury's Gaze<var 49 01 /var><var 48 01 /var>, which will be indicated by an aetherial tether linking them to their company's flag.","TEXT_VOICEMAN_03200_001561_SYSTEM_030<tab>模擬戦中は、審判者によって、
それぞれの軍から「戦術目標」となる人物が選出されます。
自軍の旗と線で結ばれているのが「戦術目標」です。","","False","0x000000A4","",""
"","TEXT_VOICEMAN_03200_001561_SYSTEM_040<tab>While defeating most combatants will award your company 1 tactical point, defeating marked combatants will award your company 10 tactical points.","TEXT_VOICEMAN_03200_001561_SYSTEM_040<tab>通常、敵を1回倒すごとに「1点」加算されますが、
「戦術目標」を倒すと、「10点」加算されます。","","False","0x000000A5","",""
"","TEXT_VOICEMAN_03200_001561_SYSTEM_050<tab>Marked combatants also possess enhanced attributes, rendering them more powerful and more difficult to defeat.","TEXT_VOICEMAN_03200_001561_SYSTEM_050<tab>また、「戦術目標」に選ばれている間は、
支援魔法をかけられるため、
「被ダメージ低下」の状態となります。","","False","0x000000A6","",""
"","TEXT_VOICEMAN_03200_001561_SYSTEM_060<tab>Defending and defeating these combatants is the key to victory!","TEXT_VOICEMAN_03200_001561_SYSTEM_060<tab>味方の「戦術目標」を守りつつ、
敵の「戦術目標」を優先的に狙っていきましょう！","","False","0x000000A7","",""
"","TEXT_VOICEMAN_03200_001570_AYMERIC<tab>For the honor and the glory of Ishgard!","TEXT_VOICEMAN_03200_001570_AYMERIC<tab>……ということだ。
勝つぞ、必ず！","","False","0x000000A8","",""
"","TEXT_VOICEMAN_03200_001580_NANAMOULNAMO<tab>All is ready, then. Very well.","TEXT_VOICEMAN_03200_001580_NANAMOULNAMO<tab>準備は整ったのじゃな。
では、至急、全軍に通達せよ……。","","False","0x000000A9","",""
"","TEXT_VOICEMAN_03200_001590_NANAMOULNAMO<tab>Brave men and women of the Eorzean Alliance. Let the grand melee begin!","TEXT_VOICEMAN_03200_001590_NANAMOULNAMO<tab>これより、エオルゼア都市軍事同盟、
「合同演習」を開始する！","","False","0x000000AA","",""
"","TEXT_VOICEMAN_03200_001600_EMMANELLAIN<tab>Did...did <var 08 E905 ((she)) ((he)) /var> win? Then we...we...","TEXT_VOICEMAN_03200_001600_EMMANELLAIN<tab>あいつ、まさか勝ったのか……？
じゃあ……もしかして、オレたちの……！","","False","0x000000AB","",""
"","TEXT_VOICEMAN_03200_001610_AYMERIC<tab>Victory is ours! Ishgard! Ishgard!","TEXT_VOICEMAN_03200_001610_AYMERIC<tab>ああ！
我々の……イシュガルドの勝利だ！","","False","0x000000AC","",""
"","TEXT_VOICEMAN_03200_001620_AYMERIC<tab>Well fought! Well fought, my friend! You truly are the warrior of warriors! Thank the Fury you were on our side!","TEXT_VOICEMAN_03200_001620_AYMERIC<tab>本当に、よくやってくれた！
君は、最高で最強の盟友だ……ッ！","","False","0x000000AD","",""
"","TEXT_VOICEMAN_03200_001630_EMMANELLAIN<tab>Hah hah...my lungs are burning, and I can barely stand!","TEXT_VOICEMAN_03200_001630_EMMANELLAIN<tab>はは……すげぇ、なんだよこれ……。
胸の奥が熱い……こんなの初めてだ……！","","False","0x000000AE","",""
"","TEXT_VOICEMAN_03200_001640_EMMANELLAIN<tab>I didn't think I could do it...but then I did! We did! We faced the Alliance's best, and together, with one heart, with one purpose, we prevailed!","TEXT_VOICEMAN_03200_001640_EMMANELLAIN<tab>頑張ったって、どうせ大したことはできないって思ってた。
なのに、こいつらと剣を振るったら……
同じものを目指したら、「やれる」って力が湧いたんだ……。","","False","0x000000AF","",""
"","TEXT_VOICEMAN_03200_001650_EMMANELLAIN<tab>After a thousand years of hardship, of strife and bloodshed, we are strong enough to rise to any challenge─be it on the battlefield or beyond.","TEXT_VOICEMAN_03200_001650_EMMANELLAIN<tab>そうさ、オレたちは千年の間、こうやって生きてきた……！
戦いの伝統も、立ち上がる強さも、
竜と戦うためだけのものじゃない……！","","False","0x000000B0","",""
"","TEXT_VOICEMAN_03200_001660_EMMANELLAIN<tab>The future holds so much promise. So much joy. We need only show them the way.","TEXT_VOICEMAN_03200_001660_EMMANELLAIN<tab>踏み出した先の明日は、きっと楽しい。
……伝わるかな、まだ泣いてる奴らにも。","","False","0x000000B1","",""
"","TEXT_VOICEMAN_03200_001670_NANAMOULNAMO<tab>A truly magnificent display, ser knight. While doubtless less than pleased, I am quite sure the Grand Companies are <var 1A 02 /var>honored<var 1A 01 /var> to have been bested by such valiant warriors.","TEXT_VOICEMAN_03200_001670_NANAMOULNAMO<tab>実によい模擬戦であった。
負けたのは悔しいが、今はそなたらの健闘を大いに讃えよう。","","False","0x000000B2","",""
"","TEXT_VOICEMAN_03200_001680_AYMERIC<tab>The honor was ours, Your Grace.","TEXT_VOICEMAN_03200_001680_AYMERIC<tab>お褒めの言葉、ありがたく頂戴いたします。","","False","0x000000B3","",""
"","TEXT_VOICEMAN_03200_001690_NANAMOULNAMO<tab>I am pleased to see that Ishgard's proud martial tradition is being upheld.","TEXT_VOICEMAN_03200_001690_NANAMOULNAMO<tab>うむ、イシュガルドの民は強い。
それは固い絆によるものだと、この一戦からでもよくわかった。","","False","0x000000B4","",""
"","TEXT_VOICEMAN_03200_001700_NANAMOULNAMO<tab>When the time comes, I trust you will fight alongside your brothers and sisters in the Eorzean Alliance with the same fervor you displayed in opposing them.","TEXT_VOICEMAN_03200_001700_NANAMOULNAMO<tab>だからこそ、忘れないでほしい。
今や我らとて、エオルゼアに生きる、そなたらの同胞なのじゃ。
……同盟への復帰、改めて歓迎するぞ。","","False","0x000000B5","",""
"","TEXT_VOICEMAN_03200_001710_NANAMOULNAMO<tab>I note that our friend elected to take the field in Ishgardian colors.","TEXT_VOICEMAN_03200_001710_NANAMOULNAMO<tab>それにしても、あの冒険者が、
イシュガルドの盟友として参戦するとはな……？","","False","0x000000B6","",""
"","TEXT_VOICEMAN_03200_001720_AYMERIC<tab>At my behest, Your Grace. If we have given offense, the blame lies with me.","TEXT_VOICEMAN_03200_001720_AYMERIC<tab>あの者は、友として、
我々の願いに添うてくれただけのこと。
お咎めになるのなら、どうか私を……。","","False","0x000000B7","",""
"","TEXT_VOICEMAN_03200_001730_NANAMOULNAMO<tab>Fear not, ser knight. It was a surprise, nothing more. And any hint of ill-feeling was thoroughly dispelled by the spectacle of our mutual friend's duel with General Raubahn.","TEXT_VOICEMAN_03200_001730_NANAMOULNAMO<tab>ふふっ、咎めたりはせぬ。
こちらも、それゆえにラウバーンを出した。
実に名勝負であったといえよう。","","False","0x000000B8","",""
"","TEXT_VOICEMAN_03200_001740_NANAMOULNAMO<tab>On the subject of surprises, I could not help but marvel at the passion and unity of purpose displayed by your countrymen...given the troubling reports we have received of late.","TEXT_VOICEMAN_03200_001740_NANAMOULNAMO<tab>わらわはただ、イシュガルドはこうして変わっていくのかと、
目を見張る思いだったのじゃ。
先ごろまで門戸を閉ざしていた国とは、とても思えぬ。","","False","0x000000B9","",""
"","TEXT_VOICEMAN_03200_001750_AYMERIC<tab>I shall take that as a compliment, Your Grace. The events to which you allude are the price of change. The end of the Dragonsong War marks the beginning of a new era for our nation─and for the <var 1A 02 /var>people<var 1A 01 /var>, high- and lowborn alike, who will lead her into the future.","TEXT_VOICEMAN_03200_001750_AYMERIC<tab>竜詩戦争が終焉を迎えれば、
イシュガルドはさらなる蒼天へと羽ばたくでしょう。
……今度こそ、民自身の力で。","","False","0x000000BA","",""
"","TEXT_VOICEMAN_03200_001760_NANAMOULNAMO<tab>Ah, yes... The people.","TEXT_VOICEMAN_03200_001760_NANAMOULNAMO<tab>そなた、もしや…………。
……いや。","","False","0x000000BB","",""
"","TEXT_VOICEMAN_03200_001770_NANAMOULNAMO<tab>Change is indeed a perilous thing, for we who seek it and they who fear it. I shall pray for Ishgard─and for you.","TEXT_VOICEMAN_03200_001770_NANAMOULNAMO<tab>変革の道は険しい……
わらわは身をもって、それを学んだ。
それでも、貴国の行く先に、どうか栄えあらんことを。","","False","0x000000BC","",""
"","TEXT_VOICEMAN_03200_001780_THANCRED<tab>Well, that made for a refreshing change. Congratulations on your victory, by the way.","TEXT_VOICEMAN_03200_001780_THANCRED<tab>予想に違わぬ活躍ぶりだったらしいな。
……おつかれ。","","False","0x000000BD","",""
"","TEXT_VOICEMAN_03200_001790_THANCRED<tab>The Ishgardians certainly seem happy with themselves. I, for my part, am merely glad you did not strain anything in the process of single-handedly winning the battle for them.","TEXT_VOICEMAN_03200_001790_THANCRED<tab>無事に勝ったようで何よりだ。
これで、イシュガルドに吉報が…………","","False","0x000000BE","",""
"","TEXT_VOICEMAN_03200_001800_THANCRED<tab><gasp>","TEXT_VOICEMAN_03200_001800_THANCRED<tab>クッ……！","","False","0x000000BF","",""
"","TEXT_VOICEMAN_03200_001810_THANCRED<tab>'Tis but a scratch, I assure you. And I will not suffer you to worry over me─not when we have a dozen far more important concerns.","TEXT_VOICEMAN_03200_001810_THANCRED<tab>ああ、別に「大したこと」はなかったさ。
お前が、選んだことをとことんやり抜けたなら、それで十分だ。","","False","0x000000C0","",""
"","TEXT_VOICEMAN_03200_001820_THANCRED<tab>...Make that two dozen. Still, as Y'shtola never tires of telling me, we can but face them head-on, one at a time. One day at a time...as Minfilia would have done.","TEXT_VOICEMAN_03200_001820_THANCRED<tab>……まっすぐ進めよ。
その行く先を信じたから、彼女はお前に真実を託したんだ。","","False","0x000000C1","",""
"","TEXT_VOICEMAN_03200_001830_HONOROIT<tab>(-???-)My lord!","TEXT_VOICEMAN_03200_001830_HONOROIT<tab>(-？？？？-)エマネラン様ーーッ！","","False","0x000000C2","",""
"","TEXT_VOICEMAN_03200_001840_EMMANELLAIN<tab>Honoroit, my boy! Shouldn't you be in bed?","TEXT_VOICEMAN_03200_001840_EMMANELLAIN<tab>オノロワ！？
お前、もう大丈夫なのかよ！","","False","0x000000C3","",""
"","TEXT_VOICEMAN_03200_001850_HONOROIT<tab>Thank you for your concern, my lord, but I have largely recovered from my ordeal, and I have naught but several scars to show for it. Which, I have been told, some women may find...appealing.","TEXT_VOICEMAN_03200_001850_HONOROIT<tab>おかげさまで息災です、はい。
傷はいくつか残ってしまうと言われましたが……
男子として、ハクがつくというものです、はいっ！","","False","0x000000C4","",""
"","TEXT_VOICEMAN_03200_001860_EMMANELLAIN<tab>I see! And to think I was worried sick over you!","TEXT_VOICEMAN_03200_001860_EMMANELLAIN<tab>そっかぁ……。
ったく、この野郎！
従者のクセに、オレ様を心配させやがって～！","","False","0x000000C5","",""
"","TEXT_VOICEMAN_03200_001870_HONOROIT<tab>I'm not sure I understand, my lord.","TEXT_VOICEMAN_03200_001870_HONOROIT<tab>あわわわわわ！？","","False","0x000000C6","",""
"","TEXT_VOICEMAN_03200_001880_EMMANELLAIN<tab>Well, let's put that theory to the proof, shall we?","TEXT_VOICEMAN_03200_001880_EMMANELLAIN<tab>さあ、存っ分に褒めやがれっ！","","False","0x000000C7","",""
"","TEXT_VOICEMAN_03200_001890_HONOROIT<tab>M-M-My lord!?","TEXT_VOICEMAN_03200_001890_HONOROIT<tab>うぇえ！？","","False","0x000000C8","",""
"","TEXT_VOICEMAN_03200_001900_ALPHINAUD<tab>'Twould seem that a great many things have occurred in my absence. I thought I might begin to make amends by welcoming you in person.","TEXT_VOICEMAN_03200_001900_ALPHINAUD<tab>すまない、私が出遅れている間に、
ずいぶんな事件が起きていたのだな……。
フォルタン伯爵に話を伺って、せめて出迎えをと思ってね。","","False","0x000000C9","",""
"","TEXT_VOICEMAN_03200_001910_EDMONT<tab>The messengers spared not their chocobos to bring us word of your victory in the grand melee. I cannot well describe our elation when we heard the news.","TEXT_VOICEMAN_03200_001910_EDMONT<tab>此度は、よくぞ勝利を収めてくださった！
「合同演習」にて、我がイシュガルドが勝利したと、
伝令がさっそく皇都中に報せましてな。","","False","0x000000CA","",""
"","TEXT_VOICEMAN_03200_001920_EDMONT<tab>It called to mind the day we rejoined the Eorzean Alliance, when I glimpsed hope rekindled in the eyes of the people.","TEXT_VOICEMAN_03200_001920_EDMONT<tab>皆、大変な熱気に包まれておりますぞ。
エオルゼア都市軍事同盟に復帰した日を思い出し、
希望を取り戻した者も多い様子……。","","False","0x000000CB","",""
"","TEXT_VOICEMAN_03200_001930_LUCIA<tab>The Fury Herself ushers us into a new era. Ser Aymeric, the time is now!","TEXT_VOICEMAN_03200_001930_LUCIA<tab>まさに、一迅の追い風が吹いているわけか……。
アイメリク様、今ならば……！","","False","0x000000CC","",""
"","TEXT_VOICEMAN_03200_001940_AYMERIC<tab>Aye, that it is. Reconvene the conference and summon Vidofnir to Falcon's Nest.","TEXT_VOICEMAN_03200_001940_AYMERIC<tab>至急、ヴィゾーヴニルに使者を。
ファルコンネストの式典準備も、再開してくれ。","","False","0x000000CD","",""
"","TEXT_VOICEMAN_03200_001950_AYMERIC<tab>We will make peace with Hraesvelgr's brood and hasten this bloody war to its end.","TEXT_VOICEMAN_03200_001950_AYMERIC<tab>竜詩戦争の終焉に向けて、
今こそ、聖竜の眷属と、和平の契りを結ぼう！","","False","0x000000CE","",""
"","TEXT_VOICEMAN_03200_001960_LUCIA<tab>Yes, Lord Commander!","TEXT_VOICEMAN_03200_001960_LUCIA<tab>ハッ！","","False","0x000000CF","",""
"","TEXT_VOICEMAN_03200_001970_EDMONT<tab>I will send word to Artoirel and bid him resume preparations.","TEXT_VOICEMAN_03200_001970_EDMONT<tab>アルトアレールが、ファルコンネストに残っております。
私からも連絡を入れ、急ぎ式典に備えさせましょう。","","False","0x000000D0","",""
"","TEXT_VOICEMAN_03200_001980_EDMONT<tab>Emmanellain─you will place yourself at your brother's disposal. He will be glad of your assistance.","TEXT_VOICEMAN_03200_001980_EDMONT<tab>……エマネラン、お前も手伝うのだぞ。","","False","0x000000D1","",""
"","TEXT_VOICEMAN_03200_001990_THANCRED<tab>No stopping it now, is there? We should inform Y'shtola and the others.","TEXT_VOICEMAN_03200_001990_THANCRED<tab>イシュガルドの歴史が、また大きく動くかもな……。
ヤ・シュトラたちにも、声をかけておくとしよう。","","False","0x000000D2","",""
"","TEXT_VOICEMAN_03200_002000_AYMERIC<tab>My dear friend...I doubt I will ever be able to thank you enough. But when the conference is successfully concluded, I damn well mean to try.","TEXT_VOICEMAN_03200_002000_AYMERIC<tab>君には、いくら感謝をしても足りないほどだ。
まずは式典の成功をもって、その功績に応えよう。","","False","0x000000D3","",""
"","TEXT_VOICEMAN_03200_002010_LUCIA<tab>The appointed hour approaches.","TEXT_VOICEMAN_03200_002010_LUCIA<tab>そろそろ約束の時刻……
ヴィゾーヴニルが来るはずです。","","False","0x000000D4","",""
"","TEXT_VOICEMAN_03200_002020_AYMERIC<tab>Aye.","TEXT_VOICEMAN_03200_002020_AYMERIC<tab>そうだな……。","","False","0x000000D5","",""
"","TEXT_VOICEMAN_03200_002030_LUCIA<tab>She begged leave to watch the proceedings. I saw no reason not to grant it.","TEXT_VOICEMAN_03200_002030_LUCIA<tab>ああ、彼女は例の……
先日この場所で暴動を起こした者です。
一命を取り留め、どうしてもと言うので、見物を許しました。","","False","0x000000D6","",""
"","TEXT_VOICEMAN_03200_002040_AYMERIC<tab>Should I choose to deviate from my prepared remarks, I ask that you trust in my judgment.","TEXT_VOICEMAN_03200_002040_AYMERIC<tab>…………ルキア。
この式典で、私が用意された原稿と違う言葉を述べても、
驚かずに聞き届けてくれないか。","","False","0x000000D7","",""
"","TEXT_VOICEMAN_03200_002050_LUCIA<tab>Have I ever done otherwise?","TEXT_VOICEMAN_03200_002050_LUCIA<tab>承知しました……。
心ゆくまで、貴方の言葉で伝えてください。","","False","0x000000D8","",""
"","TEXT_VOICEMAN_03200_002060_CITIZENA02240<tab>Look!","TEXT_VOICEMAN_03200_002060_CITIZENA02240<tab>来たぞ！","","False","0x000000D9","",""
"","TEXT_VOICEMAN_03200_002070_CITIZENB02240<tab>The white dragon!","TEXT_VOICEMAN_03200_002070_CITIZENB02240<tab>白き竜だわ……！","","False","0x000000DA","",""
"","TEXT_VOICEMAN_03200_002080_VIDOFNIR<tab>Ah, how long it hath been since our peoples met thus, children of Thordan. Even by our reckoning.","TEXT_VOICEMAN_03200_002080_VIDOFNIR<tab>待たせたか、小さき者らよ……。
我らはヒトと時を異にするもの、多少の差異は大目に見よ。","","False","0x000000DB","",""
"","TEXT_VOICEMAN_03200_002090_AYMERIC<tab>Vidofnir, daughter of Hraesvelgr, we give thanks for your visit and bid you welcome to Falcon's Nest.","TEXT_VOICEMAN_03200_002090_AYMERIC<tab>ヴィゾーヴニル、よくぞ来てくださった。
まずは我々の申し出に賛同してくれたことに対し、
最大限の感謝を贈りたい。","","False","0x000000DC","",""
"","TEXT_VOICEMAN_03200_002100_VIDOFNIR<tab>Our sire bade us hearken unto the whispers of our hearts. They spoke to us of a paradise lost─of bonds of brotherhood which they yearn to see restored.","TEXT_VOICEMAN_03200_002100_VIDOFNIR<tab>なあに、父祖の許しを得たゆえ、我が心に従ったまでのこと。
我ら竜もまた、悲しみの向こうにある懐かしき記憶を胸に、
人との蜜月の再来を、心待ちにしていたのやもしれぬ。","","False","0x000000DD","",""
"","TEXT_VOICEMAN_03200_002110_AYMERIC<tab>Ours too yearn for such a restoration. And they have guided us here this day, that they might yearn no longer.","TEXT_VOICEMAN_03200_002110_AYMERIC<tab>その言葉が、どれほどの救いとなることか……。
我らの思いを、今ここに、契りとして刻みましょう。","","False","0x000000DE","",""
"","TEXT_VOICEMAN_03200_002120_AYMERIC<tab>Brothers and sisters, ye who stand as witness, hearken to me!","TEXT_VOICEMAN_03200_002120_AYMERIC<tab>誓いの証人となる皆よ、聞いてほしい！","","False","0x000000DF","",""
