"location","source","target","id","fuzzy","context","translator_comments","developer_comments"
"","TEXT_VOICEMAN_03200_002130_AYMERIC<tab>Since the days of eld, when the bonds betwixt man and dragon were sundered by our hand, our peoples have known only war.","TEXT_VOICEMAN_03200_002130_AYMERIC<tab>……人と竜を繋ぐ絆が、人の裏切りによって絶たれて以来、
双方は長らく争いの日々を続けてきた。","","False","0x000000E0","",""
"","TEXT_VOICEMAN_03200_002140_AYMERIC<tab>Bloodshed without end, losses beyond counting─and still we fought. And still we fought.","TEXT_VOICEMAN_03200_002140_AYMERIC<tab>長い歴史の中で、互いに失った同胞は数知れず、
幾多の悲しみが、我々をまた戦へと駆り立てた。","","False","0x000000E1","",""
"","TEXT_VOICEMAN_03200_002150_AYMERIC<tab>Some wounds do not heal. The dead cannot be returned to us.","TEXT_VOICEMAN_03200_002150_AYMERIC<tab>その傷は深く、決して癒えはしないだろう。","","False","0x000000E2","",""
"","TEXT_VOICEMAN_03200_002160_AYMERIC<tab>But we the living can yet choose another course. Here and now, we can lay down this burden─this hatred, this vengeance.","TEXT_VOICEMAN_03200_002160_AYMERIC<tab>だが、嘆く者よ……
今ひとたび、己を焦がす怒りを鎮め、
戦いの手を止めてはくれまいか。","","False","0x000000E3","",""
"","TEXT_VOICEMAN_03200_002170_AYMERIC<tab>Our forebears fought not so that we could die, but that we might live! So let us honor their sacrifice and spare our children this death sentence. Let us gift them a new legacy. Life!","TEXT_VOICEMAN_03200_002170_AYMERIC<tab>先逝く者が戦いの末に遺したのは、
ほかでもない、貴方の命だ。
私は貴方と明日に歩むことで、彼らの行いに報いたい。","","False","0x000000E4","",""
"","TEXT_VOICEMAN_03200_002180_VIDOFNIR<tab>Betwixt our peoples yawneth a divide deeper than the deepest abyss; wider than the widest sea.","TEXT_VOICEMAN_03200_002180_VIDOFNIR<tab>竜と人を隔てる溝は谷より深く、
越えねばならぬ障害は、仰ぎ見る霊峰ほどもあろう。","","False","0x000000E5","",""
"","TEXT_VOICEMAN_03200_002190_VIDOFNIR<tab>Generations will live and die ere this divide is bridged. Knowing this, doth thy heart yet yearn for peace, son of Thordan?","TEXT_VOICEMAN_03200_002190_VIDOFNIR<tab>それでも人は、その短き一生を重ね、
再び我らと蜜月を迎えんことを、心より望むか？","","False","0x000000E6","",""
"","TEXT_VOICEMAN_03200_002200_AYMERIC<tab>Look now on the legacy we would leave to our children. A dream of peace inscribed in stone for generations to come.","TEXT_VOICEMAN_03200_002200_AYMERIC<tab>ああ、望むとも。
そして、この願いが再び歴史に曲げられぬよう、
すべての証人の心と石に刻んで、和平の誓いと成さん……！","","False","0x000000E7","",""
"","TEXT_VOICEMAN_03200_002210_VIDOFNIR<tab>Father and his beloved. As they were so long ago. Happy and at peace.","TEXT_VOICEMAN_03200_002210_VIDOFNIR<tab>おうや、これは……
我が父祖フレースヴェルグと、シヴァではないか。
なるほど、和平の契りとするのに、これ以上のものはない。","","False","0x000000E8","",""
"","TEXT_VOICEMAN_03200_002220_VIDOFNIR<tab>The dream they shared shall be ours once more.","TEXT_VOICEMAN_03200_002220_VIDOFNIR<tab>よかろう……。
今このときより、聖竜に連なる子らは、
再び人と同じ夢を見ようではないか。","","False","0x000000E9","",""
"","TEXT_VOICEMAN_03200_002230_ESTINIEN<tab>(-???-)Never!","TEXT_VOICEMAN_03200_002230_ESTINIEN<tab>(-？？？？-)笑止ッ！","","False","0x000000EA","",""
"","TEXT_VOICEMAN_03200_002240_AYMERIC<tab>Your bow!","TEXT_VOICEMAN_03200_002240_AYMERIC<tab>貸せっ！","","False","0x000000EB","",""
"","TEXT_VOICEMAN_03200_002250_ALPHINAUD<tab>Estinien! No...","TEXT_VOICEMAN_03200_002250_ALPHINAUD<tab>あ、あれは、エスティニアン殿！？
そんな、どうして……ッ！？","","False","0x000000EC","",""
"","TEXT_VOICEMAN_03200_002260_ESTINIEN<tab>Child of Dravania! Art thou grown so forgetful that thou wouldst forsake kith and kin, and consort with the spawn of Thordan? That thou wouldst <var 1A 02 /var>dare<var 1A 01 /var> contemplate peace!","TEXT_VOICEMAN_03200_002260_ESTINIEN<tab>どこまで墜ちるか、聖竜の眷属よ。
ヒトと和平を契ろうなどと、同族とは思えぬ愚かしさ……。","","False","0x000000ED","",""
"","TEXT_VOICEMAN_03200_002270_ESTINIEN<tab>Hearken unto me, all of you! The final chorus is nigh, and all will be held to account! All will bathe in the flames of retribution!","TEXT_VOICEMAN_03200_002270_ESTINIEN<tab>聞け……ヒトと、ヒトに与する竜ども！
次にとどろく竜の咆哮は、最後の戦を告げる合図……
貴様らのすべてを、宿怨の炎で焼き尽くしてくれる。","","False","0x000000EE","",""
"","TEXT_VOICEMAN_03200_002280_ESTINIEN<tab>Till the coming of that day, look you on your sins and despair! For none shall 'scape my wrath! None shall 'scape my revenge!","TEXT_VOICEMAN_03200_002280_ESTINIEN<tab>その日まで恐れ、嘆き、絶望せよ。
それらすべてを蹂躙してこそ、我が怒りも晴らせよう……！","","False","0x000000EF","",""
"","TEXT_VOICEMAN_03200_002290_ALPHINAUD<tab>Seven hells!","TEXT_VOICEMAN_03200_002290_ALPHINAUD<tab>我が怒り……？
そんな……それじゃあ、お前はッ……！","","False","0x000000F0","",""
"","TEXT_VOICEMAN_03200_002300_ALPHINAUD<tab>Damn you, Nidhogg...","TEXT_VOICEMAN_03200_002300_ALPHINAUD<tab>邪竜……ニーズヘッグ……！","","False","0x000000F1","",""
"","TEXT_VOICEMAN_03200_002310_CITIZENA02240<tab>Hells take that wyrm! While he lives, we'll never know peace!","TEXT_VOICEMAN_03200_002310_CITIZENA02240<tab>ぜ、全部あの邪竜のせいだ……！
あいつさえいなければ、戦争は終わるのに！","","False","0x000000F2","",""
"","TEXT_VOICEMAN_03200_002320_CITIZENB02240<tab>Aye, there'll be no end to this war till Nidhogg is dead and gone!","TEXT_VOICEMAN_03200_002320_CITIZENB02240<tab>そうよ、いつまでもやられているものですか！
今こそ、イシュガルドの宿命を変えるとき……
あいつを倒して、真の平和を！","","False","0x000000F3","",""
"","TEXT_VOICEMAN_03200_002330_CITIZENC02240<tab>So let's kill the bastard and be done with it! Death to Nidhogg! Death to Nidhogg! Death to Nidhogg!","TEXT_VOICEMAN_03200_002330_CITIZENC02240<tab>邪竜ニーズヘッグを返り討ちにしてやるんだ！
倒せ、倒せ、邪竜を殺せぇッ！","","False","0x000000F4","",""
"","TEXT_VOICEMAN_03200_002340_CITIZENA02240<tab>(-Angry Mob-)Death to Nidhogg! Death to Nidhogg!
Death to Nidhogg! Death to Nidhogg!
Death to Nidhogg! Death to Nidhogg!","TEXT_VOICEMAN_03200_002340_CITIZENA02240<tab>倒せ、倒せ、邪竜を殺せ……
倒せ、倒せ、邪竜を殺せ……ッ！！","","False","0x000000F5","",""
"","TEXT_VOICEMAN_03200_002350_CITIZENB02240<tab>(-Angry Mob-)Death to Nidhogg! Death to Nidhogg!
Death to Nidhogg! Death to Nidhogg!
Death to Nidhogg! Death to Nidhogg!","TEXT_VOICEMAN_03200_002350_CITIZENB02240<tab>倒せ、倒せ、邪竜を殺せ……
倒せ、倒せ、邪竜を殺せ……ッ！！","","False","0x000000F6","",""
"","TEXT_VOICEMAN_03200_002360_CITIZENC02240<tab>(-Angry Mob-)Death to Nidhogg! Death to Nidhogg!
Death to Nidhogg! Death to Nidhogg!
Death to Nidhogg! Death to Nidhogg!","TEXT_VOICEMAN_03200_002360_CITIZENC02240<tab>倒せ、倒せ、邪竜を殺せ……
倒せ、倒せ、邪竜を殺せ……ッ！！","","False","0x000000F7","",""
"","TEXT_VOICEMAN_03200_002361_CITIZENA02240<tab>(-Angry Mob-)Death to the wyrm! Death to Nidhogg!
Death to the wyrm! Death to Nidhogg!
Death to the wyrm! Death to Nidhogg!","TEXT_VOICEMAN_03200_002361_CITIZENA02240<tab>そうだ、ひるむな！","","False","0x000000F8","",""
"","TEXT_VOICEMAN_03200_002362_CITIZENB02240<tab>(-Angry Mob-)Death to Nidhogg! Death to Nidhogg!
Death to Nidhogg! Death to Nidhogg!","TEXT_VOICEMAN_03200_002362_CITIZENB02240<tab>倒せーッ！","","False","0x000000F9","",""
"","TEXT_VOICEMAN_03200_002363_CITIZENC02240<tab>(-Angry Mob-)Death to Nidhogg! Death to Nidhogg!
Death to Nidhogg! Death to Nidhogg!
Death to Nidhogg! Death to Nidhogg!","TEXT_VOICEMAN_03200_002363_CITIZENC02240<tab>今こそ邪龍討伐だ！","","False","0x000000FA","",""
"","TEXT_VOICEMAN_03200_002370_KRILE<tab>Of all the ways for it to end.","TEXT_VOICEMAN_03200_002370_KRILE<tab>まさか、あんな形で式典が終わるなんてね……。","","False","0x000000FB","",""
"","TEXT_VOICEMAN_03200_002380_KRILE<tab>Even before his transformation, I could feel the wyrm's hatred swirling about Estinien. The terrible, all-consuming rage...","TEXT_VOICEMAN_03200_002380_KRILE<tab>エスティニアンさん……
いえ、ニーズヘッグと呼ぶべきかしら。
彼の中に、すさまじい怨念が渦巻いているのを感じたわ。","","False","0x000000FC","",""
"","TEXT_VOICEMAN_03200_002390_KRILE<tab>Enough to fuel a thousand-year quest for vengeance. It was all I could do not to run away screaming.","TEXT_VOICEMAN_03200_002390_KRILE<tab>思わず震えてしまうほど、恐ろしい怨念だった……。
千年もの間、人と戦い続けてきたのにも納得よ。","","False","0x000000FD","",""
"","TEXT_VOICEMAN_03200_002400_KRILE<tab>But Ishgardians─nay, all Eorzeans─are made of sterner stuff. They face danger and death on a daily basis, and understand what it takes to win a war.","TEXT_VOICEMAN_03200_002400_KRILE<tab>あれほどの危険と隣り合わせなのが、
イシュガルドの……エオルゼアの日常なのね。
なるほど、マトーヤ様が釘を刺すわけだわ。","","False","0x000000FE","",""
"","TEXT_VOICEMAN_03200_002410_YSHTOLA<tab>Think not too deeply on Master Matoya's words. Her intent was but to steel our resolve.","TEXT_VOICEMAN_03200_002410_YSHTOLA<tab>真の願いを見失っていないか、という問いのこと？
あれは、マトーヤなりに激励していたんじゃないかしら……。","","False","0x000000FF","",""
"","TEXT_VOICEMAN_03200_002420_YSHTOLA<tab>That, and to remind us to look beyond these passing conflicts to trials greater still─to the truth which hides at the heart of this world.","TEXT_VOICEMAN_03200_002420_YSHTOLA<tab>……だから、私は進み続ける。
あらゆる戦いを超えて、マトーヤが求めた「世界の真理」を、
マトーヤよりも遠くまで視るために……。","","False","0x00000100","",""
"","TEXT_VOICEMAN_03200_002430_KRILE<tab>So that's your aim, is it?","TEXT_VOICEMAN_03200_002430_KRILE<tab>もしかして、それがヤ・シュトラの目的だったの？","","False","0x00000101","",""
"","TEXT_VOICEMAN_03200_002440_YSHTOLA<tab>You disapprove?","TEXT_VOICEMAN_03200_002440_YSHTOLA<tab>……おかしいかしら？","","False","0x00000102","",""
"","TEXT_VOICEMAN_03200_002450_KRILE<tab>Not at all! I believe it's traditional for the student to follow in the footsteps of the master. And you are so very alike.","TEXT_VOICEMAN_03200_002450_KRILE<tab>全然！
あの師匠にして、この弟子ありだわ！","","False","0x00000103","",""
"","TEXT_VOICEMAN_03200_002460_ALPHINAUD<tab>Forgive me. That took longer than expected.","TEXT_VOICEMAN_03200_002460_ALPHINAUD<tab>すまない、待たせてしまったね。","","False","0x00000104","",""
"","TEXT_VOICEMAN_03200_002470_ALPHINAUD<tab>...You seem puzzled. Oh, these? I thought something warming might not go amiss.","TEXT_VOICEMAN_03200_002470_ALPHINAUD<tab>ああ、これかい？
ここの住民に、応接室を使わせてほしいと頼みに行ったら、
寒かろうと持たせてくれてね……。","","False","0x00000105","",""
"","TEXT_VOICEMAN_03200_002480_ALPHINAUD<tab>It was not all that long ago that we sat here, you and I. In our very own “Falling Snows,” as Lord Haurchefant called it.","TEXT_VOICEMAN_03200_002480_ALPHINAUD<tab>……ウルダハの祝賀会から逃げ延びて、
この「雪の家」に来たときのことを思い出すよ。","","False","0x00000106","",""
"","TEXT_VOICEMAN_03200_002490_ALPHINAUD<tab>I still struggle to believe he has gone. And Ysayle too... I had such hopes for her...","TEXT_VOICEMAN_03200_002490_ALPHINAUD<tab>あのとき励ましてくれたオルシュファン卿は、もういない。
旅の中で多くの出会いと別れを繰り返したが、
イゼルもまた、私たちを送り出すため散っていった……。","","False","0x00000107","",""
"","TEXT_VOICEMAN_03200_002500_ALPHINAUD<tab>Master Matoya asked me what it was all for. Why we fight...and why we die.","TEXT_VOICEMAN_03200_002500_ALPHINAUD<tab>……マトーヤ様の言葉について、ずっと考えていたんだ。
進むことで失うものがあるのなら、何のために進むのか。","","False","0x00000108","",""
"","TEXT_VOICEMAN_03200_002510_ALPHINAUD<tab>Were I still commander of the Braves, I would doubtless have replied, “For the future of Eorzea,” but I am not that man. Not anymore.","TEXT_VOICEMAN_03200_002510_ALPHINAUD<tab>かつて、クリスタルブレイブを設立したころの私なら、
迷うことなく、理想の世界のためだと言い切れるだろう。
だが、今は……失うものの重みが、怖いんだ……。","","False","0x00000109","",""
"","TEXT_VOICEMAN_03200_002520_ALPHINAUD<tab>I needed a new answer. One that I could live with. And when I saw Estinien at the ceremony, I knew at last what it was.","TEXT_VOICEMAN_03200_002520_ALPHINAUD<tab>だからこそ、後悔することのないように、
私が何のために進むのか、自分自身に問わねばと思った。
先ほどの式典でエスティニアン殿を見て、やっと確信したよ。","","False","0x0000010A","",""
"","TEXT_VOICEMAN_03200_002530_ALPHINAUD<tab>I do not want to be a man who sacrifices his friends and family for a cause. I want to fight for Estinien─and I want to save him.","TEXT_VOICEMAN_03200_002530_ALPHINAUD<tab>私は、友を救える男になりたい。
そのためならば、どんな絶望も、きっと超えられる。","","False","0x0000010B","",""
"","TEXT_VOICEMAN_03200_002540_ALPHINAUD<tab>When Nidhogg leads the Horde into battle, Ser Aymeric and his forces will do what they believe must be done.","TEXT_VOICEMAN_03200_002540_ALPHINAUD<tab>恐らく遠くないうちに、ニーズヘッグの咆哮が響くだろう。
そのとき、アイメリク卿はイシュガルドの指導者として、
かつての友を討つ道しか選べないはずだ。","","False","0x0000010C","",""
"","TEXT_VOICEMAN_03200_002550_ALPHINAUD<tab>That is their choice to make. Yet even if Ser Aymeric is willing to forsake Estinien, I am not.","TEXT_VOICEMAN_03200_002550_ALPHINAUD<tab>その決断に、異を唱えるつもりはない。
だが、アイメリク卿が選べないからこそ……
私は、エスティニアン殿を救う道を探したいんだ。","","False","0x0000010D","",""
"","TEXT_VOICEMAN_03200_002560_ALPHINAUD<tab>We must fight for him, for he is our friend and ally. We may struggle, we may fail, but we must try.","TEXT_VOICEMAN_03200_002560_ALPHINAUD<tab>可能性などないに等しい、困難な道だろう。
だから、同じエスティニアン殿の友である、
君の力を貸してくれ……ッ！","","False","0x0000010E","",""
"","TEXT_VOICEMAN_03200_Q1_000_001<tab>What will you say?","TEXT_VOICEMAN_03200_Q1_000_001<tab>何と答える？","","False","0x0000010F","",""
"","TEXT_VOICEMAN_03200_A1_000_001<tab>We will find a way to save him.","TEXT_VOICEMAN_03200_A1_000_001<tab>必ずエスティニアンを救おう","","False","0x00000110","",""
"","TEXT_VOICEMAN_03200_A1_000_002<tab>...To aid those in need.","TEXT_VOICEMAN_03200_A1_000_002<tab>友のために戦おう","","False","0x00000111","",""
"","TEXT_VOICEMAN_03200_A1_000_003<tab>...","TEXT_VOICEMAN_03200_A1_000_003<tab>…………","","False","0x00000112","",""
"","TEXT_VOICEMAN_03200_002570_ALPHINAUD<tab>We will. I know we will.","TEXT_VOICEMAN_03200_002570_ALPHINAUD<tab>ああ、必ずだとも……！
私たちの力で、エスティニアン殿を連れ戻そう！","","False","0x00000113","",""
"","TEXT_VOICEMAN_03200_002580_ALPHINAUD<tab>Lord Haurchefant would be proud. I knew you would understand! Together, we will surely find a way.","TEXT_VOICEMAN_03200_002580_ALPHINAUD<tab>君は、オルシュファン卿の遺志を継いでいるのだな……。
……ああ、私も足掻いてみせるとも。
必ず、エスティニアン殿を連れ戻そう！","","False","0x00000114","",""
"","TEXT_VOICEMAN_03200_002590_ALPHINAUD<tab>Forgive me. I say these things to you in full knowledge of the fact that you have never yet given up on a friend. We will find a way. I know we will.","TEXT_VOICEMAN_03200_002590_ALPHINAUD<tab>君の意志は、言葉にせずとも伝わってくる。
誰よりも、仲間のことを思っていることも……。
ありがとう……必ず、エスティニアン殿を連れ戻そう！","","False","0x00000115","",""
"","TEXT_VOICEMAN_03200_002600_EDMONT<tab>Change─that great, inexorable wave─was upon us, and soon all of Ishgard would bend to its will.","TEXT_VOICEMAN_03200_002600_EDMONT<tab>かくして 運命の歯車はそれぞれに廻りだし
このイシュガルドをも 大きく動かさんとしていた","","False","0x00000116","",""
"","TEXT_VOICEMAN_03200_002610_EDMONT<tab>For all our sins, for all our scars, the future for which we had long yearned was at last within our grasp.","TEXT_VOICEMAN_03200_002610_EDMONT<tab>誰もが癒えぬ傷を抱きながら
渇望した未来へと 歩みはじめたのである","","False","0x00000117","",""
"","TEXT_VOICEMAN_03200_002620_EDMONT<tab>But it would be bought at a heavy price.","TEXT_VOICEMAN_03200_002620_EDMONT<tab>それは同時に 避けられぬ決着の訪れでもあった","","False","0x00000118","",""
"","TEXT_VOICEMAN_03200_002630_EDMONT<tab>For in those twilight hours did Nidhogg cry out for vengeance,
and his brethren raise their voices for the final chorus of the Dragonsong War.","TEXT_VOICEMAN_03200_002630_EDMONT<tab>邪竜ニーズヘッグによる宣戦布告
竜詩戦争の終焉にむけて 戦端が開かれようとしていた――","","False","0x00000119","",""
"","TEXT_VOICEMAN_03200_002640_SYSTEM<tab>From the memoirs of Count Edmont de Fortemps
<var 1A 02 /var>Heavensward: The Gears of Change<var 1A 01 /var>","TEXT_VOICEMAN_03200_002640_SYSTEM<tab>フォルタン伯爵の回顧録『蒼天のイシュガルド』
第三章「運命の歯車」より抜粋","","False","0x0000011A","",""
"","TEXT_VOICEMAN_03200_002650_KRILE<tab>","TEXT_VOICEMAN_03200_002650_KRILE<tab>（★未使用／削除予定★）","","False","0x0000011B","",""

