"location","source","target","id","fuzzy","context","translator_comments","developer_comments"
"","TEXT_VOICEMAN_03200_000010_KRILE<tab>Well done, sir. And with that, I believe we are ready to proceed.","TEXT_VOICEMAN_03200_000010_KRILE<tab>……厄介払い、おつかれさま。
おかげで、こっちも認証がパスできそうよ。","","False","0x00000000","",""
"","TEXT_VOICEMAN_03200_000020_THANCRED<tab>Let us be about our business then. The next patrol may not be so credulous.","TEXT_VOICEMAN_03200_000020_THANCRED<tab>それなら、先を急ごう。
即席の変装じゃ、そう何度もやりすごせないからな。","","False","0x00000001","",""
"","TEXT_VOICEMAN_03200_000030_KRILE<tab>Why must you be so disappointingly brusque? You're not at all as Minfilia described, you know. I don't think you've favored me with so much as a single compliment since we set out.","TEXT_VOICEMAN_03200_000030_KRILE<tab>サンクレッドさん……。
あなたが手を貸してくれて、本当に助かるわ。
前から噂は聞いていたけど、正直、別人を見ている気分よ。","","False","0x00000002","",""
"","TEXT_VOICEMAN_03200_000040_KRILE<tab>Tell me, did your time in the wilderness sap you of all your charm, or are you holding it in reserve for your beloved?","TEXT_VOICEMAN_03200_000040_KRILE<tab>こんなにも頼もしいのは、例のサバイバル生活の賜物かしら？
それとも……ミンフィリアを強く想っているから？","","False","0x00000003","",""
"","TEXT_VOICEMAN_03200_000050_THANCRED<tab>This is neither the time nor the place.","TEXT_VOICEMAN_03200_000050_THANCRED<tab>……今する話じゃないと思うが。","","False","0x00000004","",""
"","TEXT_VOICEMAN_03200_000060_KRILE<tab>Well, call me old-fashioned, but when I'm risking life and limb infiltrating an imperial castrum, I like to be sure of my comrades' motivations.","TEXT_VOICEMAN_03200_000060_KRILE<tab>いいえ、意志の確認は大切よ。
ここから先は、もっと危険な場所なんだから。
あとで侵入したことを後悔されても、困ってしまうし。","","False","0x00000005","",""
"","TEXT_VOICEMAN_03200_000070_THANCRED<tab>I see now where Alphinaud gets it from.","TEXT_VOICEMAN_03200_000070_THANCRED<tab>さすがは、アルフィノ様の先輩。
とんだ曲者だよ……。","","False","0x00000006","",""
"","TEXT_VOICEMAN_03200_000080_THANCRED<tab>Minfilia is dear to me, it is true─but not in the way you think.","TEXT_VOICEMAN_03200_000080_THANCRED<tab>確かに、ミンフィリアは、何にも代えがたい大事な人だ。
……だが、恐らく君が想像しているような関係じゃない。","","False","0x00000007","",""
"","TEXT_VOICEMAN_03200_000090_THANCRED<tab>Fifteen years past, when she was still but a child, there was an incident at a parade. A goobbue broke free of its fetters and ran amok through the streets of Ul'dah. Had I been more attentive, I could have prevented it...but I was distracted, and her father was killed.","TEXT_VOICEMAN_03200_000090_THANCRED<tab>15年前、俺の油断と甘さが、ミンフィリアの父親の命を奪った。
だから最初は、贖罪のつもりで助けてやろうと思ったんだ。","","False","0x00000008","",""
"","TEXT_VOICEMAN_03200_000100_THANCRED<tab>I feared she would never recover, but in the years that followed, she showed herself to be more resilient than I had ever imagined. And when she learned of her gift, she did not flinch from the responsibility, but sought to guide others on the path.","TEXT_VOICEMAN_03200_000100_THANCRED<tab>けれども、成長した彼女が、
自らの「力」を他人のために使おうとしている姿を見て、
純粋に協力したいと思うようになった……。","","False","0x00000009","",""
"","TEXT_VOICEMAN_03200_000110_THANCRED<tab>She touched the hearts of all around her. Mine, Louisoix's, every Scion's. In those dark days following the Calamity, she was our guiding light─our hope for a brighter future.","TEXT_VOICEMAN_03200_000110_THANCRED<tab>ミンフィリアに心を動かされたのは、俺だけじゃない。
俺の恩師であるルイゾワのじいさんや、
「暁」の仲間たちも、彼女に未来を賭けていた。","","False","0x0000000A","",""
"","TEXT_VOICEMAN_03200_000120_THANCRED<tab>She had so many dreams...and I would give anything to make them come true.","TEXT_VOICEMAN_03200_000120_THANCRED<tab>それもあってかな……
ミンフィリアは俺にとって、一番尊い希望になっていたんだ。
彼女の目指す夢だけは、何としても叶えてやりたい。","","False","0x0000000B","",""
"","TEXT_VOICEMAN_03200_000130_KRILE<tab>My apologies. I can see she means the world to you. I did not mean to pick at old scars.","TEXT_VOICEMAN_03200_000130_KRILE<tab>……なるほど。
あの子はとても、大事に思われているのね。
試すようなことを言って、ごめんなさい。","","False","0x0000000C","",""
"","TEXT_VOICEMAN_03200_000140_THANCRED<tab>No harm done, I assure you. But fair is fair, my lady─what is Minfilia to you?","TEXT_VOICEMAN_03200_000140_THANCRED<tab>構わないさ。
しかし、君の方こそどうなんだ？
ただの協力者にしては、危ない橋を渡っていると思うが。","","False","0x0000000D","",""
"","TEXT_VOICEMAN_03200_000150_KRILE<tab>You mean you don't know? Only my dearest friend.","TEXT_VOICEMAN_03200_000150_KRILE<tab>あら、知らなかった？
わたしとミンフィリアって、大の親友なのよ。","","False","0x0000000E","",""
"","TEXT_VOICEMAN_03200_000160_KRILE<tab>When I finally emerged from my torpor, I learned that nary a day had passed without her asking after me. She never gave up hope.","TEXT_VOICEMAN_03200_000160_KRILE<tab>……バル島が襲撃され、わたしが眠り続けていたとき、
彼女は何度も本部と連絡をとって、身を案じてくれていた。","","False","0x0000000F","",""
"","TEXT_VOICEMAN_03200_000170_KRILE<tab>And neither will I.","TEXT_VOICEMAN_03200_000170_KRILE<tab>だから、今度はわたしの番。
彼女を探すためなら、どんな危険もへっちゃらよ！","","False","0x00000010","",""
"","TEXT_VOICEMAN_03200_000180_THANCRED<tab>Then for Minfilia's sake, let us pray that these vestiges of Hydaelyn's intervention will lead us to her.","TEXT_VOICEMAN_03200_000180_THANCRED<tab>では、行こう。
ハイデリンの干渉の痕跡について調べれば、
きっと、ミンフィリアの手がかりに辿りつくさ！","","False","0x00000011","",""
"","TEXT_VOICEMAN_03200_000190_MINFILIA<tab>Hear... Feel... Think...","TEXT_VOICEMAN_03200_000190_MINFILIA<tab>……聞いて……感じて……考えて…………","","False","0x00000012","",""
"","TEXT_VOICEMAN_03200_000200_MINFILIA<tab>(-???-)Through time and space hast thou journeyed unto me...as I knew thou wouldst.","TEXT_VOICEMAN_03200_000200_MINFILIA<tab>(-？？？？-)あなたならば、必ずや辿りつくと信じていた……。
よくぞ、ここまで来てくれました。","","False","0x00000013","",""
"","TEXT_VOICEMAN_03200_000210_MINFILIA<tab>We are the Word of the Mother. We who were once called “Minfilia.”","TEXT_VOICEMAN_03200_000210_MINFILIA<tab>わたしは「星の代弁者」。
あなたにとっては、ミンフィリアだった者……。","","False","0x00000014","",""
"","TEXT_VOICEMAN_03200_000220_MINFILIA<tab>Much time hath passed for thee, since the bloody banquet. Since...since I hearkened to Her word.","TEXT_VOICEMAN_03200_000220_MINFILIA<tab>そちらの時間では、もう久しい過去になるのでしょうか……。
裏切りの祝宴から逃げる最中、
「わたし」は星の……ハイデリンの声を聞きました。","","False","0x00000015","",""
"","TEXT_VOICEMAN_03200_000230_MINFILIA<tab>Mother... Hydaelyn guided me...towards Y'shtola and Thancred, that I might be swept up in their Flow...and delivered unto the aetherial sea...","TEXT_VOICEMAN_03200_000230_MINFILIA<tab>「わたし」は声に導かれるまま、
自ら仲間のエンシェント・テレポに巻き込まれることで、
エーテルの流れに身を投じ、星の海に辿りついたのです。","","False","0x00000016","",""
"","TEXT_VOICEMAN_03200_000240_MINFILIA<tab>There, adrift and alone, Her voice silent once more, I prayed... For those we have lost. For those we can yet save. To Her I would make an offering...","TEXT_VOICEMAN_03200_000240_MINFILIA<tab>けれど、星の声はすでに消えかけていた……。
失われゆく訴えのすべてを知るため、
「わたし」は、ハイデリンの一部となることを望みました。","","False","0x00000017","",""
"","TEXT_VOICEMAN_03200_000250_MINFILIA<tab>We speak now with one Voice. One Will. One Word. Unto thee we bequeath the most precious of gifts: the truth which lieth at the heart of this world.","TEXT_VOICEMAN_03200_000250_MINFILIA<tab>そして、今のわたしとなったのです。
わたしの声は、星の声……。
ずっと、あなたに世界の真実を伝えたかった。","","False","0x00000018","",""
"","TEXT_VOICEMAN_03200_000260_MINFILIA<tab>Thus do we beseech thee once more... Hear... Feel... Think...","TEXT_VOICEMAN_03200_000260_MINFILIA<tab>だから、お願い。
聞いて……感じて……考えて…………。","","False","0x00000019","",""
"","TEXT_VOICEMAN_03200_000270_MINFILIA<tab>Before there was life, in the depths of the aetherial sea, Light and Dark did once dwell as one.","TEXT_VOICEMAN_03200_000270_MINFILIA<tab>すべての命が生まれるより前、星の海の底では、
光たる「ハイデリン」と闇たる「ゾディアーク」とが、
ひとところにありました……。","","False","0x0000001A","",""
"","TEXT_VOICEMAN_03200_000280_MINFILIA<tab>But the Darkness coveted power, and the balance was broken. Thus was I forced to banish Him unto the distant heavens, to forever remain apart. A moon bound.","TEXT_VOICEMAN_03200_000280_MINFILIA<tab>しかし、闇が力をつけ、光との均衡が崩壊したのです……。
そこでハイデリンは、ゾディアークを星の海より放逐し、
遠い天に封じることとしました……。","","False","0x0000001B","",""
"","TEXT_VOICEMAN_03200_000290_MINFILIA<tab>In sundering the star did we cry out, and the barriers 'twixt planes chance to falter.","TEXT_VOICEMAN_03200_000290_MINFILIA<tab>こうして、月が生まれた……。
しかし、星をふたつに割く痛みは、
次元の境界をも傷つけてしまったのです……。","","False","0x0000001C","",""
"","TEXT_VOICEMAN_03200_000300_MINFILIA<tab>Across ten and three were we then divided. Reflections of the Source, each possessed of a shard.","TEXT_VOICEMAN_03200_000300_MINFILIA<tab>あなたがたが生きる「原初世界」のほかに、
十と三もの鏡像の世界が、このときに生じました……。
そして、光と闇の力も、それぞれの世界に分かたれたのです。","","False","0x0000001D","",""
"","TEXT_VOICEMAN_03200_000310_MINFILIA<tab>Zodiark longeth to be made whole. For His restoration, for His resurrection, His servants labor without cease.","TEXT_VOICEMAN_03200_000310_MINFILIA<tab>……月に追放されたゾディアークは、
使徒たるアシエンを使わし、世界を統合しようとしています。
闇の力をより合わせ、完全なる復活を成そうというのです。","","False","0x0000001E","",""
"","TEXT_VOICEMAN_03200_000320_MINFILIA<tab>They seek to tear down the barriers which surround the Source.","TEXT_VOICEMAN_03200_000320_MINFILIA<tab>そのためには、ここ「原初世界」の側から、
「世界を分かつ壁」を破壊しなければならない。","","False","0x0000001F","",""
"","TEXT_VOICEMAN_03200_000330_MINFILIA<tab>Thus do they rejoice in their Ardor─in your calamities─for each marks a Rejoining.","TEXT_VOICEMAN_03200_000330_MINFILIA<tab>これこそが「次元圧壊」であり、
アシエンたちが「アーダー」と呼ぶ現象なのです。
そして、人の歴史では、これに伴う災厄を「霊災」と呼ぶ……。","","False","0x00000020","",""
"","TEXT_VOICEMAN_03200_000340_MINFILIA<tab>Seven times have they succeeded. Seven times hath the Darkness grown stronger. Seven times have I failed.","TEXT_VOICEMAN_03200_000340_MINFILIA<tab>過去七度の霊災により、
すでに七つの世界が統合されてしまった……。
強まった闇の力に、光の力は押されるばかりです……。","","False","0x00000021","",""
"","TEXT_VOICEMAN_03200_000350_MINFILIA<tab>The Ascians cannot be suffered to continue. This...this is my final...","TEXT_VOICEMAN_03200_000350_MINFILIA<tab>どうかアシエンを止めて、世界の統合を阻止してください。
それが……「わたし」の……最後、の…………","","False","0x00000022","",""
"","TEXT_VOICEMAN_03200_000351_MINFILIA<tab>","TEXT_VOICEMAN_03200_000351_MINFILIA<tab>（★未使用／削除予定★）","","False","0x00000023","",""
"","TEXT_VOICEMAN_03200_000360_MINFILIA<tab>The Crystal's power is all but spent. With what remains, I will return you to the shore of the aetherial sea.","TEXT_VOICEMAN_03200_000360_MINFILIA<tab>あなたのクリスタルから借りた力も、これ以上は、もう……。
残った力で、あなたを星の渚まで送りましょう……。","","False","0x00000024","",""
"","TEXT_VOICEMAN_03200_000370_MINFILIA<tab>Blessed children, go forth and seek...seek...","TEXT_VOICEMAN_03200_000370_MINFILIA<tab>光の加護を受けし、ハイデリンの子らよ……。
どうか、世界を…………","","False","0x00000025","",""
"","TEXT_VOICEMAN_03200_000371_ALPHINAUD<tab>You've had another vision, haven't you?","TEXT_VOICEMAN_03200_000371_ALPHINAUD<tab>その様子、何かを視たのだね……？","","False","0x00000026","",""
"","TEXT_VOICEMAN_03200_000372_ALPHINAUD<tab>Let us return to Master Matoya's cave. Everyone will wish to hear what you saw.","TEXT_VOICEMAN_03200_000372_ALPHINAUD<tab>よし、マトーヤ様の洞窟に戻ろう。
詳しいことは、クルルさんを交えて聞かせてくれ。","","False","0x00000027","",""
"","TEXT_VOICEMAN_03200_000380_ALPHINAUD<tab>Thank the Twelve!","TEXT_VOICEMAN_03200_000380_ALPHINAUD<tab>（★未使用／削除予定★）","","False","0x00000028","",""
"","TEXT_VOICEMAN_03200_000390_THANCRED<tab>Did you find her!? Did you find Minfilia!?","TEXT_VOICEMAN_03200_000390_THANCRED<tab>（★未使用／削除予定★）","","False","0x00000029","",""
"","TEXT_VOICEMAN_03200_000392_MATOYA<tab>Still in one piece, are we?","TEXT_VOICEMAN_03200_000392_MATOYA<tab>ふん、全員無事のようだね……。","","False","0x0000002A","",""
"","TEXT_VOICEMAN_03200_000393_MATOYA<tab>Well? Did you learn anything?","TEXT_VOICEMAN_03200_000393_MATOYA<tab>それで、首尾はどうだったんだい？","","False","0x0000002B","",""
"","TEXT_VOICEMAN_03200_000400_ALPHINAUD<tab>The Word of the Mother...? I am not sure I understand.","TEXT_VOICEMAN_03200_000400_ALPHINAUD<tab>なんという……。
「星の海」で、そんなことが……。","","False","0x0000002C","",""
"","TEXT_VOICEMAN_03200_000410_YSHTOLA<tab>Nor am I. Krile?","TEXT_VOICEMAN_03200_000410_YSHTOLA<tab>……クルル。
あなたの率直な見立てを聞きたいのだけれど……。","","False","0x0000002D","",""
"","TEXT_VOICEMAN_03200_000420_KRILE<tab>As unbelievable as it sounds, I see no reason to doubt her─the Word's tale. No one was more sensitive to the will of Hydaelyn than Minfilia.","TEXT_VOICEMAN_03200_000420_KRILE<tab>ハイデリンの声に導かれて「星の代弁者」となる……
とんでもない話だけれど、嘘ではないと思う。
彼女は誰よりも、星の声を聞き取る力が強かったもの……。","","False","0x0000002E","",""
"","TEXT_VOICEMAN_03200_000430_KRILE<tab>And if Hydaelyn has grown so weak that She can barely make Herself heard, it is not hard to see why Minfilia, having joined with Her, might struggle to maintain her own form.","TEXT_VOICEMAN_03200_000430_KRILE<tab>そして……声が消えるほど、ハイデリンが弱っているなら、
その一部となったミンフィリアも、
とても不安定な状態だったでしょうね……。","","False","0x0000002F","",""
"","TEXT_VOICEMAN_03200_000440_ALPHINAUD<tab><var 1A 02 /var>What<var 1A 01 /var>? Why would she need to “maintain her own form”? Are you saying─ Are you saying she's gone?","TEXT_VOICEMAN_03200_000440_ALPHINAUD<tab>では、まさか本当に、
ミンフィリアは力を使い果たして……！？","","False","0x00000030","",""
"","TEXT_VOICEMAN_03200_000450_ALPHINAUD<tab>But that cannot be! Not now, not after all we have accomplished! We were meant to usher in the dawn's light together!","TEXT_VOICEMAN_03200_000450_ALPHINAUD<tab>……っ……ミンフィリア……！
「暁」の灯火が、やっと輝きを取り戻してきたんだ。
それを見たかったのは、誰よりも、君だっただろうに……！","","False","0x00000031","",""
"","TEXT_VOICEMAN_03200_000460_MATOYA<tab>She threw herself on the fire to fuel your “dawn's light,” boy. You'll just have to usher it in on your own.","TEXT_VOICEMAN_03200_000460_MATOYA<tab>灯火、ねぇ……。
ミンフィリアという娘を殺したのも、
その熱すぎる炎に、ほかならないと思うがね。","","False","0x00000032","",""
"","TEXT_VOICEMAN_03200_000470_YSHTOLA<tab>Must you be so ungentle!?","TEXT_VOICEMAN_03200_000470_YSHTOLA<tab>ちょっと、マトーヤ……！？","","False","0x00000033","",""
"","TEXT_VOICEMAN_03200_000480_MATOYA<tab>Tell me about the Scions, boy.","TEXT_VOICEMAN_03200_000480_MATOYA<tab>なあ、坊主……。
お前たちは、いったい何がしたいんだい？","","False","0x00000034","",""
"","TEXT_VOICEMAN_03200_000490_ALPHINAUD<tab>The...the Scions of the Seventh Dawn labor for Eorzea's salvation.","TEXT_VOICEMAN_03200_000490_ALPHINAUD<tab>我々「暁の血盟」の目的は、エオルゼアの救済です。","","False","0x00000035","",""
"","TEXT_VOICEMAN_03200_000500_ALPHINAUD<tab>Whenever the realm is threatened, be it by primal, Ascian, Garlean or any other, we take up arms in her defense, that all in Eorzea may live to see a brighter tomorrow.","TEXT_VOICEMAN_03200_000500_ALPHINAUD<tab>ミンフィリアが教えてくれた、アシエンの暗躍……
加えて蛮神問題など、この地は脅威に晒され続けている。
それらから、エオルゼアを救いたいんだ。","","False","0x00000036","",""
"","TEXT_VOICEMAN_03200_000510_MATOYA<tab>And that's very noble of you. But in chasing after these lofty goals of yours, you seem to have lost sight of some basic truths.","TEXT_VOICEMAN_03200_000510_MATOYA<tab>なるほど、いかにももっともだ。
だが聞こえのいい大義ほど、人を無心に駆り立てて、
そこにあったはずの「真の願い」を見失わせるのさ……。","","False","0x00000037","",""
"","TEXT_VOICEMAN_03200_000520_MATOYA<tab>To win a war, you must be willing to do whatever it takes. To fight, to kill, and, if necessary, to die.","TEXT_VOICEMAN_03200_000520_MATOYA<tab>お前たちのやっていることは、しょせん戦いだ。
先に進もうとすれば、今回のように、命を失うこともある。","","False","0x00000038","",""
"","TEXT_VOICEMAN_03200_000530_MATOYA<tab>The path you've chosen is paved with the dead. Walk it with your eyes open, or not at all.","TEXT_VOICEMAN_03200_000530_MATOYA<tab>掲げている、その目的は、
自分の……誰かの、死を捧ぐほどの願いかね。","","False","0x00000039","",""
"","TEXT_VOICEMAN_03200_000540_YSHTOLA<tab>I know the truth of which you speak, and have from the first.","TEXT_VOICEMAN_03200_000540_YSHTOLA<tab>……私の覚悟は、とっくに決まってるわ。
最初から、自分の願いを成すために、
「暁」の理想を追っているんだから。","","False","0x0000003A","",""
"","TEXT_VOICEMAN_03200_000550_YSHTOLA<tab>If the Ascians will go to any lengths to resurrect their god, then we must needs be as committed to our cause─to unmask them and their schemes, and to crush them both utterly.","TEXT_VOICEMAN_03200_000550_YSHTOLA<tab>アシエンが、闇の力の復活を目論んでいるならなおさら……
霊災のきっかけとなりかねない、あらゆる戦の種を、
片っ端から……潰すだけよ。","","False","0x0000003B","",""
"","TEXT_VOICEMAN_03200_000560_YSHTOLA<tab>Come. There is much to be done.","TEXT_VOICEMAN_03200_000560_YSHTOLA<tab>クルル、手伝ってもらいたいことがあるの。
一緒に来てもらえるかしら。","","False","0x0000003C","",""
"","TEXT_VOICEMAN_03200_000570_KRILE<tab>Y-Yes, of course.","TEXT_VOICEMAN_03200_000570_KRILE<tab>え、ええ……。","","False","0x0000003D","",""
"","TEXT_VOICEMAN_03200_000580_ALPHINAUD<tab>Thancred, wait!","TEXT_VOICEMAN_03200_000580_ALPHINAUD<tab>サンクレッド……！","","False","0x0000003E","",""
"","TEXT_VOICEMAN_03200_000590_ALPHINAUD<tab> No... No, this is all wrong.","TEXT_VOICEMAN_03200_000590_ALPHINAUD<tab>ミンフィリア……。
私は…………。","","False","0x0000003F","",""
"","TEXT_VOICEMAN_03200_000600_AYMERIC<tab>A pleasure to see you again, my friend. I take it you received our invitation?","TEXT_VOICEMAN_03200_000600_AYMERIC<tab>ああ、君か。
さては、「式典」への招待を受けてくれたのだな。","","False","0x00000040","",""
"","TEXT_VOICEMAN_03200_000610_AYMERIC<tab>Good, good... You of all people should be present.","TEXT_VOICEMAN_03200_000610_AYMERIC<tab>ありがたい、心から歓迎しよう。
君には、ぜひ立ち会ってもらいたくてね。","","False","0x00000041","",""
"","TEXT_VOICEMAN_03200_000620_AYMERIC<tab>When the True Brothers of the Faith seized control of the Vault, I feared the worst.","TEXT_VOICEMAN_03200_000620_AYMERIC<tab>……先日の、守旧派「豪胆将の精兵」による、
教皇庁立てこもり事件は覚えているな。","","False","0x00000042","",""
"","TEXT_VOICEMAN_03200_000630_AYMERIC<tab>Yet in adversity were we blessed with the promise of peace between man and dragon, through Vidofnir's timely rescue of an innocent child. Timely, I say, though “miraculous” or “providential” might better describe the event. The gods themselves could not have devised a more fitting symbol of hope.","TEXT_VOICEMAN_03200_000630_AYMERIC<tab>結果として、人質の少女をヴィゾーヴニルが助けることで、
人々にドラゴン族との融和の可能性を見せることができた……。","","False","0x00000043","",""
"","TEXT_VOICEMAN_03200_000640_AYMERIC<tab>Needless to say, we could scarce let such an opportunity pass us by, which is why I set about making formal arrangements for a peace conference between our peoples.","TEXT_VOICEMAN_03200_000640_AYMERIC<tab>その可能性を確固たるものにすべく、
改めて、ヴィゾーヴニルら聖竜の眷属と、
和平の契りを交わす「式典」を開くことになったのだ。","","False","0x00000044","",""
"","TEXT_VOICEMAN_03200_000650_AYMERIC<tab>You and yours have done more to bring us together than any, and it is only right that you attend.","TEXT_VOICEMAN_03200_000650_AYMERIC<tab>君や「暁」の協力によって拓かれた可能性を、
こうして次に繋げられて、私も大変嬉しいよ。","","False","0x00000045","",""
"","TEXT_VOICEMAN_03200_000660_AYMERIC<tab>But, I confess, that is not the only reason I would be glad to have you there. Given Nidhogg's implacable opposition to the peace, it is possible that he and his followers may attempt to disrupt proceedings, in which event, your presence would be a comfort to all in attendance.","TEXT_VOICEMAN_03200_000660_AYMERIC<tab>……無論、聖竜の眷属と和平の契りを結んだところで、
邪竜の一派が動けば、戦わざるを得ないだろう。","","False","0x00000046","",""
"","TEXT_VOICEMAN_03200_000670_AYMERIC<tab>Pray understand, I have no wish to invite the wyrm's ire, but if our fractured nation is to heal─if we are to move forward as a people united─then we must do whatever is necessary to bring about lasting change.","TEXT_VOICEMAN_03200_000670_AYMERIC<tab>だが、少しでも多くの国力を、
皇都復興と混乱の収束にあてることこそ、
「真の変革」になるのだと確信している……！","","False","0x00000047","",""
"","TEXT_VOICEMAN_03200_000680_AYMERIC<tab>'Tis nothing, 'tis nothing. <sigh> Lucia cautioned me against giving vent to my passions, lest my wounds reopen.","TEXT_VOICEMAN_03200_000680_AYMERIC<tab>すまない、大丈夫だ……。
「怪我も治りきっていないのに張り切りすぎるな」と、
ルキアから釘を刺されてはいるのだがな……。","","False","0x00000048","",""
"","TEXT_VOICEMAN_03200_000690_AYMERIC<tab>It has not been easy reaching out to our opponents in Ishgard, many of whom sympathized with the actions of the “True Brothers.” But in so doing, we have limited the influence of the zealots.","TEXT_VOICEMAN_03200_000690_AYMERIC<tab>立てこもり事件以来、同じ過ちを繰り返さぬよう、
私は多くの民の意見を聞いてきた……。
不安を汲み、できる限り最善の施策を提案してきたつもりだ。","","False","0x00000049","",""
