"location","source","target","id","fuzzy","context","translator_comments","developer_comments"
"","TEXT_VOICEMAN_03200_000700_AYMERIC<tab>The people are ready, my friend. This conference <var 1A 02 /var>must<var 1A 01 /var> go ahead!","TEXT_VOICEMAN_03200_000700_AYMERIC<tab>その甲斐あってか、最近では、守旧派の声も収まっている。
だからこそ、やっと「式典」に漕ぎ着けることができた……！","","False","0x0000004A","",""
"","TEXT_VOICEMAN_03200_000710_AYMERIC<tab>I knew you would understand.","TEXT_VOICEMAN_03200_000710_AYMERIC<tab>……ありがとう。
君は主賓に等しい存在なのだ、
くれぐれも遅れないで来てくれよ。","","False","0x0000004B","",""
"","TEXT_VOICEMAN_03200_000720_AYMERIC<tab>The conference will take place on the border of Ishgardian and Dravanian territory, in Falcon's Nest.","TEXT_VOICEMAN_03200_000720_AYMERIC<tab>「式典」の開催場所は、人の領地と、竜の領地の狭間……
クルザス西部高地の「ファルコンネスト」と決まっている。","","False","0x0000004C","",""
"","TEXT_VOICEMAN_03200_000730_AYMERIC<tab>Lucia is there seeing to the final preparations even as we speak. Pray join her at your earliest convenience─'twould not do for the guest of honor to arrive late, after all.","TEXT_VOICEMAN_03200_000730_AYMERIC<tab>現地では、ルキアが準備を仕切っているはずだ。
到着したら、声をかけてやってくれ。","","False","0x0000004D","",""
"","TEXT_VOICEMAN_03200_000740_AYMERIC<tab>Oh, and one more thing!","TEXT_VOICEMAN_03200_000740_AYMERIC<tab>すまない、最後にもうひとつ！","","False","0x0000004E","",""
"","TEXT_VOICEMAN_03200_000750_AYMERIC<tab>A drink! We should make time for one. Once the conference is concluded, I mean. By my reckoning, 'tis long overdue.","TEXT_VOICEMAN_03200_000750_AYMERIC<tab>……「式典」が無事に済んで落ち着いたら、
ぜひ、君と杯を交わしたい。
諸々の礼もかねてな。","","False","0x0000004F","",""
"","TEXT_VOICEMAN_03200_000760_WAITRESS02236<tab>Welcome, welcome! Find yourself an empty seat, and I'll be with you in a moment.","TEXT_VOICEMAN_03200_000760_WAITRESS02236<tab>いらっしゃいませ！
よかったら、空いているお席にどうぞ。","","False","0x00000050","",""
"","TEXT_VOICEMAN_03200_000770_WAITRESS02236<tab>Cold out, en't it? Here─a mug on the house. Let's get some color back in them cheeks!","TEXT_VOICEMAN_03200_000770_WAITRESS02236<tab>外は寒かったでしょう？
式典を祝してサービスするから、温まってくださいな。","","False","0x00000051","",""
"","TEXT_VOICEMAN_03200_000780_WAITRESS02236<tab>'Fraid food'll be a bit longer than usual. We've got a lot of hungry folk to feed what with the conference and all.","TEXT_VOICEMAN_03200_000780_WAITRESS02236<tab>お料理は、少しお待ちくださいね。
なにせ大賑わいなものだから、準備が追い付かなくて。","","False","0x00000052","",""
"","TEXT_VOICEMAN_03200_000790_WAITRESS02236<tab><sigh> So many people with cause to celebrate. To think there could be peace in our time, after all them years of fightin'...","TEXT_VOICEMAN_03200_000790_WAITRESS02236<tab>……みんな、平和の兆しが見えて嬉しいんだわ。
ずっと、戦いばっかりだったから。","","False","0x00000053","",""
"","TEXT_VOICEMAN_03200_000800_WAITRESS02236<tab>When I heard about the conference, I knew I had to come. I knew I had to be here─to do my bit.","TEXT_VOICEMAN_03200_000800_WAITRESS02236<tab>私だって、少しでも式典開催を後押ししたくて、
いてもたってもいられずに、ここで働かせてもらってるんです。","","False","0x00000054","",""
"","TEXT_VOICEMAN_03200_000810_WAITRESS02236<tab>My husband, he...he died fighting the dragons, you see... And here we are, about to break bread with them.","TEXT_VOICEMAN_03200_000810_WAITRESS02236<tab>恋人をドラゴン族との戦いで亡くして、
とても悲しい思いをしたから……。
戦いが終結に向かい始めるのが……嬉しくて。","","False","0x00000055","",""
"","TEXT_VOICEMAN_03200_000820_WAITRESS02236<tab>You all right, my lover? You look tired. Reckon you could do with a good long rest.","TEXT_VOICEMAN_03200_000820_WAITRESS02236<tab>あら……もう眠たくなってしまったんですか？
ずいぶんお疲れだったようですね。","","False","0x00000056","",""
"","TEXT_VOICEMAN_03200_000830_WAITRESS02236<tab>After all you've done, I'd say you've <var 1A 02 /var>earned<var 1A 01 /var> it.","TEXT_VOICEMAN_03200_000830_WAITRESS02236<tab>まあ、あれだけ大きなことを成せば、当然か……。
そうでしょう……竜の背に乗り凱旋した、救国の英雄さん？","","False","0x00000057","",""
"","TEXT_VOICEMAN_03200_000840_WAITRESS02236<tab>Sleep, now...sleeeeeep. Sleep and leave us to our affairs.","TEXT_VOICEMAN_03200_000840_WAITRESS02236<tab>しばらく、お休みになっていてください……。
これ以上、余計なことはしなくていいんです……。","","False","0x00000058","",""
"","TEXT_VOICEMAN_03200_000850_WAITRESS02236<tab>This was never your fight.","TEXT_VOICEMAN_03200_000850_WAITRESS02236<tab>全部、お前のせいだ……。","","False","0x00000059","",""
"","TEXT_VOICEMAN_03200_000860_OLDWOMAN02236<tab><sniffle> <sob>","TEXT_VOICEMAN_03200_000860_OLDWOMAN02236<tab>うっ……うっ……。","","False","0x0000005A","",""
"","TEXT_VOICEMAN_03200_000870_OLDWOMAN02236<tab>My son, they...they told me he walks in Halone's halls. Him and the rest of his unit.","TEXT_VOICEMAN_03200_000870_OLDWOMAN02236<tab>ごめんなさいね、お恥ずかしいところを……。
ここには、息子たちが眠っているの。
勇敢にドラゴン族との戦に出て、みんな逝ってしまったわ。","","False","0x0000005B","",""
"","TEXT_VOICEMAN_03200_000880_WAITRESS02236<tab>...They told me the same.","TEXT_VOICEMAN_03200_000880_WAITRESS02236<tab>お気持ちは、とてもよくわかります……。","","False","0x0000005C","",""
"","TEXT_VOICEMAN_03200_000890_OLDWOMAN02236<tab>I expect they think it's comforting.","TEXT_VOICEMAN_03200_000890_OLDWOMAN02236<tab>……そう、あなたも戦で大事な人を亡くしたのね。","","False","0x0000005D","",""
"","TEXT_VOICEMAN_03200_000900_OLDWOMAN02236<tab>Every time I come, I cry. I cannot bear to remember, but to forget would be a thousand times worse.","TEXT_VOICEMAN_03200_000900_OLDWOMAN02236<tab>ここにくると泣いてしまうとわかっていても、
なんだか、来ずにはいられなかったの。","","False","0x0000005E","",""
"","TEXT_VOICEMAN_03200_000910_OLDWOMAN02236<tab>Yet that is what they would have us do. Accept this truth for the sake of peace. Bury the past and look to the future.","TEXT_VOICEMAN_03200_000910_OLDWOMAN02236<tab>例の「真実」が明かされて、近頃の皇都では、
ドラゴン族との融和が、しきりに説かれているでしょう？
それは、素晴らしいことだとわかっているのだけれど……。","","False","0x0000005F","",""
"","TEXT_VOICEMAN_03200_000920_OLDWOMAN02236<tab>But <var 1A 02 /var>he<var 1A 01 /var> was my future. My flesh and blood─my heart...","TEXT_VOICEMAN_03200_000920_OLDWOMAN02236<tab>どうしてでしょうね……。
人と竜の和解が進むほど、戦に散った息子たちのことを、
忘れろと言われているようで、寂しくて……悔しくて……。","","False","0x00000060","",""
"","TEXT_VOICEMAN_03200_000930_TRAITORB02236<tab>Is this it? Are we the only ones with the courage to oppose this madness? Cowards, the lot of 'em!","TEXT_VOICEMAN_03200_000930_TRAITORB02236<tab>信頼のおける同志は、これだけか……。
ドラゴン族との融和政策に反対する者も、少なくなったものだ。","","False","0x00000061","",""
"","TEXT_VOICEMAN_03200_000940_TRAITORC02236<tab>They think only of the prize─of the peace Ser Aymeric promises them. They know in their hearts it's a lie, but they go along with it anyway, desperate fools. But not I. Not I!","TEXT_VOICEMAN_03200_000940_TRAITORC02236<tab>仕方があるまい。
アイメリク卿が提案した政策は、さも最良に見えた。
利益のみで道を選ぶ連中はみな、閉口して付き従おうよ。","","False","0x00000062","",""
"","TEXT_VOICEMAN_03200_000950_TRAITORC02236<tab>I see the wyrm that killed my brother in my dreams every night! And I will not rest until he lies broken at my feet! Him and every last one of his accursed kin!","TEXT_VOICEMAN_03200_000950_TRAITORC02236<tab>だが、俺は違う……。
今でも竜に殺された兄弟が夢に出ては、竜を許すなと言うんだ。
あいつらが浮かばれるまで、戦いを続けたい……！","","False","0x00000063","",""
"","TEXT_VOICEMAN_03200_000960_TRAITORB02236<tab>All this nonsense about kings of eld. As if I care what they did or didn't do! Makes no difference to me and mine! Have the dragons sued for peace in a thousand years? Have they bollocks!","TEXT_VOICEMAN_03200_000960_TRAITORB02236<tab>そもそも、これまでの歴史が嘘であったというのなら、
融和の先に掲げられた繁栄も、本当かどうか怪しいものだ。","","False","0x00000064","",""
"","TEXT_VOICEMAN_03200_000970_TRAITORB02236<tab>It's a bloody ruse is what it is! And Ser Aymeric and the rest of 'em've bloody fallen for it!","TEXT_VOICEMAN_03200_000970_TRAITORB02236<tab>融和に前向きなドラゴン族など、
この千年間、現れたことがなかったのだぞ？
劣勢を悟った竜が、アイメリク卿を騙したに違いない！","","False","0x00000065","",""
"","TEXT_VOICEMAN_03200_000980_OLDWOMAN02236<tab>But what can we do? They believe, and naught we can say will ever change their minds.","TEXT_VOICEMAN_03200_000980_OLDWOMAN02236<tab>でも、融和を望む気運は、
もはや私たちに止められるものではなくなっています……。","","False","0x00000066","",""
"","TEXT_VOICEMAN_03200_000990_OLDWOMAN02236<tab>Whether we like it or not, man and dragon will come together at Falcon's Nest, and all will be forgiven. Forgiven and forgotten.","TEXT_VOICEMAN_03200_000990_OLDWOMAN02236<tab>今度ファルコンネストで行われるという、
竜と和平の契りを交わす式典……
それが無事に済めば、行く末は決定的となるでしょう。","","False","0x00000067","",""
"","TEXT_VOICEMAN_03200_001000_WAITRESS02236<tab>No. I will not let that happen.","TEXT_VOICEMAN_03200_001000_WAITRESS02236<tab>それなら、式典を阻害すればいい。","","False","0x00000068","",""
"","TEXT_VOICEMAN_03200_001010_WAITRESS02236<tab>They will remember the true face of the enemy. I will show it to them. And we will rise up against them once more!","TEXT_VOICEMAN_03200_001010_WAITRESS02236<tab>……私はやります。
この命で、みんなが戦う意志を取り戻すなら、十分です。","","False","0x00000069","",""
"","TEXT_VOICEMAN_03200_001020_THANCRED<tab>Hey! Hey! This is no time for napping!","TEXT_VOICEMAN_03200_001020_THANCRED<tab>……い……おいッ！
起きろ、目を覚ませッ！","","False","0x0000006A","",""
"","TEXT_VOICEMAN_03200_001030_THANCRED<tab>Do you have your wits about you? Good. Come with me─we have a crisis on our hands!","TEXT_VOICEMAN_03200_001030_THANCRED<tab>大丈夫か……！？
少しばかり、マズイことになった。
ともかく、外に出るぞ！","","False","0x0000006B","",""
"","TEXT_VOICEMAN_03200_001040_WAITRESS02236<tab>Hear me, brothers and sisters! Do not be fooled by the honeyed words of the Dravanians! The peace they promise is but a prelude to slaughter!","TEXT_VOICEMAN_03200_001040_WAITRESS02236<tab>聞けッ、イシュガルドの民よ！
我々は融和という偽りの安息を拒み、立ち上がらねばならない！","","False","0x0000006C","",""
"","TEXT_VOICEMAN_03200_001050_WAITRESS02236<tab>Remember your husbands and wives, never returned from war! Your children, torn apart by fang and claw! All your loved ones, shown no mercy!","TEXT_VOICEMAN_03200_001050_WAITRESS02236<tab>思い出せ、竜にはらわたを喰い千切られた親類を。
思い出せ、戦地に旅立ち、二度とは戻らなかった友を。
……恋人をッ！","","False","0x0000006D","",""
"","TEXT_VOICEMAN_03200_001060_WAITRESS02236<tab>Does not your heart cry out for vengeance!? Your blood boil at the injustice!? Remember the face of your enemy, brothers and sisters! Remember it and strike back!","TEXT_VOICEMAN_03200_001060_WAITRESS02236<tab>この血が、悲しみに凍ることなく巡っているのは、
奪われたことに怒り、戦い続けてきたからだ！
イシュガルドの民、その強さは、竜との戦いのみに活きるッ！","","False","0x0000006E","",""
"","TEXT_VOICEMAN_03200_001070_EMMANELLAIN<tab>You there! Don't just stand around gawping! Do something, man! Stop her!","TEXT_VOICEMAN_03200_001070_EMMANELLAIN<tab>お、おい、何を突っ立ってる！
早くあいつを止めろ……早くッ！","","False","0x0000006F","",""
"","TEXT_VOICEMAN_03200_001080_CAVALRY02236<tab>Yes, yes, my lord!","TEXT_VOICEMAN_03200_001080_CAVALRY02236<tab>ハ、ハイッ！！","","False","0x00000070","",""
"","TEXT_VOICEMAN_03200_001090_WAITRESS02236<tab>Augh!","TEXT_VOICEMAN_03200_001090_WAITRESS02236<tab>うっ……！","","False","0x00000071","",""
"","TEXT_VOICEMAN_03200_001100_WAITRESS02236<tab>See! See here the true nature of the highborn! With lies and deception they lead us to our doom, and dare we raise our voices in dissent─death is our reward!","TEXT_VOICEMAN_03200_001100_WAITRESS02236<tab>っ……見ろ……これが現実だ……！
奴らは、意にそぐわない事実を消していく。
民はまた騙されて、都合よく使われるだけだ……。","","False","0x00000072","",""
"","TEXT_VOICEMAN_03200_001110_WAITRESS02236<tab>This is the choice they have given us, brothers and sisters! Death by dragon's fang or death by nobleman's command! Death to all we hold dear!","TEXT_VOICEMAN_03200_001110_WAITRESS02236<tab>民を戦場へと導き、我々から愛しき者を奪っておきながら、
のうのうと融和を説いて、復讐の機会さえも奪おうとする……。
クソくらえ……ッ！","","False","0x00000073","",""
"","TEXT_VOICEMAN_03200_001120_WAITRESS02236<tab>I spit on your choices, nobleman! You will take no more from me... No more! NO MORE!","TEXT_VOICEMAN_03200_001120_WAITRESS02236<tab>戦だけが……竜との戦いだけが、唯一の希望なんだ。
我々から……私から……もう、生きる理由を奪わないで……！","","False","0x00000074","",""
"","TEXT_VOICEMAN_03200_001130_EMMANELLAIN<tab>What have you done!?","TEXT_VOICEMAN_03200_001130_EMMANELLAIN<tab>な、何してるんだよ！
殺せだなんて、オレは、一言も……！","","False","0x00000075","",""
"","TEXT_VOICEMAN_03200_001140_CAVALRY02236<tab>I─ I only did as you ordered, my lord...","TEXT_VOICEMAN_03200_001140_CAVALRY02236<tab>し、しかしッ……！","","False","0x00000076","",""
"","TEXT_VOICEMAN_03200_001150_EMMANELLAIN<tab>I gave no such order! I did not! I...I never meant for anyone to...","TEXT_VOICEMAN_03200_001150_EMMANELLAIN<tab>ち、違う！
オレが命じたわけじゃない、本当だ！
オレはただ……本当に、そんなつもりじゃ…………！","","False","0x00000077","",""
"","TEXT_VOICEMAN_03200_001160_EMMANELLAIN<tab>Honoroit!","TEXT_VOICEMAN_03200_001160_EMMANELLAIN<tab>オノロワ！","","False","0x00000078","",""
"","TEXT_VOICEMAN_03200_001170_EMMANELLAIN<tab>No, no! What have they done to you!? Honoroit! Honoroit!","TEXT_VOICEMAN_03200_001170_EMMANELLAIN<tab>嘘だろ、なんでこんなに傷ついて……！
おい、オノロワッ！？","","False","0x00000079","",""
"","TEXT_VOICEMAN_03200_001180_HONOROIT<tab>Is that you, my lord? You...you seem rather flustered.","TEXT_VOICEMAN_03200_001180_HONOROIT<tab>エマネラン、様……？
ああ……元気になられたんですね……。
よかったです、はい……。","","False","0x0000007A","",""
"","TEXT_VOICEMAN_03200_001190_EMMANELLAIN<tab>Because of you, you imbecile! What in the seven hells happened to you!?","TEXT_VOICEMAN_03200_001190_EMMANELLAIN<tab>げ、元気だよ、オレは！　いつだって！
それよりお前、どうしたんだよ……！","","False","0x0000007B","",""
"","TEXT_VOICEMAN_03200_001200_HONOROIT<tab>My...my apologies... Some few of the guests expressed a wish to leave...and I implored them to stay.","TEXT_VOICEMAN_03200_001200_HONOROIT<tab>申し訳、ありません……。
式典のお客様たちが、口々に帰ろうとおっしゃったもので、
どうにか止めようと思いまして……はい……。","","False","0x0000007C","",""
"","TEXT_VOICEMAN_03200_001210_HONOROIT<tab>It would seem they took issue with my request.","TEXT_VOICEMAN_03200_001210_HONOROIT<tab>だけど……僕の頼み方が悪かったのでしょう……
皆様、とてもお怒りになり…………。","","False","0x0000007D","",""
"","TEXT_VOICEMAN_03200_001220_EMMANELLAIN<tab>Gods forgive me... If I had only been more careful with my words!","TEXT_VOICEMAN_03200_001220_EMMANELLAIN<tab>馬鹿ッ……！
それは、お前のせいじゃなくて、オレの……！","","False","0x0000007E","",""
"","TEXT_VOICEMAN_03200_001230_HONOROIT<tab>D-Do not blame yourself, my lord... I know... I know that you and your brother have Ishgard's best interests at heart.","TEXT_VOICEMAN_03200_001230_HONOROIT<tab>……大丈夫ですよ、エマネラン様。
旦那様や、アルトアレール様……
皆様がやろうとしていることを、僕は信じています。","","False","0x0000007F","",""
"","TEXT_VOICEMAN_03200_001240_HONOROIT<tab>That poor woman... She lives in the past, clinging to the memories of the lost.","TEXT_VOICEMAN_03200_001240_HONOROIT<tab>あの女性が言ったように、悲しい記憶は消えませんし、
悩みを抱くことは多いでしょう……。","","False","0x00000080","",""
"","TEXT_VOICEMAN_03200_001250_HONOROIT<tab>But the future holds so much promise. So much joy. And you...you know that better than any...","TEXT_VOICEMAN_03200_001250_HONOROIT<tab>でも、踏み出した先の明日は、きっと楽しい。
それを教えてくれたのは、僕をさんざん振り回した、
エマネラン様じゃないですか……。","","False","0x00000081","",""
"","TEXT_VOICEMAN_03200_001260_EMMANELLAIN<tab>Honoroit!?","TEXT_VOICEMAN_03200_001260_EMMANELLAIN<tab>オノロワ……！？","","False","0x00000082","",""
"","TEXT_VOICEMAN_03200_001270_THANCRED<tab>Calm yourself. The boy will live. But it's imperative we get him inside and into the care of a chirurgeon without delay.","TEXT_VOICEMAN_03200_001270_THANCRED<tab>落ち着け、気を失っただけだ。
早く暖かいところで手当てしてやるんだな。","","False","0x00000083","",""
"","TEXT_VOICEMAN_03200_001280_EMMANELLAIN<tab>Gah! We were so close! Why does it all have to fall to pieces!?","TEXT_VOICEMAN_03200_001280_EMMANELLAIN<tab>クソッ……！
なんで、どうして何もかも上手くいかない！","","False","0x00000084","",""
"","TEXT_VOICEMAN_03200_001290_EMMANELLAIN<tab>Don't they <var 1A 02 /var>want<var 1A 01 /var> to live in peace!? Don't they <var 1A 02 /var>want<var 1A 01 /var> to be happy!? We all want the same thing, and still─STILL it falls to pieces!","TEXT_VOICEMAN_03200_001290_EMMANELLAIN<tab>変革を進める兄貴たちも、さっきの反対派の奴らだって、
本音は、幸せに笑っていたいだけだろ！？
なのに、もれなく全員、不幸面だ！","","False","0x00000085","",""
"","TEXT_VOICEMAN_03200_001300_EMMANELLAIN<tab>Tell me: what─what was I supposed to do, hm!? Someone, anyone, tell me: <var 1A 02 /var>what was I supposed to do<var 1A 01 /var>!?","TEXT_VOICEMAN_03200_001300_EMMANELLAIN<tab>オレはいったい、どうすりゃいいって言うんだよ……！
うんざりだ……誰か代わりに、正しい道を選んでくれ！","","False","0x00000086","",""
"","TEXT_VOICEMAN_03200_001310_THANCRED<tab>Stop looking to others. You make your choice and you live with the consequences.","TEXT_VOICEMAN_03200_001310_THANCRED<tab>……誰かに判断を委ねるのは構わない。
だが、その生き方を選んだ結果は、
必ず自分の周りに返ってくるぞ。","","False","0x00000087","",""
"","TEXT_VOICEMAN_03200_001320_EMMANELLAIN<tab>And what would <var 1A 02 /var>you<var 1A 01 /var> know about consequences!? You who always know just what to say, and just what to do! Your every deed is greeted with a round of applause!","TEXT_VOICEMAN_03200_001320_EMMANELLAIN<tab>オマエに何がわかる！
英雄の一味で、自分で何でもできるオマエに、何がッ！","","False","0x00000088","",""
"","TEXT_VOICEMAN_03200_001330_THANCRED<tab>You know <var 1A 02 /var>nothing<var 1A 01 /var> about me. I have fought tooth and nail for the people I hold dear─done <var 1A 02 /var>everything<var 1A 01 /var> in my power to save them...and I have failed.","TEXT_VOICEMAN_03200_001330_THANCRED<tab>何でもなんて、できるものか。
俺は、自分が一番大事にしていたものすら、
手を差し伸べることもできずに失った……。","","False","0x00000089","",""
"","TEXT_VOICEMAN_03200_001340_THANCRED<tab>Learn to live with it. I have.","TEXT_VOICEMAN_03200_001340_THANCRED<tab>だからこそ、死ぬ気で歯を食いしばって、ここに来たんだ。
どれほど痛もうが、終わらせたくないものが、
今の俺にはあるからな。","","False","0x0000008A","",""
"","TEXT_VOICEMAN_03200_001350_EMMANELLAIN<tab>Lord Commander, if I may. I wished to speak with you before the grand melee.","TEXT_VOICEMAN_03200_001350_EMMANELLAIN<tab>アイメリク卿。
「合同演習」について、話を伺いました。
……ひとつ、質問をさせてもらいたい。","","False","0x0000008B","",""
"","TEXT_VOICEMAN_03200_001360_AYMERIC<tab>Proceed.","TEXT_VOICEMAN_03200_001360_AYMERIC<tab>何だろうか。","","False","0x0000008C","",""
"","TEXT_VOICEMAN_03200_001370_EMMANELLAIN<tab>How do you do it, my lord? How do you lead with such certainty when so many of our countrymen will not hear of peace with the Dravanians?","TEXT_VOICEMAN_03200_001370_EMMANELLAIN<tab>いくら民の気持ちを前向きにできたとしても、
変革に心の折り合いがつかない奴は、絶対にいるはずだ……。","","False","0x0000008D","",""
"","TEXT_VOICEMAN_03200_001380_EMMANELLAIN<tab>Some of them hate you almost as much as the dragons themselves. They decry you as a patricide in the streets. They even tried to kill you, for gods' sakes! Yet still you march on, undaunted, where no archbishop dared to tread. What is your secret? Where do you find the strength?","TEXT_VOICEMAN_03200_001380_EMMANELLAIN<tab>そいつらは、変革の旗手である貴方を恨むだろう。
それでも貴方は進むって言うのか？
何を信じたら、そんなに強くいられる……！？","","False","0x0000008E","",""
"","TEXT_VOICEMAN_03200_001390_AYMERIC<tab>For centuries, our nation has been punished for the sins of our forefathers.","TEXT_VOICEMAN_03200_001390_AYMERIC<tab>竜詩戦争が続く限り、新たな悲しみが生まれ続け、
この国はいつまでも、悲劇の連鎖に囚われたままだ。","","False","0x0000008F","",""
"","TEXT_VOICEMAN_03200_001400_AYMERIC<tab>If our punishment is to end, I believe we must right the wrongs of antiquity and move forward as a nation united. Needless to say, my father did not share this opinion.","TEXT_VOICEMAN_03200_001400_AYMERIC<tab>連鎖を断ち切るためには、変革の一歩を踏み出さねばならない。
その点においては、前教皇……私の父に共感している。","","False","0x00000090","",""
"","TEXT_VOICEMAN_03200_001410_AYMERIC<tab>He did not believe the people strong enough to bring about their own deliverance, trusting only in himself. Tyranny seemed to him the only solution.","TEXT_VOICEMAN_03200_001410_AYMERIC<tab>だが、父は国を愛せど、民を信じなかった。
ゆえに己の力のみで変革を行わんとし、道を誤ったのだ。","","False","0x00000091","",""
"","TEXT_VOICEMAN_03200_001420_AYMERIC<tab>But I have faith in the people, Lord Emmanellain. I have faith that they will weather this storm, and overcome every trial we set before them.","TEXT_VOICEMAN_03200_001420_AYMERIC<tab>エマネラン卿……。
私は、イシュガルドに生きる民を信じている。
変革の嵐を、皆の力で超えていけると信じている……！","","False","0x00000092","",""
"","TEXT_VOICEMAN_03200_001430_AYMERIC<tab>Many have fought and died to see this blight upon our nation's history cleansed, and I would not let their sacrifices be in vain. Though we invite reprisals, the risk is worth the reward.","TEXT_VOICEMAN_03200_001430_AYMERIC<tab>だからこそ、真の変革のため、いかなる痛みも受ける覚悟だ。
かつて友であったものの屍を踏み越えることになろうとも……
決して、立ち止まりはしない！","","False","0x00000093","",""
