"location","source","target","id","fuzzy","context","translator_comments","developer_comments"
"","TEXT_FESPDYEST2024GUID_00843_GUIDEPDY00843_000_000<tab><var 08 E3E90C0D ((<var 08 E3E90C05 ((Good evening)) ((Good morrow)) /var>)) ((<var 08 E3E90C12 ((Good day)) ((Good evening)) /var>)) /var> to you, adventurer. Have you any questions regarding the history of Little Ladies' Day or Hatching<var 1F /var>tide, I am at your service.","TEXT_FESPDYEST2024GUID_00843_GUIDEPDY00843_000_000<tab>Bienvenue à la fête des demoiselles, aventuri<var 08 E905 ((ère)) ((er)) /var>. Si vous avez des questions au sujet de l'événement, je suis tout ouïe.","","False","0x00000000","",""
"","TEXT_FESPDYEST2024GUID_00843_Q1_000_000<tab>What will you ask?","TEXT_FESPDYEST2024GUID_00843_Q1_000_000<tab>Sur quoi vous renseignez-vous<var 1D /var>?","","False","0x00000001","",""
"","TEXT_FESPDYEST2024GUID_00843_A1_000_001<tab>What is Little Ladies' Day?","TEXT_FESPDYEST2024GUID_00843_A1_000_001<tab>La fête des demoiselles","","False","0x00000002","",""
"","TEXT_FESPDYEST2024GUID_00843_A1_000_002<tab>Who was Princess Edvya?","TEXT_FESPDYEST2024GUID_00843_A1_000_002<tab>La princesse Edvya","","False","0x00000003","",""
"","TEXT_FESPDYEST2024GUID_00843_A1_000_003<tab>What is Hatching<var 1F /var>tide?","TEXT_FESPDYEST2024GUID_00843_A1_000_003<tab>La chasse aux Prœufs","","False","0x00000004","",""
"","TEXT_FESPDYEST2024GUID_00843_A1_000_004<tab>Nothing.","TEXT_FESPDYEST2024GUID_00843_A1_000_004<tab>Annuler","","False","0x00000005","",""
"","TEXT_FESPDYEST2024GUID_00843_GUIDEPDY00843_000_010<tab>Once a year, when the peach blossoms come to bloom, Eorzea celebrates all the lovely and spirited young maidens who bring such joy to our realm.","TEXT_FESPDYEST2024GUID_00843_GUIDEPDY00843_000_010<tab>La fête des demoiselles est une célébration organisée en l'honneur de la gent féminine.","","False","0x00000006","",""
"","TEXT_FESPDYEST2024GUID_00843_GUIDEPDY00843_000_011<tab>The origins of the holiday can be traced back to events that happened some three centuries past, when the Thorne Dynasty still reigned in Ul'dah.","TEXT_FESPDYEST2024GUID_00843_GUIDEPDY00843_000_011<tab>Elle trouve son origine dans une anecdote vieille de trois cents ans, une histoire qui remonte à l'époque de la dynastie Thorne.","","False","0x00000007","",""
"","TEXT_FESPDYEST2024GUID_00843_GUIDEPDY00843_000_012<tab>The plucky Princess Edvya, tired of being sequestered within palace walls by her overprotective father─the sultan Baldric Thorne─exchanged garb with a miller girl and wandered off into town in search of adventure.","TEXT_FESPDYEST2024GUID_00843_GUIDEPDY00843_000_012<tab>La princesse Edvya, fille du sultan Baldric Thorne, lassée des obligations imposées par son rang, décida un jour d'aller voir le monde et de découvrir la vie des personnes de basse extraction. Pour cela, elle emprunta les habits d'une fille de meunier et se glissa dis<var 16 /var>crè<var 16 /var>te<var 16 /var>ment hors du palais royal.","","False","0x00000008","",""
"","TEXT_FESPDYEST2024GUID_00843_GUIDEPDY00843_000_013<tab>Upon learning of his daughter's disappearance, the sultan was stricken with panic. He summoned the palace guard─down to the last man─and ordered them to tear the city apart to see that no harm befell his precious princess.","TEXT_FESPDYEST2024GUID_00843_GUIDEPDY00843_000_013<tab>Baldric, réalisant que sa fille chérie avait fugué, mobilisa son armée entière pour la retrouver tant il était inquiet. Les recherches qu'il ordonna mirent la ville sens dessus dessous. Le sultan avait décidé de ne pas lésiner sur les moyens pour revoir la chair de sa chair.","","False","0x00000009","",""
"","TEXT_FESPDYEST2024GUID_00843_GUIDEPDY00843_000_014<tab>...And tear the city apart they did. The poor miller whose daughter assisted the princess in her escape saw his house nigh ripped from the ground, while the family was threatened with imprisonment and worse.","TEXT_FESPDYEST2024GUID_00843_GUIDEPDY00843_000_014<tab>Nombreuses furent les habitations endommagées dans l'agitation avant que les soldats ne découvrent l'identité de la jeune fille qui avait aidé Edvya à se travestir. Sa famille vit d'ailleurs sa maison à moitié détruite par la brutalité de la per<var 16 /var>qui<var 16 /var>si<var 16 /var>tion de l'armée...","","False","0x0000000A","",""
"","TEXT_FESPDYEST2024GUID_00843_GUIDEPDY00843_000_015<tab>To the good fortune of all, Princess Edvya was soon found just outside the palace walls. When she confessed the true reason that she had run away, her father was racked with guilt for his actions. He had the miller's house rebuilt by his most skilled craftsmen, and offered to personally serve as seneschal to the miller girl for a day to atone for his actions.","TEXT_FESPDYEST2024GUID_00843_GUIDEPDY00843_000_015<tab>Une fois la princesse retrouvée et le souverain apaisé, celui-ci réalisa qu'il avait quelque peu cédé à la panique et rendit visite à la jeune complice pour s'excuser. Il déclara que les femmes étaient un trésor pour le pays et qu'elles devaient être honorées comme il se doit.
Il fit reconstruire la maison de la pauvre jeune fille et lui proposa d'être son sénéchal pour un jour.","","False","0x0000000B","",""
"","TEXT_FESPDYEST2024GUID_00843_GUIDEPDY00843_000_016<tab>The commonfolk were deeply moved by their sultan's newfound compassion. The sultan himself, vowing to never forget the lessons he had learned, declared that each year he would serve as seneschal for a young girl chosen from the townspeople by lot.","TEXT_FESPDYEST2024GUID_00843_GUIDEPDY00843_000_016<tab>La population fut agré<var 16 /var>a<var 16 /var>ble<var 16 /var>ment surprise de cette mesure inattendue de la part d'un sultan qui semblait jusqu'alors ferme et austère. Baldric décida même de renouveler l'expérience tous les ans, en nommant une jeune fille par tirage au sort chaque printemps.","","False","0x0000000C","",""
"","TEXT_FESPDYEST2024GUID_00843_GUIDEPDY00843_000_017<tab>The tradition continued long after Sultan Baldric's death, living on even as the Thorne Dynasty gave way to the Ul. In time, it spread to other nations, where it took on new forms, eventually evolving into the Little Ladies' Day celebration that we know and love today.","TEXT_FESPDYEST2024GUID_00843_GUIDEPDY00843_000_017<tab>Après sa mort, d'autres pays s'inspirèrent de ces événements pour célébrer à leur tour les demoiselles. La coutume dépassa ainsi les frontières d'Ul'dah, et perdura après l'ef<var 16 /var>fon<var 16 /var>dre<var 16 /var>ment de la dynastie des Thorne et le retour des Ul. Elle évolua pour devenir la fête que nous connaissons aujourd'hui.","","False","0x0000000D","",""
"","TEXT_FESPDYEST2024GUID_00843_GUIDEPDY00843_000_020<tab>Princess Edvya was the one and only daughter of Sultan Baldric of House Thorne, the Hyuran noble house that ruled Ul'dah some three hundred years ago to the day.","TEXT_FESPDYEST2024GUID_00843_GUIDEPDY00843_000_020<tab>Edvya Thorne est une princesse qui vivait il y a environ trois siècles. Elle était l'héritière de la dynastie hyure des Thorne, qui régnait sur Ul'dah à cette époque.","","False","0x0000000E","",""
"","TEXT_FESPDYEST2024GUID_00843_GUIDEPDY00843_000_021<tab>Her disappearance from the palace, the commotion that followed, and its eventual resolution─oft retold as the “Legend of the Lost Lady”─are said to represent the origins of the celebration we now know as Little Ladies' Day.","TEXT_FESPDYEST2024GUID_00843_GUIDEPDY00843_000_021<tab>L'anecdote célèbre de sa fugue de jeunesse fut racontée et romancée au fil du temps, et est à l'origine de la fête des demoiselles.","","False","0x0000000F","",""
"","TEXT_FESPDYEST2024GUID_00843_GUIDEPDY00843_000_022<tab>It is said that before the events of that day, relations between the spirited princess and her stern, overly protective father were strained at best. Though the father claimed to love his daughter dearly, the form this love took was the stifling sort.","TEXT_FESPDYEST2024GUID_00843_GUIDEPDY00843_000_022<tab>Cette princesse éprise de liberté était la fille d'un souverain connu pour sa sévérité et son austérité, le sultan Baldric. Leur relation n'était, dit-on, pas des plus chaleureuses...","","False","0x00000010","",""
"","TEXT_FESPDYEST2024GUID_00843_GUIDEPDY00843_000_023<tab>The princess's disappearance and return changed everything. Sultan Baldric gained a newfound respect for his daughter's independent nature, while Princess Edvya realized that her father's treatment of her was born of simple misunderstanding, not lack of love.","TEXT_FESPDYEST2024GUID_00843_GUIDEPDY00843_000_023<tab>Mais cette fugue a justement changé la donne. Le sultan s'est tant inquiété pour sa fille qu'il a agi avec excès sous le coup de l'émotion. Edvya a dû alors réaliser à quel point il tenait à elle, malgré leurs caractères opposés.","","False","0x00000011","",""
"","TEXT_FESPDYEST2024GUID_00843_GUIDEPDY00843_000_024<tab>The bonds between the two grew only stronger in the months and years to follow, and the two came to be celebrated as the most ideal embodiment of father and daughter that the realm had ever seen.","TEXT_FESPDYEST2024GUID_00843_GUIDEPDY00843_000_024<tab>Après cette péripétie, la princesse s'est montrée plus mesurée et s'est davantage ouverte à son père. Ils se sont beaucoup rapprochés, si bien que le peuple a gardé l'image d'une famille très soudée.","","False","0x00000012","",""
"","TEXT_FESPDYEST2024GUID_00843_GUIDEPDY00843_000_030<tab>While Little Ladies' Day and Hatching<var 1F /var>tide have up until this point been two separate events, this year the organizers of each have joined hands to bring twice the festive spirit to the realm.","TEXT_FESPDYEST2024GUID_00843_GUIDEPDY00843_000_030<tab>Il s'agit d'une toute autre célébration que notre fête des demoiselles, mais sous l'impulsion de son organisatrice, nous avons décidé cette année de créer un événement commun pour célébrer les deux commémorations.","","False","0x00000013","",""
"","TEXT_FESPDYEST2024GUID_00843_GUIDEPDY00843_000_031<tab>As you may already know, Little Ladies' Day is even now being held in Ul'dah, while Hatching<var 1F /var>tide is filling Gridania with smiles. If you have the time, I urge you to take your fill of excitement at both celebrations.","TEXT_FESPDYEST2024GUID_00843_GUIDEPDY00843_000_031<tab>À Ul'dah nous organisons la fête de demoiselles, comme à l'accoutumée. Et à Gridiania se déroule la chasse aux Prœufs. Je vous conseille d'aller jeter un œil sur place<var 1D /var>!","","False","0x00000014","",""
"","TEXT_FESPDYEST2024GUID_00843_GUIDEPDY00843_000_032<tab>As you may already know, Hatching<var 1F /var>tide is even now being held in Gridania, while Little Ladies' Day spreads smiles across Ul'dah. If you have the time, I urge you to take your fill of excitement at both celebrations.","TEXT_FESPDYEST2024GUID_00843_GUIDEPDY00843_000_032<tab>La chasse aux Proeufs se déroule à Vieille Gridania et la fête des demoiselles est organisée à Ul'dah. Si jamais vous désirez participer aux animations proposées par nos équipes, rendez-vous dans ces deux cités<var 1D /var>!","","False","0x00000015","",""
"","TEXT_FESPDYEST2024GUID_00843_EGGHUNTINGSTAFFA_000_040<tab><var 08 E3E90C0D ((<var 08 E3E90C05 ((Good evening)) ((Good morning)) /var>)) ((<var 08 E3E90C12 ((Good day to you)) ((Good evening)) /var>)) /var>, friend. Might you be interested in learning about the Hatching<var 1F /var>tide festivities?","TEXT_FESPDYEST2024GUID_00843_EGGHUNTINGSTAFFA_000_040<tab>C'est la fête des œufs... blancs, jaunes, noirs ou bleus<var 1D /var>!♪
Permettez-moi de vous expliquer l'origine de cette formidable célébration<var 1D /var>!","","False","0x00000016","",""
"","TEXT_FESPDYEST2024GUID_00843_EGGHUNTINGSTAFFA_000_041<tab>A fledgling festival, Hatching<var 1F /var>tide was born of a prophetic dream visited upon a Gridanian maiden named Jihli Aliapoh. In her dream, the Twelve Archons of old appeared, those heroes who saved the realm from the destruction of the Sixth Umbral Calamity.","TEXT_FESPDYEST2024GUID_00843_EGGHUNTINGSTAFFA_000_041<tab>Tout a commencé lorsqu'une Gridanienne du nom de Jihli Aliapoh a fait un rêve des plus curieux...","","False","0x00000017","",""
"","TEXT_FESPDYEST2024GUID_00843_EGGHUNTINGSTAFFA_000_042<tab>Descending from the heavens atop beautifully decorated eggs, they said to Jihli, “Arise, young Dreamer, and make ready the vessels for our return.” And so she did─painstakingly painting and gilding eggs to match those from her vision.","TEXT_FESPDYEST2024GUID_00843_EGGHUNTINGSTAFFA_000_042<tab>Dans ce rêve lui seraient apparus les Preux, ces douze héros qui ont sauvé nos contrées lorsque le sixième fléau les a frappées plus de quinze siècles auparavant. Toujours d'après elle, ces fameux Preux chevauchaient, tenez-vous bien... des œufs décorés. Je sais, cela peut paraître saugrenu.
Toujours est-il que suite à ce rêve, Jihli Aliapoh a décidé d'organiser une fête par<var 16 /var>ti<var 16 /var>cu<var 16 /var>liè<var 16 /var>re, destinée à faire revenir nos héros d'antan en ce monde<var 1D /var>: la “chasse aux Prœufs”<var 1D /var>!","","False","0x00000018","",""
"","TEXT_FESPDYEST2024GUID_00843_EGGHUNTINGSTAFFA_000_043<tab>Word of the prophecy spread, and Jihli attracted helpers to assist in her toils. After the Calamity, the festival grew further, as townsfolk and adventurers flocked to celebrate the Archons of yore, who many believe had some hand in delivering the realm once again.","TEXT_FESPDYEST2024GUID_00843_EGGHUNTINGSTAFFA_000_043<tab>Malgré des débuts difficiles, le festival s'est installé durablement dans le calendrier des rendez-vous annuels. En effet, beaucoup pensent que la prophétie annoncée par le rêve de Jihli s'est réalisée, et que les Preux auraient contribué à la protection du pays lors du septième fléau.
Nous avons donc décidé de maintenir cette tradition, pour que personne n'oublie la dette que nous avons envers eux.","","False","0x00000019","",""
"","TEXT_FESPDYEST2024GUID_00843_EGGHUNTINGSTAFFA_000_044<tab>For this year only, the organizers of Hatching<var 1F /var>tide have joined hands with the planners of Little Ladies' Day in Ul'dah to create a joint celebration that spans two of Eorzea's city-states!","TEXT_FESPDYEST2024GUID_00843_EGGHUNTINGSTAFFA_000_044<tab>Mais cette année, nous avons organisé un événement ex<var 16 /var>cep<var 16 /var>tion<var 16 /var>nel en tandem avec la fête des demoiselles organisée à Ul'dah<var 1D /var>!","","False","0x0000001A","",""
"","TEXT_FESPDYEST2024GUID_00843_EGGHUNTINGSTAFFA_000_050<tab>If you're so inclined, I urge you to travel to Gridania and hunt eggs to your heart's content!","TEXT_FESPDYEST2024GUID_00843_EGGHUNTINGSTAFFA_000_050<tab>Les festivités se déroulent à Vieille Gridania. Si jamais vous désirez participer aux animations proposées par nos équipes, c'est là-bas qu'il faut aller<var 1D /var>!","","False","0x0000001B","",""

