"location","source","target","id","fuzzy","context","translator_comments","developer_comments"
"","<tab><tab><tab>","<tab><tab><tab>","","False","0x00000000","",""
"","splinter of Inferno magicite<tab>splinters of Inferno magicite<tab>Inferno Magicite<tab>Creates a simulacrum of Ifrit, Lord of the Inferno, based off the wielder's memories of past encounters with the primal.","magilithe d'Ifrit<tab>magilithes d'Ifrit<tab>Magilithe d'Ifrit<tab>Un objet enchanté qui utilise une technique ancestrale pour sonder les souvenirs de celui qui en fait usage afin de recréer un simulacre du Primordial des flammes infernales.","","False","0x00000001","",""
"","splinter of Crag magicite<tab>splinters of Crag magicite<tab>Crag Magicite<tab>Creates a simulacrum of Titan, Lord of Crags, based off the wielder's memories of past encounters with the primal.","magilithe de Titan<tab>magilithes de Titan<tab>Magilithe de Titan<tab>Un objet enchanté qui utilise une technique ancestrale pour sonder les souvenirs de celui qui en fait usage afin de recréer un simulacre du Primordial des tremblements dévastateurs.","","False","0x00000002","",""
"","splinter of Vortex magicite<tab>splinters of Vortex magicite<tab>Vortex Magicite<tab>Creates a simulacrum of Garuda, Lady of the Vortex, based off the wielder's memories of past encounters with the primal.","magilithe de Garuda<tab>magilithes de Garuda<tab>Magilithe de Garuda<tab>Un objet enchanté qui utilise une technique ancestrale pour sonder les souvenirs de celui qui en fait usage afin de recréer un simulacre du Primordial des rafales cinglantes.","","False","0x00000003","",""
"","splinter of elder magicite<tab>splinters of elder magicite<tab>Elder Magicite<tab>Creates a simulacrum of Odin based off the wielder's memories of past encounters with the elder primal.","magilithe d'Odin<tab>magilithes d'Odin<tab>Magilithe d'Odin<tab>Un objet enchanté qui utilise une technique ancestrale pour sonder les souvenirs de celui qui en fait usage afin de recréer un simulacre du Chevalier des ombres.","","False","0x00000004","",""
