"location","source","target","id","fuzzy","context","translator_comments","developer_comments"
"","TEXT_VOICEMAN_03003_J00060_ALPHINAUD<tab>Are you privy to new intelligence, my lord?","TEXT_VOICEMAN_03003_J00060_ALPHINAUD<tab>Vous semblez être au courant de quelque chose que nous ignorons, Seigneur Lolorito...","","False","0x0000010F","",""
"","TEXT_VOICEMAN_03003_J00070_LOLORITO<tab>I would hardly call it new. Remind me: what was the name of that enormous imperial warship which met its end in Mor Dhona? Wait, I have it! The <var 1A 02 /var>Agrius<var 1A 01 /var>. Yes, well, 'twould appear that the Garleans have been hard at work on another such vessel.","TEXT_VOICEMAN_03003_J00070_LOLORITO<tab>Comment s'appelle ce vaisseau impérial gigantesque qui s'est écrasé au bord du lac de Pleurargent<var 1D /var>?<var 1D /var>... Ah oui, l'Agrius. Eh bien, figurez-vous qu'à l'heure qu'il est, son successeur doit déjà avoir effectué son baptême de l'air.","","False","0x00000110","",""
"","TEXT_VOICEMAN_03003_J00080_PIPPIN<tab>How close are they to completing this ship!? Is it operational!?","TEXT_VOICEMAN_03003_J00080_PIPPIN<tab>Mais... quand ça<var 1D /var>!?","","False","0x00000111","",""
"","TEXT_VOICEMAN_03003_J00090_LOLORITO<tab>Its maiden flight was a success, I hear. I should imagine Emperor Varis is eager to see how it performs in battle.","TEXT_VOICEMAN_03003_J00090_LOLORITO<tab>Il y a quelques jours à peine, me semble-t-il. Ce n'est plus qu'une question de temps avant que l'empereur Varis n'en prenne les commandes et ne lance un nouvel assaut sur Éorzéa.","","False","0x00000112","",""
"","TEXT_VOICEMAN_03003_J00100_LOLORITO<tab><var 08 E905 ((My lords and ladies)) ((My lords...and lady)) /var>, I move that it is time to repair the damage caused by Teledji Adeledji, and prepare our great nation to repel the Empire once more.","TEXT_VOICEMAN_03003_J00100_LOLORITO<tab>Maintenant que Teledji Adeledji n'est plus là pour nous empoisonner la vie, je propose que nous fassions tout ce qui est en notre pouvoir pour résister à cette invasion imminente. J'ose espérer que vous serez d'accord avec moi...","","False","0x00000113","",""
"","TEXT_VOICEMAN_03003_K00010_ALPHINAUD<tab>'Tis well that the sultana has awoken. The Syndicate yet needs to put its house in order, but 'twould seem the worst of the confusion has passed.","TEXT_VOICEMAN_03003_K00010_ALPHINAUD<tab>Quelle bonne nouvelle que le retour de la Sultane, n'est-ce pas<var 1D /var>? Malgré la discorde qui continue de prévaloir au sein du Cartel des Scorpions, la situation politique devrait se stabiliser maintenant.","","False","0x00000114","",""
"","TEXT_VOICEMAN_03003_K00020_ALPHINAUD<tab>Ul'dah has taken control of its future...and I must do the same.","TEXT_VOICEMAN_03003_K00020_ALPHINAUD<tab>Il est même possible qu'Ul'dah entre dans une nouvelle ère de prospérité. Auquel cas, je suppose que je ferais bien de suivre cet exemple...","","False","0x00000115","",""
"","TEXT_VOICEMAN_03003_K00030_ALPHINAUD<tab>I have decided to disband the Crystal Braves.","TEXT_VOICEMAN_03003_K00030_ALPHINAUD<tab>Ma décision est prise. Je vais mettre un terme à l'existence des Braves du Cristal.","","False","0x00000116","",""
"","TEXT_VOICEMAN_03003_K00040_ALPHINAUD<tab>Among the recruits, there were those who supported our order's goals and convictions with all sincerity. 'Tis my hope that these loyal men and women will choose to remain our allies in the battles to come.","TEXT_VOICEMAN_03003_K00040_ALPHINAUD<tab>Nombreux sont ceux qui ont rejoint notre cause avec ferveur et abnégation, et je leur en serai éter<var 16 /var>nel<var 16 /var>le<var 16 /var>ment re<var 16 /var>con<var 16 /var>nais<var 16 /var>sant. J'espère qu'ils resteront nos alliés dans les dures batailles qui nous attendent.","","False","0x00000117","",""
"","TEXT_VOICEMAN_03003_K00050_ALPHINAUD<tab>As for those who sided with the traitor, Ilberd, they shall be hunted down and held to account for their crimes. It is my earnest hope that they will surrender themselves peaceably when the time comes...though I think it unlikely.","TEXT_VOICEMAN_03003_K00050_ALPHINAUD<tab>Quant aux déserteurs qui ont décidé de suivre ce traître d'Ilberd, l'Alliance éorzéenne devrait tôt ou tard les stopper dans leur élan. S'ils décident d'être raisonnables, ils se rendront sans trop faire de vagues, mais je n'en mettrais pas ma main à couper.","","False","0x00000118","",""
"","TEXT_VOICEMAN_03003_K00060_ALPHINAUD<tab>Ah, my all-conquering Crystal Braves... The model army meant to pave the way for a single, unified Grand Company of Eorzea. That so high an ideal should be brought so low...","TEXT_VOICEMAN_03003_K00060_ALPHINAUD<tab>J'avais mis tellement d'espoir dans les Braves du Cristal, et tout est parti en fumée... À présent, je souhaite simplement que l'union des cités-États au sein d'une même grande compagnie connaisse un avenir plus radieux.","","False","0x00000119","",""
"","TEXT_VOICEMAN_03003_K00070_ALPHINAUD<tab>I need not tell you how deeply the betrayal stung me. Yet I see now that it was mine own naivety and pride which allowed the Braves to fall prey to corruption.","TEXT_VOICEMAN_03003_K00070_ALPHINAUD<tab>Je m'en rends bien compte aujourd'hui...","","False","0x0000011A","",""
"","TEXT_VOICEMAN_03003_K00080_ALPHINAUD<tab>As ever, it is to your own shining example that I turn for inspiration. Like you, I mean to stand firm in the face of hardship, and give mine all for the cause.","TEXT_VOICEMAN_03003_K00080_ALPHINAUD<tab>La trahison que nous avons subie n'est que la conséquence de ma naïveté et de mon arrogance.","","False","0x0000011B","",""
"","TEXT_VOICEMAN_03003_K00090_ALPHINAUD<tab>Let us resume the search for our missing comrades, that we might come together to shine the light of dawn across the realm once more.","TEXT_VOICEMAN_03003_K00090_ALPHINAUD<tab>La lumière de l'aube doit briller à nouveau sur Éorzéa, et pour cela, nous devons retrouver Minfilia et les autres au plus vite.","","False","0x0000011C","",""
"","TEXT_VOICEMAN_03003_K00100_ALPHINAUD<tab>The role of Crystal Brave commander suited me ill, and I shall play it no longer. Henceforth, I shall be no more or less than Alphinaud, proud member of the Scions.","TEXT_VOICEMAN_03003_K00100_ALPHINAUD<tab>Quoi qu'il en soit, le commandant Leveilleur raccroche of<var 16 /var>fi<var 16 /var>ciel<var 16 /var>le<var 16 /var>ment les gants<var 1D /var>! L'Héritier de la Septième Aube Alphinaud prend la relève, et il compte bien faire de son mieux dans toutes ses futures entreprises<var 1D /var>!","","False","0x0000011D","",""
"","TEXT_VOICEMAN_03003_L00010_ESTINIEN<tab>All stands ready, Lord Commander.","TEXT_VOICEMAN_03003_L00010_ESTINIEN<tab>Tout est prêt.","","False","0x0000011E","",""
"","TEXT_VOICEMAN_03003_L00020_AYMERIC<tab>Ah, the moment has come, then?","TEXT_VOICEMAN_03003_L00020_AYMERIC<tab>Fort bien... Nous allons enfin pouvoir passer à l'action.","","False","0x0000011F","",""
"","TEXT_VOICEMAN_03003_L00030_ALPHINAUD<tab>Pray excuse my lateness. I paid a brief visit to the workshop to inquire about the manacutters. The engineers assure me that they are ready.","TEXT_VOICEMAN_03003_L00030_ALPHINAUD<tab>Veuillez m'excuser pour le retard. Je viens juste d'assister aux derniers réglages du Manacutter. Il devrait être prêt à prendre son envol incessamment sous peu.","","False","0x00000120","",""
"","TEXT_VOICEMAN_03003_L00040_ESTINIEN<tab>The Aery is now but a short flight away. Yet what a long and winding path we took to reach this point.","TEXT_VOICEMAN_03003_L00040_ESTINIEN<tab>Après tous ces efforts, nous allons enfin pouvoir pénétrer dans le Nid du dragon...","","False","0x00000121","",""
"","TEXT_VOICEMAN_03003_L00050_ESTINIEN<tab>Were it not for Master Alphinaud's proposal, we never would have attempted to parley with the dragons.","TEXT_VOICEMAN_03003_L00050_ESTINIEN<tab>Lorsque nous sommes arrivés à L'Écume des cieux, convaincre les dragons d'accepter une trêve était loin d'être gagné.","","False","0x00000122","",""
"","TEXT_VOICEMAN_03003_L00060_ESTINIEN<tab>Though our negotiations yielded little, our expedition with Lady Iceheart taught us much.","TEXT_VOICEMAN_03003_L00060_ESTINIEN<tab>Heu<var 16 /var>reu<var 16 /var>se<var 16 /var>ment, Alphinaud et son talent pour la diplomatie nous ont permis de faire de Cœur-de-glace notre alliée, ainsi que d'avoir un entretien avec Hraesvelgr.","","False","0x00000123","",""
"","TEXT_VOICEMAN_03003_L00070_AYMERIC<tab>You took an unimaginable risk... I could scarce believe the tale Estinien told.","TEXT_VOICEMAN_03003_L00070_AYMERIC<tab>Pour être honnête, je ne pensais pas que vous prendriez de tels risques... Quand Estinien m'a raconté toutes vos aventures, je n'en croyais pas mes oreilles.","","False","0x00000124","",""
"","TEXT_VOICEMAN_03003_L00080_ESTINIEN<tab>Aye, 'tis true that many of our countrymen would sooner die than join hands with the heretics' mistress, but 'twas through that most unlikely of alliances that we came to speak with Hraesvelgr.","TEXT_VOICEMAN_03003_L00080_ESTINIEN<tab>La grande majorité des Ishgardais considéreraient cer<var 16 /var>tai<var 16 /var>ne<var 16 /var>ment le fait de collaborer avec la chef des hérétiques comme une pure folie. Pourtant, c'est grâce à elle que Hraesvelgr ne nous a pas réduits en cendres dès le début.","","False","0x00000125","",""
"","TEXT_VOICEMAN_03003_L00090_ALPHINAUD<tab>A conversation that went rather poorly, as I recall.","TEXT_VOICEMAN_03003_L00090_ALPHINAUD<tab>Mal<var 16 /var>heu<var 16 /var>reu<var 16 /var>se<var 16 /var>ment, nous n'avons pas vraiment de quoi nous réjouir. Notre tentative de négociation avec l'ancien dragon s'est soldée par un échec.","","False","0x00000126","",""
"","TEXT_VOICEMAN_03003_L00100_ESTINIEN<tab>In this instance, the journey was more important than the destination. Had we not slain Nidhogg's consort, Tioman, and put the great wyrm on his guard, the Dravanians would have arrived at Ishgard's walls long ago.","TEXT_VOICEMAN_03003_L00100_ESTINIEN<tab>Allons, ne soyez pas si défaitiste. Après tout, nous avons réussi à mettre Tioman hors d'état de nuire, ce qui n'a pas manqué de mettre Nidhogg sur ses gardes et de retarder l'attaque des Dravaniens.","","False","0x00000127","",""
"","TEXT_VOICEMAN_03003_L00110_AYMERIC<tab>Aye, that they would. Full grateful am I for every hour of respite your actions have afforded us. Thanks to you, our defenses are much improved. 'Tis but a pity they won't be enough.","TEXT_VOICEMAN_03003_L00110_AYMERIC<tab>Oui, vous nous avez fait gagner un temps précieux. C'est plutôt moi qui devrais m'excuser, car nos défenses sont encore loin d'être opérationnelles...","","False","0x00000128","",""
"","TEXT_VOICEMAN_03003_L00120_ALPHINAUD<tab>Thus you believe an assault upon the Aery represents the city's best chance of survival. Is that not so, Estinien?","TEXT_VOICEMAN_03003_L00120_ALPHINAUD<tab>Il va donc de soi qu'il ne nous reste plus qu'une seule solution<var 1D /var>: nous devons partir à l'assaut du Nid du dragon. Peut-on connaître votre opinion là-dessus, Estinien<var 1D /var>?","","False","0x00000129","",""
"","TEXT_VOICEMAN_03003_L00130_ESTINIEN<tab>I am under no illusions. Nidhogg's might is legendary. But with his eye in my possession, I can stifle his strength at the source.","TEXT_VOICEMAN_03003_L00130_ESTINIEN<tab>Je suis conscient que vaincre Nidhogg ne sera pas une partie de plaisir. Mais tant que je conserverai une partie de sa puissance entre mes mains, notre rêve de victoire pourra devenir réalité.","","False","0x0000012A","",""
"","TEXT_VOICEMAN_03003_L00140_ESTINIEN<tab>Victory will be hard-won, even so, and I shall be glad indeed to have the Warrior of Light at my side.","TEXT_VOICEMAN_03003_L00140_ESTINIEN<tab>Et puis, j'ai un<var 08 E905 ((e)) (()) /var> pourfendeu<var 08 E905 ((se)) ((r)) /var> de Primordiaux à mes côtés, ne l'oublions pas<var 1D /var>!","","False","0x0000012B","",""
"","TEXT_VOICEMAN_03003_L00150_AYMERIC<tab>You shall have my blade as well. There are more of these “manacutters” to be had, yes?","TEXT_VOICEMAN_03003_L00150_AYMERIC<tab>Laissez-moi vous accompagner. Il est hors de question que je demeure ici sans rien faire. J'ose espérer qu'il y aura une place pour moi sur votre nouvel aéronef.","","False","0x0000012C","",""
"","TEXT_VOICEMAN_03003_L00160_LUCIA<tab>(-Lucia-)Lord Commander, no!","TEXT_VOICEMAN_03003_L00160_LUCIA<tab>Messire Aymeric<var 1D /var>! Vous ne pouvez pas faire ça<var 1D /var>!?","","False","0x0000012D","",""
"","TEXT_VOICEMAN_03003_L00170_AYMERIC<tab>How can I, a proud knight of Ishgard, stand by and do naught while an outsider risks life and limb for our homeland? I swore an oath to protect this city!","TEXT_VOICEMAN_03003_L00170_AYMERIC<tab>Voyons, Lucia... Crois-tu vraiment qu'un homme de mon rang peut se permettre de rester les bras croisés pendant que des étrangers risquent leur vie pour Ishgard<var 1D /var>? N'ai-je pas juré devant Halone de protéger la sainte Cité<var 1D /var>?","","False","0x0000012E","",""
"","TEXT_VOICEMAN_03003_L00180_ESTINIEN<tab>Pray leave the slaying of dragons to dragoons, ser knight. Your duty to command the city's defense is no less vital.","TEXT_VOICEMAN_03003_L00180_ESTINIEN<tab>Sauf votre respect, je pense que Lucia a raison. Laissez les dragons aux chasseurs de dragons, et continuez à superviser la fortification de la cité. Cela vaudra mieux pour tout le monde.","","False","0x0000012F","",""
"","TEXT_VOICEMAN_03003_L00190_ESTINIEN<tab>Should we fail, and Nidhogg slip through our grasp, who, then, will hold the walls against him? Will you leave Ishgard in the hands of the Holy See's zealots?","TEXT_VOICEMAN_03003_L00190_ESTINIEN<tab>Et si par malheur, nous échouions dans notre combat, le simple fait de vous savoir aux commandes des défenses serait la plus grande des consolations.","","False","0x00000130","",""
"","TEXT_VOICEMAN_03003_L00200_AYMERIC<tab>There are others─","TEXT_VOICEMAN_03003_L00200_AYMERIC<tab>Mais il doit bien y avoir un moyen pour moi de vous aider<var 1D /var>!","","False","0x00000131","",""
"","TEXT_VOICEMAN_03003_L00210_ESTINIEN<tab>Who but you has the authority and the standing to orchestrate a citywide defense? I do not, and neither does the Warrior of Light. That is why it is our place to fight, and yours to remain here, Lord Commander.","TEXT_VOICEMAN_03003_L00210_ESTINIEN<tab>Vous nous aiderez en restant ici pour coordonner les défenses d'Ishgard. Vous êtes le seul parmi nous qui soit capable de remplir cette fonction<var 1D /var>!","","False","0x00000132","",""
"","TEXT_VOICEMAN_03003_L00220_ESTINIEN<tab>What, you too, Master Alphinaud? By the Fury... You have shown some promise, but this adversary is far beyond your skills.","TEXT_VOICEMAN_03003_L00220_ESTINIEN<tab>Et laissez-moi vous dire que j'ai la même opinion à votre sujet, Messire Leveilleur. Vous êtes peut-être très versé dans les arcanes de la magie, mais Nidhogg vous écraserait avant que vous ayez eu le temps de dire “ouf”.","","False","0x00000133","",""
"","TEXT_VOICEMAN_03003_L00230_ALPHINAUD<tab>Your candor is appreciated, ser dragoon. I shall remain, then, and cheer you from afar.","TEXT_VOICEMAN_03003_L00230_ALPHINAUD<tab>Eh bien, on ne peut pas dire que vous manquez de franchise<var 1D /var>! Je mentirais si je prétendais que vos paroles me font plaisir, mais au fond, je sais bien que vous avez raison... Si vous le permettez, je resterai donc en compagnie de sire Aymeric.","","False","0x00000134","",""
"","TEXT_VOICEMAN_03003_L00240_ESTINIEN<tab>Well, my friend, 'twould seem I have discouraged the last of the volunteers, and claimed the task as ours alone. But if any alive can best this wyrm, 'tis surely we two!","TEXT_VOICEMAN_03003_L00240_ESTINIEN<tab>Voilà une sage décision<var 1D /var>! Bien, il est temps pour nous de prendre la route, camarade. Nous sommes les seuls capables de faire mordre la poussière à ce dragon de malheur, et nous allons le prouver<var 1D /var>!","","False","0x00000135","",""
"","TEXT_VOICEMAN_03003_M00010_ESTINIEN<tab>We're through!","TEXT_VOICEMAN_03003_M00010_ESTINIEN<tab>Nous sommes passés<var 1D /var>!!","","False","0x00000136","",""
"","TEXT_VOICEMAN_03003_M00020_ESTINIEN<tab>So, this is the Aery! Where are you Nidhogg!? You have guests!","TEXT_VOICEMAN_03003_M00020_ESTINIEN<tab>C'est donc ça, le Nid du dragon<var 1D /var>! Où es-tu, Nidhogg<var 1D /var>? Montre-toi, vermine<var 1D /var>!","","False","0x00000137","",""
"","TEXT_VOICEMAN_03003_M00030_ESTINIEN<tab>There!","TEXT_VOICEMAN_03003_M00030_ESTINIEN<tab>Là<var 1D /var>!","","False","0x00000138","",""
"","TEXT_VOICEMAN_03003_M00040_ESTINIEN<tab>Greetings, Lord of Dravania! I believe we have something that belongs to you!","TEXT_VOICEMAN_03003_M00040_ESTINIEN<tab>Dragon des temps anciens<var 1D /var>! Que ta propre essence soit le fossoyeur de ton tombeau<var 1D /var>!","","False","0x00000139","",""
"","TEXT_VOICEMAN_03003_M00050_NIDHOGG<tab>Wicked mortals! I shall melt your flesh, and turn your bones to ash!","TEXT_VOICEMAN_03003_M00050_NIDHOGG<tab>Misérables humains<var 1D /var>!! Vous allez tous périr<var 1D /var>! Tous<var 1D /var>!!","","False","0x0000013A","",""
"","TEXT_VOICEMAN_03003_N00010_NIDHOGG<tab>Thou wouldst use mine own eye against me!? Time hath done naught to dilute thy kind's depravity!","TEXT_VOICEMAN_03003_N00010_NIDHOGG<tab>Comment osez-vous retourner ma puissance contre moi, mortels<var 1D /var>!? Votre bassesse n'a donc aucune limite<var 1D /var>?","","False","0x0000013B","",""
"","TEXT_VOICEMAN_03003_N00020_NIDHOGG<tab>I have not forgotten thee, dragoon! Mine essence claimed thee once...and shall do so again!","TEXT_VOICEMAN_03003_N00020_NIDHOGG<tab>Cet œil se souvient de ton image, chevalier<var 1D /var>! Mon esprit a déjà pris possession de ton corps une fois... Prépare-toi à subir le même sort<var 1D /var>!","","False","0x0000013C","",""
"","TEXT_VOICEMAN_03003_N00030_ESTINIEN<tab>No, wyrm! This ends here!","TEXT_VOICEMAN_03003_N00030_ESTINIEN<tab>Non, c'est moi qui vais en finir avec toi<var 1D /var>!","","False","0x0000013D","",""
"","TEXT_VOICEMAN_03003_N00040_ESTINIEN<tab>You gifted my people a thousand years of suffering. Now I gift you an eternity in darkness!","TEXT_VOICEMAN_03003_N00040_ESTINIEN<tab>Mon peuple a souffert pendant des siècles par ta faute... Maintenant, tu vas payer pour tes crimes en errant dans les profondeurs des abysses pour l'éternité<var 1D /var>!","","False","0x0000013E","",""
"","TEXT_VOICEMAN_03003_O00010_SYLVETREL<tab>They are ours, Lord Haldrath... The eyes of Nidhogg!","TEXT_VOICEMAN_03003_O00010_SYLVETREL<tab>Sire Haldrath<var 1D /var>! Nous sommes enfin victorieux... Les yeux du dragon sont à nous<var 1D /var>!","","False","0x0000013F","",""
"","TEXT_VOICEMAN_03003_O00020_HALDRATH<tab>Aye... The wyrm lies broken and my father is avenged. With the wellspring of his vitality thus denied him, Nidhogg shall not linger long in this world.","TEXT_VOICEMAN_03003_O00020_HALDRATH<tab>Père... Je t'ai enfin vengé... Avec la source de son pouvoir entre nos mains, le terrible Nidhogg n'est plus qu'une carcasse sans vie.","","False","0x00000140","",""
"","TEXT_VOICEMAN_03003_O00030_HALDRATH<tab>But behold the terrible price we have paid. My sire is dead; so many brother knights slain.","TEXT_VOICEMAN_03003_O00030_HALDRATH<tab>Mais lourd est le prix que nous avons dû payer... D'abord notre roi Thordan bien-aimé, puis nos frères d'armes...","","False","0x00000141","",""
"","TEXT_VOICEMAN_03003_O00040_HALDRATH<tab>We traded our honor for the strength which now courses in our veins. And still we are forced to make such sacrifice.","TEXT_VOICEMAN_03003_O00040_HALDRATH<tab>Grâce à notre serment, nous avons tenu bon dans l'adversité. La mort de Ratatosk et les yeux de Nidhogg vont nous apporter puissance, gloire et prospérité, et pourtant... je ne peux m'empêcher de regretter tous ces sacrifices...","","False","0x00000142","",""
"","TEXT_VOICEMAN_03003_O00050_SYLVETREL<tab>But not in vain, my lord. Hraesvelgr is the only great wyrm left in Dravania, and he dares not leave his lair.","TEXT_VOICEMAN_03003_O00050_SYLVETREL<tab>Ils n'auront pas été vains, Sire. Des sept grands dragons, il ne reste plus que Hraesvelgr, et il ne s'aventure plus hors de son repaire depuis bien longtemps.","","False","0x00000143","",""
"","TEXT_VOICEMAN_03003_O00060_SYLVETREL<tab>With Nidhogg's eyes in your possession, who now can challenge the might of Ishgard? Ascend the throne, and take your rightful place as the ruler of our people!","TEXT_VOICEMAN_03003_O00060_SYLVETREL<tab>Une fois que vous serez couronné, ces Yeux vous confèreront tout le pouvoir et l'autorité nécessaires pour faire d'Ishgard une cité sûre et prospère<var 1D /var>!","","False","0x00000144","",""
"","TEXT_VOICEMAN_03003_O00070_HALDRATH<tab>Nay, my friend, I must forsake the mantle of king. Though Nidhogg be defeated, his wyrmling horde yet darkens the skies with wings beyond counting.","TEXT_VOICEMAN_03003_O00070_HALDRATH<tab>Je suis désolé, Sylvetrel, mais je n'ai aucune intention de monter sur le trône. Nidhogg est peut-être hors d'état de nuire, mais le sang des dragons bouillonne encore d'une effroyable colère.","","False","0x00000145","",""
"","TEXT_VOICEMAN_03003_O00080_HALDRATH<tab>As one who partook of Ratatoskr's strength, it shall be my penance to bear a knight's arms until death grants me leave to retire. When that day comes, no prince shall perish, but a hells-bound hunter of dragons...","TEXT_VOICEMAN_03003_O00080_HALDRATH<tab>En tant que détenteur de ces Yeux, je ne pourrai abandonner la bataille avant que le dernier de leur race n'ait mordu la poussière. Mon destin est de les traquer jusqu'à ce que la mort vienne me prendre.","","False","0x00000146","",""
"","TEXT_VOICEMAN_03003_O00090_SYLVETREL<tab>But Lord Haldrath! What then shall become of the royal line!?","TEXT_VOICEMAN_03003_O00090_SYLVETREL<tab>Mais... avez-vous pensé à Ishgard<var 1D /var>? Que va-t-il advenir de notre monarchie<var 1D /var>?","","False","0x00000147","",""
"","TEXT_VOICEMAN_03003_O00100_FLAVIEN<tab>Think of your people, my lord! Without a king, who will the common man turn to in his hour of need? How will he find his way without your benevolent hand to guide him?","TEXT_VOICEMAN_03003_O00100_FLAVIEN<tab>Et votre peuple, alors<var 1D /var>? Sans un roi pour le gouverner, il sera comme un troupeau de moutons sans berger<var 1D /var>! Vous n'avez pas le droit de l'abandonner ainsi<var 1D /var>!","","False","0x00000148","",""
"","TEXT_VOICEMAN_03003_O00110_HALDRATH<tab>I thank you, Ser Flavien and Ser Sylvetrel─for dispelling my remaining doubts. With men of such wisdom and compassion in service to the realm, 'tis plain that Ishgard has no need of a king.","TEXT_VOICEMAN_03003_O00110_HALDRATH<tab>Écoutez-moi... C'est précisément parce que vous êtes à mes côtés depuis si longtemps que je suis certain de ma décision. Avec des gentilshommes comme vous pour la défendre, Ishgard se passera très bien de roi.","","False","0x00000149","",""
"","TEXT_VOICEMAN_03003_O00120_HALDRATH<tab>But if you must bow to the demands of tradition, you need look no further than yourselves for one worthy to wear the crown.","TEXT_VOICEMAN_03003_O00120_HALDRATH<tab>Et si la politique exigeait absolument la présence d'un monarque sur le trône, je ne doute pas un seul instant que l'un d'entre vous remplirait ce rôle à merveille.","","False","0x0000014A","",""
"","TEXT_VOICEMAN_03003_O00130_HALDRATH<tab>Fare thee well, my brother knights...my loyal friends. On these shoulders shall I bear the weight of my father's sins; with this lance shall I repay the debt accrued through our misdeeds.","TEXT_VOICEMAN_03003_O00130_HALDRATH<tab>Adieu, mes chers compagnons... N'essayez pas de me retenir, car je m'en vais absoudre le péché de mon défunt père... Je ne trouverai le repos que lorsque cette lance aura lavé nos fautes...","","False","0x0000014B","",""
"","TEXT_VOICEMAN_03003_O00140_SYLVETREL<tab>What cruel jest has fate played upon us...? Have we seized this desperate victory only to lose a king?","TEXT_VOICEMAN_03003_O00140_SYLVETREL<tab>Notre Roi nous a abandonnés... Par la Conquérante, comment le destin peut-il être aussi cruel<var 1D /var>? Pourquoi la victoire a-t-elle un goût aussi amer<var 1D /var>?","","False","0x0000014C","",""
"","TEXT_VOICEMAN_03003_O00150_FLAVIEN<tab>We can but act as our lord has bid. We few who remain must divide between us the rulership of Ishgard and her people.","TEXT_VOICEMAN_03003_O00150_FLAVIEN<tab>Hélas, il ne nous reste plus qu'à suivre sa volonté... Nous allons nous partager les terres d'Ishgard, et guider notre peuple vers des jours meilleurs.","","False","0x0000014D","",""
"","TEXT_VOICEMAN_03003_O00160_BRAWNYKNIGHT<tab>Not I. My oath was to Lord Haldrath, and he alone. If he is not to be king, then I would hang up my shield, as well.","TEXT_VOICEMAN_03003_O00160_BRAWNYKNIGHT<tab>Vous me permettrez de ne pas vous accompagner dans cette entreprise. Mon allégeance va à sire Haldrath, et à lui seul. Sans notre Roi, l'ordre des chevaliers n'a plus aucune raison d'être.","","False","0x0000014E","",""
"","TEXT_VOICEMAN_03003_O00170_SYLVETREL<tab>Will you abandon us, too, ser?","TEXT_VOICEMAN_03003_O00170_SYLVETREL<tab>Attends<var 1D /var>! Tu ne vas tout de même pas nous quitter, toi aussi<var 1D /var>?","","False","0x0000014F","",""
