"location","source","target","id","fuzzy","context","translator_comments","developer_comments"
"","TEXT_REGSEAAETHEGUID_00051_SUNDHIMAL_000_1<tab>Greetings, adventurer. Do you wish an explanation of aetherial travel? I am here to answer any queries you might have.","TEXT_REGSEAAETHEGUID_00051_SUNDHIMAL_000_1<tab>冒険者よ。<br>よければ、「転送魔法」と「エーテライト」について<br>説明してやるが、聞いていかぬか？","","False","0x00000000","",""
"","TEXT_REGSEAAETHEGUID_00051_Q1_000_1<tab>Select a topic.","TEXT_REGSEAAETHEGUID_00051_Q1_000_1<tab>何を聞く？","","False","0x00000001","",""
"","TEXT_REGSEAAETHEGUID_00051_A1_000_1<tab>What is aetherial travel?","TEXT_REGSEAAETHEGUID_00051_A1_000_1<tab>転送魔法とは？","","False","0x00000002","",""
"","TEXT_REGSEAAETHEGUID_00051_A1_000_2<tab>What is aetheryte?","TEXT_REGSEAAETHEGUID_00051_A1_000_2<tab>エーテライトとは？","","False","0x00000003","",""
"","TEXT_REGSEAAETHEGUID_00051_A1_000_3<tab>What is the difference between Return and Teleport?","TEXT_REGSEAAETHEGUID_00051_A1_000_3<tab>デジョンとテレポの違いとは？","","False","0x00000004","",""
"","TEXT_REGSEAAETHEGUID_00051_A1_000_4<tab>Nothing.","TEXT_REGSEAAETHEGUID_00051_A1_000_4<tab>キャンセル","","False","0x00000005","",""
"","TEXT_REGSEAAETHEGUID_00051_SUNDHIMAL_000_10<tab>To understand aetherial travel, you must first understand the nature of aether.","TEXT_REGSEAAETHEGUID_00051_SUNDHIMAL_000_10<tab>「転送魔法」を理解するには、<br>まず「エーテル」について知っておく必要がある。","","False","0x00000006","",""
"","TEXT_REGSEAAETHEGUID_00051_SUNDHIMAL_000_11<tab>Aether is the source of all life, and the underlying force that makes all forms of arcane manipulation possible.","TEXT_REGSEAAETHEGUID_00051_SUNDHIMAL_000_11<tab>エーテルとは、すべての命の源であり、<br>魔法の原動力とされる力だ。","","False","0x00000007","",""
"","TEXT_REGSEAAETHEGUID_00051_SUNDHIMAL_000_12<tab>This ephemeral substance, though unseen and unfelt, flows around and within every single living creature.","TEXT_REGSEAAETHEGUID_00051_SUNDHIMAL_000_12<tab>私や君はもちろん、<br>生きとし生ける者すべてが、<br>その身にエーテルを宿している。","","False","0x00000008","",""
"","TEXT_REGSEAAETHEGUID_00051_SUNDHIMAL_000_13<tab>In the moment of our death, it is believed that a separation occurs between our spiritual and physical forms. Our bodies break down and are absorbed back into the aetherial river, while our souls continue on to the afterlife. This final journey is sometimes called “returning to the Lifestream.”","TEXT_REGSEAAETHEGUID_00051_SUNDHIMAL_000_13<tab>それは、大地とて同じこと。<br>この大地にも、目には見えぬが<br>エーテルが脈々と流れている。これが「地脈」と呼ばれる奔流だ。","","False","0x00000009","",""
"","TEXT_REGSEAAETHEGUID_00051_SUNDHIMAL_000_14<tab>However, our ancestors discovered ways in which, through meditation and focus of spiritual energies, one could reduce <var 08 E905 ((her)) ((his)) /var> body to aether without losing the grip on <var 08 E905 ((her)) ((his)) /var> spirit, in turn allowing for travel upon the Lifestream. These methods have been given the names Return and Teleport.","TEXT_REGSEAAETHEGUID_00051_SUNDHIMAL_000_14<tab>そして「地脈」の流れを利用し、<br>望みの場所へ瞬時に転送する魔法が、<br>「デジョン」や「テレポ」といった「転送魔法」なのだ。","","False","0x0000000A","",""
"","TEXT_REGSEAAETHEGUID_00051_SUNDHIMAL_000_20<tab>As you travel through Eorzea, you will oft come across large floating deposits of a crystalline substance known as aetheryte. The one before us here is a fine example.","TEXT_REGSEAAETHEGUID_00051_SUNDHIMAL_000_20<tab>「エーテライト」とは、転送魔法の利用を<br>補助するために作られた装置のこと。","","False","0x0000000B","",""
"","TEXT_REGSEAAETHEGUID_00051_SUNDHIMAL_000_21<tab>It is said that aetheryte is the solid manifestation of the planet's lifeblood, aether, and that by touching it, the aether which makes up our bodies resonates with that contained in the crystal. This is called “attunement.”","TEXT_REGSEAAETHEGUID_00051_SUNDHIMAL_000_21<tab>結晶化したエーテル……<br>すなわち「クリスタル」を用いて作られている。","","False","0x0000000C","",""
"","TEXT_REGSEAAETHEGUID_00051_SUNDHIMAL_000_22<tab>Normally, when one's body is reduced to aether, it will naturally gravitate to the location with which it resonates the greatest─or one's “home point.” This is why upon losing consciousness in battle, many wake to find themselves back at an aetheryte.","TEXT_REGSEAAETHEGUID_00051_SUNDHIMAL_000_22<tab>「地脈」の流れに乗るだけならば、簡単な話だ。<br>だが、それは荒れ狂う海に飛び込むようなもの。<br>激流に流され、戻ることかなわぬ。","","False","0x0000000D","",""
"","TEXT_REGSEAAETHEGUID_00051_SUNDHIMAL_000_23<tab>In other words, aetherytes act as lodestones, assuring that the body, in its aetherial form, is not lost to the pull of the greater flow.","TEXT_REGSEAAETHEGUID_00051_SUNDHIMAL_000_23<tab>エーテライトは、激しい「地脈」の流れのなかで、<br>出口となる場所を示す灯台のような存在なのだ。","","False","0x0000000E","",""
"","TEXT_REGSEAAETHEGUID_00051_SUNDHIMAL_000_24<tab>And, because signatures of past attunements are maintained within our bodies, it is possible (with some spiritual training, of course) to ignore the pull back to the strongest resonation, and travel to another beacon. Many refer to this as “Teleportation.”","TEXT_REGSEAAETHEGUID_00051_SUNDHIMAL_000_24<tab>「地脈」の流れが交差する結節点に<br>エーテライトを設置することで、はじめて<br>転送先として利用可能となる。","","False","0x0000000F","",""
"","TEXT_REGSEAAETHEGUID_00051_SUNDHIMAL_000_25<tab>What is even more amazing is that when teleporting, we can “carry” those with whom we have created a bond, such as an adventuring party─assuming they have previously attuned with the destination aetheryte.","TEXT_REGSEAAETHEGUID_00051_SUNDHIMAL_000_25<tab>ただし、転送魔法で飛べるのは、<br>一度触れて「交感」したことのあるエーテライトのみ。<br>旅先では、エーテライトへの「交感」を忘れぬようにな。","","False","0x00000010","",""
"","TEXT_REGSEAAETHEGUID_00051_SUNDHIMAL_000_30<tab>As Return merely involves allowing the body to be drawn back to the strongest aetherial beacon─one's home point─it is fairly easy to execute and requires very little spiritual exertion.","TEXT_REGSEAAETHEGUID_00051_SUNDHIMAL_000_30<tab>転送魔法には、デジョンとテレポの二種類が存在する。<br>このうち、もっとも扱いやすいのがデジョンだ。","","False","0x00000011","",""
"","TEXT_REGSEAAETHEGUID_00051_SUNDHIMAL_000_31<tab>Usually, a few moments of rest is all that is needed before it is safe to attempt another jump.","TEXT_REGSEAAETHEGUID_00051_SUNDHIMAL_000_31<tab>デジョンは、精神的な負担が少ないため、<br>気軽に利用できる。","","False","0x00000012","",""
"","TEXT_REGSEAAETHEGUID_00051_SUNDHIMAL_000_32<tab>Teleportation, on the other hand, comes with a greater price. A great deal of spiritual energy known as “anima” is required to fight the natural flow of the Lifestream and guide one's body and soul to a comparatively weak aetherial beacon.","TEXT_REGSEAAETHEGUID_00051_SUNDHIMAL_000_32<tab>ただし、エーテライトとより深い結びつきを<br>必要とするため、帰還地点（ホームポイント）と<br>定めた場所だけにしか転送できぬ。","","False","0x00000013","",""
"","TEXT_REGSEAAETHEGUID_00051_SUNDHIMAL_000_33<tab>If one's body lacks sufficient anima, teleporting to a location may prove impossible. Luckily for most of us, anima is restored quickly and should not prohibit regular travel.","TEXT_REGSEAAETHEGUID_00051_SUNDHIMAL_000_33<tab>一方、テレポは、一度でも交感したことのある<br>エーテライトならば、どこにでも転送可能だ。","","False","0x00000014","",""
"","TEXT_REGSEAAETHEGUID_00051_SUNDHIMAL_000_34<tab>Then why, you ask, must we pay gil when using Teleport? Well, after the Calamity, many of the existing aetheryte camps were destroyed. To relocate and rebuild them required a large sum of money, much of which was lent by certain men of business from Ul'dah.","TEXT_REGSEAAETHEGUID_00051_SUNDHIMAL_000_34<tab>ただし、一定額のギルの支払いが必要となるぞ。<br>エーテライト網の復旧費用を補うためだ。了承願う。","","False","0x00000015","",""
"","TEXT_REGSEAAETHEGUID_00051_SUNDHIMAL_000_35<tab>The gil you pay when either leaving from or arriving at an aetheryte goes to paying off that debt.","TEXT_REGSEAAETHEGUID_00051_SUNDHIMAL_000_35<tab>テレポは精神的負担が大きいゆえ、<br>身を落ち着け、精神を集中させることなしには使えぬ。<br>状況に応じて二種類をうまく使い分けることが肝要だ。","","False","0x00000016","",""
