"location","source","target","id","fuzzy","context","translator_comments","developer_comments"
"","TEXT_FESSUM2021_00711_ETHELIA_000_000<tab>Feel that balmy breeze in the air, friend? Another lovely summer is upon us, and that means it's time to celebrate the Moonfire Faire! And what better place to do so than here in Costa del Sol? Should you have any questions as to how best to enjoy the festivities, you need only say the word!","TEXT_FESSUM2021_00711_ETHELIA_000_000<tab>Чувствуешь, как повеяло приятным ветерком, друг? Наступило ещё одно прекрасное лето, а это значит, что пришло время праздновать фестиваль огненной луны! И что может быть лучше для этого, чем место в Коста-дель-Соль? Если у вас возникнут вопросы о том, как лучше насладиться праздником, вам стоит лишь сказать слово!","","False","0x00000000","",""
"","TEXT_FESSUM2021_00711_ETHELIA_000_010<tab>Feel that balmy breeze in the air, friend? Another lovely summer is upon us, and that means it's time to celebrate the Moonfire Faire! Should you have any questions as to how best to enjoy the festivities, you need only say the word!","Чувствуешь, как повеяло приятным ветерком, друг? Наступило ещё одно прекрасное лето, а это значит, что пришло время праздновать фестиваль огненной луны! Если у вас возникнут вопросы о том, как лучше насладиться праздником, вам нужно сказать мне лишь слово!","","False","0x00000001","",""
"","TEXT_FESSUM2021_00711_Q1_000_000<tab>What will you ask?","TEXT_FESSUM2021_00711_Q1_000_000<tab>Что вы хотите узнать?","","False","0x00000002","",""
"","TEXT_FESSUM2021_00711_A1_000_001<tab>What is the Moonfire Faire?","TEXT_FESSUM2021_00711_Q1_000_000<tab>Что такое фестиваль огненной луны?","","False","0x00000003","",""
"","TEXT_FESSUM2021_00711_A1_000_002<tab>What are Faire tokens?","TEXT_FESSUM2021_00711_A1_000_002<tab>Что такое ваучеры фестиваля?","","False","0x00000004","",""
"","TEXT_FESSUM2021_00711_A1_000_003<tab>How do I obtain Faire tokens?","TEXT_FESSUM2021_00711_A1_000_003<tab>Как я могу получить ваучеры фестиваля?","","False","0x00000005","",""
"","TEXT_FESSUM2021_00711_A1_000_004<tab>Nothing.","TEXT_FESSUM2021_00711_A1_000_004<tab>Ничего.","","False","0x00000006","",""
"","TEXT_FESSUM2021_00711_ETHELIA_000_020<tab>Several years ago, the Adventurers' Guild formed the Cascadiers to combat an invasion of rampaging Bombards. The Moonfire Faire was first held to attract new members to the cause.","TEXT_FESSUM2021_00711_ETHELIA_000_020<tab>Несколько лет назад Гильдия искателей приключений сформировала отряд каскадёров для борьбы с нашествием буйных Бомбёжек. Чтобы привлечь новых членов к делу, был проведён фестиваль «Огненной луны».","","False","0x00000007","",""
"","TEXT_FESSUM2021_00711_ETHELIA_000_021<tab>It proved so popular that it has been held annually ever since, whether the Bombards appear or not. It helps spread word of the guild's activities and generate interest among potential new recruits. In charge of the proceedings is the grand chaperone, Haermaga.","TEXT_FESSUM2021_00711_ETHELIA_000_021<tab>Он оказался настолько популярным, что с тех пор проводится ежегодно, независимо от того, появляются ли Бомбёжки или нет. Это помогает распространить информацию о деятельности гильдии и вызвать интерес у потенциальных новобранцев. Руководит процессом великий провожатый Хаермага.","","False","0x00000008","",""
"","TEXT_FESSUM2021_00711_ETHELIA_000_022<tab>He has decided to have members of the Adventurers' Guild demonstrate their courage and physical prowess to faire-goers through a series of challenges in Costa del Sol.","TEXT_FESSUM2021_00711_ETHELIA_000_022<tab>Он решил, что члены Гильдии искателей приключений продемонстрируют посетителям ярмарки свою храбрость и физическое мастерство, пройдя ряд испытаний в Коста-дель-Соль.","","False","0x00000009","",""
"","TEXT_FESSUM2021_00711_ETHELIA_000_030<tab>Master Gegeruju has once again provided the space and funding for the event. It's sure to be the most spectacular Moonfire Faire held to date!","TEXT_FESSUM2021_00711_ETHELIA_000_030<tab>Мастер Гегеруджу снова предоставил помещение и финансирование для проведения мероприятия. Это будет самый впечатляющий фестиваль огненной луны!","","False","0x0000000A","",""
"","TEXT_FESSUM2021_00711_ETHELIA_000_031<tab>Since you're here, why not join in the festivities?","TEXT_FESSUM2021_00711_ETHELIA_000_031<tab>Раз уж вы здесь, почему бы не принять участие в празднике?","","False","0x0000000B","",""
"","TEXT_FESSUM2021_00711_ETHELIA_000_032<tab>The event is being held even as we speak, courtesy of the ever-generous Master Gegeruju. Your participation would be most appreciated!","TEXT_FESSUM2021_00711_ETHELIA_000_032<tab>Мероприятие проводится даже сейчас, когда мы разговариваем, благодаря вечно щедрому господину Гегеруджу. Ваше участие будет оценено по достоинству!","","False","0x0000000C","",""
"","TEXT_FESSUM2021_00711_ETHELIA_000_040<tab>Faire tokens are given to adventurers who contribute to the success and festive atmosphere of our celebrations. You can trade them for all kinds of wonderful trinkets and baubles.","TEXT_FESSUM2021_00711_ETHELIA_000_040<tab>Ваучеры фестиваля выдаются приключенцам, которые способствуют успеху и праздничной атмосфере наших торжеств. Их можно обменять на всевозможные чудесные безделушки и побрякушки.","","False","0x0000000D","",""
"","TEXT_FESSUM2021_00711_ETHELIA_000_050<tab>How do you contribute, you ask? Well...this year we're having a problem with a particularly blustery sort of Bombard, so anything you could do to help us with that would be greatly appreciated! I'm not entirely certain what we did to incur their wrath, but they seem most intent on interrupting the festivities...","TEXT_FESSUM2021_00711_ETHELIA_000_050<tab>Как вы можете внести свой вклад, спросите вы? Ну... в этом году у нас возникли проблемы с особенно буйным видом Бомбёжек, так что всё, что вы можете сделать, чтобы помочь нам с этим, будет очень признательно! Я не совсем понимаю, чем мы вызвали их гнев, но, похоже, они очень хотят прервать праздник...","","False","0x0000000E","",""
"","TEXT_FESSUM2021_00711_ETHELIA_000_051<tab>Don't worry, you won't be asked to go it alone─Haermaga has assured me that we have a team at the ready to fight at your side. Pray lend your strength and defend the beach from this frosty menace!","TEXT_FESSUM2021_00711_ETHELIA_000_051<tab>Не волнуйтесь, вам не придётся действовать в одиночку — Хаермага заверил меня, что у нас есть команда, готовая сражаться на вашей стороне. Приложите свои силы и защитите пляж от этой леденящей угрозы!","","False","0x0000000F","",""
"","TEXT_FESSUM2021_00711_ETHELIA_000_052<tab>Once the Bombard's been blasted off, you'll be rewarded with Faire tokens commensurate with your contribution in the battle. Get enough of them and who knows what wonderful prizes you'll be able to trade them for!","TEXT_FESSUM2021_00711_ETHELIA_000_052<tab>Как только Бомбёжка будет взорвана, вы получите ваучеры фестиваля, соразмерные вашему вкладу в битву. Соберите их достаточно, и кто знает, на какие замечательные призы вы сможете их обменять!","","False","0x00000010","",""
"","TEXT_FESSUM2021_00711_SYSTEM_000_053<tab>Faire tokens can be obtained from participating in the FATE occurring in the southeastern region of the Isle of Endless Summer.","TEXT_FESSUM2021_00711_SYSTEM_000_053<tab>Жетоны фестиваля можно получить, участвуя в активности ЗОНА, проходящей в юго-восточной части Острова Бесконечного Лета.","","False","0x00000011","",""
