"location","source","target","id","fuzzy","context","translator_comments","developer_comments"
"","TEXT_CTSDKBCHARACTER1SUB1_00572_EISMON_000_001<tab>I never thought of forging anything metallic for the Zun. They always seemed like a “bone and hide” kind of people...","TEXT_CTSDKBCHARACTER1SUB1_00572_EISMON_000_001<tab>Die Zun haben eine Vorliebe für Leder und Knochen, davon war ich immer überzeugt. Offenbar habe ich mich geirrt.","","False","0x00000000","",""
"","TEXT_CTSDKBCHARACTER1SUB1_00572_EISMON_000_050<tab>I'd almost forgotten what it was like to feel the weight of coins in my pocket...","TEXT_CTSDKBCHARACTER1SUB1_00572_EISMON_000_050<tab>Darf ich etwa auf eine regelmäßige Gehaltszahlung hoffen? Dass ich diesen Tag noch erlebe<var 1D /var>...","","False","0x00000001","",""
"","TEXT_CTSDKBCHARACTER1SUB1_00572_EISMON_000_100<tab>With Iola on one side, and Colana on the other, I'm feeling a bit squeezed in the middle. If only Rend were here, he'd gladly take some of the heat.","TEXT_CTSDKBCHARACTER1SUB1_00572_EISMON_000_100<tab>Wohin ich mich auch wende, werde ich von meinen starrköpfigen Vorgesetzten zusammengestaucht. Hoffentlich kommt Sue-Rend bald zurück.","","False","0x00000002","",""
"","TEXT_CTSDKBCHARACTER1SUB1_00572_EISMON_100_100<tab>Even with Rend back, I'm still getting the heavy end of the hammer. Aye, it was a faint hope at best...","TEXT_CTSDKBCHARACTER1SUB1_00572_EISMON_100_100<tab>Sue-Rend ist zurück, aber das hat mein Leben nicht leichter gemacht. Ich werde noch immer herumkommandiert<var 1D /var>... Aber eigentlich habe ich mir keine großen Hoffnungen auf Besserung gemacht.","","False","0x00000003","",""
"","TEXT_CTSDKBCHARACTER1SUB1_00572_EISMON_000_150<tab>You're an inspiration, <var 2C ((<var 29 EB02 /var>)) (( )) 02 /var>. I may not have your imagination, but I'm willing to give this new merchandise thing a damn good try!","TEXT_CTSDKBCHARACTER1SUB1_00572_EISMON_000_150<tab>Wie gerne würde ich auch so <var 08 E905 ((eine überragende Handwerkerin)) ((ein überragender Handwerker)) /var> wie du sein! Ach, das ist wohl etwas vermessen. Aber ich werde mich bemühen und dir nacheifern, so gut ich es kann.","","False","0x00000004","",""
"","TEXT_CTSDKBCHARACTER1SUB1_00572_EISMON_000_200<tab>Right, something new, something new... I'm drawing a complete blank.","TEXT_CTSDKBCHARACTER1SUB1_00572_EISMON_000_200<tab>Ein neues Produkt ... Ein neues Produkt ...<br>Ja, was denn nur? Vielleicht stimmt es, was Iola sagt und ich bin einfach nicht sehr kreativ<var 1D /var>...","","False","0x00000005","",""
