"location","source","target","id","fuzzy","context","translator_comments","developer_comments"
"","TEXT_FESVLT2023PRESENTATION_00794_EMILIE_000_000<tab>The day's crowning event is about to begin, adventurer! Folk from all walks will speak of their greatest love while dressed in the latest Valentione fashions. You'll be staying to watch, of course?","TEXT_FESVLT2023PRESENTATION_00794_EMILIE_000_000<tab><var 08 E905 ((Искательница)) ((Искатель)) /var> приключений! Главное представление праздника вот-вот начнется! Гости со всего света, облачившись в самые новые одеяния Валентиона, скажут пару слов о своей величайшей любви. Вы же останетесь посмотреть?","","False","0x00000000","",""
"","TEXT_FESVLT2023PRESENTATION_00794_Q2_100_000<tab>Stay for the event?","TEXT_FESVLT2023PRESENTATION_00794_Q2_100_000<tab>Посмотреть представление?","","False","0x00000001","",""
"","TEXT_FESVLT2023PRESENTATION_00794_Q1_000_000<tab>Whose presentation will you watch?","TEXT_FESVLT2023PRESENTATION_00794_Q1_000_000<tab>Чье выступление вы посмотрите?","","False","0x00000002","",""
"","TEXT_FESVLT2023PRESENTATION_00794_A1_000_001<tab>The face of adventure and a fosterer of flora.","TEXT_FESVLT2023PRESENTATION_00794_A1_000_001<tab>Матерь приключений и любительница лесоводства.","","False","0x00000003","",""
"","TEXT_FESVLT2023PRESENTATION_00794_A2_000_001<tab>The soul of wood and a great oak in the making.","TEXT_FESVLT2023PRESENTATION_00794_A2_000_001<tab>Дающий дереву новую жизнь и его юный ассистент.","","False","0x00000004","",""
"","TEXT_FESVLT2023PRESENTATION_00794_A3_000_001<tab>Infatuated emissaries.","TEXT_FESVLT2023PRESENTATION_00794_A3_000_001<tab>Влюбленные эмиссары.","","False","0x00000005","",""
"","TEXT_FESVLT2023PRESENTATION_00794_A4_000_001<tab>Scion sisters.","","","False","0x00000006","",""
"","TEXT_FESVLT2023PRESENTATION_00794_A5_000_001<tab>A funny-talking fortune-teller and a furry friend.","","","False","0x00000007","",""
"","TEXT_FESVLT2023PRESENTATION_00794_ASTRID_000_010<tab>Please give a warm welcome to Gridania's very own Mother Miounne and Fufucha! Tell us─what inspired you to participate in today's event?","","","False","0x00000008","",""
"","TEXT_FESVLT2023PRESENTATION_00794_MIOUNNE_000_011<tab>I thought I'd use this opportunity to advertise the Adventurers' Guild, which operates at the Carline Canopy. To those seeking adventure─or a scrumptious eel pie─look no further!","","","False","0x00000009","",""
"","TEXT_FESVLT2023PRESENTATION_00794_FUFUCHA_000_012<tab>And I'm here representing the Botanists' Guild. We hope to cultivate a fondness of flora in one and all!","","","False","0x0000000A","",""
"","TEXT_FESVLT2023PRESENTATION_00794_EMILIE_000_013<tab>There's no better way to express one's love than in the company of like-minded friends! Please share with us what it is that you love!","","","False","0x0000000B","",""
"","TEXT_FESVLT2023PRESENTATION_00794_MIOUNNE_000_014<tab>Well, I can't speak of love without mentioning tea. Whether I'm enjoying a cup or brewing a pot for a weary soul, tea brings me joy like little else.","","","False","0x0000000C","",""
"","TEXT_FESVLT2023PRESENTATION_00794_MIOUNNE_100_014<tab>We serve only the finest teas at the Carline Canopy, and I hope you'll all come and try some. There's a drop for every taste!","","","False","0x0000000D","",""
"","TEXT_FESVLT2023PRESENTATION_00794_FUFUCHA_000_015<tab>To that I can attest─though, admittedly, my own adoration lies more with the leaves than the beverage!","","","False","0x0000000E","",""
"","TEXT_FESVLT2023PRESENTATION_00794_FUFUCHA_100_015<tab>Be it herbs or fruits or flowers, it's my passion and purpose to understand nature's bounty, for the benefit of both mankind and the star.","","","False","0x0000000F","",""
"","TEXT_FESVLT2023PRESENTATION_00794_ASTRID_000_016<tab>Well now, if tea and flowers aren't absolutely perfect for this season of doting! I invite you all to seek out the Carline Canopy and Botanists' Guild to treat yourselves and your loved ones! Thank you, Mother Miounne and Fufucha!","","","False","0x00000010","",""
"","TEXT_FESVLT2023PRESENTATION_00794_ASTRID_000_020<tab>We welcome to the stage two Gridanian mainstays─Timbermaster Beatin and young Nicoliaux! Tell us, what inspired you to participate in today's event?","","","False","0x00000011","",""
"","TEXT_FESVLT2023PRESENTATION_00794_BEATINE_000_021<tab>That should be evident─I desire to share my wood with the world.","","","False","0x00000012","",""
"","TEXT_FESVLT2023PRESENTATION_00794_NICOLIAUX_000_022<tab>I'm here with old Beat─er...I mean, the timbermaster. To keep watch over him, I suppose? Oh, but I'm also hoping to find more younglings to play with us in the Acorn Orchard.","","","False","0x00000013","",""
"","TEXT_FESVLT2023PRESENTATION_00794_EMILIE_000_023<tab>So a hail to new friends and, erm, timber enthusiasts! Lovely! Without further ado, then─what is it that you love?","","","False","0x00000014","",""
"","TEXT_FESVLT2023PRESENTATION_00794_BEATINE_000_024<tab>Your query is simple─but how does one aptly describe the fire kindled within a carpenter's breast at the sight of a quarter-cleft plank?","","","False","0x00000015","",""
"","TEXT_FESVLT2023PRESENTATION_00794_BEATINE_100_024<tab>The thrill of taking hardwood in hand, stroking it end to end, feeling every knot and grain against your fingertips? No words could do such euphoria justice!","","","False","0x00000016","",""
"","TEXT_FESVLT2023PRESENTATION_00794_NICOLIAUX_000_025<tab>Er, what he's saying is...wood is great!","","","False","0x00000017","",""
"","TEXT_FESVLT2023PRESENTATION_00794_NICOLIAUX_100_025<tab>As for me, I love all my friends as well as the carpenters who built our play equipment. That includes the timbermaster, of course!","","","False","0x00000018","",""
"","TEXT_FESVLT2023PRESENTATION_00794_ASTRID_000_026<tab>Marvelous! Those with a love of wood, the Carpenters' Guild has what you desire and more! And young ones who wish to play, don't be shy─run along to the Acorn Orchard and get to know Nicoliaux! Thank you for joining us!","","","False","0x00000019","",""
"","TEXT_FESVLT2023PRESENTATION_00794_ASTRID_000_030<tab>May I have a warm welcome for Lisette de Valentione and her beloved, Ser Hortefense! Tell us─what inspired you to participate in today's event?","","","False","0x0000001A","",""
"","TEXT_FESVLT2023PRESENTATION_00794_LISETTE_000_031<tab>Well, I could hardly forgo this splendid production of ardor and affection hosted by my very own emissaries of love!","","","False","0x0000001B","",""
"","TEXT_FESVLT2023PRESENTATION_00794_HORTEFENSE_000_032<tab>Precisely! We are here to support you. ...And I suppose I'd like to profess my passions a little as well.","","","False","0x0000001C","",""
"","TEXT_FESVLT2023PRESENTATION_00794_EMILIE_000_033<tab>How romantic! You have our audience captivated already─tell us all about your love!","","","False","0x0000001D","",""
"","TEXT_FESVLT2023PRESENTATION_00794_HORTEFENSE_000_034<tab>Well, my love...my <var 1A 02 /var>angel<var 1A 01 /var> is... Oh, how am I to aptly summarize such feelings!?","","","False","0x0000001E","",""
"","TEXT_FESVLT2023PRESENTATION_00794_HORTEFENSE_100_034<tab>Ever since my darling Lisette─my goddess!─first descended upon me as I lay collapsed amongst the pillowed drifts, I knew that I could never love another! Even now, when she gathers me into her milky arms, I─ ","","","False","0x0000001F","",""
"","TEXT_FESVLT2023PRESENTATION_00794_LISETTE_000_035<tab>Wh-What are you doing, saying such embarrassing things out loud!? And what's even worse is...is...","","","False","0x00000020","",""
"","TEXT_FESVLT2023PRESENTATION_00794_LISETTE_100_035<tab>...I don't dislike it. When you bare your heart to me like that, it makes me think of all <var 1A 02 /var>I'd<var 1A 01 /var> like to bare in return...","","","False","0x00000021","",""
"","TEXT_FESVLT2023PRESENTATION_00794_ASTRID_000_036<tab>A-And we seem to be out of time! Perhaps these two love-doves can continue their conversation somewhere private! Thank you very much!","","","False","0x00000022","",""
"","TEXT_FESVLT2023PRESENTATION_00794_ASTRID_000_040<tab>We welcome to the stage former Scions of the Seventh Dawn, Aenor and Clemence! Tell us─what inspired you to participate in today's event?","","","False","0x00000023","",""
"","TEXT_FESVLT2023PRESENTATION_00794_AENOR_000_041<tab>I happen to be staying in Gridania at the moment, so I thought I'd join in the celebration.","","","False","0x00000024","",""
"","TEXT_FESVLT2023PRESENTATION_00794_CLEMENCE_000_042<tab>For my part, I came to the Twelveswood to meet my sister, whom I hadn't seen in a while. But one thing led to another, and now here we are!","","","False","0x00000025","",""
"","TEXT_FESVLT2023PRESENTATION_00794_EMILIE_000_043<tab>What heartwarming familial affection! With that, please share with us what you love most!","","","False","0x00000026","",""
"","TEXT_FESVLT2023PRESENTATION_00794_AENOR_000_044<tab>What I love most...is love. <var 1A 02 /var>Brotherly<var 1A 01 /var> love. Aaah, how it used to wash over me in waves of blessed warmth... But that tide has receded and I've been left high and dry.","","","False","0x00000027","",""
"","TEXT_FESVLT2023PRESENTATION_00794_AENOR_100_044<tab>Damn it all! I can't bear it anymore! Can't bear the deprivation! Please don't take it from me! Give me back my brotherly love! <sob>","","","False","0x00000028","",""
"","TEXT_FESVLT2023PRESENTATION_00794_CLEMENCE_000_045<tab>Ugh, give me strength! Can't we make it through a single day without the mention of brotherly love!? And in front of all and sundry, no less! P-Please forget you heard any of that, everyone!","","","False","0x00000029","",""
"","TEXT_FESVLT2023PRESENTATION_00794_CLEMENCE_100_045<tab>...Ahem! I'm presently studying at the Astrologicum in Ishgard, and I love every moment of it! And once I've concluded my time there, I believe I will next explore Nymian magicks!","","","False","0x0000002A","",""
"","TEXT_FESVLT2023PRESENTATION_00794_ASTRID_000_046<tab>Though we've been asked to forget it, I must say I didn't quite understand it myself... Thank you for sharing, Aenor and Clemence, and please enjoy the rest of the festivities!","","","False","0x0000002B","",""
"","TEXT_FESVLT2023PRESENTATION_00794_ASTRID_000_050<tab>We have with us today a most honored guest─the one and only Urianger Augurelt, accompanied by the sweet Puddingway! Tell us─what inspired you to participate in today's event?","","","False","0x0000002C","",""
"","TEXT_FESVLT2023PRESENTATION_00794_URIANGER_000_051<tab>Simply, these observances of love did seem a worthy endeavor. That I should chance to spy a familiar countenance among those in attendance served as further encouragement.","","","False","0x0000002D","",""
"","TEXT_FESVLT2023PRESENTATION_00794_PUDDINGWAY_000_052<tab>And I've come for the pudding!","","","False","0x0000002E","",""
"","TEXT_FESVLT2023PRESENTATION_00794_EMILIE_000_053<tab>What a charming duo! Now, please tell us what the crowd is simply dying to know─what do you love?","","","False","0x0000002F","",""
"","TEXT_FESVLT2023PRESENTATION_00794_PUDDINGWAY_000_054<tab>Love? Why, pudding, of course!","","","False","0x00000030","",""
"","TEXT_FESVLT2023PRESENTATION_00794_PUDDINGWAY_100_054<tab>Sticky pudding, jiggly pudding, pudding with sweetmeats or biscuits... So long as it is pudding, it brings me unparalleled delight!","","","False","0x00000031","",""
"","TEXT_FESVLT2023PRESENTATION_00794_URIANGER_000_055<tab>Were I to likewise nominate a dish for which I harbor affection, it could be naught else but cockatrice meatballs. Not only for the gastronomic pleasure it doth provide, but the fond memories it doth rouse.","","","False","0x00000032","",""
"","TEXT_FESVLT2023PRESENTATION_00794_URIANGER_100_055<tab>In my youth, knowing it to be my favorite, a dear friend oft prepared it for me. From the burnt flavors of her earliest attempts to the sublime texture of her later handiwork, to simply think of the dish doth transport me back to those halcyon days.","","","False","0x00000033","",""
"","TEXT_FESVLT2023PRESENTATION_00794_ASTRID_000_056<tab>Meals shared with a special someone and the undeniable joy of pudding─two exceptional examples of love, indeed! Why, I'm feeling rather peckish myself... Thank you for your participation!","","","False","0x00000034","",""
