"location","source","target","id","fuzzy","context","translator_comments","developer_comments"
"","TEXT_VOICEMAN_05400_001360_GRAHATIA<tab>As you know, reversing the effects of tempering demands a profuse amount of aether. And while Alisaie was able to heal Ga Bu alone, I fear the same will not be true for those who exhibit more advanced symptoms.","TEXT_VOICEMAN_05400_001360_GRAHATIA<tab>Как вы уже знаете, обращение эффекта перековки требует существенных объёмов эфира. Ализе сумела исцелить Га Бу в одиночку, но боюсь, на существ с несколько иными симптомами это может не подействовать.","","False","0x0000008F","",""
"","TEXT_VOICEMAN_05400_001370_GRAHATIA<tab>Moreover, the treatment's effects are limited to the soul. It offers no succor to those whose very flesh has been altered through prolonged exposure to a primal's influence.","TEXT_VOICEMAN_05400_001370_GRAHATIA<tab>Более того, чары применяются только на душу. Пострадавшие, у кого в результате длительного воздействия праймала успели измениться тела, останутся неизлечимыми.","","False","0x00000090","",""
"","TEXT_VOICEMAN_05400_001380_GRAHATIA<tab>All of which is to say that we cannot save everyone.","TEXT_VOICEMAN_05400_001380_GRAHATIA<tab>Короче говоря, мы не в силах спасти всех и каждого.","","False","0x00000091","",""
"","TEXT_VOICEMAN_05400_001390_ALISAIE<tab>Maybe we can't. Or maybe we can. No one gave us a hope of saving Ga Bu, and yet here we are. We must find a way to treat as many as possible.","TEXT_VOICEMAN_05400_001390_ALISAIE<tab>Может, и нет. А может, получится. Успех с Га Бу тоже никто не гарантировал, но у нас всё вышло! Мы должны отыскать способ исцелить больше народу!","","False","0x00000092","",""
"","TEXT_VOICEMAN_05400_001400_ALPHINAUD<tab>Then...the next logical step would be to produce a veritable army of porxies, would it not? Granted, it seemed a simple enough process in the First, but I suspect it will be different here in the Source. Not that I am any authority, of course...","TEXT_VOICEMAN_05400_001400_ALPHINAUD<tab>В таком случае... следующим логичным шагом стало бы сотворить целую армию поро? В смысле, на Первом процесс казался довольно простым, но подозреваю, на Источнике всё может быть иначе. Не то чтобы я эксперт в области...","","False","0x00000093","",""
"","TEXT_VOICEMAN_05400_001410_YSHTOLA<tab>Yet there <var 1A 02 /var>is<var 1A 01 /var> an authority on familiars to whom we may grudgingly turn. She's stubborn, haughty, eccentric, irascible, laconic, annoying─and her name is Master Matoya. The real one.","TEXT_VOICEMAN_05400_001410_YSHTOLA<tab>Однако такой эксперт существует, и мы можем к ней обратиться. Упрямая, колючая, эксцентричная, раздражительная, немногословная и надоедливая — имя ей госпожа Матойя. Настоящая Матойя.","","False","0x00000094","",""
"","TEXT_VOICEMAN_05400_001420_ALISAIE<tab>I have to go now, Ga Bu, but the people here will look after you, all right? And I promise to come and visit you again soon.","TEXT_VOICEMAN_05400_001420_ALISAIE<tab>Мы должны идти, Га Бу, но местные за тобой присмотрят, ладно? Обещаю, вскоре я приду тебя навестить.","","False","0x00000095","",""
"","TEXT_VOICEMAN_05400_001430_GABU<tab>All right! Thank you, Alisaie! Thank you!","TEXT_VOICEMAN_05400_001430_GABU<tab>Хорошо! Спасибо, Ализе! Спасибо!","","False","0x00000096","",""
"","TEXT_VOICEMAN_05400_001440_MATOYA<tab>Nary a word from you all this time, then you bring every man and his poroggo with you. Did no one teach you any manners, girl?","TEXT_VOICEMAN_05400_001440_MATOYA<tab>От тебя то вестей не дождёшься, то являешься сюда с кучей народу. Тебя не учили манерам, девочка?","","False","0x00000097","",""
"","TEXT_VOICEMAN_05400_001450_YSHTOLA<tab>They were too busy teaching me aetherology, Master. Jesting aside, I wanted to be the one to express our gratitude.","TEXT_VOICEMAN_05400_001450_YSHTOLA<tab>Эти «они» были слишком заняты и вместо того занимались со мной эфирологией, учительница. Но шутки в сторону — мне бы хотелось лично тебя поблагодарить.","","False","0x00000098","",""
"","TEXT_VOICEMAN_05400_001460_YSHTOLA<tab>I am told you spared no effort to sustain our bodies while we were away. And for that we owe you our lives. Thank you.","TEXT_VOICEMAN_05400_001460_YSHTOLA<tab>Мне сказали, что ты поддерживала наши тела в стабильном состоянии, пока нас не было. Мы обязаны тебе своими жизнями. Спасибо.","","False","0x00000099","",""
"","TEXT_VOICEMAN_05400_001470_MATOYA<tab>Hmph. You were gone so long, I was starting to think you'd set your heart on staying.","TEXT_VOICEMAN_05400_001470_MATOYA<tab>Хмф. Тебя так долго не было, что я уж начала гадать — может, вы передумали и решили там остаться.","","False","0x0000009A","",""
"","TEXT_VOICEMAN_05400_001480_YSHTOLA<tab>It wasn't easy to leave, as it happens. Seldom does one have the opportunity to study other worlds, and I would not have minded extending my stay by a handful of years.","TEXT_VOICEMAN_05400_001480_YSHTOLA<tab>Уходить было нелегко, это факт. Возможность изучить другие миры выпадает редко — лично я была бы не прочь остаться на десяток годков, представься такая возможность.","","False","0x0000009B","",""
"","TEXT_VOICEMAN_05400_001490_ALPHINAUD<tab>Ever the scholar, Y'shtola dedicated herself to studying ancient civilizations of the First, befriending a tribe known as the Night's Blessed in the process. There, she took on the name of Matoya, and won the respect of all the children of the forest.","TEXT_VOICEMAN_05400_001490_ALPHINAUD<tab>Учёная до мозга костей, Я'штола посвятила себя изучению древних цивилизаций Первого и подружилась в процессе с племенем Братьев Ночи. Там, назвавшись Матойей, она завоевала уважение всех детей леса.","","False","0x0000009C","",""
"","TEXT_VOICEMAN_05400_001500_YSHTOLA<tab>I merely adopted an alias in accordance with the custom of my hosts. Yours just happened to be the first name that came to mind.","TEXT_VOICEMAN_05400_001500_YSHTOLA<tab>Мне пришлось взять псевдоним, ведь таков был обычай того племени. Просто твоё первым пробудилось в памяти.","","False","0x0000009D","",""
"","TEXT_VOICEMAN_05400_001510_MATOYA<tab>You mean to tell me you went gallivanting about using my name, and only bother to visit when you need a favor? And don't pretend you don't! I taught you long enough.","TEXT_VOICEMAN_05400_001510_MATOYA<tab>Хочешь сказать, ты там натворила кучу дел под моим именем, а в гости пришла, только когда тебе понадобилась услуга? И не притворяйся, будто тебе не нужна помощь! Я слишком долго тебя знаю.","","False","0x0000009E","",""
"","TEXT_VOICEMAN_05400_001520_YSHTOLA<tab>Indeed. And devoted pupil that I am, I could not fail to recall my master's sage advice: “When the answer eludes you, look to the wisdom of your elders.”","TEXT_VOICEMAN_05400_001520_YSHTOLA<tab>В самом деле. Как преданная ученица, я первым делом припомнила хороший совет своей учительницы: «Когда ответ от тебя ускользает, ищи мудрости старших».","","False","0x0000009F","",""
"","TEXT_VOICEMAN_05400_001530_MATOYA<tab>You there─were you going to introduce yourself?","TEXT_VOICEMAN_05400_001530_MATOYA<tab>Эй, ты — не хочешь представиться?","","False","0x000000A0","",""
"","TEXT_VOICEMAN_05400_001540_GRAHATIA<tab>How remiss of me. G'raha Tia is my name, and I am proud to call myself a Scion.","TEXT_VOICEMAN_05400_001540_GRAHATIA<tab>Простите за невежливость. Я Г'раха Тиа, горжусь тем, что называю себя Хранителем.","","False","0x000000A1","",""
"","TEXT_VOICEMAN_05400_001550_GRAHATIA<tab>I too wish to offer my gratitude for your invaluable aid in sustaining the Archons' bodies...as well as my apologies. It was my inexpert summoning spell which endangered their lives in the first place.","TEXT_VOICEMAN_05400_001550_GRAHATIA<tab>Я тоже хотел бы поблагодарить за вашу неоценимую помощь в поддержании тел архонов... а вместе с тем извиниться. Это из-за моих неумелых чар призыва их жизни оказались в опасности.","","False","0x000000A2","",""
"","TEXT_VOICEMAN_05400_001560_MATOYA<tab>Ah, yes, the one bent on digging up the mysteries of Allag. Old Galuf used to speak of you, and Krile's told me all about your recent exploits.","TEXT_VOICEMAN_05400_001560_MATOYA<tab>А, да, ты тот повёрнутый на исследованиях загадок Аллага? Старый Галуф о тебе упоминал, а Крайл рассказывала о твоих последних делах.","","False","0x000000A3","",""
"","TEXT_VOICEMAN_05400_001570_MATOYA<tab>Do you have a bad back, or something? At ease, boy! Whatever mess you've made, I'm not in the habit of dwelling on the failings of the younger generation.","TEXT_VOICEMAN_05400_001570_MATOYA<tab>У тебя что, с позвоночником проблемы? Расслабься, парниша. Устроил небольшой бардачок, подумаешь. За мной не водится привычки расстраиваться из-за юношеских шалостей.","","False","0x000000A4","",""
"","TEXT_VOICEMAN_05400_001580_GRAHATIA<tab>...You are too kind. I have also heard much and more about you, Master Matoya. 'Tis an honor to finally make your acquaintance.","TEXT_VOICEMAN_05400_001580_GRAHATIA<tab>...Вы слишком добры. Я тоже многое о вас слышал, госпожа Матойя. Для меня большая честь наконец-то с вами встретиться.","","False","0x000000A5","",""
"","TEXT_VOICEMAN_05400_001590_MATOYA<tab>Well, that's more than enough pleasantries for anyone. Tell me what you want. I haven't got all day.","TEXT_VOICEMAN_05400_001590_MATOYA<tab>Ну ладно, хватит меня жиром смазывать. Говорите, зачем пришли. Я что тут, весь день торчать буду?","","False","0x000000A6","",""
"","TEXT_VOICEMAN_05400_001600_MATOYA<tab>...So that's the way of it. It should be a simple enough matter to make the familiar. The magick, on the other hand...","TEXT_VOICEMAN_05400_001600_MATOYA<tab>...Вот значит как. Сделать фамильяра — дело простецкое. Но вплести чары...","","False","0x000000A7","",""
"","TEXT_VOICEMAN_05400_001610_GRAHATIA<tab>Ah, that you may leave to me. Being the only one possessed of royal blood, I alone can imbue the subject with the necessary magick.","TEXT_VOICEMAN_05400_001610_GRAHATIA<tab>О, это можете оставить мне. Я единственный с Королевской Кровью, и только я смогу наполнить объект необходимой магией.","","False","0x000000A8","",""
"","TEXT_VOICEMAN_05400_001620_MATOYA<tab>So I just need to create porxies with the power to stir the soul.","TEXT_VOICEMAN_05400_001620_MATOYA<tab>Значит, всего-то нужны поро со способностью влиять на душу?","","False","0x000000A9","",""
"","TEXT_VOICEMAN_05400_001630_MATOYA<tab>“Just,” I say, though we're talking about a veritable herd of the little buggers. We'd collapse before we reached double figures.","TEXT_VOICEMAN_05400_001630_MATOYA<tab>Я сказала «всего-то», но нам ведь потребуется не один такой паршивец. Мы все свалимся ещё до того, как закончим работу над вторым.","","False","0x000000AA","",""
"","TEXT_VOICEMAN_05400_001640_MATOYA<tab>But if I could get a <var 1A 02 /var>familiar<var 1A 01 /var> to create the familiars─a mother porxie, as it were...","TEXT_VOICEMAN_05400_001640_MATOYA<tab>Но если мне удастся создать фамильяра, который в состоянии производить других фамильяров — матерь<var 1F /var>поро, так сказать...","","False","0x000000AB","",""
"","TEXT_VOICEMAN_05400_001650_MATOYA<tab>It seems I haven't seen the last of that moldy old hole after all...","TEXT_VOICEMAN_05400_001650_MATOYA<tab>Похоже, та старая заплесневелая пещера нам всё-таки пригодится...","","False","0x000000AC","",""
"","TEXT_VOICEMAN_05400_001660_MATOYA<tab>Right. To begin with, I need you to gather a few ingredients.","TEXT_VOICEMAN_05400_001660_MATOYA<tab>Ладно. Для начала понадобится несколько ингредиентов.","","False","0x000000AD","",""
"","TEXT_VOICEMAN_05400_001670_MATOYA<tab>Listen well to what the poroggos say. Or you'll wish you had.","TEXT_VOICEMAN_05400_001670_MATOYA<tab>Слушайте, что вам говорят делать порогго. Не хватало нам проблем.","","False","0x000000AE","",""
"","TEXT_VOICEMAN_05400_001680_MATOYA<tab>Right then! Let's get this over with!","TEXT_VOICEMAN_05400_001680_MATOYA<tab>Отлично! Давайте начинать!","","False","0x000000AF","",""
"","TEXT_VOICEMAN_05400_001690_MATOYA<tab>Newborns are wont to be difficult! Show her who's in charge!","TEXT_VOICEMAN_05400_001690_MATOYA<tab>Новорожденные не преминут показать непокорство! Покажите ей, кто тут главный!","","False","0x000000B0","",""
"","TEXT_VOICEMAN_05400_001700_MATOYA<tab>There we are. Quite tame.","TEXT_VOICEMAN_05400_001700_MATOYA<tab>Вот так. Неплохое приручение.","","False","0x000000B1","",""
"","TEXT_VOICEMAN_05400_001710_GRAHATIA<tab>Then all that remains is for me to imbue her with the magick. My friends, I'm afraid I must trouble you for your aether once more.","TEXT_VOICEMAN_05400_001710_GRAHATIA<tab>Тогда мне остаётся только наполнить её магией. Друзья мои — боюсь, я вновь вынужден просить вашего эфира.","","False","0x000000B2","",""
"","TEXT_VOICEMAN_05400_001720_GRAHATIA<tab>That should suffice...","TEXT_VOICEMAN_05400_001720_GRAHATIA<tab>Должно сработать...","","False","0x000000B3","",""
"","TEXT_VOICEMAN_05400_001730_MATOYA<tab>Good. Let's set her to work then, shall we? I want to see some porxies. Assuming, that is, someone can spare the requisite energy?","TEXT_VOICEMAN_05400_001730_MATOYA<tab>Отлично. Приставим её к работе, да? Мне нужны поро. Это, конечно, при условии, что кто-нибудь готов пожертвовать немного энергии?","","False","0x000000B4","",""
"","TEXT_VOICEMAN_05400_001740_MATOYA<tab>A mere drop in the ocean for the great sorceress Matoya, I daresay.","TEXT_VOICEMAN_05400_001740_MATOYA<tab>Капля в море для такой великой чародейки, как Матойя, уверена.","","False","0x000000B5","",""
"","TEXT_VOICEMAN_05400_001750_MATOYA<tab>Excellent. Our very own litter of Angelos.","TEXT_VOICEMAN_05400_001750_MATOYA<tab>Превосходно. Наш выводок маленьких Анжело.","","False","0x000000B6","",""
"","TEXT_VOICEMAN_05400_001760_MATOYA<tab>And we can make as many more as we want simply by providing the mother porxie with additional aether.","TEXT_VOICEMAN_05400_001760_MATOYA<tab>И мы можем сделать ещё, сколько душе угодно, просто предоставляя матери<var 1F /var>поро дополнительный эфир.","","False","0x000000B7","",""
"","TEXT_VOICEMAN_05400_001770_YSHTOLA<tab>I will require a moment before I try again.","TEXT_VOICEMAN_05400_001770_YSHTOLA<tab>Мне нужно будет... отдохнуть... перед новой попыткой.","","False","0x000000B8","",""
"","TEXT_VOICEMAN_05400_001780_ALISAIE<tab>It's still hard work, but a damn sight more efficient than making them one by one. Thank you, Master Matoya. Everyone. We're a step closer to our goal.","TEXT_VOICEMAN_05400_001780_ALISAIE<tab>Это всё ещё тяжёлый труд, но совершенно ясно — такое эффективнее, чем делать их по одному. Спасибо, госпожа Матойя. Спасибо всем. Мы на шаг ближе к нашей цели.","","False","0x000000B9","",""
"","TEXT_VOICEMAN_05400_001790_ALPHINAUD<tab>Distributed amongst the allied nations, they should do much to facilitate closer dialogue with the beast tribes. And given their present travails, I believe our friends in Limsa Lominsa should be the first beneficiaries.","TEXT_VOICEMAN_05400_001790_ALPHINAUD<tab>Мы распределим их между нациями Альянса, и они послужат отличным инструментом для близкого диалога со звериными племенами. И учитывая наши предыдущие дела, Лимса Ломинса по праву должна получить первую партию.","","False","0x000000BA","",""
"","TEXT_VOICEMAN_05400_001800_YSHTOLA<tab>Agreed. Though I must leave this errand to you. I doubt my legs will carry me out of the cave, much less to Vylbrand.","TEXT_VOICEMAN_05400_001800_YSHTOLA<tab>Согласна. Но эту задачку я оставлю вам. Сомневаюсь, что мои ноги сейчас донесут меня до выхода из пещеры, и уж точно не до Вилбренда.","","False","0x000000BB","",""
"","TEXT_VOICEMAN_05400_001810_YSHTOLA<tab>Thank you for taking the lead in gathering the ingredients. I expect you would benefit from a rest too.","TEXT_VOICEMAN_05400_001810_YSHTOLA<tab>Спасибо, что <var 08 E905 ((возглавила)) ((возглавил)) /var> поиск ингредиентов. Думаю, тебе отдых тоже не помешает.","","False","0x000000BC","",""
"","TEXT_VOICEMAN_05400_001820_MATOYA<tab>In addition to the porxies, I trust you've gained an inkling of how much effort goes into the creation of familiars. Or mayhap you attribute your struggles to old age?","TEXT_VOICEMAN_05400_001820_MATOYA<tab>После всего этого дела с поро, понимаешь теперь, сколько усилий уходит на создание фамильяров? Или ты так устала из-за своего преклонного возраста?","","False","0x000000BD","",""
"","TEXT_VOICEMAN_05400_001830_YSHTOLA<tab>If I said yes, would it persuade you to treat me like an adult?","TEXT_VOICEMAN_05400_001830_YSHTOLA<tab>Если я скажу «да», это заставит тебя относиться ко мне, как ко взрослой?","","False","0x000000BE","",""
"","TEXT_VOICEMAN_05400_001840_MATOYA<tab>Hmph! Not with that pertness, it wouldn't. Anyway, assuming you have no other favors to ask, I shall be leaving.","TEXT_VOICEMAN_05400_001840_MATOYA<tab>Хмф! Пока не перестанешь вертеть хвостом, не мечтай. Итак, если у других нет больше просьб, я ухожу.","","False","0x000000BF","",""
"","TEXT_VOICEMAN_05400_001850_BLOODYEXECUTIONERA<tab>Look who's come crawlin'!","TEXT_VOICEMAN_05400_001850_BLOODYEXECUTIONERA<tab>Глядите, кто приполз!","","False","0x000000C0","",""
"","TEXT_VOICEMAN_05400_001860_BLOODYEXECUTIONERB<tab>Traitor!","TEXT_VOICEMAN_05400_001860_BLOODYEXECUTIONERB<tab>Предательница!","","False","0x000000C1","",""
"","TEXT_VOICEMAN_05400_001870_BLOODYEXECUTIONERC<tab>You can shove yer peace!","TEXT_VOICEMAN_05400_001870_BLOODYEXECUTIONERC<tab>Чхали мы на твой мир!","","False","0x000000C2","",""
"","TEXT_VOICEMAN_05400_001880_SICARD<tab>Welcome aboard, Admiral. I'll wager you don't remember me. Sicard, actin' captain of the Bloody Executioners, at your service.","TEXT_VOICEMAN_05400_001880_SICARD<tab>Добро пожаловать на борт, Адмирал. Хотя уверен, вы меня не помните. Сигард, действующий капитан Багровых Рубак, к вашим услугам.","","False","0x000000C3","",""
"","TEXT_VOICEMAN_05400_001890_MERLWYB<tab>'Twas kind of you to invite us. Now, if Captain Hyllfyr has a message for me, I bid you speak it.","TEXT_VOICEMAN_05400_001890_MERLWYB<tab>Благодарю за ваше приглашение. Теперь, если <var 1A 02 /var>капитан<var 1A 01 /var> Хиллфир хочет мне что-то передать, я слушаю.","","False","0x000000C4","",""
"","TEXT_VOICEMAN_05400_001900_SICARD<tab><var 1A 02 /var>We<var 1A 01 /var> have just the one demand: that you forget this bilge about makin' peace with the beastmen.","TEXT_VOICEMAN_05400_001900_SICARD<tab>У <var 1A 02 /var>нас<var 1A 01 /var> только одно требование — вы забудете всю эту муть по поводу мира со зверолюдьми.","","False","0x000000C5","",""
"","TEXT_VOICEMAN_05400_001910_SICARD<tab>Ours is a nation of pirates. Always has been, always will be. Deny us our right to plunder and you deny who we are!","TEXT_VOICEMAN_05400_001910_SICARD<tab>Мы нация пиратов. Всегда были, и всегда ими останемся. Запретите нам грабить — и вы запретите нам быть самими собой!","","False","0x000000C6","",""
"","TEXT_VOICEMAN_05400_001920_BLOODYEXECUTIONERA<tab>Too bloody right!","TEXT_VOICEMAN_05400_001920_BLOODYEXECUTIONERA<tab>Именно, бляха муха!","","False","0x000000C7","",""
"","TEXT_VOICEMAN_05400_001930_BLOODYEXECUTIONERB<tab>Pirates till we die!","TEXT_VOICEMAN_05400_001930_BLOODYEXECUTIONERB<tab>Пираты до гробовой доски!","","False","0x000000C8","",""
"","TEXT_VOICEMAN_05400_001940_BLOODYEXECUTIONERC<tab>What we want, we take!","TEXT_VOICEMAN_05400_001940_BLOODYEXECUTIONERC<tab>Что хотим, то берём!","","False","0x000000C9","",""
"","TEXT_VOICEMAN_05400_001950_MERLWYB<tab>Piracy has no place in our future.","TEXT_VOICEMAN_05400_001950_MERLWYB<tab>Пиратству нет места в нашем будущем.","","False","0x000000CA","",""
"","TEXT_VOICEMAN_05400_001960_BLOODYEXECUTIONERA<tab>What she say?","TEXT_VOICEMAN_05400_001960_BLOODYEXECUTIONERA<tab>Чего она говорит?","","False","0x000000CB","",""
"","TEXT_VOICEMAN_05400_001970_BLOODYEXECUTIONERC<tab>Pirates...have no place?","TEXT_VOICEMAN_05400_001970_BLOODYEXECUTIONERC<tab>Пиратам... нет места?","","False","0x000000CC","",""
"","TEXT_VOICEMAN_05400_001980_MERLWYB<tab>Our nation has prospered through piracy, 'tis true. Yet it is but one part of our long and storied history.","TEXT_VOICEMAN_05400_001980_MERLWYB<tab>Эта нация расцвела благодаря пиратству, верно. Но это лишь одна-единственная часть нашей длинной и славной истории.","","False","0x000000CD","",""
