"location","source","target","id","fuzzy","context","translator_comments","developer_comments"
"","TEXT_VOICEMAN_05400_000010_ALPHINAUD<tab>Well, my friends─now that we have all settled back into our bodies, it is time we resumed our duties in earnest. Let us speak of our plans.","TEXT_VOICEMAN_05400_000010_ALPHINAUD<tab>Что ж, друзья мои — теперь, когда все мы возвратились в свои тела, следует немедля вернуться к нашим обязанностям. Какие у нас планы?","","False","0x00000000","",""
"","TEXT_VOICEMAN_05400_000020_THANCRED<tab>Ever since the Emperor's death, it's been one unsettling rumor after another. I've a mind to pay a visit to Garlemald to ascertain the truth of the matter.","TEXT_VOICEMAN_05400_000020_THANCRED<tab>С момента смерти Императора с севера долетают всё более тревожные слухи. У меня была идея отправиться в Гарлемалд и самому разведать обстановку.","","False","0x00000001","",""
"","TEXT_VOICEMAN_05400_000030_URIANGER<tab>A prudent endeavor. 'Tis of the essence that we establish the full extent of the threat. Not least if it should prove that Zenos doth indeed orchestrate events from the shadows.","TEXT_VOICEMAN_05400_000030_URIANGER<tab>Весьма благоразумно. Нам следует в полной мере оценить угрозу. Весть о том, будто се Зенос есмь зачинщик последних событий, лишь подкрепляет сию необходимость.","","False","0x00000002","",""
"","TEXT_VOICEMAN_05400_000040_URIANGER<tab>In light of which possibility, I shall accompany thee on thy mission.","TEXT_VOICEMAN_05400_000040_URIANGER<tab>В свете возможности подобного, мне стоит отправиться на задание с тобою.","","False","0x00000003","",""
"","TEXT_VOICEMAN_05400_000050_URIANGER<tab>Be assured that thou shalt find me more a help than a hindrance. Thou requirest another to imbue thine ammunition, dost thou not?","TEXT_VOICEMAN_05400_000050_URIANGER<tab>Будь покоен — я не стану тебе обузою, но напротив. Тебе ведь нужен спутник, что будет восполнять твою амуницию, разве нет?","","False","0x00000004","",""
"","TEXT_VOICEMAN_05400_000051_YSHTOLA<tab>For DE and FR only. Report if displayed.","TEXT_VOICEMAN_05400_000051_YSHTOLA<tab>For DE and FR only. Report if displayed.","","False","0x00000005","",""
"","TEXT_VOICEMAN_05400_000060_ALISAIE<tab>Assuming that's settled, there's something I've been meaning to look into as well.","TEXT_VOICEMAN_05400_000060_ALISAIE<tab>Раз с этим решили, у меня есть идея, куда я могу отправиться...","","False","0x00000006","",""
"","TEXT_VOICEMAN_05400_000070_LYSE<tab>Welcome back, everyone!","TEXT_VOICEMAN_05400_000070_LYSE<tab>С возвращением, ребята!","","False","0x00000007","",""
"","TEXT_VOICEMAN_05400_000080_ALPHINAUD<tab>Lyse!","TEXT_VOICEMAN_05400_000080_ALPHINAUD<tab>Лиз!","","False","0x00000008","",""
"","TEXT_VOICEMAN_05400_000090_LYSE<tab>You're fine now, right? No more headaches or keeling over?","TEXT_VOICEMAN_05400_000090_LYSE<tab>Ну как вы, нормально? Никаких головных болей, пошатывания?","","False","0x00000009","",""
"","TEXT_VOICEMAN_05400_000100_ALISAIE<tab>That's right. We're fighting fit, and raring to go!","TEXT_VOICEMAN_05400_000100_ALISAIE<tab>Именно! Готовы сражаться, скорее даже в нетерпении!","","False","0x0000000A","",""
"","TEXT_VOICEMAN_05400_000110_GRAHATIA<tab>The famous Lyse Hext...former Scion and hero of the Ala Mhigan Resistance.","TEXT_VOICEMAN_05400_000110_GRAHATIA<tab>Знаменитая Лиз Хекст... бывшая Хранительница и героиня Сопротивления Ала Миго.","","False","0x0000000B","",""
"","TEXT_VOICEMAN_05400_000120_LYSE<tab>I don't believe we've met.","TEXT_VOICEMAN_05400_000120_LYSE<tab>Мы, вроде, не знакомы?","","False","0x0000000C","",""
"","TEXT_VOICEMAN_05400_000130_KRILE<tab>Really? It's so easy to assume that all Archons are acquainted. But then I suppose your fields of expertise <var 1A 02 /var>are<var 1A 01 /var> rather different.","TEXT_VOICEMAN_05400_000130_KRILE<tab>Да? Правда, иной раз можно прийти к заблуждению, будто все архоны представлены. Хотя, думаю, ваши сферы деятельности <var 1A 02 /var>весьма<var 1A 01 /var> разнятся.","","False","0x0000000D","",""
"","TEXT_VOICEMAN_05400_000140_GRAHATIA<tab>G'raha Tia, at your service. I have read much and more about your exploits, Commander. It is a pleasure to finally make your acquaintance.","TEXT_VOICEMAN_05400_000140_GRAHATIA<tab>Г'раха Тиа, к вашим услугам. Я столько читал о ваших деяниях, командир. Наконец-то я имею честь познакомиться с вами лично.","","False","0x0000000E","",""
"","TEXT_VOICEMAN_05400_000150_LYSE<tab>Likewise. The others told me all about you.","TEXT_VOICEMAN_05400_000150_LYSE<tab>Честь для меня. Остальные мне всё о тебе рассказали.","","False","0x0000000F","",""
"","TEXT_VOICEMAN_05400_000160_ALPHINAUD<tab>Do not be so sure. Words scarcely do justice to the vital role he played in our victory in the First. A more dependable comrade one would be hard-pressed to find.","TEXT_VOICEMAN_05400_000160_ALPHINAUD<tab>Не будь так уверена. Едва ли слова в силах передать всю значимость той роли, что он исполнил для победы на Первом. Незаменимый союзник, каких не сыскать.","","False","0x00000010","",""
"","TEXT_VOICEMAN_05400_000170_LYSE<tab>Ah, right, I did glance at the report...but I'd be lying if I said I understood half of it.","TEXT_VOICEMAN_05400_000170_LYSE<tab>Да, правда, я читала рапорт, но... я совру, если скажу, будто поняла там хотя бы половину.","","False","0x00000011","",""
"","TEXT_VOICEMAN_05400_000180_LYSE<tab>Well, well...that's a lot to take in. Um... Just to be clear, this means we're <var 1A 02 /var>not<var 1A 01 /var> heading for another calamity, does it?","TEXT_VOICEMAN_05400_000180_LYSE<tab>Что ж, действительно, такое нужно переварить. Гм... Так, чтобы убедиться — больше НЕТ угрозы ещё одного Катаклизма, верно?","","False","0x00000012","",""
"","TEXT_VOICEMAN_05400_000190_URIANGER<tab>Shorn of their unsundered masters' leadership, what Ascians remain shall struggle to see their plans to fruition.","TEXT_VOICEMAN_05400_000190_URIANGER<tab>Лишённые лидерства своих нерасколотых братьев, оставшиеся асцианцы едва ли сумеют довести свои планы до конца.","","False","0x00000013","",""
"","TEXT_VOICEMAN_05400_000200_URIANGER<tab>And though I would ever advise caution, I believe we may rest easy for a time.","TEXT_VOICEMAN_05400_000200_URIANGER<tab>Я посоветовал бы осмотрительность в любом случае — однако верю, что ныне можно немного послабить бдительность.","","False","0x00000014","",""
"","TEXT_VOICEMAN_05400_000210_LYSE<tab>I'll take that as a yes.","TEXT_VOICEMAN_05400_000210_LYSE<tab>Будем считать, ты сказал «да».","","False","0x00000015","",""
"","TEXT_VOICEMAN_05400_000220_LYSE<tab>Even so, I don't know what to make of this business about Hydaelyn and Zodiark being primals...","TEXT_VOICEMAN_05400_000220_LYSE<tab>Ладно... но я не понимаю, что с этим делом про Хайделин и Зодиарка — будто они праймалы...","","False","0x00000016","",""
"","TEXT_VOICEMAN_05400_000230_YSHTOLA<tab>A difficult truth to bear, yes. But at last we understand the nature of our adversary. And if there are no further calamities, neither will there be Rejoinings, meaning Zodiark will never regain His full strength.","TEXT_VOICEMAN_05400_000230_YSHTOLA<tab>Принять такое непросто, да. Но наконец-то мы понимаем природу нашего противника. Если больше не будет Катаклизмов, значит, не будет и Схождений — и таким образом, Зодиарк никогда не вернётся к Его полной силе.","","False","0x00000017","",""
"","TEXT_VOICEMAN_05400_000240_YSHTOLA<tab>Even so, as the oldest and mightiest of primals, He remains a force to be feared.","TEXT_VOICEMAN_05400_000240_YSHTOLA<tab>Но пусть и так — Он старейший и самый могучий из праймалов. Его мощи следует опасаться.","","False","0x00000018","",""
"","TEXT_VOICEMAN_05400_000250_YSHTOLA<tab>Though His is a power born of the desire for salvation, we have seen the havoc it may wreak. And it falls to us to ensure that it is never again brought to bear upon this star.","TEXT_VOICEMAN_05400_000250_YSHTOLA<tab>Хоть Его сила и рождена из желания спасти мир, в чужих руках она способна сеять разрушения. Мы обязаны проследить, чтоб подобное не случилось с нашей планетой.","","False","0x00000019","",""
"","TEXT_VOICEMAN_05400_000260_ALPHINAUD<tab>But tell us, Lyse, to what do we owe the pleasure of your visit? ","TEXT_VOICEMAN_05400_000260_ALPHINAUD<tab>Но скажи, Лиз, ты тут по делу или просто так?","","False","0x0000001A","",""
"","TEXT_VOICEMAN_05400_000270_LYSE<tab>What do you mean? Isn't seeing my long-lost comrades reason enough? ...All right, there <var 1A 02 /var>was<var 1A 01 /var> one other matter. I have a message from the Alliance. And before you ask, yes, it's about the Empire.","TEXT_VOICEMAN_05400_000270_LYSE<tab>О чём идёт речь? Я же вас сто лет не видела, разве это недостаточная причина?
...Ладно, действительно было одно дельце. У меня сообщение от Альянса. И перед тем, как вы спросите, — да, речь пойдёт об Империи.","","False","0x0000001B","",""
"","TEXT_VOICEMAN_05400_000280_LYSE<tab>So, after Emperor Varis's assassination, it seems his cousin “Nerva” made a bid for the throne.","TEXT_VOICEMAN_05400_000280_LYSE<tab>Итак, после убийства Императора Вара на трон метил его кузен, Нерва.","","False","0x0000001C","",""
"","TEXT_VOICEMAN_05400_000290_LYSE<tab>The trouble is, he wasn't the only one with designs on it, and it didn't take long for a civil war to break out. And it's not just in the provinces. Early reports say huge swathes of the imperial capital have been reduced to rubble.","TEXT_VOICEMAN_05400_000290_LYSE<tab>Но конечно, он был не единственным с притязаниями на престол, так что вскоре началась гражданская война. И не только в провинциях. В последних докладах сообщается, будто целые кварталы имперской столицы сровняли с землёй.","","False","0x0000001D","",""
"","TEXT_VOICEMAN_05400_000300_LYSE<tab>The Alliance will soon convene in Ala Mhigo to decide on a course of action, and we were hoping you'd come along.","TEXT_VOICEMAN_05400_000300_LYSE<tab>Вскоре представители Альянса соберутся в Ала Миго, чтобы обсудить дальнейшие планы, и мы надеялись, что вы тоже придёте.","","False","0x0000001E","",""
"","TEXT_VOICEMAN_05400_000310_THANCRED<tab>Well! As it happens, Urianger and I were just this moment planning a little trip to Garlemald. And we should be grateful for any advice the Alliance can provide on how best to make the most of our visit.","TEXT_VOICEMAN_05400_000310_THANCRED<tab>Надо же! Мы с Урианже буквально только что планировали небольшую экскурсию в Гарлемалд. Мы будем рады любому совету, который Альянс сможет нам дать касательно предстоящего нам дела.","","False","0x0000001F","",""
"","TEXT_VOICEMAN_05400_000320_ALPHINAUD<tab>To Ala Mhigo, then.","TEXT_VOICEMAN_05400_000320_ALPHINAUD<tab>Тогда в Ала Миго.","","False","0x00000020","",""
"","TEXT_VOICEMAN_05400_000330_ALISAIE<tab>Why don't you go on without me. There's something I need to look into.","TEXT_VOICEMAN_05400_000330_ALISAIE<tab>Отправляйтесь без меня. Есть кое-что, чем я хотела заняться.","","False","0x00000021","",""
"","TEXT_VOICEMAN_05400_000340_ALPHINAUD<tab>Ah, forgive me, you were just telling us. What is it, if I may ask?","TEXT_VOICEMAN_05400_000340_ALPHINAUD<tab>А, прости, ты начала рассказывать, но не успела закончить. Позволь поинтересоваться?","","False","0x00000022","",""
"","TEXT_VOICEMAN_05400_000350_ALISAIE<tab>I want to find a way to cure the tempered.","TEXT_VOICEMAN_05400_000350_ALISAIE<tab>Хочу отыскать способ излечения перекованных.","","False","0x00000023","",""
"","TEXT_VOICEMAN_05400_000360_ALPHINAUD<tab>Of course. You think it may be possible to adapt the treatment you used to help those corrupted by the sin eaters...","TEXT_VOICEMAN_05400_000360_ALPHINAUD<tab>Ну конечно! Ты полагаешь, можно адаптировать лечение, которое вы применяли для прокажённых пожирателями?..","","False","0x00000024","",""
"","TEXT_VOICEMAN_05400_000370_LYSE<tab>I'm sorry? A cure for tempering? But that would change everything! Alisaie─consider yourself uninvited. Go and find us this cure!","TEXT_VOICEMAN_05400_000370_LYSE<tab>Минуточку... Лечение для перекованных? Но это же всё меняет! Ализе — можешь считать, тебя не приглашали. Иди и отыщи это лекарство!","","False","0x00000025","",""
"","TEXT_VOICEMAN_05400_000380_ALISAIE<tab>I'll do my best.","TEXT_VOICEMAN_05400_000380_ALISAIE<tab>Сделаю всё в моих силах.","","False","0x00000026","",""
"","TEXT_VOICEMAN_05400_000390_ALISAIE<tab>I was hoping you might join me. Don't worry if not, though─I won't hold it against you if you'd rather attend a stuffy meeting.","TEXT_VOICEMAN_05400_000390_ALISAIE<tab>Я надеялась, ты присоединишься. Но не буду настаивать — насколько я помню, ты ведь всегда <var 08 E905 ((была сторонницей)) ((был сторонником)) /var> нудных собраний?..","","False","0x00000027","",""
"","TEXT_VOICEMAN_05400_Q1_000_001_NONE_VOICE<tab>What will you say?","TEXT_VOICEMAN_05400_Q1_000_001_NONE_VOICE<tab>Что вы скажете?","","False","0x00000028","",""
"","TEXT_VOICEMAN_05400_A1_000_001_NONE_VOICE<tab>What meeting? Lead on!","TEXT_VOICEMAN_05400_A1_000_001_NONE_VOICE<tab>Ещё чего! Я с тобой!","","False","0x00000029","",""
"","TEXT_VOICEMAN_05400_A1_000_002_NONE_VOICE<tab>I <var 1A 02 /var>like<var 1A 01 /var> stuffy meetings.","TEXT_VOICEMAN_05400_A1_000_002_NONE_VOICE<tab>Но мне и правда они нравятся...","","False","0x0000002A","",""
"","TEXT_VOICEMAN_05400_000400_ALISAIE<tab>I knew you'd say yes.","TEXT_VOICEMAN_05400_000400_ALISAIE<tab>Ну кто бы сомневался.","","False","0x0000002B","",""
"","TEXT_VOICEMAN_05400_000410_YSHTOLA<tab>Rest assured there'll be many, many more. Go on, lend Alisaie a hand.","TEXT_VOICEMAN_05400_000410_YSHTOLA<tab>Будь <var 08 E905 ((уверена)) ((уверен)) /var>, впереди подобных мероприятий нас ждёт немало. Ступай, помоги лучше Ализе.","","False","0x0000002C","",""
"","TEXT_VOICEMAN_05400_000420_GRAHATIA<tab>I'll come too! ...If you don't mind, that is.","TEXT_VOICEMAN_05400_000420_GRAHATIA<tab>Я тоже с вами!
...Если, конечно, не возражаете.","","False","0x0000002D","",""
"","TEXT_VOICEMAN_05400_000421_YSHTOLA<tab>For DE and FR only. Report if displayed.","TEXT_VOICEMAN_05400_000421_YSHTOLA<tab>For DE and FR only. Report if displayed.","","False","0x0000002E","",""
"","TEXT_VOICEMAN_05400_000430_YSHTOLA<tab>Mind? I'm sure they would be glad of your company. Pray enjoy your time together with your hero.","TEXT_VOICEMAN_05400_000430_YSHTOLA<tab>Возражения? Уверена, они будут только рады. Развлекись там как следует со <var 08 E905 ((своей героиней)) ((своим героем)) /var>.","","False","0x0000002F","",""
"","TEXT_VOICEMAN_05400_000440_GRAHATIA<tab>My...? N-No, that's not─ I mean, I— I-I simply thought my knowledge might be of some use!","TEXT_VOICEMAN_05400_000440_GRAHATIA<tab>Что?.. Н-нет, это не то, что вы... То есть... Я... я...
Я просто подумал, мои знания могут пригодиться!","","False","0x00000030","",""
"","TEXT_VOICEMAN_05400_000450_ALPHINAUD<tab>We shall be on our way, then. Godsspeed.","TEXT_VOICEMAN_05400_000450_ALPHINAUD<tab>В таком случае всем пора отправляться. Удачи нам.","","False","0x00000031","",""
"","TEXT_VOICEMAN_05400_000460_AYMERIC<tab>My friend. After the disappointment of not seeing you in Ala Mhigo, what good fortune to chance upon you here of all places.","TEXT_VOICEMAN_05400_000460_AYMERIC<tab>Друг мой! Какое разочарование — ты не <var 08 E905 ((явилась)) ((явился)) /var> в Ала Миго, но удача, как вижу, не совсем от меня отвернулась.","","False","0x00000032","",""
"","TEXT_VOICEMAN_05400_000470_AYMERIC<tab>As you may have heard, the allied nations are making a renewed effort to address the primal problem.","TEXT_VOICEMAN_05400_000470_AYMERIC<tab>Ты уже, должно быть, в курсе — нации Альянса собираются серьёзно заняться проблемой праймалов.","","False","0x00000033","",""
"","TEXT_VOICEMAN_05400_000480_AYMERIC<tab>To that end have I invited the chieftain of the Vanu to Ishgard, that we might together plot a course.","TEXT_VOICEMAN_05400_000480_AYMERIC<tab>Именно поэтому я пригласил вождя Вану в Ишгард — дабы мы могли подумать о будущем вместе.","","False","0x00000034","",""
"","TEXT_VOICEMAN_05400_000490_AYMERIC<tab>Since the war with the Empire appears to be nearing its conclusion, I would also like to call upon Estinien's lance. Alas, he is as ever a difficult man to find.","TEXT_VOICEMAN_05400_000490_AYMERIC<tab>Наша война с Империей, по всей видимости, приближается к завершению, а поэтому я собираюсь снова воззвать к копью Эстиниена. Увы, его бывает очень трудно найти...","","False","0x00000035","",""
"","TEXT_VOICEMAN_05400_000500_AYMERIC<tab>I am informed he recently paid a visit to the Rising Stones. Should he happen to do so again, be sure to pass on my regards, won't you.","TEXT_VOICEMAN_05400_000500_AYMERIC<tab>Мне сообщали, что недавно он появлялся в «Могучих камнях». Если вдруг снова произойдёт нечто подобное... передавай от меня привет.","","False","0x00000036","",""
"","TEXT_VOICEMAN_05400_000510_AYMERIC<tab>But tell me, what business brings you to our fair city this day?","TEXT_VOICEMAN_05400_000510_AYMERIC<tab>Но скажи, какое дело привело тебя в наш славный город?","","False","0x00000037","",""
"","TEXT_VOICEMAN_05400_000520_AYMERIC<tab>A cure for tempering... You never cease to amaze me. Until now, our only hope has been prevention, our every failure irrevocable. But this─this would rewrite the rules of engagement. It could end the cycle of bloodshed...!","TEXT_VOICEMAN_05400_000520_AYMERIC<tab>Лекарство от перековки?.. Ты не перестаёшь меня удивлять. Поныне нашим лучшим ответом было не вступать в подобные схватки вовсе — а ошибки обходились дорогой ценой. А теперь... будут переписаны сами законы сражений с праймалами. Наконец закончится кровопролитие!","","False","0x00000038","",""
"","TEXT_VOICEMAN_05400_000530_AYMERIC<tab>Very well. You shall have all the ceruleum we can provide─and an airship with which to transport it.","TEXT_VOICEMAN_05400_000530_AYMERIC<tab>Что ж. Можешь рассчитывать на весь церулеум, который мы только сможем разыскать — и отдельный дирижабль для его перевозки.","","False","0x00000039","",""
"","TEXT_VOICEMAN_05400_000540_AYMERIC<tab>In this matter, you may count on Ishgard's full support.","TEXT_VOICEMAN_05400_000540_AYMERIC<tab>В этом деле рассчитывай на полное содействие Ишгарда.","","False","0x0000003A","",""
"","TEXT_VOICEMAN_05400_000550_ALISAIE<tab>Who would have thought ceruleum weighed so much?","TEXT_VOICEMAN_05400_000550_ALISAIE<tab>Кто бы мог подумать, что церулеум столько весит?","","False","0x0000003B","",""
"","TEXT_VOICEMAN_05400_000560_ALISAIE<tab>Serves me right for being stubborn, I suppose. I should have just done what you did and accepted help.","TEXT_VOICEMAN_05400_000560_ALISAIE<tab>Вот мне наука — наказание за упрямство. Надо было соглашаться, когда предлагали помощь.","","False","0x0000003C","",""
"","TEXT_VOICEMAN_05400_000570_CID<tab>Good work, you two. This is all we asked for and more. Quite a lot more, now that I look at it...","TEXT_VOICEMAN_05400_000570_CID<tab>Отлично, вы двое! Больше нам не понадобится. Да, не понадобится, это точно...","","False","0x0000003D","",""
"","TEXT_VOICEMAN_05400_000580_CID<tab>Lord Aymeric, eh? And entirely by chance? Hah! Some people have all the luck.","TEXT_VOICEMAN_05400_000580_CID<tab>С лордом Эмериком, э? Совершенно случайно? Ха! Везёт же некоторым.","","False","0x0000003E","",""
"","TEXT_VOICEMAN_05400_000590_GRAHATIA<tab>We have also succeeded in configuring the terminals─thanks in no small part to our able assistant.","TEXT_VOICEMAN_05400_000590_GRAHATIA<tab>Мы тем временем настроили терминалы — во многом благодаря нашему способному ассистенту.","","False","0x0000003F","",""
"","TEXT_VOICEMAN_05400_000600_NERO<tab>It's been a while, hero. You seem surprised to see me. Lest you misunderstand, I've no interest in such things as cures for tempering.","TEXT_VOICEMAN_05400_000600_NERO<tab>Давненько не виделись, герой. Неужели ты <var 08 E905 ((удивлена)) ((удивлён)) /var>? Чтобы не возникало недомолвок — лекарство от перековки и подобная ерунда меня не интересует.","","False","0x00000040","",""
"","TEXT_VOICEMAN_05400_000610_NERO<tab>But if you mean to achieve that which eluded even the storied Allagans, it seemed plain that you would require my expertise. And so it proved. Is that not right, Garlond?","TEXT_VOICEMAN_05400_000610_NERO<tab>Но если вы намерены совершить открытие, которое не сумели аллагцы, — тут вам непременно потребуются мои умения. Итак, я здесь. Ты рад, Гарлонд?","","False","0x00000041","",""
"","TEXT_VOICEMAN_05400_000620_CID<tab>Ask Jessie. She was the one who hired you. All I know is you're an employee of the Ironworks now, so you'll bloody well earn your keep.","TEXT_VOICEMAN_05400_000620_CID<tab>Спроси Джесси. Это она тебя наняла. Всё, что мне нужно знать — ты теперь рабочая сила «Шестерёнок», и клянусь, ты у меня заслужишь каждую монетку.","","False","0x00000042","",""
