"location","source","target","id","fuzzy","context","translator_comments","developer_comments"
"","TEXT_CMNGSCGILTOCOIN_00240_TALK_ACTOR<tab>Welcome to the Gold Saucer! If you're looking to exchange your ordinary old gil for shiny new MGP, then you've come to the right place. What do you say?","TEXT_CMNGSCGILTOCOIN_00240_TALK_ACTOR<tab>Soyez <var 08 E905 ((la bienvenue)) ((le bienvenu)) /var> au Gold Saucer des Manderville, aventuri<var 08 E905 ((ère)) ((er)) /var><var 1D /var>! Vous désirez vous procurer des points<var 1D /var>? Je m'occupe de vous tout de suite<var 1D /var>!","","False","0x00000000","",""
"","TEXT_CMNGSCGILTOCOIN_00240_ERROR_GIL<tab>I'm sorry, but it seems you lack the necessary funds to conduct the transaction. Might I suggest checking your coinpurse for holes?","TEXT_CMNGSCGILTOCOIN_00240_ERROR_GIL<tab>... Je suis désolé, mais vous n'avez pas assez de gils. Veuillez revenir plus tard.","","False","0x00000001","",""
"","TEXT_CMNGSCGILTOCOIN_00240_ERROR_COIN_MAX<tab>Oh ho! It would seem you're already carrying a sizable sum of MGP, dear customer. If you're looking for more, you'll have to earn it for yourself!","TEXT_CMNGSCGILTOCOIN_00240_ERROR_COIN_MAX<tab>... Je suis désolé, mais le nombre de points en votre possession est supérieur à la limite que le bureau de change est autorisé à fournir.","","False","0x00000002","",""
"","TEXT_CMNGSCGILTOCOIN_00240_ERROR_COIN_MAX_SYSTEM_000<tab>Use of the exchange service is restricted to patrons with less than 500 MGP in their possession.","TEXT_CMNGSCGILTOCOIN_00240_ERROR_COIN_MAX_SYSTEM_000<tab>La quantité maximum autorisée après une transaction au bureau de change du Gold Saucer est de <var 20 E802 /var> points.","","False","0x00000003","",""
"","TEXT_CMNGSCGILTOCOIN_00240_ERROR_COIN_MAX_SYSTEM_001<tab>Additional MGP may be won from the numerous events and attractions available in the Gold Saucer. May the Spinner smile upon you!","TEXT_CMNGSCGILTOCOIN_00240_ERROR_COIN_MAX_SYSTEM_001<tab>Si vous voulez en gagner davantage, tentez votre chance aux mini-jeux et autres attractions qui ont lieu un peu partout dans le Gold Saucer.","","False","0x00000004","",""
"","TEXT_CMNGSCGILTOCOIN_00240_ERROR_QUEST<tab>","TEXT_CMNGSCGILTOCOIN_00240_ERROR_QUEST<tab>（★未使用／削除予定★）","","False","0x00000005","",""
