"location","source","target","id","fuzzy","context","translator_comments","developer_comments"
"","TEXT_DUNGEONFESYOJINBO_00000_YOJINBO_000_000<tab>For far, far too long have I waited for this rematch!","TEXT_DUNGEONFESYOJINBO_00000_YOJINBO_000_000<tab>J'ai tant attendu le jour de notre face-à-face<var 1D /var>!","","False","0x00000000","",""
"","TEXT_DUNGEONFESYOJINBO_00000_YOJINBO_100_000<tab>The Soboro Sukehiro may have brought us together, but 'twas fate that<br>ordained we engage in glorious fisticuffs─but with swords!─once more!","TEXT_DUNGEONFESYOJINBO_00000_YOJINBO_100_000<tab>Réglons cette affaire de Soboro-sukehiro... et décidons qui est le plus fort de nous deux, une bonne fois pour toutes<var 1D /var>!","","False","0x00000001","",""
"","TEXT_DUNGEONFESYOJINBO_00000_YOJINBO_000_001<tab>Victory will be mine this day!","TEXT_DUNGEONFESYOJINBO_00000_YOJINBO_000_001<tab>En garde<var 1D /var>!","","False","0x00000002","",""
"","TEXT_DUNGEONFESYOJINBO_00000_GILGAMESH_000_010<tab>I yield, I yield!","TEXT_DUNGEONFESYOJINBO_00000_GILGAMESH_000_010<tab>Tu as gagné<var 1D /var>!","","False","0x00000003","",""
"","TEXT_DUNGEONFESYOJINBO_00000_GILGAMESH_000_011<tab>I throw myself upon your boundless mercy and beg forgiveness! Please!","TEXT_DUNGEONFESYOJINBO_00000_GILGAMESH_000_011<tab>Pitié, laisse-moi la vie sauve<var 1D /var>!","","False","0x00000004","",""
