"location","source","target","id","fuzzy","context","translator_comments","developer_comments"
"","Mapping the Realm: Brayflox's Longstop<tab>Discover every location within Brayflox's Longstop.","Mapping the Realm: Brayflox's Longstop<tab>Discover every location within Brayflox's Longstop.","","True","0x00000298","",""
"","Mapping the Realm: The Wanderer's Palace<tab>Discover every location within the Wanderer's Palace.","Mapping the Realm: The Wanderer's Palace<tab>Discover every location within the Wanderer's Palace.","","True","0x00000299","",""
"","Mapping the Realm: Copperbell Mines<tab>Discover every location within Copperbell Mines.","Mapping the Realm: Copperbell Mines<tab>Discover every location within Copperbell Mines.","","True","0x0000029A","",""
"","Mapping the Realm: Halatali<tab>Discover every location within Halatali.","Mapping the Realm: Halatali<tab>Discover every location within Halatali.","","True","0x0000029B","",""
"","Mapping the Realm: Sunken Temple of Qarn<tab>Discover every location within the Sunken Temple of Qarn.","Mapping the Realm: Sunken Temple of Qarn<tab>Discover every location within the Sunken Temple of Qarn.","","True","0x0000029C","",""
"","Mapping the Realm: Tam-Tara Deepcroft<tab>Discover every location within the Tam-Tara Deepcroft.","Mapping the Realm: Tam-Tara Deepcroft<tab>Discover every location within the Tam-Tara Deepcroft.","","True","0x0000029D","",""
"","Mapping the Realm: Haukke Manor<tab>Discover every location within Haukke Manor.","Mapping the Realm: Haukke Manor<tab>Discover every location within Haukke Manor.","","True","0x0000029E","",""
"","Mapping the Realm: Amdapor Keep<tab>Discover every location within Amdapor Keep.","Mapping the Realm: Amdapor Keep<tab>Discover every location within Amdapor Keep.","","True","0x0000029F","",""
"","Mapping the Realm: Stone Vigil<tab>Discover every location within the Stone Vigil.","Mapping the Realm: Stone Vigil<tab>Discover every location within the Stone Vigil.","","True","0x000002A0","",""
"","Mapping the Realm: Thousand Maws of Toto-Rak<tab>Discover every location within the Thousand Maws of Toto-Rak.","Mapping the Realm: Thousand Maws of Toto-Rak<tab>Discover every location within the Thousand Maws of Toto-Rak.","","True","0x000002A1","",""
"","Mapping the Realm: Cutter's Cry<tab>Discover every location within Cutter's Cry.","Mapping the Realm: Cutter's Cry<tab>Discover every location within Cutter's Cry.","","True","0x000002A2","",""
"","Mapping the Realm: Dzemael Darkhold<tab>Discover every location within Dzemael Darkhold.","Mapping the Realm: Dzemael Darkhold<tab>Discover every location within Dzemael Darkhold.","","True","0x000002A3","",""
"","Mapping the Realm: Aurum Vale<tab>Discover every location within the Aurum Vale.","Mapping the Realm: Aurum Vale<tab>Discover every location within the Aurum Vale.","","True","0x000002A4","",""
"","Mapping the Realm: Outer La Noscea<tab>Visit outer La Noscea and unlock the area map.","Mapping the Realm: Outer La Noscea<tab>Visit outer La Noscea and unlock the area map.","","True","0x000002A5","",""
"","Mapping the Realm: Castrum Meridianum<tab>Discover every location within Castrum Meridianum.","Mapping the Realm: Castrum Meridianum<tab>Discover every location within Castrum Meridianum.","","True","0x000002A6","",""
"","Mapping the Realm: Praetorium<tab>Discover every location within the Praetorium.","Mapping the Realm: Praetorium<tab>Discover every location within the Praetorium.","","True","0x000002A7","",""
"","Mapping the Realm: The Binding Coil of Bahamut I<tab>Discover every location within the first turn of the Binding Coil of Bahamut.","Mapping the Realm: The Binding Coil of Bahamut I<tab>Discover every location within the first turn of the Binding Coil of Bahamut.","","True","0x000002A8","",""
"","Mapping the Realm: The Binding Coil of Bahamut II<tab>Discover every location within the second turn of the Binding Coil of Bahamut.","Mapping the Realm: The Binding Coil of Bahamut II<tab>Discover every location within the second turn of the Binding Coil of Bahamut.","","True","0x000002A9","",""
"","Mapping the Realm: The Binding Coil of Bahamut III<tab>Discover every location within the third turn of the Binding Coil of Bahamut.","Mapping the Realm: The Binding Coil of Bahamut III<tab>Discover every location within the third turn of the Binding Coil of Bahamut.","","True","0x000002AA","",""
"","Mapping the Realm: The Binding Coil of Bahamut IV<tab>Discover every location within the fourth turn of the Binding Coil of Bahamut.","Mapping the Realm: The Binding Coil of Bahamut IV<tab>Discover every location within the fourth turn of the Binding Coil of Bahamut.","","True","0x000002AB","",""
"","Mapping the Realm: The Binding Coil of Bahamut V<tab>Discover every location within the fifth turn of the Binding Coil of Bahamut.","Mapping the Realm: The Binding Coil of Bahamut V<tab>Discover every location within the fifth turn of the Binding Coil of Bahamut.","","True","0x000002AC","",""
"","Mapping the Realm: The Binding Coil of Bahamut VI<tab>Discover every location within the final turn of the Binding Coil of Bahamut.","Mapping the Realm: The Binding Coil of Bahamut VI<tab>Discover every location within the final turn of the Binding Coil of Bahamut.","","True","0x000002AD","",""
"","In the Red I<tab>Complete 5 unique Maelstrom levequests.","In the Red I<tab>Complete 5 unique Maelstrom levequests.","","True","0x000002AE","",""
"","In the Red II<tab>Complete 10 unique Maelstrom levequests.","In the Red II<tab>Complete 10 unique Maelstrom levequests.","","True","0x000002AF","",""
"","In the Red III<tab>Complete 15 unique Maelstrom levequests.","In the Red III<tab>Complete 15 unique Maelstrom levequests.","","True","0x000002B0","",""
"","In the Yellow I<tab>Complete 5 unique Order of the Twin Adder levequests.","In the Yellow I<tab>Complete 5 unique Order of the Twin Adder levequests.","","True","0x000002B1","",""
"","In the Yellow II<tab>Complete 10 unique Order of the Twin Adder levequests.","In the Yellow II<tab>Complete 10 unique Order of the Twin Adder levequests.","","True","0x000002B2","",""
"","In the Yellow III<tab>Complete 15 unique Order of the Twin Adder levequests.","In the Yellow III<tab>Complete 15 unique Order of the Twin Adder levequests.","","True","0x000002B3","",""
"","In the Black I<tab>Complete 5 unique Immortal Flames levequests.","In the Black I<tab>Complete 5 unique Immortal Flames levequests.","","True","0x000002B4","",""
"","In the Black II<tab>Complete 10 unique Immortal Flames levequests.","In the Black II<tab>Complete 10 unique Immortal Flames levequests.","","True","0x000002B5","",""
"","In the Black III<tab>Complete 15 unique Immortal Flames levequests.","In the Black III<tab>Complete 15 unique Immortal Flames levequests.","","True","0x000002B6","",""
"","I Made That: Carpenter I<tab>Craft and record completion of 30 unique carpenter recipes.","I Made That: Carpenter I<tab>Craft and record completion of 30 unique carpenter recipes.","","True","0x000002B7","",""
"","I Made That: Carpenter II<tab>Craft and record completion of 50 unique carpenter recipes.","I Made That: Carpenter II<tab>Craft and record completion of 50 unique carpenter recipes.","","True","0x000002B8","",""
"","I Made That: Carpenter III<tab>Craft and record completion of 100 unique carpenter recipes.","I Made That: Carpenter III<tab>Craft and record completion of 100 unique carpenter recipes.","","True","0x000002B9","",""
"","I Made That: Blacksmith I<tab>Craft and record completion of 40 unique blacksmith recipes.","I Made That: Blacksmith I<tab>Craft and record completion of 40 unique blacksmith recipes.","","True","0x000002BA","",""
"","I Made That: Blacksmith II<tab>Craft and record completion of 90 unique blacksmith recipes.","I Made That: Blacksmith II<tab>Craft and record completion of 90 unique blacksmith recipes.","","True","0x000002BB","",""
"","I Made That: Blacksmith III<tab>Craft and record completion of 190 unique blacksmith recipes.","I Made That: Blacksmith III<tab>Craft and record completion of 190 unique blacksmith recipes.","","True","0x000002BC","",""
"","I Made That: Armorer I<tab>Craft and record completion of 30 unique armorer recipes.","I Made That: Armorer I<tab>Craft and record completion of 30 unique armorer recipes.","","True","0x000002BD","",""
"","I Made That: Armorer II<tab>Craft and record completion of 70 unique armorer recipes.","I Made That: Armorer II<tab>Craft and record completion of 70 unique armorer recipes.","","True","0x000002BE","",""
"","I Made That: Armorer III<tab>Craft and record completion of 160 unique armorer recipes.","I Made That: Armorer III<tab>Craft and record completion of 160 unique armorer recipes.","","True","0x000002BF","",""
"","I Made That: Goldsmith I<tab>Craft and record completion of 60 unique goldsmith recipes.","I Made That: Goldsmith I<tab>Craft and record completion of 60 unique goldsmith recipes.","","True","0x000002C0","",""
"","I Made That: Goldsmith II<tab>Craft and record completion of 130 unique goldsmith recipes.","I Made That: Goldsmith II<tab>Craft and record completion of 130 unique goldsmith recipes.","","True","0x000002C1","",""
"","I Made That: Goldsmith III<tab>Craft and record completion of 270 unique goldsmith recipes.","I Made That: Goldsmith III<tab>Craft and record completion of 270 unique goldsmith recipes.","","True","0x000002C2","",""
"","I Made That: Leatherworker I<tab>Craft and record completion of 40 unique leatherworker recipes.","I Made That: Leatherworker I<tab>Craft and record completion of 40 unique leatherworker recipes.","","True","0x000002C3","",""
"","I Made That: Leatherworker II<tab>Craft and record completion of 90 unique leatherworker recipes.","I Made That: Leatherworker II<tab>Craft and record completion of 90 unique leatherworker recipes.","","True","0x000002C4","",""
"","I Made That: Leatherworker III<tab>Craft and record completion of 180 unique leatherworker recipes.","I Made That: Leatherworker III<tab>Craft and record completion of 180 unique leatherworker recipes.","","True","0x000002C5","",""
"","I Made That: Weaver I<tab>Craft and record completion of 50 unique weaver recipes.","I Made That: Weaver I<tab>Craft and record completion of 50 unique weaver recipes.","","True","0x000002C6","",""
"","I Made That: Weaver II<tab>Craft and record completion of 110 unique weaver recipes.","I Made That: Weaver II<tab>Craft and record completion of 110 unique weaver recipes.","","True","0x000002C7","",""
"","I Made That: Weaver III<tab>Craft and record completion of 230 unique weaver recipes.","I Made That: Weaver III<tab>Craft and record completion of 230 unique weaver recipes.","","True","0x000002C8","",""
"","I Made That: Alchemist I<tab>Craft and record completion of 30 unique alchemist recipes.","I Made That: Alchemist I<tab>Craft and record completion of 30 unique alchemist recipes.","","True","0x000002C9","",""
"","I Made That: Alchemist II<tab>Craft and record completion of 60 unique alchemist recipes.","I Made That: Alchemist II<tab>Craft and record completion of 60 unique alchemist recipes.","","True","0x000002CA","",""
"","I Made That: Alchemist III<tab>Craft and record completion of 110 unique alchemist recipes.","I Made That: Alchemist III<tab>Craft and record completion of 110 unique alchemist recipes.","","True","0x000002CB","",""
"","I Made That: Culinarian I<tab>Craft and record completion of 30 unique culinarian recipes.","I Made That: Culinarian I<tab>Craft and record completion of 30 unique culinarian recipes.","","True","0x000002CC","",""
"","I Made That: Culinarian II<tab>Craft and record completion of 60 unique culinarian recipes.","I Made That: Culinarian II<tab>Craft and record completion of 60 unique culinarian recipes.","","True","0x000002CD","",""
"","I Made That: Culinarian III<tab>Craft and record completion of 120 unique culinarian recipes.","I Made That: Culinarian III<tab>Craft and record completion of 120 unique culinarian recipes.","","True","0x000002CE","",""
"","I Found That: Miner I<tab>Mine and record discovery of 15 unique items that can only be gathered as a miner.","I Found That: Miner I<tab>Mine and record discovery of 15 unique items that can only be gathered as a miner.","","True","0x000002CF","",""
"","I Found That: Miner II<tab>Mine and record discovery of 30 unique items that can only be gathered as a miner.","I Found That: Miner II<tab>Mine and record discovery of 30 unique items that can only be gathered as a miner.","","True","0x000002D0","",""
"","I Found That: Miner III<tab>Mine and record discovery of 50 unique items that can only be gathered as a miner.","I Found That: Miner III<tab>Mine and record discovery of 50 unique items that can only be gathered as a miner.","","True","0x000002D1","",""
"","I Found That: Botanist I<tab>Harvest and record discovery of 25 unique items that can only be gathered as a botanist.","I Found That: Botanist I<tab>Harvest and record discovery of 25 unique items that can only be gathered as a botanist.","","True","0x000002D2","",""
"","I Found That: Botanist II<tab>Harvest and record discovery of 50 unique items that can only be gathered as a botanist.","I Found That: Botanist II<tab>Harvest and record discovery of 50 unique items that can only be gathered as a botanist.","","True","0x000002D3","",""
"","I Found That: Botanist III<tab>Harvest and record discovery of 100 unique items that can only be gathered as a botanist.","I Found That: Botanist III<tab>Harvest and record discovery of 100 unique items that can only be gathered as a botanist.","","True","0x000002D4","",""
"","I Caught That I<tab>Catch and record discovery of 40 unique fish.","I Caught That I<tab>Catch and record discovery of 40 unique fish.","","True","0x000002D5","",""
"","I Caught That II<tab>Catch and record discovery of 80 unique fish.","I Caught That II<tab>Catch and record discovery of 80 unique fish.","","True","0x000002D6","",""
"","I Caught That III<tab>Catch and record discovery of 160 unique fish.","I Caught That III<tab>Catch and record discovery of 160 unique fish.","","True","0x000002D7","",""
"","Bump on a Log: Gladiator<tab>Complete all gladiator entries in the hunting log.","Bump on a Log: Gladiator<tab>Complete all gladiator entries in the hunting log.","","True","0x000002D8","",""
"","Bump on a Log: Pugilist<tab>Complete all pugilist entries in the hunting log.","Bump on a Log: Pugilist<tab>Complete all pugilist entries in the hunting log.","","True","0x000002D9","",""
"","Bump on a Log: Marauder<tab>Complete all marauder entries in the hunting log.","Bump on a Log: Marauder<tab>Complete all marauder entries in the hunting log.","","True","0x000002DA","",""
"","Bump on a Log: Lancer<tab>Complete all lancer entries in the hunting log.","Bump on a Log: Lancer<tab>Complete all lancer entries in the hunting log.","","True","0x000002DB","",""
"","Bump on a Log: Archer<tab>Complete all archer entries in the hunting log.","Bump on a Log: Archer<tab>Complete all archer entries in the hunting log.","","True","0x000002DC","",""
"","Bump on a Log: Conjurer<tab>Complete all conjurer entries in the hunting log.","Bump on a Log: Conjurer<tab>Complete all conjurer entries in the hunting log.","","True","0x000002DD","",""
"","Bump on a Log: Thaumaturge<tab>Complete all thaumaturge entries in the hunting log.","Bump on a Log: Thaumaturge<tab>Complete all thaumaturge entries in the hunting log.","","True","0x000002DE","",""
"","Bump on a Log: Arcanist<tab>Complete all arcanist entries in the hunting log.","Bump on a Log: Arcanist<tab>Complete all arcanist entries in the hunting log.","","True","0x000002DF","",""
"","Bump on a Log: Maelstrom<tab>Complete all Maelstrom entries in the hunting log.","Bump on a Log: Maelstrom<tab>Complete all Maelstrom entries in the hunting log.","","True","0x000002E0","",""
"","Bump on a Log: Order of the Twin Adder<tab>Complete all Order of the Twin Adder entries in the hunting log.","Bump on a Log: Order of the Twin Adder<tab>Complete all Order of the Twin Adder entries in the hunting log.","","True","0x000002E1","",""
"","Bump on a Log: Immortal Flames<tab>Complete all Immortal Flames entries in the hunting log.","Bump on a Log: Immortal Flames<tab>Complete all Immortal Flames entries in the hunting log.","","True","0x000002E2","",""
"","To the Dungeons I<tab>Successfully complete 5 unique instanced dungeon raids or trials.","To the Dungeons I<tab>Successfully complete 5 unique instanced dungeon raids or trials.","","True","0x000002E3","",""
"","To the Dungeons II<tab>Successfully complete 10 unique instanced dungeon raids or trials.","To the Dungeons II<tab>Successfully complete 10 unique instanced dungeon raids or trials.","","True","0x000002E4","",""
"","To the Dungeons III<tab>Successfully complete 20 unique instanced dungeon raids or trials.","To the Dungeons III<tab>Successfully complete 20 unique instanced dungeon raids or trials.","","True","0x000002E5","",""
"","Dungeon Siege I<tab>Complete 10 instanced dungeon raids or trials.","Dungeon Siege I<tab>Complete 10 instanced dungeon raids or trials.","","True","0x000002E6","",""
"","Dungeon Siege II<tab>Complete 30 instanced dungeon raids or trials.","Dungeon Siege II<tab>Complete 30 instanced dungeon raids or trials.","","True","0x000002E7","",""
"","Dungeon Siege III<tab>Complete 100 instanced dungeon raids or trials.","Dungeon Siege III<tab>Complete 100 instanced dungeon raids or trials.","","True","0x000002E8","",""
"","Dungeon Siege IV<tab>Complete 300 instanced dungeon raids or trials.","Dungeon Siege IV<tab>Complete 300 instanced dungeon raids or trials.","","True","0x000002E9","",""
"","Dungeon Master<tab>Complete 1,000 instanced dungeon raids or trials.","Dungeon Master<tab>Complete 1,000 instanced dungeon raids or trials.","","True","0x000002EA","",""
"","The Binds That Tie I<tab>Complete the Binding Coil of Bahamut.","The Binds That Tie I<tab>Complete the Binding Coil of Bahamut.","","True","0x000002EB","",""
"","The Binds That Tie II<tab>Complete the Binding Coil of Bahamut 5 times.","The Binds That Tie II<tab>Complete the Binding Coil of Bahamut 5 times.","","True","0x000002EC","",""
"","The Binds That Tie III<tab>Complete the Binding Coil of Bahamut 10 times.","The Binds That Tie III<tab>Complete the Binding Coil of Bahamut 10 times.","","True","0x000002ED","",""
"","An Eye for Detail: Carpenter I<tab>Craft 100 high-quality items as a carpenter.","An Eye for Detail: Carpenter I<tab>Craft 100 high-quality items as a carpenter.","","True","0x000002EE","",""
"","An Eye for Detail: Carpenter II<tab>Craft 500 high-quality items as a carpenter.","An Eye for Detail: Carpenter II<tab>Craft 500 high-quality items as a carpenter.","","True","0x000002EF","",""
"","An Eye for Detail: Carpenter III<tab>Craft 3,000 high-quality items as a carpenter.","An Eye for Detail: Carpenter III<tab>Craft 3,000 high-quality items as a carpenter.","","True","0x000002F0","",""
"","An Eye for Detail: Blacksmith I<tab>Craft 100 high-quality items as a blacksmith.","An Eye for Detail: Blacksmith I<tab>Craft 100 high-quality items as a blacksmith.","","True","0x000002F1","",""
"","An Eye for Detail: Blacksmith II<tab>Craft 500 high-quality items as a blacksmith.","An Eye for Detail: Blacksmith II<tab>Craft 500 high-quality items as a blacksmith.","","True","0x000002F2","",""
"","An Eye for Detail: Blacksmith III<tab>Craft 3,000 high-quality items as a blacksmith.","An Eye for Detail: Blacksmith III<tab>Craft 3,000 high-quality items as a blacksmith.","","True","0x000002F3","",""
"","An Eye for Detail: Armorer I<tab>Craft 100 high-quality items as an armorer.","An Eye for Detail: Armorer I<tab>Craft 100 high-quality items as an armorer.","","True","0x000002F4","",""
"","An Eye for Detail: Armorer II<tab>Craft 500 high-quality items as an armorer.","An Eye for Detail: Armorer II<tab>Craft 500 high-quality items as an armorer.","","True","0x000002F5","",""
"","An Eye for Detail: Armorer III<tab>Craft 3,000 high-quality items as an armorer.","An Eye for Detail: Armorer III<tab>Craft 3,000 high-quality items as an armorer.","","True","0x000002F6","",""
"","An Eye for Detail: Goldsmith I<tab>Craft 100 high-quality items as a goldsmith.","An Eye for Detail: Goldsmith I<tab>Craft 100 high-quality items as a goldsmith.","","True","0x000002F7","",""
"","An Eye for Detail: Goldsmith II<tab>Craft 500 high-quality items as a goldsmith.","An Eye for Detail: Goldsmith II<tab>Craft 500 high-quality items as a goldsmith.","","True","0x000002F8","",""
"","An Eye for Detail: Goldsmith III<tab>Craft 3,000 high-quality items as a goldsmith.","An Eye for Detail: Goldsmith III<tab>Craft 3,000 high-quality items as a goldsmith.","","True","0x000002F9","",""
"","An Eye for Detail: Leatherworker I<tab>Craft 100 high-quality items as a leatherworker.","An Eye for Detail: Leatherworker I<tab>Craft 100 high-quality items as a leatherworker.","","True","0x000002FA","",""
"","An Eye for Detail: Leatherworker II<tab>Craft 500 high-quality items as a leatherworker.","An Eye for Detail: Leatherworker II<tab>Craft 500 high-quality items as a leatherworker.","","True","0x000002FB","",""
"","An Eye for Detail: Leatherworker III<tab>Craft 3,000 high-quality items as a leatherworker.","An Eye for Detail: Leatherworker III<tab>Craft 3,000 high-quality items as a leatherworker.","","True","0x000002FC","",""
"","An Eye for Detail: Weaver I<tab>Craft 100 high-quality items as a weaver.","An Eye for Detail: Weaver I<tab>Craft 100 high-quality items as a weaver.","","True","0x000002FD","",""
"","An Eye for Detail: Weaver II<tab>Craft 500 high-quality items as a weaver.","An Eye for Detail: Weaver II<tab>Craft 500 high-quality items as a weaver.","","True","0x000002FE","",""
"","An Eye for Detail: Weaver III<tab>Craft 3,000 high-quality items as a weaver.","An Eye for Detail: Weaver III<tab>Craft 3,000 high-quality items as a weaver.","","True","0x000002FF","",""
"","An Eye for Detail: Alchemist I<tab>Craft 100 high-quality items as an alchemist.","An Eye for Detail: Alchemist I<tab>Craft 100 high-quality items as an alchemist.","","True","0x00000300","",""
"","An Eye for Detail: Alchemist II<tab>Craft 500 high-quality items as an alchemist.","An Eye for Detail: Alchemist II<tab>Craft 500 high-quality items as an alchemist.","","True","0x00000301","",""
"","An Eye for Detail: Alchemist III<tab>Craft 3,000 high-quality items as an alchemist.","An Eye for Detail: Alchemist III<tab>Craft 3,000 high-quality items as an alchemist.","","True","0x00000302","",""
"","An Eye for Detail: Culinarian I<tab>Craft 100 high-quality items as a culinarian.","An Eye for Detail: Culinarian I<tab>Craft 100 high-quality items as a culinarian.","","True","0x00000303","",""
"","An Eye for Detail: Culinarian II<tab>Craft 500 high-quality items as a culinarian.","An Eye for Detail: Culinarian II<tab>Craft 500 high-quality items as a culinarian.","","True","0x00000304","",""
"","An Eye for Detail: Culinarian III<tab>Craft 3,000 high-quality items as a culinarian.","An Eye for Detail: Culinarian III<tab>Craft 3,000 high-quality items as a culinarian.","","True","0x00000305","",""
"","An Eye for Quantity: Miner I<tab>Gather 300 items with the Gatherer's Boon effect as a miner.","An Eye for Quantity: Miner I<tab>Gather 300 items with the Gatherer's Boon effect as a miner.","","True","0x00000306","",""
"","An Eye for Quantity: Miner II<tab>Gather 1,500 items with the Gatherer's Boon effect as a miner.","An Eye for Quantity: Miner II<tab>Gather 1,500 items with the Gatherer's Boon effect as a miner.","","True","0x00000307","",""
"","An Eye for Quantity: Miner III<tab>Gather 10,000 items with the Gatherer's Boon effect as a miner.","An Eye for Quantity: Miner III<tab>Gather 10,000 items with the Gatherer's Boon effect as a miner.","","True","0x00000308","",""
"","An Eye for Quantity: Botanist I<tab>Gather 300 items with the Gatherer's Boon effect as a botanist.","An Eye for Quantity: Botanist I<tab>Gather 300 items with the Gatherer's Boon effect as a botanist.","","True","0x00000309","",""
"","An Eye for Quantity: Botanist II<tab>Gather 1,500 items with the Gatherer's Boon effect as a botanist.","An Eye for Quantity: Botanist II<tab>Gather 1,500 items with the Gatherer's Boon effect as a botanist.","","True","0x0000030A","",""
"","An Eye for Quantity: Botanist III<tab>Gather 10,000 items with the Gatherer's Boon effect as a botanist.","An Eye for Quantity: Botanist III<tab>Gather 10,000 items with the Gatherer's Boon effect as a botanist.","","True","0x0000030B","",""
"","The One That Didn't Get Away I<tab>Catch 100 large-sized fish.","The One That Didn't Get Away I<tab>Catch 100 large-sized fish.","","True","0x0000030C","",""
"","The One That Didn't Get Away II<tab>Catch 500 large-sized fish.","The One That Didn't Get Away II<tab>Catch 500 large-sized fish.","","True","0x0000030D","",""
"","The One That Didn't Get Away III<tab>Catch 3,000 large-sized fish.","The One That Didn't Get Away III<tab>Catch 3,000 large-sized fish.","","True","0x0000030E","",""
"","Back from the Wood<tab>Complete the main scenario quest “Back from the Wood.”","Back from the Wood<tab>Complete the main scenario quest «Back from the Wood».","","True","0x0000030F","",""
"","Skeletons<tab>Complete the main scenario quest “Skeletons in Her Closet.”","Skeletons<tab>Complete the main scenario quest «Skeletons in Her Closet».","","True","0x00000310","",""
"","Those Who Wait<tab>Complete the main scenario quest “All Good Things.”","Those Who Wait<tab>Complete the main scenario quest «All Good Things».","","True","0x00000311","",""
