"location","source","target","id","fuzzy","context","translator_comments","developer_comments"
"","Mapping the Realm: Sohr Khai<tab>Discover every location in Sohr Khai.","Mapping the Realm: Sohr Khai<tab>Discover every location in Sohr Khai.","","True","0x0000063F","",""
"","Remapping the Realm: Hullbreaker Isle<tab>Discover every location in Hullbreaker Isle (Hard).","Remapping the Realm: Hullbreaker Isle<tab>Discover every location in Hullbreaker Isle (Hard).","","True","0x00000640","",""
"","Let Me Be Your Hogg<tab>Defeat Nidhogg in the Minstrel's Ballad: Nidhogg's Rage.","Let Me Be Your Hogg<tab>Defeat Nidhogg in the Minstrel's Ballad: Nidhogg's Rage.","","True","0x00000641","",""
"","Mapping the Realm: The Weeping City of Mhach<tab>Discover every location in the Weeping City of Mhach.","Mapping the Realm: The Weeping City of Mhach<tab>Discover every location in the Weeping City of Mhach.","","True","0x00000642","",""
"","I Hope Mentor Will Notice Me V<tab>Complete 1,000 duties via Duty Roulette: Mentor.","I Hope Mentor Will Notice Me V<tab>Complete 1,000 duties via Duty Roulette: Mentor.","","True","0x00000643","",""
"","I Hope Mentor Will Notice Me VI<tab>Complete 2,000 duties via Duty Roulette: Mentor.","I Hope Mentor Will Notice Me VI<tab>Complete 2,000 duties via Duty Roulette: Mentor.","","True","0x00000644","",""
"","It's Alive: The Twin Thegns<tab>Obtain both the Sword of the Twin Thegns and the Shield of the Twin Thegns.","It's Alive: The Twin Thegns<tab>Obtain both the Sword of the Twin Thegns and the Shield of the Twin Thegns.","","True","0x00000645","",""
"","It's Alive: The Sultan<tab>Obtain a pair of Sultan's Fists.","It's Alive: The Sultan<tab>Obtain a pair of Sultan's Fists.","","True","0x00000646","",""
"","It's Alive: The Blood Emperor<tab>Obtain an Axe of the Blood Emperor.","It's Alive: The Blood Emperor<tab>Obtain an Axe of the Blood Emperor.","","True","0x00000647","",""
"","It's Alive: The Overlord<tab>Obtain a Trident of the Overlord.","It's Alive: The Overlord<tab>Obtain a Trident of the Overlord.","","True","0x00000648","",""
"","It's Alive: The Autarch<tab>Obtain a Bow of the Autarch.","It's Alive: The Autarch<tab>Obtain a Bow of the Autarch.","","True","0x00000649","",""
"","It's Alive: The White Tsar<tab>Obtain a Cane of the White Tsar.","It's Alive: The White Tsar<tab>Obtain a Cane of the White Tsar.","","True","0x0000064A","",""
"","It's Alive: The Black Khan<tab>Obtain a Rod of the Black Khan.","It's Alive: The Black Khan<tab>Obtain a Rod of the Black Khan.","","True","0x0000064B","",""
"","It's Alive: The Mad Queen<tab>Obtain a Book of the Mad Queen.","It's Alive: The Mad Queen<tab>Obtain a Book of the Mad Queen.","","True","0x0000064C","",""
"","It's Alive: The Magnate<tab>Obtain a Word of the Magnate.","It's Alive: The Magnate<tab>Obtain a Word of the Magnate.","","True","0x0000064D","",""
"","It's Alive: The Thorn Prince<tab>Obtain a pair of Spurs of the Thorn Prince.","It's Alive: The Thorn Prince<tab>Obtain a pair of Spurs of the Thorn Prince.","","True","0x0000064E","",""
"","It's Alive: The Dynast<tab>Obtain a Flame of the Dynast.","It's Alive: The Dynast<tab>Obtain a Flame of the Dynast.","","True","0x0000064F","",""
"","It's Alive: The Tyrant<tab>Obtain a Guillotine of the Tyrant.","It's Alive: The Tyrant<tab>Obtain a Guillotine of the Tyrant.","","True","0x00000650","",""
"","It's Alive: The Last Heir<tab>Obtain a Sphere of the Last Heir.","It's Alive: The Last Heir<tab>Obtain a Sphere of the Last Heir.","","True","0x00000651","",""
"","Mog Eat Mog I<tab>Attain rank 1 reputation (neutral) with the Mogmenders of Moghome.","Mog Eat Mog I<tab>Attain rank 1 reputation (neutral) with the Mogmenders of Moghome.","","True","0x00000652","",""
"","Mog Eat Mog II<tab>Attain rank 3 reputation (friendly) with the Mogmenders of Moghome.","Mog Eat Mog II<tab>Attain rank 3 reputation (friendly) with the Mogmenders of Moghome.","","True","0x00000653","",""
"","Mog Eat Mog III<tab>Attain rank 5 reputation (respected) with the Mogmenders of Moghome.","Mog Eat Mog III<tab>Attain rank 5 reputation (respected) with the Mogmenders of Moghome.","","True","0x00000654","",""
"","Top Mog<tab>Attain rank 7 reputation (sworn) with the Mogmenders of Moghome.","Top Mog<tab>Attain rank 7 reputation (sworn) with the Mogmenders of Moghome.","","True","0x00000655","",""
"","Go Big or Go Home XI<tab>Catch 119 different varieties of big fish in areas explored during A Realm Reborn, Heavensward, or Stormblood.","Go Big or Go Home XI<tab>Catch 119 different varieties of big fish in areas explored during A Realm Reborn, Heavensward, or Stormblood.","","True","0x00000656","",""
"","The Leader of the Band III<tab>Add 50 unique music rolls to your orchestrion.","The Leader of the Band III<tab>Add 50 unique music rolls to your orchestrion.","","True","0x00000657","",""
"","It's the Wake Pumpkin, Circus Clown<tab>Complete the quest “In a Manor of Spooking.”","It's the Wake Pumpkin, Circus Clown<tab>Завершить задание «In a Manor of Spooking».","","True","0x00000658","",""
"","Beautiful Youngling Too Good for This World, Too Pure<tab>Complete the quest “I'll Be Home for Starlight.”","Beautiful Youngling Too Good for This World, Too Pure<tab>Завершить задание «I'll Be Home for Starlight».","","True","0x00000659","",""
"","Dying for Paissa<tab>Complete the quest “A Thousand Blows.”","Dying for Paissa<tab>Завершить задание «A Thousand Blows».","","True","0x0000065A","",""
"","Hey Now, You're an All-star<tab>Complete the quest “Eternity, Loyalty, Honesty.”","Hey Now, You're an All-star<tab>Завершить задание «Eternity, Loyalty, Honesty».","","True","0x0000065B","",""
"","Back to School II<tab>Complete the quest “Finding Ulaa.”","Back to School II<tab>Завершить задание «Finding Ulaa».","","True","0x0000065C","",""
"","Back in Time<tab>Complete the quest “Of Endings and Beginnings.”","Back in Time<tab>Завершить задание «Of Endings and Beginnings».","","True","0x0000065D","",""
"","No Retreat, No Surrender<tab>Complete the main scenario quest “An Ending to Mark a New Beginning.”","No Retreat, No Surrender<tab>Complete the main scenario quest «An Ending to Mark a New Beginning».","","True","0x0000065E","",""
"","Triple-decker VI<tab>Obtain 150 unique Triple Triad cards.","Triple-decker VI<tab>Obtain 150 unique Triple Triad cards.","","True","0x0000065F","",""
"","Triple Team V<tab>Defeat 60 unique NPCs at Triple Triad.","Triple Team V<tab>Defeat 60 unique NPCs at Triple Triad.","","True","0x00000660","",""
"","Go Big or Go Home XII<tab>Catch 135 different varieties of big fish in areas explored during A Realm Reborn, Heavensward, or Stormblood.","Go Big or Go Home XII<tab>Catch 135 different varieties of big fish in areas explored during A Realm Reborn, Heavensward, or Stormblood.","","True","0x00000661","",""
"","The Leader of the Band IV<tab>Add 70 unique music rolls to your orchestrion.","The Leader of the Band IV<tab>Add 70 unique music rolls to your orchestrion.","","True","0x00000662","",""
"","The Leader of the Band V<tab>Add 100 unique music rolls to your orchestrion.","The Leader of the Band V<tab>Add 100 unique music rolls to your orchestrion.","","True","0x00000663","",""
"","Sophia's Choice<tab>Defeat Sophia in Containment Bay P1T6 (Extreme).","Sophia's Choice<tab>Defeat Sophia in Containment Bay P1T6 (Extreme).","","True","0x00000664","",""
"","Mapping the Realm: Xelphatol<tab>Discover every location within Xelphatol.","Mapping the Realm: Xelphatol<tab>Discover every location within Xelphatol.","","True","0x00000665","",""
"","Remapping the Realm: The Great Gubal Library<tab>Discover every location within the Great Gubal Library (Hard).","Remapping the Realm: The Great Gubal Library<tab>Discover every location within the Great Gubal Library (Hard).","","True","0x00000666","",""
"","Sins of the Creator I<tab>Complete Alexander.","Sins of the Creator I<tab>Complete Alexander.","","True","0x00000667","",""
"","Sins of the Creator II<tab>Complete Alexander 5 times.","Sins of the Creator II<tab>Complete Alexander 5 times.","","True","0x00000668","",""
"","Sins of the Creator III<tab>Complete Alexander 10 times.","Sins of the Creator III<tab>Complete Alexander 10 times.","","True","0x00000669","",""
"","Sins of the Savage Creator I<tab>Complete Alexander (Savage).","Sins of the Savage Creator I<tab>Complete Alexander (Savage).","","True","0x0000066A","",""
"","Sins of the Savage Creator II<tab>Complete Alexander (Savage) 5 times.","Sins of the Savage Creator II<tab>Complete Alexander (Savage) 5 times.","","True","0x0000066B","",""
"","Sins of the Savage Creator III<tab>Complete Alexander (Savage) 10 times.","Sins of the Savage Creator III<tab>Complete Alexander (Savage) 10 times.","","True","0x0000066C","",""
"","Mapping the Realm: Alexander I<tab>Discover every location within Alexander - the Eyes of the Creator.","Mapping the Realm: Alexander I<tab>Discover every location within Alexander - the Eyes of the Creator.","","True","0x0000066D","",""
"","Mapping the Realm: Alexander II<tab>Discover every location within Alexander - the Breath of the Creator.","Mapping the Realm: Alexander II<tab>Discover every location within Alexander - the Breath of the Creator.","","True","0x0000066E","",""
"","Mapping the Realm: Alexander III<tab>Discover every location within Alexander - the Heart of the Creator.","Mapping the Realm: Alexander III<tab>Discover every location within Alexander - the Heart of the Creator.","","True","0x0000066F","",""
"","And Khloe Was Her Name-o I<tab>Successfully complete a series of Wondrous Tails.","And Khloe Was Her Name-o I<tab>Successfully complete a series of Wondrous Tails.","","True","0x00000670","",""
"","And Khloe Was Her Name-o II<tab>Successfully complete 5 series of Wondrous Tails.","And Khloe Was Her Name-o II<tab>Successfully complete 5 series of Wondrous Tails.","","True","0x00000671","",""
"","And Khloe Was Her Name-o III<tab>Successfully complete 10 series of Wondrous Tails.","And Khloe Was Her Name-o III<tab>Successfully complete 10 series of Wondrous Tails.","","True","0x00000672","",""
"","And Khloe Was Her Name-o IV<tab>Successfully complete 20 series of Wondrous Tails.","And Khloe Was Her Name-o IV<tab>Successfully complete 20 series of Wondrous Tails.","","True","0x00000673","",""
"","And Khloe Was Her Name-o V<tab>Successfully complete 30 series of Wondrous Tails.","And Khloe Was Her Name-o V<tab>Successfully complete 30 series of Wondrous Tails.","","True","0x00000674","",""
"","And Khloe Was Her Name-o VI<tab>Successfully complete 40 series of Wondrous Tails.","And Khloe Was Her Name-o VI<tab>Successfully complete 40 series of Wondrous Tails.","","True","0x00000675","",""
"","And Khloe Was Her Name-o VII<tab>Successfully complete 50 series of Wondrous Tails.","And Khloe Was Her Name-o VII<tab>Successfully complete 50 series of Wondrous Tails.","","True","0x00000676","",""
"","In Too Deep VI<tab>Clear the 100th floor of the Palace of the Dead.","In Too Deep VI<tab>Clear the 100th floor of the Palace of the Dead.","","True","0x00000677","",""
"","In Too Deep VII<tab>Clear the 150th floor of the Palace of the Dead.","In Too Deep VII<tab>Clear the 150th floor of the Palace of the Dead.","","True","0x00000678","",""
"","In Too Deep VIII<tab>Clear the 200th floor of the Palace of the Dead.","In Too Deep VIII<tab>Clear the 200th floor of the Palace of the Dead.","","True","0x00000679","",""
"","Some Kinna Wonderful<tab>Obtain a piece of kinna gear.","Some Kinna Wonderful<tab>Obtain a piece of kinna gear.","","True","0x0000067A","",""
"","Pal-less Palace I<tab>Clear the 1st through the 50th floors of the Palace of the Dead solo and record a score on floor 51 or below.","Pal-less Palace I<tab>Clear the 1st through the 50th floors of the Palace of the Dead solo and record a score on floor 51 or below.","","True","0x0000067B","",""
"","Pal-less Palace II<tab>Clear the 1st through the 100th floors of the Palace of the Dead solo and record a score on floor 101 or below.","Pal-less Palace II<tab>Clear the 1st through the 100th floors of the Palace of the Dead solo and record a score on floor 101 or below.","","True","0x0000067C","",""
"","For the Hoard I<tab>Discover a piece of the Accursed Hoard.","For the Hoard I<tab>Discover a piece of the Accursed Hoard.","","True","0x0000067D","",""
"","For the Hoard II<tab>Discover 100 pieces of the Accursed Hoard.","For the Hoard II<tab>Discover 100 pieces of the Accursed Hoard.","","True","0x0000067E","",""
"","For the Hoard III<tab>Discover 1,000 pieces of the Accursed Hoard.","For the Hoard III<tab>Discover 1,000 pieces of the Accursed Hoard.","","True","0x0000067F","",""
"","For the Hoard IV<tab>Discover 5,000 pieces of the Accursed Hoard.","For the Hoard IV<tab>Discover 5,000 pieces of the Accursed Hoard.","","True","0x00000680","",""
"","The Trouble with Buried I<tab>Discover a piece of the Accursed Hoard without using a pomander or protomander of intuition.","","","True","0x00000681","",""
"","The Trouble with Buried II<tab>Discover 100 pieces of the Accursed Hoard without using a pomander or protomander of intuition.","","","True","0x00000682","",""
"","It's Smart: The Twin Thegns<tab>Obtain both a sharpened Sword of the Twin Thegns and a sharpened Shield of the Twin Thegns.","It's Smart: The Twin Thegns<tab>Obtain both a sharpened Sword of the Twin Thegns and a sharpened Shield of the Twin Thegns.","","True","0x00000683","",""
"","It's Smart: The Sultan<tab>Obtain a pair of sharpened Sultan's Fists.","It's Smart: The Sultan<tab>Obtain a pair of sharpened Sultan's Fists.","","True","0x00000684","",""
"","It's Smart: The Blood Emperor<tab>Obtain a sharpened Axe of the Blood Emperor.","It's Smart: The Blood Emperor<tab>Obtain a sharpened Axe of the Blood Emperor.","","True","0x00000685","",""
"","It's Smart: The Overlord<tab>Obtain a sharpened Trident of the Overlord.","It's Smart: The Overlord<tab>Obtain a sharpened Trident of the Overlord.","","True","0x00000686","",""
"","It's Smart: The Autarch<tab>Obtain a sharpened Bow of the Autarch.","It's Smart: The Autarch<tab>Obtain a sharpened Bow of the Autarch.","","True","0x00000687","",""
"","It's Smart: The White Tsar<tab>Obtain a sharpened Cane of the White Tsar.","It's Smart: The White Tsar<tab>Obtain a sharpened Cane of the White Tsar.","","True","0x00000688","",""
"","It's Smart: The Black Khan<tab>Obtain a sharpened Rod of the Black Khan.","It's Smart: The Black Khan<tab>Obtain a sharpened Rod of the Black Khan.","","True","0x00000689","",""
"","It's Smart: The Mad Queen<tab>Obtain a sharpened Book of the Mad Queen.","It's Smart: The Mad Queen<tab>Obtain a sharpened Book of the Mad Queen.","","True","0x0000068A","",""
"","It's Smart: The Magnate<tab>Obtain a sharpened Word of the Magnate.","It's Smart: The Magnate<tab>Obtain a sharpened Word of the Magnate.","","True","0x0000068B","",""
"","It's Smart: The Thorn Prince<tab>Obtain a pair of sharpened Spurs of the Thorn Prince.","It's Smart: The Thorn Prince<tab>Obtain a pair of sharpened Spurs of the Thorn Prince.","","True","0x0000068C","",""
"","It's Smart: The Dynast<tab>Obtain a sharpened Flame of the Dynast.","It's Smart: The Dynast<tab>Obtain a sharpened Flame of the Dynast.","","True","0x0000068D","",""
"","It's Smart: The Tyrant<tab>Obtain a sharpened Guillotine of the Tyrant.","It's Smart: The Tyrant<tab>Obtain a sharpened Guillotine of the Tyrant.","","True","0x0000068E","",""
"","It's Smart: The Last Heir<tab>Obtain a sharpened Sphere of the Last Heir.","It's Smart: The Last Heir<tab>Obtain a sharpened Sphere of the Last Heir.","","True","0x0000068F","",""
"","Dead Tired<tab>Complete the quest “Dead but Not Gone.”","Dead Tired<tab>Завершить задание «Dead but Not Gone».","","True","0x00000690","",""
"","I Kiss You<tab>Complete the quest “The Magic Number.”","I Kiss You<tab>Завершить задание «The Magic Number».","","True","0x00000691","",""
"","Eorzean Idol<tab>Complete the quest “Idols Give Back.”","Eorzean Idol<tab>Завершить задание «Idols Give Back».","","True","0x00000692","",""
"","Kindred Surprise<tab>Complete the quest “Eggsistential Crisis.”","Kindred Surprise<tab>Завершить задание «Eggsistential Crisis».","","True","0x00000693","",""
"","All Saucer Everything<tab>Complete the quest “Golden Rain.”","All Saucer Everything<tab>Завершить задание «Golden Rain».","","True","0x00000694","",""
"","Zurvan Safari<tab>Defeat Zurvan in Containment Bay Z1T9 (Extreme).","Zurvan Safari<tab>Defeat Zurvan in Containment Bay Z1T9 (Extreme).","","True","0x00000695","",""
"","Mapping the Realm: Baelsar's Wall<tab>Discover every location within Baelsar's Wall.","Mapping the Realm: Baelsar's Wall<tab>Discover every location within Baelsar's Wall.","","True","0x00000696","",""
"","Remapping the Realm: Sohm Al<tab>Discover every location within Sohm Al (Hard).","Remapping the Realm: Sohm Al<tab>Discover every location within Sohm Al (Hard).","","True","0x00000697","",""
"","Mapping the Realm: Dun Scaith<tab>Discover every location within Dun Scaith.","Mapping the Realm: Dun Scaith<tab>Discover every location within Dun Scaith.","","True","0x00000698","",""
"","What's Dun Is Done<tab>Complete Dun Scaith.","What's Dun Is Done<tab>Complete Dun Scaith.","","True","0x00000699","",""
"","School's Out Forever<tab>Complete the main scenario quest “Louisoix's Finest Student.”","School's Out Forever<tab>Complete the main scenario quest «Louisoix's Finest Student».","","True","0x0000069A","",""
"","Five Minutes of Fate<tab>Complete the main scenario quest “The Far Edge of Fate.”","Five Minutes of Fate<tab>Complete the main scenario quest «The Far Edge of Fate».","","True","0x0000069B","",""
"","Back to School III<tab>Complete the quest “The Life and Lies of Father Saturnois.”","Back to School III<tab>Завершить задание «The Life and Lies of Father Saturnois».","","True","0x0000069C","",""
"","That Is What You Are<tab>Complete the quest “If I Could Turn Back Time.”","That Is What You Are<tab>Завершить задание «If I Could Turn Back Time».","","True","0x0000069D","",""
"","Just Like Fire<tab>Obtain a Firebird whistle.","Just Like Fire<tab>Obtain a Firebird whistle.","","True","0x0000069E","",""
"","It's Done: Aettir & Priwen<tab>Obtain Aettir and Priwen.","It's Done: Aettir & Priwen<tab>Obtain Aettir and Priwen.","","True","0x0000069F","",""
"","It's Done: Nyepels<tab>Obtain a pair of Nyepels.","It's Done: Nyepels<tab>Obtain a pair of Nyepels.","","True","0x000006A0","",""
"","It's Done: Minos<tab>Obtain Minos.","It's Done: Minos<tab>Obtain Minos.","","True","0x000006A1","",""
"","It's Done: Areadbhar<tab>Obtain Areadbhar.","It's Done: Areadbhar<tab>Obtain Areadbhar.","","True","0x000006A2","",""
"","It's Done: Terpander<tab>Obtain Terpander.","It's Done: Terpander<tab>Obtain Terpander.","","True","0x000006A3","",""
"","It's Done: Sindri<tab>Obtain Sindri.","It's Done: Sindri<tab>Obtain Sindri.","","True","0x000006A4","",""
"","It's Done: Kaladanda<tab>Obtain Kaladanda.","It's Done: Kaladanda<tab>Obtain Kaladanda.","","True","0x000006A5","",""
"","It's Done: Mimesis<tab>Obtain a copy of <var 1A 02 /var>Mimesis<var 1A 01 /var>.","It's Done: Mimesis<tab>Obtain a copy of <var 1A 02 /var>Mimesis<var 1A 01 /var>.","","True","0x000006A6","",""
"","It's Done: Anabasis<tab>Obtain a copy of <var 1A 02 /var>Anabasis<var 1A 01 /var>.","It's Done: Anabasis<tab>Obtain a copy of <var 1A 02 /var>Anabasis<var 1A 01 /var>.","","True","0x000006A7","",""
"","It's Done: Sandungs<tab>Obtain a pair of Sandungs.","It's Done: Sandungs<tab>Obtain a pair of Sandungs.","","True","0x000006A8","",""
"","It's Done: Deathlocke<tab>Obtain Deathlocke.","It's Done: Deathlocke<tab>Obtain Deathlocke.","","True","0x000006A9","",""
"","It's Done: Cronus<tab>Obtain Cronus.","It's Done: Cronus<tab>Obtain Cronus.","","True","0x000006AA","",""
"","It's Done: Canopus<tab>Obtain Canopus.","It's Done: Canopus<tab>Obtain Canopus.","","True","0x000006AB","",""
"","It's Really Done: Aettir Lux & Priwen Lux<tab>Obtain Aettir Lux and Priwen Lux.","It's Really Done: Aettir Lux & Priwen Lux<tab>Obtain Aettir Lux and Priwen Lux.","","True","0x000006AC","",""
"","It's Really Done: Nyepels Lux<tab>Obtain a pair of Nyepels Lux.","It's Really Done: Nyepels Lux<tab>Obtain a pair of Nyepels Lux.","","True","0x000006AD","",""
"","It's Really Done: Minos Lux<tab>Obtain Minos Lux.","It's Really Done: Minos Lux<tab>Obtain Minos Lux.","","True","0x000006AE","",""
"","It's Really Done: Areadbhar Lux<tab>Obtain Areadbhar Lux.","It's Really Done: Areadbhar Lux<tab>Obtain Areadbhar Lux.","","True","0x000006AF","",""
"","It's Really Done: Terpander Lux<tab>Obtain Terpander Lux.","It's Really Done: Terpander Lux<tab>Obtain Terpander Lux.","","True","0x000006B0","",""
"","It's Really Done: Sindri Lux<tab>Obtain Sindri Lux.","It's Really Done: Sindri Lux<tab>Obtain Sindri Lux.","","True","0x000006B1","",""
"","It's Really Done: Kaladanda Lux<tab>Obtain Kaladanda Lux.","It's Really Done: Kaladanda Lux<tab>Obtain Kaladanda Lux.","","True","0x000006B2","",""
"","It's Really Done: Mimesis Lux<tab>Obtain a copy of <var 1A 02 /var>Mimesis Lux<var 1A 01 /var>.","It's Really Done: Mimesis Lux<tab>Obtain a copy of <var 1A 02 /var>Mimesis Lux<var 1A 01 /var>.","","True","0x000006B3","",""
"","It's Really Done: Anabasis Lux<tab>Obtain a copy of <var 1A 02 /var>Anabasis Lux<var 1A 01 /var>.","It's Really Done: Anabasis Lux<tab>Obtain a copy of <var 1A 02 /var>Anabasis Lux<var 1A 01 /var>.","","True","0x000006B4","",""
"","It's Really Done: Sandungs Lux<tab>Obtain a pair of Sandungs Lux.","It's Really Done: Sandungs Lux<tab>Obtain a pair of Sandungs Lux.","","True","0x000006B5","",""
"","It's Really Done: Deathlocke Lux<tab>Obtain Deathlocke Lux.","It's Really Done: Deathlocke Lux<tab>Obtain Deathlocke Lux.","","True","0x000006B6","",""
"","It's Really Done: Cronus Lux<tab>Obtain Cronus Lux.","It's Really Done: Cronus Lux<tab>Obtain Cronus Lux.","","True","0x000006B7","",""
"","It's Really Done: Canopus Lux<tab>Obtain Canopus Lux.","It's Really Done: Canopus Lux<tab>Obtain Canopus Lux.","","True","0x000006B8","",""
"","I Made That: Carpenter V<tab>Craft and record completion of 320 unique carpenter recipes.","I Made That: Carpenter V<tab>Craft and record completion of 320 unique carpenter recipes.","","True","0x000006B9","",""
"","I Made That: Blacksmith V<tab>Craft and record completion of 380 unique blacksmith recipes.","I Made That: Blacksmith V<tab>Craft and record completion of 380 unique blacksmith recipes.","","True","0x000006BA","",""
"","I Made That: Armorer V<tab>Craft and record completion of 280 unique armorer recipes.","I Made That: Armorer V<tab>Craft and record completion of 280 unique armorer recipes.","","True","0x000006BB","",""
"","I Made That: Goldsmith V<tab>Craft and record completion of 550 unique goldsmith recipes.","I Made That: Goldsmith V<tab>Craft and record completion of 550 unique goldsmith recipes.","","True","0x000006BC","",""
"","I Made That: Leatherworker V<tab>Craft and record completion of 360 unique leatherworker recipes.","I Made That: Leatherworker V<tab>Craft and record completion of 360 unique leatherworker recipes.","","True","0x000006BD","",""
"","I Made That: Weaver V<tab>Craft and record completion of 440 unique weaver recipes.","I Made That: Weaver V<tab>Craft and record completion of 440 unique weaver recipes.","","True","0x000006BE","",""
"","I Made That: Alchemist V<tab>Craft and record completion of 270 unique alchemist recipes.","I Made That: Alchemist V<tab>Craft and record completion of 270 unique alchemist recipes.","","True","0x000006BF","",""
"","I Made That: Culinarian V<tab>Craft and record completion of 190 unique culinarian recipes.","I Made That: Culinarian V<tab>Craft and record completion of 190 unique culinarian recipes.","","True","0x000006C0","",""
"","I Found That: Miner V<tab>Mine and record discovery of 150 unique items that can only be gathered as a miner.","I Found That: Miner V<tab>Mine and record discovery of 150 unique items that can only be gathered as a miner.","","True","0x000006C1","",""
"","I Found That: Botanist V<tab>Harvest and record discovery of 230 unique items that can only be gathered as a botanist.","I Found That: Botanist V<tab>Harvest and record discovery of 230 unique items that can only be gathered as a botanist.","","True","0x000006C2","",""
"","I Caught That V<tab>Catch and record discovery of 460 unique fish.","I Caught That V<tab>Catch and record discovery of 460 unique fish.","","True","0x000006C3","",""
"","Go Big or Go Home XIII<tab>Catch 156 different varieties of big fish in areas explored during A Realm Reborn, Heavensward, or Stormblood.","Go Big or Go Home XIII<tab>Catch 156 different varieties of big fish in areas explored during A Realm Reborn, Heavensward, or Stormblood.","","True","0x000006C4","",""
"","<tab>","<tab>","","True","0x000006C5","",""
"","Have a Haillenarte I<tab>Complete a Haillenarte exploratory operation in the Diadem.","Have a Haillenarte I<tab>Complete a Haillenarte exploratory operation in the Diadem.","","True","0x000006C6","",""
"","Have a Haillenarte II<tab>Complete 10 Haillenarte exploratory operations in the Diadem.","Have a Haillenarte II<tab>Complete 10 Haillenarte exploratory operations in the Diadem.","","True","0x000006C7","",""
"","Have a Haillenarte III<tab>Complete 30 Haillenarte exploratory operations in the Diadem.","Have a Haillenarte III<tab>Complete 30 Haillenarte exploratory operations in the Diadem.","","True","0x000006C8","",""
