"location","source","target","id","fuzzy","context","translator_comments","developer_comments"
"","TEXT_VOICEMAN_02200_A00090_MINFILIA<tab>It was of this that Elidibus spoke─an existence which knows neither cessation nor oblivion.","TEXT_VOICEMAN_02200_A00090_MINFILIA<tab>Es gibt also Existenzen außer den Ascians, die den Körper wechseln können, wie es ihnen beliebt! Der Sahagin war dazu in der Lage - auch wenn er nicht gerade ein legendärer Vorkämpfer für die Rettung der Welt gewesen sein mag.","","False","0x000000ED","",""
"","TEXT_VOICEMAN_02200_A00100_MINFILIA<tab>And yet, though the Sahagin had mastered his gift and thereby become immortal, he was by no means invulnerable.","TEXT_VOICEMAN_02200_A00100_MINFILIA<tab>Wenn das stimmt, wären wir einem der größten Geheimnisse dieser Welt einen riesigen Schritt näher gekommen!","","False","0x000000EE","",""
"","TEXT_VOICEMAN_02200_A00110_MINFILIA<tab>As we both bore witness, he was ultimately absorbed into Leviathan.","TEXT_VOICEMAN_02200_A00110_MINFILIA<tab>Diejenigen Aspekte der Kraft des Transzendierens, die uns bekannt waren, betrafen alle die Fähigkeit, die Schranken des Geistes zu überschreiten - die Grenzen der Sprache zu überwinden und in die Ver<var 16 /var>gangen<var 16 /var>heit einer Person zu blicken.","","False","0x000000EF","",""
"","TEXT_VOICEMAN_02200_A00120_MINFILIA<tab>And the import of this observation? If the Ascians' mode of existence is indeed the same, it can be inferred that they, too, are not invulnerable─that they <var 1A 02 /var>can<var 1A 01 /var> be destroyed.","TEXT_VOICEMAN_02200_A00120_MINFILIA<tab>Aber vielleicht geht es um mehr. Nicht nur um die Grenzen des Geistes, sondern auch um die Grenzen des Körpers.","","False","0x000000F0","",""
"","TEXT_VOICEMAN_02200_A00130_MINFILIA<tab>There exists a legend which tells of souls who are reborn upon the cusp of each Umbral Calamity, that they might stay the encroaching Darkness.","TEXT_VOICEMAN_02200_A00130_MINFILIA<tab>Wie dem auch sei: Was mit dem Sahagin-Häuptling geschah, eröffnet uns noch eine viel wichtigere Erkenntnis.","","False","0x000000F1","",""
"","TEXT_VOICEMAN_02200_A00140_MINFILIA<tab>To most, it is but a faerie tale, yet recent events have given me cause to wonder: could the legend in fact refer to the Echo?","TEXT_VOICEMAN_02200_A00140_MINFILIA<tab>Unsterblich heißt noch nicht unvergänglich, das ist der entscheidende Hinweis. Das wird der Schlüssel sein, um die Ascians zu vernichten.","","False","0x000000F2","",""
"","TEXT_VOICEMAN_02200_A00150_MINFILIA<tab>Much and more yet remains unknown, but I am confident that all will become clear in time.","TEXT_VOICEMAN_02200_A00150_MINFILIA<tab>Wir haben gesehen, wie die Seele des Häuptlings von Leviathan in seinem unstillbaren Ätherdurst verschlungen wurde.","","False","0x000000F3","",""
"","TEXT_VOICEMAN_02200_A00160_MINFILIA<tab>For the present, however, what matters is that the key to defeating the Ascians may at last be within sight.","TEXT_VOICEMAN_02200_A00160_MINFILIA<tab>Dagegen sollten auch die Ascians nicht gefeit sein. Auch sie sind nicht grundsätzlich vom Zyklus des Werdens und Vergehens ausgenommen.","","False","0x000000F4","",""
"","TEXT_VOICEMAN_02200_A00170_MINFILIA<tab>With Urianger's aid, it is my hope that I shall fathom this matter ere long.","TEXT_VOICEMAN_02200_A00170_MINFILIA<tab>Es gibt einen Weg, die Ascians zu vernichten, und gemeinsam mit Urianger werde ich ihn finden.","","False","0x000000F5","",""
"","TEXT_VOICEMAN_02200_A00180_MINFILIA<tab>Ah! I was just about to send for you, my friend.
...Is aught amiss?","TEXT_VOICEMAN_02200_A00180_MINFILIA<tab>Ah, Urianger. Wir haben gerade von ... Was ist denn?","","False","0x000000F6","",""
"","TEXT_VOICEMAN_02200_A00190_URIANGER<tab>Grave tidings from the Sharlayan motherland, my lady.","TEXT_VOICEMAN_02200_A00190_URIANGER<tab>Minfilia - eine schlechte Nachricht.","","False","0x000000F7","",""
"","TEXT_VOICEMAN_02200_A00200_URIANGER<tab>It doth concern our distant allies, the Students of Baldesion.","TEXT_VOICEMAN_02200_A00200_URIANGER<tab>Es geht um unsere Vertrauten von Baldesions Gelehrten.","","False","0x000000F8","",""
"","TEXT_VOICEMAN_02200_A00210_MINFILIA<tab>What of them?","TEXT_VOICEMAN_02200_A00210_MINFILIA<tab>Ja, was ist denn mit ihnen?","","False","0x000000F9","",""
"","TEXT_VOICEMAN_02200_A00220_URIANGER<tab>My lady...the Isle of Val, which for many years hath been the order's home, is no more.","TEXT_VOICEMAN_02200_A00220_URIANGER<tab>Val ... ist im Meer versunken und das Hauptquartier existiert nicht mehr.","","False","0x000000FA","",""
"","TEXT_VOICEMAN_02200_A00230_MINFILIA<tab>No more? Whatever do you mean?","TEXT_VOICEMAN_02200_A00230_MINFILIA<tab>Im Meer versunken? Die ganze Insel?!","","False","0x000000FB","",""
"","TEXT_VOICEMAN_02200_A00240_URIANGER<tab>I relate only that which hath been conveyed unto me by our agents. An aetheric wave of the highest magnitude was recorded in the region. Soon thereafter, 'twas observed that the isle had ceased to be.","TEXT_VOICEMAN_02200_A00240_URIANGER<tab>Wenn die Aufzeichnungen aus der Mutternation Sharlayan stimmen, dann muss die Insel von einer gewaltigen magisch generierten Welle erfasst worden sein.","","False","0x000000FC","",""
"","TEXT_VOICEMAN_02200_A00250_URIANGER<tab>'Tis postulated that a magick was evoked, like in power to Ultima.","TEXT_VOICEMAN_02200_A00250_URIANGER<tab>Die Stärke war vergleichbar mit der Ultima-Magie. Ich denke nicht, dass es Überlebende gibt.","","False","0x000000FD","",""
"","TEXT_VOICEMAN_02200_A00260_MINFILIA<tab>Twelve preserve...","TEXT_VOICEMAN_02200_A00260_MINFILIA<tab>Aber ...  Wie konnte das passieren?!","","False","0x000000FE","",""
"","TEXT_VOICEMAN_02200_B00010_LOLORITO<tab>If there are no other matters, I move that today's meeting be adjourned.","TEXT_VOICEMAN_02200_B00010_LOLORITO<tab>Also gut. Wenn es ansonsten nichts Dringendes zu besprechen gibt, erkläre ich die heutige Sitzung für beendet.","","False","0x000000FF","",""
"","TEXT_VOICEMAN_02200_B00020_FOLLOWEROFTELEDJI<tab>It is done, my lord.","TEXT_VOICEMAN_02200_B00020_FOLLOWEROFTELEDJI<tab>Alles ist vorbereitet, wie Ihr befohlen habt, Herr.","","False","0x00000100","",""
"","TEXT_VOICEMAN_02200_B00030_FOLLOWEROFTELEDJI<tab>I... <cough> F-Forgive my impertinence, my lord, but these orders... I am uncertain as to what end they serve.","TEXT_VOICEMAN_02200_B00030_FOLLOWEROFTELEDJI<tab>Äh, ich <räusper> ... frage mich nur, was Ihr mit dieser Sache wohl bezweckt?","","False","0x00000101","",""
"","TEXT_VOICEMAN_02200_B00040_TELEDJIADELEDJI<tab>Revolution.","TEXT_VOICEMAN_02200_B00040_TELEDJIADELEDJI<tab>Revolution, mein Lieber. Eine Revolution.","","False","0x00000102","",""
"","TEXT_VOICEMAN_02200_C00010_GILGAMESH<tab>Um. Well, then!","TEXT_VOICEMAN_02200_C00010_GILGAMESH<tab>Genug eingesteckt für heute!","","False","0x00000103","",""
"","TEXT_VOICEMAN_02200_C00020_GILGAMESH<tab>That's enough of a beating for now!","TEXT_VOICEMAN_02200_C00020_GILGAMESH<tab>Nächstes Mal zeig ich's euch!","","False","0x00000104","",""

