"location","source","target","id","fuzzy","context","translator_comments","developer_comments"
"","TEXT_VOICEMAN_02200_800150_EYNZAHRSLAFYRSYN<tab>By all accounts, Leviathan's most formidable weapon is the very sea itself. Waves and whirlpools, tides and currents─all these things are his to command. The key to victory, I believe, lies in disarming our foe.","TEXT_VOICEMAN_02200_800150_EYNZAHRSLAFYRSYN<tab>Leviathans stärkste Waffe ist die See selbst. Wellen und Strudel, Gezeiten und Strömungen - über all diese Kräfte gebietet er. Der Schlüssel zum Sieg, so denke ich daher, ist es, unseren Feind zu entwaffnen.","","False","0x000000AA","",""
"","TEXT_VOICEMAN_02200_800160_EYNZAHRSLAFYRSYN<tab>This, in effect, is what the Company of Heroes achieved with their ruse. We cannot lure Leviathan from the sea a second time, but what if we could weaken his hold upon the element of water? I have heard of devices capable of such wonders. They draw upon the power of corrupted crystals, I am told.","TEXT_VOICEMAN_02200_800160_EYNZAHRSLAFYRSYN<tab>Genau diese Taktik verhalf ja auch dem Heer der Helden zum Erfolg ... Ein zweites Mal wird Leviathan auf denselben Trick nicht hereinfallen, doch wenn wir das Wasser selbst ... „entkräften“ könnten? Ich habe von Apparaturen gehört, die zu so etwas imstande sind. Sie sollen mit denaturierten Kristallen funktionieren.","","False","0x000000AB","",""
"","TEXT_VOICEMAN_02200_800170_EYNZAHRSLAFYRSYN<tab>If mounted upon a ship, such a device might be used to prevent Leviathan from bringing the full force of the sea to bear against us, rendering him no more dangerous than any other sea serpent.","TEXT_VOICEMAN_02200_800170_EYNZAHRSLAFYRSYN<tab>Ein solches Gerät könnte verhindern, dass Leviathan das Meer in seiner Allgewalt auf uns hetzt. Er wäre dann nicht gefährlicher als jede andere Seeschlange auch.","","False","0x000000AC","",""
"","TEXT_VOICEMAN_02200_800180_MINFILIA<tab>Of course... Cid built a similar device to grant the <var 1A 02 /var>Enterprise<var 1A 01 /var> safe passage through Garuda's tempest, did he not?","TEXT_VOICEMAN_02200_800180_MINFILIA<tab>Aber natürlich! Cid tat doch etwas ganz Ähnliches, um die <var 1A 02 /var>Enterprise<var 1A 01 /var> sicher durch Garudas Stürme zu manövrieren, nicht wahr?","","False","0x000000AD","",""
"","TEXT_VOICEMAN_02200_800190_EYNZAHRSLAFYRSYN<tab>Begging your pardon, my lady, but to give credit where it's due, this is something I heard from an old arcanist friend of mine.","TEXT_VOICEMAN_02200_800190_EYNZAHRSLAFYRSYN<tab>Mir, äh, erzählte ein alter Bekannter davon, ein Hermetiker auf Wanderschaft.","","False","0x000000AE","",""
"","TEXT_VOICEMAN_02200_800200_MERLWYB<tab>It makes little difference who thought of it first, so long as it works. Beg the specifications of this device from your friend, and I shall pass them on to our people at Naldiq & Vymelli's.","TEXT_VOICEMAN_02200_800200_MERLWYB<tab>Solange es klappt, ist mir egal, wer die glorreiche Idee hatte. Befrage deinen Freund zum Aufbau der Apparatur und ich werde Naldiq & Vymelli mit der Konstruktion beauftragen.","","False","0x000000AF","",""
"","TEXT_VOICEMAN_02200_800210_MERLWYB<tab>But before we proceed any further, I would voice one concern: piercing Garuda's defenses is one thing, suppressing Leviathan's attacks quite another.","TEXT_VOICEMAN_02200_800210_MERLWYB<tab>Eines jedoch möchte ich zu bedenken geben: Das wäre lediglich eine Verteidigungsmaßnahme. Wir brauchen aber auch etwas, um das Mistvieh auf den Grund des Meeres zu schicken.","","False","0x000000B0","",""
"","TEXT_VOICEMAN_02200_800220_MERLWYB<tab>In matters of science, I am as a babbling babe, but I cannot well imagine that such a feat would be possible without a veritable mountain of corrupted crystals.","TEXT_VOICEMAN_02200_800220_MERLWYB<tab>Außerdem nehme ich an, dass wir eine gehörige Menge denaturierter Kristalle benötigen, um die erhoffte Wirkung zu erzielen.","","False","0x000000B1","",""
"","TEXT_VOICEMAN_02200_800230_MERLWYB<tab>The question being: do we have a ship big enough to bear such a burden?","TEXT_VOICEMAN_02200_800230_MERLWYB<tab>Nicht einmal unser größtes Schiff wäre in der Lage, mit solch einer schweren Ladung an Bord noch vernünftig zu manövrieren.","","False","0x000000B2","",""
"","TEXT_VOICEMAN_02200_800240_EYNZAHRSLAFYRSYN<tab>Mayhap not, Admiral. But two might. Recall you the tale of Mistbeard's greatest haul? It is said that he lashed two ships together, side by side, the better to bear his plunder.","TEXT_VOICEMAN_02200_800240_EYNZAHRSLAFYRSYN<tab>Vermutlich nicht. Zwei aber vielleicht schon. Darf ich an Rauschebarts größten Coup erinnern? Es heißt, er habe zwei Schiffe zusammengetäut, um damit seine Beute in Sicherheit zu bringen.","","False","0x000000B3","",""
"","TEXT_VOICEMAN_02200_800250_EYNZAHRSLAFYRSYN<tab>By your leave, we might attempt to repeat the trick. The gods know, it would be quicker than building a new vessel.","TEXT_VOICEMAN_02200_800250_EYNZAHRSLAFYRSYN<tab>Mit Eurer Erlaubnis könnten wir dasselbe versuchen. Ganz sicherlich wäre es schneller, als ein neues Schiff zu bauen.","","False","0x000000B4","",""
"","TEXT_VOICEMAN_02200_800260_MERLWYB<tab>Mistbeard did this? Truly, Marshal, upon the subject of the pirate king, you are as a scholar.","TEXT_VOICEMAN_02200_800260_MERLWYB<tab>Was du nicht sagst! Ein Trick, der diesem Halunken ähnlich sieht. Du bist wie immer gut über den Piratenkönig informiert, Eynzahr.","","False","0x000000B5","",""
"","TEXT_VOICEMAN_02200_800270_EYNZAHRSLAFYRSYN<tab>Now, from what I have gleaned of these matters, the device will need to be in close and constant proximity to the target. To wit, we must lash our twin vessel to Leviathan.","TEXT_VOICEMAN_02200_800270_EYNZAHRSLAFYRSYN<tab>Man tut, was man kann. Nun, wie auch immer. Meinem Verständnis nach werden wir unser Zwillingsschiff mit Leviathan vertäuen müssen, um den Apparat ganz nah an ihn heranzubringen.","","False","0x000000B6","",""
"","TEXT_VOICEMAN_02200_800280_EYNZAHRSLAFYRSYN<tab>This in itself will be no small feat. Ramming speed will be required, but given the weight of the cargo, that will only be attainable with the aid of a towing vessel...","TEXT_VOICEMAN_02200_800280_EYNZAHRSLAFYRSYN<tab>Dieser Vorgang alleine ist schon eine Heraus<var 16 /var>forde<var 16 /var>rung für sich. Wir brauchen genug Ge<var 16 /var>schwindig<var 16 /var>keit zum Rammen. Und mit Blick auf die schwere Fracht werden wir dafür ein Zugschiff benötigen.","","False","0x000000B7","",""
"","TEXT_VOICEMAN_02200_800290_EYNZAHRSLAFYRSYN<tab>Suffice it to say, the task of piloting said vessel will entail considerable danger, and I would not ask it of another. I volunteer myself.","TEXT_VOICEMAN_02200_800290_EYNZAHRSLAFYRSYN<tab>Es ist ein riskantes Unterfangen. Darum melde ich mich freiwillig für das Kommando.","","False","0x000000B8","",""
"","TEXT_VOICEMAN_02200_800300_MERLWYB<tab>'Twill be dangerous for all involved...but we have no better recourse. Very well.","TEXT_VOICEMAN_02200_800300_MERLWYB<tab>Ich fürchte, wir haben keine andere Wahl. Also gut ...","","False","0x000000B9","",""
"","TEXT_VOICEMAN_02200_800310_MERLWYB<tab>Commodore. Assemble the remnants of the fleet at Moraby Bay.","TEXT_VOICEMAN_02200_800310_MERLWYB<tab>Reyner. Sammle unverzüglich den Rest unserer Flotte in der Moraby-Bucht.","","False","0x000000BA","",""
"","TEXT_VOICEMAN_02200_800320_MERLWYB<tab>Give priority to our soundest vessels. The repairs can wait.","TEXT_VOICEMAN_02200_800320_MERLWYB<tab>Ich will jeden Kahn dort sehen, der auch nur ansatzweise seetauglich ist. Um Reparaturen kümmern wir uns später ... Wenn überhaupt ein Schiff dieses Himmelfahrtskommando übersteht.","","False","0x000000BB","",""
"","TEXT_VOICEMAN_02200_800330_MERLWYB<tab>Storm Marshal Slafyrsyn, command of the operation is yours. I want that twin vessel ready to sail posthaste.","TEXT_VOICEMAN_02200_800330_MERLWYB<tab>Du hast das Kommando, Eynzahr!","","False","0x000000BC","",""
"","TEXT_VOICEMAN_02200_800340_EYNZAHRSLAFYRSYN<tab>At once, Admiral!","TEXT_VOICEMAN_02200_800340_EYNZAHRSLAFYRSYN<tab>Aye-aye!","","False","0x000000BD","",""
"","TEXT_VOICEMAN_02200_800350_MERLWYB<tab>And then there is the small matter of slaying the beast... The fate of Limsa Lominsa rests upon your shoulders once again. Go well, Warrior of Light.","TEXT_VOICEMAN_02200_800350_MERLWYB<tab>Und dann muss das Biest ja auch noch besiegt werden ... Limsas Schicksal liegt in deinen Händen, Krieger<var 08 E905 ((in)) (()) /var> des Lichts.","","False","0x000000BE","",""
"","TEXT_VOICEMAN_02200_900010_MERLWYB<tab>We Lominsans are sworn to strive “Till sea swallows all”─and swallow all it would have, had Leviathan prevailed. That we still strive now, we owe in no small part to you.","TEXT_VOICEMAN_02200_900010_MERLWYB<tab>Bis die See uns im Tod umfängt, sagen wir hier in Limsa Lominsa. Aber dank dir ist uns dieses Schicksal vorerst erspart geblieben.","","False","0x000000BF","",""
"","TEXT_VOICEMAN_02200_900020_MERLWYB<tab>Not for the first time, you have delivered Limsa Lominsa from the wrath of a primal. Never has our nation known a stouter ally.","TEXT_VOICEMAN_02200_900020_MERLWYB<tab>Du hast Leviathan tatsächlich besiegt, und das fast im Alleingang. <var 08 E905 ((Eine stärkere Verbündete)) ((Einen stärkeren Verbündeten)) /var> hat dieser Staat nie gekannt.","","False","0x000000C0","",""
"","TEXT_VOICEMAN_02200_900030_MERLWYB<tab>On behalf of my people, I give you my humblest thanks.","TEXT_VOICEMAN_02200_900030_MERLWYB<tab>Im Namen aller Limser danke ich dir.","","False","0x000000C1","",""
"","TEXT_VOICEMAN_02200_900040_MERLWYB<tab>'Tis meet that I give thanks to old Mistbeard, too, for his fine solution. Whatever else he may have been, 'tis clear he was a resourceful soul. Would that I had a man like him in my service.","TEXT_VOICEMAN_02200_900040_MERLWYB<tab>Aber dieser Plan, zwei Schiffe zu verbinden! Vielleicht sollte ich noch mehr Piraten-Weisheiten in die Manöver des Mahlstroms einfließen lassen, oder was meinst du, Eynzahr?","","False","0x000000C2","",""
"","TEXT_VOICEMAN_02200_900050_YUGIRI<tab>Before I set foot in these lands, I had no inkling that the people of Eorzea contended with such mighty foes. Suffice it to say, their existence came as something of a shock─as did the idea that they could be defeated.","TEXT_VOICEMAN_02200_900050_YUGIRI<tab>Diese Primae ... Ich hätte nie vermutet, mit welch übermächtigen Kreaturen die Eorzäer zu ringen haben!","","False","0x000000C3","",""
"","TEXT_VOICEMAN_02200_900060_YUGIRI<tab>This experience has served to remind me of the vastness of the world...and the boundless potential of man.","TEXT_VOICEMAN_02200_900060_YUGIRI<tab>Und die Stärke <var 08 E905 ((einer einzelnen Abenteurerin)) ((eines einzelnen Abenteurers)) /var> konnte so ein Wesen bezwingen! Ich bin überwältigt.","","False","0x000000C4","",""
"","TEXT_VOICEMAN_02200_900070_YUGIRI<tab>Though I am but a refugee in this realm, I would fain be of use to you in your fight.","TEXT_VOICEMAN_02200_900070_YUGIRI<tab>Wir Domaner sind Flüchtlinge und stehen mit leeren Händen vor euch. Aber vielleicht kann ich euch doch etwas geben: die fernöstliche Kampfkunst, in der ich gründlich geschult wurde.","","False","0x000000C5","",""
"","TEXT_VOICEMAN_02200_900080_YUGIRI<tab>Know that I am tutored in one of the foremost combat arts of the Far East. It may seem...outlandish to the Eorzean eye, but should any of your people care to learn, I would be pleased to initiate them.","TEXT_VOICEMAN_02200_900080_YUGIRI<tab>Sie könnte die eure gut ergänzen und gewiss wird es euch erfahrenen Kriegern kaum Mühe kosten, sie zu erlernen. Ich unterweise euch gerne darin.","","False","0x000000C6","",""
"","TEXT_VOICEMAN_02200_900090_MERLWYB<tab>And I will see to it that they are grateful. I have no doubt that your knowledge and skills will serve us well.","TEXT_VOICEMAN_02200_900090_MERLWYB<tab>Nun, das ist ein höchst willkommenes Angebot, nicht wahr?","","False","0x000000C7","",""
"","TEXT_VOICEMAN_02200_900100_MERLWYB<tab>Besides, your art is not so outlandish as you think. Would you not agree, Master Thancred?","TEXT_VOICEMAN_02200_900100_MERLWYB<tab>So ganz fremd scheinen eure Techniken ja auch gar nicht zu sein ... Vor allem deinen Stil wird die neue Kampfkunst wohl gut ergänzen, was, Thancred?","","False","0x000000C8","",""
"","TEXT_VOICEMAN_02200_900110_THANCRED<tab>Naught escapes your searching eye, Admiral.","TEXT_VOICEMAN_02200_900110_THANCRED<tab>Eurem scharfen Blick entgeht nichts, Admiral ...","","False","0x000000C9","",""
"","TEXT_VOICEMAN_02200_900120_THANCRED<tab>Few are privy to this information, but Limsa Lominsa is home to a certain...secret fraternity. Its members are trained in a form of combat not unlike your own.","TEXT_VOICEMAN_02200_900120_THANCRED<tab>Ihr müsst wissen, dass es in Limsa eine Art Untergrundorganisation gibt, deren Mitglieder in einem ganz ähnlichen Stil kämpfen wie Ihr - ohne Euer Können herabwürdigen zu wollen natürlich.","","False","0x000000CA","",""
"","TEXT_VOICEMAN_02200_900130_THANCRED<tab>By my judgment, it should not be beyond such individuals to adapt to the techniques I witnessed you employing with such admirable deftness.","TEXT_VOICEMAN_02200_900130_THANCRED<tab>Diese Leute wären wahrscheinlich sehr geeignet für die Unterweisung in der Kunst, in der Ihr es - wie ich sah - zu wahrer Meisterschaft gebracht habt.","","False","0x000000CB","",""
"","TEXT_VOICEMAN_02200_900140_YUGIRI<tab>I am heartened to hear this. I, too, noted a kinship between your style and mine own. Though it seemed to me that you fought differently in the beginning.","TEXT_VOICEMAN_02200_900140_YUGIRI<tab>Wie interessant! Und diese Technik beherrscht auch Ihr? Aber wieso habt Ihr sie denn nicht von Anfang an eingesetzt? Sie war doch sehr effektiv?","","False","0x000000CC","",""
"","TEXT_VOICEMAN_02200_900150_THANCRED<tab>A-Aye, I suppose I did... What can I say? I am a man of many talents. Hahaha...","TEXT_VOICEMAN_02200_900150_THANCRED<tab>Ja, das, äh ... wäre eine längere Geschichte, mit der ich Euch nicht langweilen möchte.","","False","0x000000CD","",""
"","TEXT_VOICEMAN_02200_900160_YSHTOLA<tab>Though you may labor to believe it, Thancred was once something of a scoundrel, who fraternized with the criminal class in these parts.","TEXT_VOICEMAN_02200_900160_YSHTOLA<tab>Bei seinen geschliffenen Umgangsformen möchte man es kaum glauben, aber Thancred hat es früher mit dem Gesetz nicht ganz so genau genommen. Daher kennt er sich ziemlich gut aus in der lokalen Unterwelt - und mit ihrer Kampfkunst.","","False","0x000000CE","",""
"","TEXT_VOICEMAN_02200_900170_THANCRED<tab>Y-Y'shtola! You jest, of course!","TEXT_VOICEMAN_02200_900170_THANCRED<tab>Y'shtola! Da-Das stimmt so nicht! Das waren nur ganz, äh, flüchtige Kontakte! Hört ihr?","","False","0x000000CF","",""
"","TEXT_VOICEMAN_02200_900180_MINFILIA<tab>But for a chance encounter with Alphinaud's grandsire, he might never have left Limsa Lominsa; or received an education in Sharlayan; or taken up his post in Ul'dah─which is where he trained in the blade, lest you wonder.","TEXT_VOICEMAN_02200_900180_MINFILIA<tab>Aber dann begegnete er unserem Anführer Louisoix, der ihn unter seine Fittiche nahm, nach Ul'dah brachte und aus dem Gelegenheitsgauner einen aufrechten Schwertkämpfer machte. Nicht wahr?","","False","0x000000D0","",""
"","TEXT_VOICEMAN_02200_900190_THANCRED<tab>Minfilia─please!","TEXT_VOICEMAN_02200_900190_THANCRED<tab>Minfilia - bitte!","","False","0x000000D1","",""
"","TEXT_VOICEMAN_02200_900200_YUGIRI<tab>It would seem there is more to you than meets the eye, Master Thancred.","TEXT_VOICEMAN_02200_900200_YUGIRI<tab>Ihr habt ja einige verborgene Seiten, Thancred!","","False","0x000000D2","",""
"","TEXT_VOICEMAN_02200_900210_MERLWYB<tab>Lady Yugiri─I am told that you and yours came to Eorzea seeking permanent resettlement, and that many Domans have since been engaged as frontier hands at Revenant's Toll. Mor Dhona is many things, but a place of refuge it is not.","TEXT_VOICEMAN_02200_900210_MERLWYB<tab>Wie ich höre, seid ihr vor den Garlearn aus dem Osten hierher geflohen und nun in Geisterzoll untergekommen?","","False","0x000000D3","",""
"","TEXT_VOICEMAN_02200_900220_MERLWYB<tab>Know that I would like nothing better than to furnish your people with a new home here on Lominsan soil. Alas, racked by instability as we are, our nation is in no fit state to take you in.","TEXT_VOICEMAN_02200_900220_MERLWYB<tab>Limsa Lominsa hat mit vielen Problemen zu kämpfen. Ich sage es ganz direkt: Wir können euch nicht aufnehmen.","","False","0x000000D4","",""
"","TEXT_VOICEMAN_02200_900230_MERLWYB<tab>Yet I'll not have it said that we turned a blind eye to your suffering. Until such time as we can do more, I pledge to send provisions.","TEXT_VOICEMAN_02200_900230_MERLWYB<tab>Was wir tun können, ist, euch mit Hilfsgütern zu unterstützen. Deine Mitarbeit in der Sache mit Leviathan war uns höchst willkommen, also wollen wir uns revanchieren.","","False","0x000000D5","",""
"","TEXT_VOICEMAN_02200_900240_YUGIRI<tab>We are in your debt, Admiral. I realize that it scarce qualifies as repayment, but if it please you, I shall set about sharing my martial knowledge with your people at once.","TEXT_VOICEMAN_02200_900240_YUGIRI<tab>Vielen Dank, Admiral. Wir stehen tief in Eurer Schuld. Ich hoffe von Herzen, dass unsere Kampfkunst Euch als - wenn auch nur kleine - Gegenleistung gelten kann.","","False","0x000000D6","",""
"","TEXT_VOICEMAN_02200_900250_MERLWYB<tab>You wished a word in private.","TEXT_VOICEMAN_02200_900250_MERLWYB<tab>Nun, worüber wolltest du sprechen?","","False","0x000000D7","",""
"","TEXT_VOICEMAN_02200_900260_YSHTOLA<tab>The better not to spoil the festive mood.","TEXT_VOICEMAN_02200_900260_YSHTOLA<tab>Es ist genau wie damals, nicht?","","False","0x000000D8","",""
"","TEXT_VOICEMAN_02200_900270_YSHTOLA<tab>History repeats itself, Admiral. As the kobolds did before them, the Sahagin resorted to summoning their god over a territorial feud. They acted in self-preservation.","TEXT_VOICEMAN_02200_900270_YSHTOLA<tab>Die Sahagin, die Kobolde ... Welches Volk es auch ist, stets bricht der Konflikt aus, weil wir den Wilden Stämmen ihr Territorium streitig machen.","","False","0x000000D9","",""
"","TEXT_VOICEMAN_02200_900280_YSHTOLA<tab>It may be that the Sahagin initiated this particular clash, but how it begins does not interest me so much as how it ends.","TEXT_VOICEMAN_02200_900280_YSHTOLA<tab>Diesmal haben die Sahagin den ersten Schlag getan, aber das Grundproblem ist dasselbe.","","False","0x000000DA","",""
"","TEXT_VOICEMAN_02200_900290_MERLWYB<tab>I have not forgotten our conversation, Y'shtola. I am aware that man bears part of the blame for the primals' existence.","TEXT_VOICEMAN_02200_900290_MERLWYB<tab>Ich habe unsere Unterhaltung nicht vergessen, Y'shtola. Das Primae-Problem ist zwar auch von uns verursacht, aber wir tragen nicht die alleinige Schuld.","","False","0x000000DB","",""
"","TEXT_VOICEMAN_02200_900300_MERLWYB<tab>Nor am I ignorant of the Sahagin's reason for acting. They sought to secure a place to breed and multiply, that their kind might survive. Self-preservation, as you say.","TEXT_VOICEMAN_02200_900300_MERLWYB<tab>Natürlich ist es ein Streit um Territorien, wie du sagst. Jeder braucht einen Ort, an dem er in Frieden leben kann.","","False","0x000000DC","",""
"","TEXT_VOICEMAN_02200_900310_MERLWYB<tab>But we have as much right to live and thrive as they. If our own survival is threatened, are we to lay down our arms and welcome oblivion? Nay.","TEXT_VOICEMAN_02200_900310_MERLWYB<tab>Und das gilt auch für uns. Hat ein Laichplatz der Sahagin etwa Vorrang vor unseren Siedlungen an Land? Doch wohl kaum. Was wir getan haben, ist gerechtfertigt, Y'shtola, denn auch wir haben das Recht zu leben.","","False","0x000000DD","",""
"","TEXT_VOICEMAN_02200_900320_YSHTOLA<tab>And so you kill, that you might live. Yet if living is a right, then that right belongs to all peoples, be they men or beastmen.","TEXT_VOICEMAN_02200_900320_YSHTOLA<tab>Töten, um nicht unterzugehen? Wenn man es so vereinfacht sagt, klingt es natürlich richtig ... Aber hier steht doch nicht Leben gegen Leben, wir fordern mehr als nur die nackte Existenz. Wir sind nicht gerecht!","","False","0x000000DE","",""
"","TEXT_VOICEMAN_02200_900330_MERLWYB<tab>I'll not deny your reasoning. But when a storm gathers, it falls to me to see my people safely through it. That is my duty, and I shall do it.","TEXT_VOICEMAN_02200_900330_MERLWYB<tab>Ich muss mein Volk durch den Sturm bringen, Y'shtola, alles andere wäre Verrat an meiner Heimat und an meinem Amt. Ob es <var 1A 02 /var>gerecht<var 1A 01 /var> ist oder nicht, ist eine müßige Frage, auf die es keine Antwort gibt.","","False","0x000000DF","",""
"","TEXT_VOICEMAN_02200_900340_YSHTOLA<tab>As must we all, Admiral. Stay the course, then, but know that it will lead to no good end.","TEXT_VOICEMAN_02200_900340_YSHTOLA<tab>Eine müßige Frage? Vielleicht. Dann gehöre ich wohl zu diesen „Verrätern“, die sie trotzdem stellen müssen ...","","False","0x000000E0","",""
"","TEXT_VOICEMAN_02200_900350_YUGIRI<tab>Man has ever put himself first and foremost.","TEXT_VOICEMAN_02200_900350_YUGIRI<tab>Gerechtigkeit ... wonach die Philosophen aller Völker fragen und worauf die Herrscher aller Länder pochen.","","False","0x000000E1","",""
"","TEXT_VOICEMAN_02200_900360_YUGIRI<tab>To justify his actions, he clads himself in the armor of righteousness─though it be a fancy of his own making. In this, mayhap the Garleans and we Domans are not so different...","TEXT_VOICEMAN_02200_900360_YUGIRI<tab>Wir finden immer gute Gründe, warum uns zusteht, was wir für uns selbst begehren - auch wenn wir ahnen, dass unsere Gegner sich genau derselben Argumente bedienen. Wie willkürlich ist doch das Fundament aller Moral ...","","False","0x000000E2","",""
"","TEXT_VOICEMAN_02200_900370_MERLWYB<tab>Eorzea has become as a raging sea. If we are to keep our heads above the waves, we cannot scruple to drown the man next to us.","TEXT_VOICEMAN_02200_900370_MERLWYB<tab>Hm! Als ob wir Herrscher blind für das Dilemma wären ... Aber handeln müssen wir ja doch, und wie wir aus dem Zwiespalt herauskommen, das bleibt letztlich an uns hängen.","","False","0x000000E3","",""
"","TEXT_VOICEMAN_02200_900380_MERLWYB<tab>When hopes of coexistence founder, strength must determine who has the greater right to live.","TEXT_VOICEMAN_02200_900380_MERLWYB<tab>In diesen Zeiten können wir es uns nicht leisten, allen anderen galant den Vortritt zu lassen, bis am Ende wir die Verlierer sind.","","False","0x000000E4","",""
"","TEXT_VOICEMAN_02200_A00010_MINFILIA<tab>I have been reflecting upon the events which took place during our visit to Vylbrand.","TEXT_VOICEMAN_02200_A00010_MINFILIA<tab>Ich möchte, dass du etwas erfährst.","","False","0x000000E5","",""
"","TEXT_VOICEMAN_02200_A00020_MINFILIA<tab>If you have a moment, I would share my conclusions with you. Please bear with me.","TEXT_VOICEMAN_02200_A00020_MINFILIA<tab>Seit wir aus Limsa zurück sind, habe ich ständig darüber nachgedacht ...","","False","0x000000E6","",""
"","TEXT_VOICEMAN_02200_A00030_MINFILIA<tab>When the Sahagin elder summoned Leviathan, he employed the power we have come to know as the Echo.","TEXT_VOICEMAN_02200_A00030_MINFILIA<tab>Als der Sahagin-Häuptling Leviathan beschwor, erlangte er eine gesteigerte Kraft des Transzendierens, wie du selbst gesehen hast.","","False","0x000000E7","",""
"","TEXT_VOICEMAN_02200_A00040_MINFILIA<tab>Though I cannot well explain the how of it, it would seem he became immortal in so doing.","TEXT_VOICEMAN_02200_A00040_MINFILIA<tab>Ob es eine direkte Ursache - oder Folge - der Beschwörung war, weiß ich nicht, aber er konnte diese Kraft offenbar ganz und gar annehmen und wurde unbesiegbar - oder in seinen Worten: unsterblich.","","False","0x000000E8","",""
"","TEXT_VOICEMAN_02200_A00050_MINFILIA<tab>When the Admiral subsequently slew him, his spirit emerged from his lifeless flesh, a consciousness shorn of physical form.","TEXT_VOICEMAN_02200_A00050_MINFILIA<tab>Das erinnert mich an eine alte Überlieferung. Sie spricht von Auserwählten, die in Zeiten einer Katastrophe wiedergeboren werden, um mit ihren außer<var 16 /var>ordent<var 16 /var>lichen Kräften dafür zu kämpfen, das Gleichgewicht der Welt wie<var 16 /var>der<var 16 /var>her<var 16 /var>zu<var 16 /var>stel<var 16 /var>len.","","False","0x000000E9","",""
"","TEXT_VOICEMAN_02200_A00060_MINFILIA<tab>Thus transfigured, he took up residence in the body of his minion with the ease of a man donning a favorite glove.","TEXT_VOICEMAN_02200_A00060_MINFILIA<tab>Es ist zwar nur eine Legende, aber es scheint fast, als ob sie selbst bestimmen könnten, wann ihre Seele wieder in die physische Welt treten soll.","","False","0x000000EA","",""
"","TEXT_VOICEMAN_02200_A00070_MINFILIA<tab>Long have I known that the Echo allows one to pass through the walls of a man's soul.","TEXT_VOICEMAN_02200_A00070_MINFILIA<tab>Nicht einfach Wiedergeburt im Sinne der Rekonstitution der Ätherkomponenten, sondern die Rückkehr ein und desselben Wesens aus freiem Willen.","","False","0x000000EB","",""
"","TEXT_VOICEMAN_02200_A00080_MINFILIA<tab>But never did I imagine that it could free us from our own flesh, nor less that our souls could then occupy the next corporeal vessel to take our fancy.","TEXT_VOICEMAN_02200_A00080_MINFILIA<tab>Was, wenn damit so eine Fähigkeit wie die des Sahagin-Häuptlings gemeint ist? Er vermochte den Weg seiner Seele selbst zu bestimmen - was wir bei Leviathans Beschwörung gesehen haben, war Beweis genug.","","False","0x000000EC","",""
