"location","source","target","id","fuzzy","context","translator_comments","developer_comments"
"","TEXT_CTSDOMRECONSTRUCTMINAZUKI_00526_MINAZUKI_000_081<tab>You and the other former refugees have much and more to share with the rest of Doma. Perhaps we should compile your experiences in a tome?","TEXT_CTSDOMRECONSTRUCTMINAZUKI_00526_MINAZUKI_000_081<tab>Je vous en prie, racontez-m'en davantage. Après tout, rares sont les Domiens qui peuvent se targuer de connaître Éorzéa et sa culture aussi bien que vous.","","False","0x0000003B","",""
"","TEXT_CTSDOMRECONSTRUCTMINAZUKI_00526_KOZAKURA_000_081<tab>Minazuki was not exaggerating when she told me how well the children had taken to the new Rissai-juku. It is another sign that life is returning to the way it was prior to the occupation.","TEXT_CTSDOMRECONSTRUCTMINAZUKI_00526_KOZAKURA_000_081<tab>Ah, le sourire des enfants est vraiment radieux aujourd'hui, vous ne trouvez pas<var 1D /var>? Ça fait plaisir à voir.","","False","0x0000003C","",""
"","TEXT_CTSDOMRECONSTRUCTMINAZUKI_00526_KOZAKURA_000_082<tab>Even with the Empire driven from this land, we must remain vigilant to problems within and without our borders. Which reminds me, the Shazenkai has received another proposal.","TEXT_CTSDOMRECONSTRUCTMINAZUKI_00526_KOZAKURA_000_082<tab>C'est une chose que nos enfants puissent étudier, mais il est aussi primordial de les protéger où qu'ils aillent. Au Shazenkai, nous sommes tous d'accord pour dire qu'il est urgent de renforcer la sécurité du quartier enclavé et de ses environs.","","False","0x0000003D","",""
"","TEXT_CTSDOMRECONSTRUCTMINAZUKI_00526_KOZAKURA_000_083<tab>A number of Domans who were once conscripted into the Garlean forces have banded together to patrol the enclave, to keep the area free from trouble. They wish to establish their own barracks by the Kienkan.","TEXT_CTSDOMRECONSTRUCTMINAZUKI_00526_KOZAKURA_000_083<tab>La bonne nouvelle, c'est qu'une milice vient justement d'être formée à l'initiative d'anciens soldats revenus s'installer ici récemment. D'après ce qu'on m'a dit, ils ont l'intention d'établir leur caserne juste à côté du Kienkan.","","False","0x0000003E","",""
"","TEXT_CTSDOMRECONSTRUCTMINAZUKI_00526_KOZAKURA_000_084<tab>My comrades and I agree that this is indeed a worthwhile endeavor, and shall be channeling funds towards its development. Please come to the Shazenkai if you would like to know more.","TEXT_CTSDOMRECONSTRUCTMINAZUKI_00526_KOZAKURA_000_084<tab>Bien sûr, le Shazenkai va tout faire pour accompagner leur démarche. C'est donc prin<var 16 /var>ci<var 16 /var>pa<var 16 /var>le<var 16 /var>ment à eux que profiteront vos futurs dons.","","False","0x0000003F","",""
"","TEXT_CTSDOMRECONSTRUCTMINAZUKI_00526_SYSTEM_000_085<tab>Rissai-juku is now complete and Kozakura has already begun preparations for the Enclave Barracks.","TEXT_CTSDOMRECONSTRUCTMINAZUKI_00526_SYSTEM_000_085<tab>L'école Rissai-juku est terminée, et le Shazenkai va à présent s'atteler à son projet suivant<var 1D /var>: la con<var 16 /var>struc<var 16 /var>tion de la caserne du Mimawarigumi. Continuez de remplir <var 33 ((EObj)) 03F61EA9DF0202 /var> pour soutenir ses efforts.","","False","0x00000040","",""
"","TEXT_CTSDOMRECONSTRUCTMINAZUKI_00526_KOZAKURA_000_090<tab>I hope that these children never have to live under oppression again. Therefore, I will do everything in my power to educate them, so that they will grow up to defend the freedom that so many died for.","TEXT_CTSDOMRECONSTRUCTMINAZUKI_00526_KOZAKURA_000_090<tab>Je n'ai qu'un souhait pour mes élèves<var 1D /var>: qu'ils deviennent des adultes libres de vivre et de penser comme ils l'entendent. C'est dans ce but que je m'efforce d'aiguiser leur esprit dès le plus jeune âge.","","False","0x00000041","",""
"","TEXT_CTSDOMRECONSTRUCTMINAZUKI_00526_KOZAKURA_000_095<tab>I believe that one day, the students will become upstanding citizens who will guide our people into an era of prosperity.","TEXT_CTSDOMRECONSTRUCTMINAZUKI_00526_KOZAKURA_000_095<tab>Les enfants grandissent vite. J'ai hâte de les voir prendre en main leur futur.","","False","0x00000042","",""
"","TEXT_CTSDOMRECONSTRUCTMINAZUKI_00526_KOZAKURA_000_096<tab>I pray that their old Master of Lessons, my husband, is watching over them.","TEXT_CTSDOMRECONSTRUCTMINAZUKI_00526_KOZAKURA_000_096<tab>Je suis sûre que de là où il est, mon regretté mari veille sur eux chaque jour.","","False","0x00000043","",""
