"location","source","target","id","fuzzy","context","translator_comments","developer_comments"
"","TEXT_VOICEMAN_05001_000010_MYSTERYVOICE<tab>You are come at a good time. As you may have heard, we have something of a quandary on our hands.","TEXT_VOICEMAN_05001_000010_MYSTERYVOICE<tab>Отлично, как раз вовремя. Вы уже в курсе? У нас тут кое-что заваривается.","","False","0x00000000","",""
"","TEXT_VOICEMAN_05001_000020_MYSTERYVOICE<tab>Laxan Loft, here in Lakeland. Eulmore has sent one of its airships.","TEXT_VOICEMAN_05001_000020_MYSTERYVOICE<tab>Мансарда. Здесь, в Озёрном краю. Юлмор послал один из своих дирижаблей.","","False","0x00000001","",""
"","TEXT_VOICEMAN_05001_000030_MYSTERYVOICE<tab>They have questions for us concerning the death of the Lightwarden. Their emissary makes his way here even as we speak.","TEXT_VOICEMAN_05001_000030_MYSTERYVOICE<tab>У них к нам вопросы касаемо смерти Стража Света. Их эмиссар как раз уже на пути сюда.","","False","0x00000002","",""
"","TEXT_VOICEMAN_05001_000040_ALISAIE<tab>I suppose the sky does rather give the game away.","TEXT_VOICEMAN_05001_000040_ALISAIE<tab>Мда. Цвет неба выдаёт нас с головой.","","False","0x00000003","",""
"","TEXT_VOICEMAN_05001_000050_MYSTERYVOICE<tab>Indeed. 'Twas inevitable they would come knocking. The only question was how soon.","TEXT_VOICEMAN_05001_000050_MYSTERYVOICE<tab>Вот именно. Рано или поздно они пришли бы стучаться в наши ворота. Это было неизбежно.","","False","0x00000004","",""
"","TEXT_VOICEMAN_05001_000060_LYNA<tab>My lord. I am come with the Eulmoran emissary. May I show him in?","TEXT_VOICEMAN_05001_000060_LYNA<tab>Милорд. Я здесь с юлморским посланником. Могу я его пригласить.","","False","0x00000005","",""
"","TEXT_VOICEMAN_05001_000070_MYSTERYVOICE<tab>A moment, Captain, if you would.","TEXT_VOICEMAN_05001_000070_MYSTERYVOICE<tab>Погодите минутку, капитан.","","False","0x00000006","",""
"","TEXT_VOICEMAN_05001_000080_MYSTERYVOICE<tab>Everyone, gather round.","TEXT_VOICEMAN_05001_000080_MYSTERYVOICE<tab>Ну ка, все вы, соберитесь вокруг.","","False","0x00000007","",""
"","TEXT_VOICEMAN_05001_000090_MYSTERYVOICE<tab>I do not wish to show our hand prematurely. Forgive me this liberty.","TEXT_VOICEMAN_05001_000090_MYSTERYVOICE<tab>Не хочу раньше времени раскрывать ваше участие в деле. Простите, небольшая предосторожность.","","False","0x00000008","",""
"","TEXT_VOICEMAN_05001_000100_MYSTERYVOICE<tab>Vanish!","TEXT_VOICEMAN_05001_000100_MYSTERYVOICE<tab>Исчезните!","","False","0x00000009","",""
"","TEXT_VOICEMAN_05001_000110_MYSTERYVOICE<tab>Enter.","TEXT_VOICEMAN_05001_000110_MYSTERYVOICE<tab>Войдите.","","False","0x0000000A","",""
"","TEXT_VOICEMAN_05001_000120_MYSTERYVOICE<tab>Well, well... The commander of the Eulmoran Army himself. To what do I owe the honor, General Ran'jit?","TEXT_VOICEMAN_05001_000120_MYSTERYVOICE<tab>Ну и ну. Командир армии Юлмора собственной персоной? Чем обязан такой чести, генерал Ран'джит?","","False","0x0000000B","",""
"","TEXT_VOICEMAN_05001_000130_RANJIT<tab>The Lightwarden is dead, Exarch. Were your people responsible?","TEXT_VOICEMAN_05001_000130_RANJIT<tab>Страж Света убит, Экзарх. Ваши люди причастны?","","False","0x0000000C","",""
"","TEXT_VOICEMAN_05001_000140_MYSTERYVOICE<tab>You are clearly in some haste, my lord. But before I address your question, you must allow me one of my own. What is Eulmore's interest in this?","TEXT_VOICEMAN_05001_000140_MYSTERYVOICE<tab>Вижу, вы здорово торопитесь, милорд. Но прежде чем вернёмся к вашему вопросу, позвольте мне задать свой. Почему Юлмор вдруг этим интересуется?","","False","0x0000000D","",""
"","TEXT_VOICEMAN_05001_000150_RANJIT<tab>His Benevolence Lord Vauthry is gravely concerned that the actions of an ignorant few may jeopardize relations between man and sin eater.","TEXT_VOICEMAN_05001_000150_RANJIT<tab>Его милость лорд Вонтри в крайней мере озабочен тем фактом, что действия каких-то невежд могут подорвать основы союза между людьми и пожирателями грешников.","","False","0x0000000E","",""
"","TEXT_VOICEMAN_05001_000160_RANJIT<tab>Should it transpire that the Crystarium is guilty of abetting the villains responsible for this outrage...","TEXT_VOICEMAN_05001_000160_RANJIT<tab>И если выяснится, что Кристариум укрывает или покрывает злодеев, ответственных за сие варварство...","","False","0x0000000F","",""
"","TEXT_VOICEMAN_05001_000170_RANJIT<tab>My lord has decreed that it suffer the same...retribution.","TEXT_VOICEMAN_05001_000170_RANJIT<tab>Милорд провозгласили, что в таком случае вас постигнет... возмездие.","","False","0x00000010","",""
"","TEXT_VOICEMAN_05001_000180_MYSTERYVOICE<tab>I see. Since you have been so candid, I too shall speak my mind.","TEXT_VOICEMAN_05001_000180_MYSTERYVOICE<tab>Вот как. Что ж, спасибо вам за прямоту. Тогда и я выскажусь.","","False","0x00000011","",""
"","TEXT_VOICEMAN_05001_000190_MYSTERYVOICE<tab>Regardless of who is responsible, the Crystarium <var 1A 02 /var>rejoices<var 1A 01 /var> in the Lightwarden's death, and welcomes the return of the night sky.","TEXT_VOICEMAN_05001_000190_MYSTERYVOICE<tab>Вне зависимости от того, от чьей руки пал Страж Света, Кристариум <var 1A 02 /var>вне себя от радости<var 1A 01 /var> в связи с этим событием, и празднует возвращение ночного неба.","","False","0x00000012","",""
"","TEXT_VOICEMAN_05001_000200_MYSTERYVOICE<tab>If Eulmore considers this tantamount to aiding those you term “villains,” then by all means carry out your retribution.","TEXT_VOICEMAN_05001_000200_MYSTERYVOICE<tab>И если Юлмор посчитает подобное поведение неприемлемым, тогда назовите ""злодеями"" и нас, а потом свершайте своё возмездие.","","False","0x00000013","",""
"","TEXT_VOICEMAN_05001_000210_MYSTERYVOICE<tab>Know, however, that even should every innocent soul in the Crystarium perish, nothing can stop that which has been set in motion.","TEXT_VOICEMAN_05001_000210_MYSTERYVOICE<tab>Полагаю, истреби вы хоть весь город, всё равно вам не под силу остановить то, что началось.","","False","0x00000014","",""
"","TEXT_VOICEMAN_05001_000220_RANJIT<tab><sigh> Folly. The death of one or a thousand thousand sin eaters changes nothing.","TEXT_VOICEMAN_05001_000220_RANJIT<tab>...Глупость. Смерть одного или тысячи тысяч пожирателей грешников ничего не изменит.","","False","0x00000015","",""
"","TEXT_VOICEMAN_05001_000230_RANJIT<tab>The world is dead, and writhe as we might, like maggots in its rotting corse, it will <var 1A 02 /var>not<var 1A 01 /var> be reborn. Only by my master's grace may we live out our days in peace.","TEXT_VOICEMAN_05001_000230_RANJIT<tab>Мир мёртв, и сколько бы мы не копошились, словно черви, на его гниющем трупе, он <var 1A 02 /var>не возродится<var 1A 01 /var>. Только милостью моего господина мы проведём остаток отведённых нам дней в мире и покое.","","False","0x00000016","",""
"","TEXT_VOICEMAN_05001_000240_RANJIT<tab>But I waste my breath. You have made your stance clear. I shall relay your words to Lord Vauthry.","TEXT_VOICEMAN_05001_000240_RANJIT<tab>Но вижу, вас не переубедить. Вы ясно высказали вашу позицию. Я передам ваши слова лорду Вонтри.","","False","0x00000017","",""
"","TEXT_VOICEMAN_05001_000250_RANJIT<tab>In the meantime, you would do well to counsel any here who have done more than merely “rejoice” in recent events to throw themselves upon Eulmore's mercy. Promptly.","TEXT_VOICEMAN_05001_000250_RANJIT<tab>А вы тем временем, когда отойдёте от своей несказанной ""радости"", будьте добры посоветовать тем, чьё участие в этом деле привело к столь плачевному результату, немедленно сдаться на суд Юлмора.","","False","0x00000018","",""
"","TEXT_VOICEMAN_05001_000260_RANJIT<tab>One last matter. We are searching for a young artist and his assistant. Know you of whom I speak?","TEXT_VOICEMAN_05001_000260_RANJIT<tab>И ещё одно. Мы ищем молодого художника и его <var 08 E905 ((ассистентку)) ((ассистента)) /var>. Вам что-нибудь о таких индивидах известно?","","False","0x00000019","",""
"","TEXT_VOICEMAN_05001_000270_MYSTERYVOICE<tab>An artist and his assistant... No. I cannot say I do.","TEXT_VOICEMAN_05001_000270_MYSTERYVOICE<tab>Художник и его <var 08 E905 ((ассистентка)) ((ассистент)) /var>?.. Нет. Нельзя сказать, что мне что-то известно.","","False","0x0000001A","",""
"","TEXT_VOICEMAN_05001_000280_RANJIT<tab>What a pity. Should they <var 1A 02 /var>reveal<var 1A 01 /var> themselves to you, I bid you hand them over at once. My master is most eager to <var 1A 02 /var>see<var 1A 01 /var> them again.","TEXT_VOICEMAN_05001_000280_RANJIT<tab>Какая жалость. В таком случае, если они вдруг решат <var 1A 02 /var>прекратить прятаться<var 1A 01 /var> и покажутся вам, передайте их нам как можно скорее. Мой господин ждёт не дождётся <var 1A 02 /var>увидеть<var 1A 01 /var> их снова.","","False","0x0000001B","",""
"","TEXT_VOICEMAN_05001_000290_ALISAIE<tab>Am I imagining things, or did he just stare straight at us?","TEXT_VOICEMAN_05001_000290_ALISAIE<tab>Мне показалось, или он глядел прямо на нас?","","False","0x0000001C","",""
"","TEXT_VOICEMAN_05001_000300_MYSTERYVOICE<tab>I fear he did.","TEXT_VOICEMAN_05001_000300_MYSTERYVOICE<tab>Боюсь, что так и есть.","","False","0x0000001D","",""
"","TEXT_VOICEMAN_05001_000310_MYSTERYVOICE<tab>The general is not a man to be trifled with. He is a warrior of fearsome repute who has led Eulmore's army since before Vauthry's time, when the nation still spearheaded the fight against the sin eaters.","TEXT_VOICEMAN_05001_000310_MYSTERYVOICE<tab>С генералом шутки плохи. Он воин с устрашающей репутацией, вёл юлморскую армию ещё до Вонтри - в те времена, когда нация жила битвами против пожирателей.","","False","0x0000001E","",""
"","TEXT_VOICEMAN_05001_000320_MYSTERYVOICE<tab>One does not command the world's mightiest army, and for so long, without possessing exceptional instincts.","TEXT_VOICEMAN_05001_000320_MYSTERYVOICE<tab>Нельзя быть командиром самой могучей армии на свете, вдобавок так долго занимать должность, не обладая исключительным чутьём. ","","False","0x0000001F","",""
"","TEXT_VOICEMAN_05001_000330_ALPHINAUD<tab>If Eulmore chose to send such an individual, we must assume this talk of retribution is more than an idle threat.","TEXT_VOICEMAN_05001_000330_ALPHINAUD<tab>Если Юлмор прислал сюда такую фигуру, надо думать, этот разговор насчёт возмездия - не пустые угрозы.","","False","0x00000020","",""
"","TEXT_VOICEMAN_05001_000340_ALPHINAUD<tab>While we are grateful for your support, my lord─we cannot in good conscience put your people in harm's way.","TEXT_VOICEMAN_05001_000340_ALPHINAUD<tab>Конечно, мы благодарны за вашу помощь, милорд... но в нормальных обстоятельствах нам бы не хотелось своим присутствием подставлять людей под удар.","","False","0x00000021","",""
"","TEXT_VOICEMAN_05001_000350_MYSTERYVOICE<tab>'Tis noble of you to say, Master Alphinaud, but my people have been in harm's way since long before you arrived.","TEXT_VOICEMAN_05001_000350_MYSTERYVOICE<tab>Благородные слова, господин Альфино, но мой народ был в страшной опасности задолго да того, как вы сюда прибыли.","","False","0x00000022","",""
"","TEXT_VOICEMAN_05001_000360_MYSTERYVOICE<tab>Eulmore has ever yearned to rule over what remains of the world. Even should we surrender the Warrior of Darkness to them, they would find some other pretext upon which to invade.","TEXT_VOICEMAN_05001_000360_MYSTERYVOICE<tab>Юлмор вечно рвался править тем, что осталось от мира. Даже если мы вручим им Воина Тени, они найдут иной повод для вторжения.","","False","0x00000023","",""
"","TEXT_VOICEMAN_05001_000370_MYSTERYVOICE<tab>The people of the Crystarium know this only too well, which is why, when the time comes, I am certain they will fight to the last man.","TEXT_VOICEMAN_05001_000370_MYSTERYVOICE<tab>Люди Кристариума очень хорошо это осознают, поэтому уверен, когда время придёт, они будут драться до последней капли крови.","","False","0x00000024","",""
"","TEXT_VOICEMAN_05001_000380_MYSTERYVOICE<tab>If truth be told, I would not have been surprised had Ran'jit declared war here and now...","TEXT_VOICEMAN_05001_000380_MYSTERYVOICE<tab>По правде говоря, я бы не удивился, если бы Ран'джит прямо с порога объявил нам войну...","","False","0x00000025","",""
"","TEXT_VOICEMAN_05001_000390_LYNA<tab>He may have reason to delay.","TEXT_VOICEMAN_05001_000390_LYNA<tab>Возможно, у них есть причина отсрочки.","","False","0x00000026","",""
"","TEXT_VOICEMAN_05001_000400_LYNA<tab>According to reports, the Eulmoran forces at Laxan Loft were observed taking a prisoner.","TEXT_VOICEMAN_05001_000400_LYNA<tab>Согласно разведданных, юлморцы, что сейчас базируются в Мансарде, вели с собой пленницу.","","False","0x00000027","",""
"","TEXT_VOICEMAN_05001_000410_LYNA<tab>A young woman believed to be none other than the Oracle of Light─Minfilia.","TEXT_VOICEMAN_05001_000410_LYNA<tab>Молодую женщину, которая по всем признакам походит на Оракула Света - Минфилию.","","False","0x00000028","",""
"","TEXT_VOICEMAN_05001_000420_LYNA<tab>It may be that General Ran'jit wishes to convey her to Eulmore before commencing hostilities.","TEXT_VOICEMAN_05001_000420_LYNA<tab>Возможно, генерал Ран'джит хочет сперва увезти её в Юлмор, а потом уже разворачивать войска.","","False","0x00000029","",""
"","TEXT_VOICEMAN_05001_000430_LYNA<tab>Having mentored generations of Minfilias, it would not surprise me if he had made her capture his chief concern.","TEXT_VOICEMAN_05001_000430_LYNA<tab>Учитывая тот факт, что до этого он имел дело с поколениями Минфилий, неудивительно, что он за неё так ухватился.","","False","0x0000002A","",""
"","TEXT_VOICEMAN_05001_Q1_000_001_NONE_VOICE<tab>What will you say?","TEXT_VOICEMAN_05001_Q1_000_001_NONE_VOICE<tab>Что вы скажете?","","False","0x0000002B","",""
"","TEXT_VOICEMAN_05001_A1_000_001_NONE_VOICE<tab>Wait, is this <var 1A 02 /var>the<var 1A 01 /var> Minfilia?","TEXT_VOICEMAN_05001_A1_000_001_NONE_VOICE<tab>Погодите, это <var 1A 02 /var>та самая<var 1A 01 /var> Минфилия?","","False","0x0000002C","",""
"","TEXT_VOICEMAN_05001_A1_000_002_NONE_VOICE<tab>I'm sorry, “generations of Minfilias”?","TEXT_VOICEMAN_05001_A1_000_002_NONE_VOICE<tab>Погодите, ""поколения Минфилий""?","","False","0x0000002D","",""
"","TEXT_VOICEMAN_05001_000440_MYSTERYVOICE<tab>Ah, of course. How remiss of me. I had intended to speak to you of Minfilia. There is, however, much to say, and precious little time in which to say it...","TEXT_VOICEMAN_05001_000440_MYSTERYVOICE<tab>О, конечно... Я совершенно забыл. Нужно было рассказать тебе о Минфилии. Конечно, история эта не из коротких, а времени у меня совсем нет...","","False","0x0000002E","",""
"","TEXT_VOICEMAN_05001_000450_MYSTERYVOICE<tab>I think it best that you seek out Moren at the Cabinet of Curiosity. He will be able to enlighten you.","TEXT_VOICEMAN_05001_000450_MYSTERYVOICE<tab>Да, полагаю, лучше всего тебе отправиться к Морену в Библиотеку Любопытных. Там он всё как следует растолкует.","","False","0x0000002F","",""
"","TEXT_VOICEMAN_05001_000460_MYSTERYVOICE<tab>Alphinaud, Alisaie─would you care to accompany your friend? You doubtless have insights of your own to offer on the matter.","TEXT_VOICEMAN_05001_000460_MYSTERYVOICE<tab>Альфино, Ализе, не сопроводите вашего друга? Без сомнения, у вас найдутся пояснения с позиции того, что вам уже известно.","","False","0x00000030","",""
"","TEXT_VOICEMAN_05001_000470_ALISAIE<tab>All right. Though I'm still not sure I understand it all myself...","TEXT_VOICEMAN_05001_000470_ALISAIE<tab>Ну хорошо. Правда, я и сам не уверен, что до конца всё понимаю...","","False","0x00000031","",""
"","TEXT_VOICEMAN_05001_000480_MYSTERYVOICE<tab>In the meantime, I will set about making provisions for war.","TEXT_VOICEMAN_05001_000480_MYSTERYVOICE<tab>Нам тем временем следует готовиться к войне.","","False","0x00000032","",""
"","TEXT_VOICEMAN_05001_000490_MYSTERYVOICE<tab>You are doubtless eager to attempt Minfilia's rescue─and with your combined strength, you may well succeed.","TEXT_VOICEMAN_05001_000490_MYSTERYVOICE<tab>Не сомневаюсь, вам не терпится броситься на спасение Минфилии - к тому же, ваших сил для этого вполне может хватить.","","False","0x00000033","",""
"","TEXT_VOICEMAN_05001_000500_MYSTERYVOICE<tab>But as I said earlier, I do not wish to show our hand unless absolutely necessary.","TEXT_VOICEMAN_05001_000500_MYSTERYVOICE<tab>Но, как я и сказал ранее, я не хочу без необходимости показывать, что вы в этом действительно замешаны.","","False","0x00000034","",""
"","TEXT_VOICEMAN_05001_000510_MYSTERYVOICE<tab>'Twas not merely the night sky that you restored to us, but hope─hope for the future of Norvrandt.","TEXT_VOICEMAN_05001_000510_MYSTERYVOICE<tab>Ведь вы не просто восстановили небо; вы вернули надежду - надежду на будущее Норврандта.","","False","0x00000035","",""
"","TEXT_VOICEMAN_05001_000520_MYSTERYVOICE<tab>Unlike you, we cannot contend with the Lightwardens. But so long as hope burns in our hearts, we will fight on regardless. This I will prove to you.","TEXT_VOICEMAN_05001_000520_MYSTERYVOICE<tab>В отличии от вас, борьба со Стражами Света нам не под силу. Но покуда жива в наших сердцах надежда, мы будем сражаться. И я вскоре вам это докажу.","","False","0x00000036","",""
"","TEXT_VOICEMAN_05001_000530_MYSTERYVOICE<tab>My friends, I thank you for gathering at such short notice. There is something I would ask you all.","TEXT_VOICEMAN_05001_000530_MYSTERYVOICE<tab>Друзья мои, спасибо, что так быстро собрались. Есть кое что, о чём я хотел бы попросить.","","False","0x00000037","",""
"","TEXT_VOICEMAN_05001_000540_MYSTERYVOICE<tab>As many of you are aware, I received an emissary from Eulmore a short while ago─in the form of General Ran'jit.","TEXT_VOICEMAN_05001_000540_MYSTERYVOICE<tab>Как вы уже знаете, совсем недавно ко мне явился посланник из Юлмора - а именно генерал Ран'джит.","","False","0x00000038","",""
"","TEXT_VOICEMAN_05001_000550_MYSTERYVOICE<tab>To my dismay, the general condemned the slaying of the Lightwarden, and warned me in no uncertain terms that, should the Crystarium cast its lot with the Warrior of Darkness, there would be war.","TEXT_VOICEMAN_05001_000550_MYSTERYVOICE<tab>К моему сожалению, генерал осудил убийство Стража Света; недвусмысленно он заявил мне, что если Кристариум объединился с Воином Тени, быть войне.","","False","0x00000039","",""
"","TEXT_VOICEMAN_05001_000560_MYSTERYVOICE<tab>Let none be mistaken: we would be hard-pressed indeed to resist the might of Eulmore. Some would even call it suicide.","TEXT_VOICEMAN_05001_000560_MYSTERYVOICE<tab>Пусть никто не питает иллюзий: мы окажемся под серьёзным давлением, реши Юлмор на нас навалиться. Иные сказали бы, что это самоубийство...","","False","0x0000003A","",""
"","TEXT_VOICEMAN_05001_000570_MYSTERYVOICE<tab>And yet my heart cries out to fight. Better that than relinquish the hope that swelled in my breast when I beheld the night sky for the first time in a hundred years.","TEXT_VOICEMAN_05001_000570_MYSTERYVOICE<tab>И всё же моё чутьё призывает к бою. Лучше так, чем отказаться от надежды, разгоревшейся в моей груди в тот момент, когда я увидел ночное небо - впервые за сотню лет.","","False","0x0000003B","",""
"","TEXT_VOICEMAN_05001_000580_MYSTERYVOICE<tab>...Or so says my heart. My mind, meanwhile, reminds me that to follow my heart would be to risk everything we have accomplished thus far.","TEXT_VOICEMAN_05001_000580_MYSTERYVOICE<tab>...Так подсказывает мне сердце. Разум же мой, однако, напоминает, какому огромному риску я подвергну всё то, чего нам уже удалось добиться.","","False","0x0000003C","",""
"","TEXT_VOICEMAN_05001_000590_MYSTERYVOICE<tab>Clearly, this is not a decision to be made lightly─nor less alone. And so I put the question to you all. What should we do?","TEXT_VOICEMAN_05001_000590_MYSTERYVOICE<tab>Совершенно ясно, к делу нельзя относиться легкомысленно, как нельзя и принимать решение в одиночку. А потому я спрашиваю всех вас. Как мы поступим?","","False","0x0000003D","",""
"","TEXT_VOICEMAN_05001_000600_GLYNARD<tab>My lord, you already know our minds.","TEXT_VOICEMAN_05001_000600_GLYNARD<tab>Милорд, вы уже и так всё знаете.","","False","0x0000003E","",""
"","TEXT_VOICEMAN_05001_000610_GLYNARD<tab>It brought tears to our eyes to witness the night's return. The whole of Norvrandt deserves the same, and not just because some children's story tells us so.","TEXT_VOICEMAN_05001_000610_GLYNARD<tab>Зрелище возвращения ночи заставило нас прослезиться. Весь Норврандт заслуживает того же - ведь теперь мы знаем, что это не просто детские сказки.","","False","0x0000003F","",""
"","TEXT_VOICEMAN_05001_000620_BRAGI<tab>Eulmore's influence is far-reaching. Should war break out, trade would be subject to restrictions.","TEXT_VOICEMAN_05001_000620_BRAGI<tab>Юлмор - чересчур влиятельная фигура. Случись война, торговле конец.","","False","0x00000040","",""
