"location","source","target","id","fuzzy","context","translator_comments","developer_comments"
"","TEXT_VOICEMAN_05001_000630_BRAGI<tab>The flow of goods will dry up, and we will struggle to make do with what little trickles through... But make do we will.","TEXT_VOICEMAN_05001_000630_BRAGI<tab>Поток товаров, вероятно, совсем иссякнет. Будет трудно с тем немногим, что останется... Но мы справимся.","","False","0x00000041","",""
"","TEXT_VOICEMAN_05001_000640_KATLISS<tab>Aye, we can weather such hardships! Is that not the very thing the Crystarium was built for?","TEXT_VOICEMAN_05001_000640_KATLISS<tab>Да, мы преодолеем трудности! Не для этого ли в первую очередь был Кристариум построен?","","False","0x00000042","",""
"","TEXT_VOICEMAN_05001_000650_KATLISS<tab>We have always taken pride in our ability to sustain ourselves─not just to endure, but to thrive!","TEXT_VOICEMAN_05001_000650_KATLISS<tab>Мы всегда гордились нашей способностью обеспечивать себя сами - не просто выживать, но и развиваться!","","False","0x00000043","",""
"","TEXT_VOICEMAN_05001_000660_MOREN<tab>""When all falls down around you, rise up.“ Those were your words.","TEXT_VOICEMAN_05001_000660_MOREN<tab>""Когда всё вокруг рушится, вставайте."" Это были ваши слова.","","False","0x00000044","",""
"","TEXT_VOICEMAN_05001_000670_MOREN<tab>""There may come a day when all hope seems lost. But even should the rest of the world give in to despair─we shall not.","TEXT_VOICEMAN_05001_000670_MOREN<tab>""Настанет день, когда будет казаться, что надежды нет. Но даже если весь мир сдастся в отчаянии - мы не опустим руки.""","","False","0x00000045","",""
"","TEXT_VOICEMAN_05001_000680_MOREN<tab>""We shall fight on, that our children and our children's children might know a better tomorrow.“","TEXT_VOICEMAN_05001_000680_MOREN<tab>""Мы будем бороться, чтобы наши дети и дети наших детей знали лучшее будущее.""","","False","0x00000046","",""
"","TEXT_VOICEMAN_05001_000690_CASSARD<tab>Rousing words apart, I never much cared for those Eulmoran bastards anyway. No better than common swindlers, most of them. Wouldn't know a fair deal if it came up and kissed them on the arse!","TEXT_VOICEMAN_05001_000690_CASSARD<tab>Отбросив пафосные слова, могу сказать, что на юлморцев мне всегда было плевать. Бездари и лоботрясы, вот кто они все. Такие даже с дерева фрукт сорвать поленятся - будут ждать, пока тот сам свалится им на башку!","","False","0x00000047","",""
"","TEXT_VOICEMAN_05001_000700_GLYNARD<tab>Trust you to spoil the moment!","TEXT_VOICEMAN_05001_000700_GLYNARD<tab>Ну вот, как всегда испортил момент!","","False","0x00000048","",""
"","TEXT_VOICEMAN_05001_000701_CASSARD<tab>(BIG LAUGH)","TEXT_VOICEMAN_05001_000701_CASSARD<tab>(BIG LAUGH)","","False","0x00000049","",""
"","TEXT_VOICEMAN_05001_000710_MYSTERYVOICE<tab>It appears we have a consensus.","TEXT_VOICEMAN_05001_000710_MYSTERYVOICE<tab>Похоже, наши с вами взгляды сошлись.","","False","0x0000004A","",""
"","TEXT_VOICEMAN_05001_000720_MYSTERYVOICE<tab>Let it be known that the Eulmoran host at Laxan Loft has taken the Oracle of Light captive.","TEXT_VOICEMAN_05001_000720_MYSTERYVOICE<tab>Да будет известно, что юлморские силы, размещённые в Мансарде, захватили в плен Оракула Света.","","False","0x0000004B","",""
"","TEXT_VOICEMAN_05001_000730_MYSTERYVOICE<tab>They fear the power she holds over the sin eaters, and doubtless intend to imprison her once more.","TEXT_VOICEMAN_05001_000730_MYSTERYVOICE<tab>Они боятся её способностей противостоять пожирателям. Без сомнения, её снова упрячут в темницу.","","False","0x0000004C","",""
"","TEXT_VOICEMAN_05001_000740_MYSTERYVOICE<tab>So I move that we rescue the Oracle, grant her a place among us, and let <var 1A 02 /var>that<var 1A 01 /var> be our answer to Eulmore's ultimatum!","TEXT_VOICEMAN_05001_000740_MYSTERYVOICE<tab>Я отправляюсь вызволить Оракула, а затем дарую место среди нас. <var 1A 02 /var>Вот это<var 1A 01 /var> будет нашим ответом юлморскому ультиматуму!","","False","0x0000004D","",""
"","TEXT_VOICEMAN_05001_000750_KATLISS<tab>Hear, hear!","TEXT_VOICEMAN_05001_000750_KATLISS<tab>Да, да!","","False","0x0000004E","",""
"","TEXT_VOICEMAN_05001_000760_CASSARD<tab>Hear, hear!","TEXT_VOICEMAN_05001_000760_CASSARD<tab>Вот это по нашему!","","False","0x0000004F","",""
"","TEXT_VOICEMAN_05001_000770_LYNA<tab>In planning a strategy for the rescue, I open the floor to you all.","TEXT_VOICEMAN_05001_000770_LYNA<tab>В разработке стратегии мы прислушаемся к идеям каждого из вас.","","False","0x00000050","",""
"","TEXT_VOICEMAN_05001_000780_MYSTERYVOICE<tab>And there you have it. If Eulmore wishes to denounce us as villains, then we shall embrace our villainy. Will you do so as well?","TEXT_VOICEMAN_05001_000780_MYSTERYVOICE<tab>Ну вот. Если Юлмор назвал нас злодеями, нам больше ничего не остаётся, кроме как злодействовать. А вы как?","","False","0x00000051","",""
"","TEXT_VOICEMAN_05001_000790_ALPHINAUD<tab>(SIGH)","TEXT_VOICEMAN_05001_000790_ALPHINAUD<tab>(SIGH)","","False","0x00000052","",""
"","TEXT_VOICEMAN_05001_000800_ALPHINAUD<tab>We will not be outdone. Consider us your partners in crime.","TEXT_VOICEMAN_05001_000800_ALPHINAUD<tab>Постараемся не отставать. Считайте, что мы с вами в преступном сговоре.","","False","0x00000053","",""
"","TEXT_VOICEMAN_05001_000810_LYNA<tab>My lord, our proposal is as follows: we begin by deploying amaro to occupy the skies over Lakeland. They should serve to delay the airship's departure.","TEXT_VOICEMAN_05001_000810_LYNA<tab>Милорд, предложение следующее: мы затмим небо над Озёрным краем нашими амаро. Они немного отложат отправление дирижабля.","","False","0x00000054","",""
"","TEXT_VOICEMAN_05001_000820_LYNA<tab>At the same time, we scatter dream powder from the air.","TEXT_VOICEMAN_05001_000820_LYNA<tab>В то же самое время рассыпаем сонный порошок над Мансардой.","","False","0x00000055","",""
"","TEXT_VOICEMAN_05001_000830_LYNA<tab>Not all will succumb to its effects, but it should thin the enemy's numbers, affording us an opening to swoop in and liberate the Oracle.","TEXT_VOICEMAN_05001_000830_LYNA<tab>Вероятно, не все уснут, однако враги заметно поредеют, тем самым предоставив нам возможность проникнуть в крепость и вызволить Оракула.","","False","0x00000056","",""
"","TEXT_VOICEMAN_05001_000840_MYSTERYVOICE<tab>Very good. See to your preparations.","TEXT_VOICEMAN_05001_000840_MYSTERYVOICE<tab>Очень хорошо. Готовьтесь действовать.","","False","0x00000057","",""
"","TEXT_VOICEMAN_05001_000850_ALISAIE<tab>And what exciting crimes would you have <var 1A 02 /var>us<var 1A 01 /var> commit? Speaking for my fellow villains, I'd say we're capable of most things─though we draw the line at indolence.","TEXT_VOICEMAN_05001_000850_ALISAIE<tab>И какие же невероятные преступления вы приготовили для нас? К слову о моих теневых подельниках, нам под силу многое - если ограничиться разумным.","","False","0x00000058","",""
"","TEXT_VOICEMAN_05001_000860_MYSTERYVOICE<tab>If excitement is your desire, then I bid you join the guard. Captain Lyna will give you your orders.","TEXT_VOICEMAN_05001_000860_MYSTERYVOICE<tab>Если хотите самую весёлую часть, присоединяйтесь к страже. Капитан Лина отдаст вам приказы.","","False","0x00000059","",""
"","TEXT_VOICEMAN_05001_000870_EULMORESOLDIERA<tab>Keep moving!","TEXT_VOICEMAN_05001_000870_EULMORESOLDIERA<tab>Шевелитесь!","","False","0x0000005A","",""
"","TEXT_VOICEMAN_05001_000880_EULMORESOLDIERA<tab>Eh? What now?","TEXT_VOICEMAN_05001_000880_EULMORESOLDIERA<tab>А? Что ещё?","","False","0x0000005B","",""
"","TEXT_VOICEMAN_05001_000890_EULMORESOLDIERB<tab>The Crystarium at a guess.","TEXT_VOICEMAN_05001_000890_EULMORESOLDIERB<tab>Похоже, Кристариум пришёл в гости.","","False","0x0000005C","",""
"","TEXT_VOICEMAN_05001_000900_EULMORESOLDIERB<tab>Desperate fools. It'll take more than a handful of overgrown lizards to ground us!","TEXT_VOICEMAN_05001_000900_EULMORESOLDIERB<tab>Отчаянные дураки. Понадобится чуть больше, чем горстка ящериц-переростков, чтобы напугать нас!","","False","0x0000005D","",""
"","TEXT_VOICEMAN_05001_000910_EULMORESOLDIERA<tab>Oh, you've got to be─ Sound the alarum!","TEXT_VOICEMAN_05001_000910_EULMORESOLDIERA<tab>Ох, да вы, наверное, шутите... Поднимайте тревогу!","","False","0x0000005E","",""
"","TEXT_VOICEMAN_05001_000920_CRYSTARIUMGARDPICKET<tab>Captain, the powder has taken effect!","TEXT_VOICEMAN_05001_000920_CRYSTARIUMGARDPICKET<tab>Капитан, пыльца подействовала!","","False","0x0000005F","",""
"","TEXT_VOICEMAN_05001_000930_LYNA<tab>It is time. Let us free the Oracle from their clutches!","TEXT_VOICEMAN_05001_000930_LYNA<tab>Отлично. Пора вызволить Оракула из цепей.","","False","0x00000060","",""
"","TEXT_VOICEMAN_05001_000940_RANJIT<tab>You, boy. You bear a striking resemblance to the artist my master seeks.","TEXT_VOICEMAN_05001_000940_RANJIT<tab>Ты, мальчишка. Очень похож на художника, которого ищет мой господин.","","False","0x00000061","",""
"","TEXT_VOICEMAN_05001_000950_RANJIT<tab>By all means, keep your counsel. You will all have ample time to confess your crimes back in Eulmore.","TEXT_VOICEMAN_05001_000950_RANJIT<tab>В молчанку будем играть? У тебя будет достаточно времени в Юлморе, чтобы сознаться во всех грехах.","","False","0x00000062","",""
"","TEXT_VOICEMAN_05001_000960_THANCRED<tab>(CHARGING ATTACK)","TEXT_VOICEMAN_05001_000960_THANCRED<tab>(CHARGING ATTACK)","","False","0x00000063","",""
"","TEXT_VOICEMAN_05001_000970_RANJIT<tab>(PARRYING ATTACK)","TEXT_VOICEMAN_05001_000970_RANJIT<tab>(PARRYING ATTACK)","","False","0x00000064","",""
"","TEXT_VOICEMAN_05001_000980_THANCRED<tab>(REELING FROM BLOW)","TEXT_VOICEMAN_05001_000980_THANCRED<tab>(REELING FROM BLOW)","","False","0x00000065","",""
"","TEXT_VOICEMAN_05001_000990_RYNE<tab>Thancred?","TEXT_VOICEMAN_05001_000990_RYNE<tab>Танкред?","","False","0x00000066","",""
"","TEXT_VOICEMAN_05001_001000_RANJIT<tab>So! <var 1A 02 /var>You<var 1A 01 /var> are the wretch who stole her from us...","TEXT_VOICEMAN_05001_001000_RANJIT<tab>Итак! <var 1A 02 /var>Это ты<var 1A 01 /var> тот, кто украл её у нас...","","False","0x00000067","",""
"","TEXT_VOICEMAN_05001_001010_THANCRED<tab>And what if I am!?","TEXT_VOICEMAN_05001_001010_THANCRED<tab>Ну я, и дальше что!?","","False","0x00000068","",""
"","TEXT_VOICEMAN_05001_001020_THANCRED<tab>What!?","TEXT_VOICEMAN_05001_001020_THANCRED<tab>Какого?..","","False","0x00000069","",""
"","TEXT_VOICEMAN_05001_001021_THANCRED<tab>(REELING FROM BLOW)","TEXT_VOICEMAN_05001_001021_THANCRED<tab>(REELING FROM BLOW)","","False","0x0000006A","",""
"","TEXT_VOICEMAN_05001_001030_RANJIT<tab>Pathetic.","TEXT_VOICEMAN_05001_001030_RANJIT<tab>Жалкое зрелище.","","False","0x0000006B","",""
"","TEXT_VOICEMAN_05001_001040_RANJIT<tab>Vermin such as you are not worthy of the Oracle.","TEXT_VOICEMAN_05001_001040_RANJIT<tab>Такие как ты ничтожества недостойны Оракула.","","False","0x0000006C","",""
"","TEXT_VOICEMAN_05001_001050_MYSTERYVOICE<tab>Break!","TEXT_VOICEMAN_05001_001050_MYSTERYVOICE<tab>Замрите!","","False","0x0000006D","",""
"","TEXT_VOICEMAN_05001_001060_RANJIT<tab>Fool! You would see your city razed?","TEXT_VOICEMAN_05001_001060_RANJIT<tab>Идиот! Хочешь, чтобы твой город сравняли с землёй?","","False","0x0000006E","",""
"","TEXT_VOICEMAN_05001_001070_MYSTERYVOICE<tab>I would sooner see it razed than conquered. Suffice it to say, we are ready to receive you.","TEXT_VOICEMAN_05001_001070_MYSTERYVOICE<tab>Лучше уж так, чем прогибаться под вас. Считайте это приглашением. Пускай ваша армия заглядывает в гости.","","False","0x0000006F","",""
"","TEXT_VOICEMAN_05001_001080_RANJIT<tab>What now, Exarch? Will you face me yourself?","TEXT_VOICEMAN_05001_001080_RANJIT<tab>Что теперь, Экзарх? Сам хочешь сразиться со мной?","","False","0x00000070","",""
"","TEXT_VOICEMAN_05001_001090_MYSTERYVOICE<tab>I think not, General. I've quite exhausted my tricks.","TEXT_VOICEMAN_05001_001090_MYSTERYVOICE<tab>Ну уж нет, генерал. Больше козырей в рукаве у меня не осталось.","","False","0x00000071","",""
"","TEXT_VOICEMAN_05001_001100_MYSTERYVOICE<tab>If you mean to give chase, I will not stand in your way.","TEXT_VOICEMAN_05001_001100_MYSTERYVOICE<tab>Если собираешься за ними, я, пожалуй, мешать тебе не стану.","","False","0x00000072","",""
"","TEXT_VOICEMAN_05001_001110_MYSTERYVOICE<tab>But you would do well to tread warily. For your quarry goes to a place where even Eulmore dare not bare its steel...","TEXT_VOICEMAN_05001_001110_MYSTERYVOICE<tab>Однако, осторожнее... Твои враги отправились в место, где даже Юлмор не отважится обнажить сталь...","","False","0x00000073","",""
"","TEXT_VOICEMAN_05001_001120_MYSTERYVOICE<tab>Il Mheg, the faerie kingdom.","TEXT_VOICEMAN_05001_001120_MYSTERYVOICE<tab>Ил Мегг, королевство фей.","","False","0x00000074","",""
"","TEXT_VOICEMAN_05001_001130_EMETSELCH<tab>(-???-)To think that mountain of indolence still had the energy to unleash his hounds...","TEXT_VOICEMAN_05001_001130_EMETSELCH<tab>(-???-)Подумать только, эта жирная, ленивая гора имеет наглость рассылать всюду своих гончих...","","False","0x00000075","",""
"","TEXT_VOICEMAN_05001_001140_EMETSELCH<tab>(-???-)Even the most pointless of conflicts may alter a world's course... And now the plan has gone awry.","TEXT_VOICEMAN_05001_001140_EMETSELCH<tab>(-???-)Даже самый бестолковый конфликт может изменить судьбы мира... А теперь план покатился в тартарары.","","False","0x00000076","",""
"","TEXT_VOICEMAN_05001_001150_EMETSELCH<tab>(-???-)But how...? How did the so-called Crystal Exarch bring the hero of the Source to the First?","TEXT_VOICEMAN_05001_001150_EMETSELCH<tab>(-???-)Но как?.. Как этот Так-называемый-Экзарх сумел притащить героя Источника на Первый?","","False","0x00000077","",""
"","TEXT_VOICEMAN_05001_001160_EMETSELCH<tab>(-???-)As if I didn't have enough on my hands already...","TEXT_VOICEMAN_05001_001160_EMETSELCH<tab>(-???-)У меня и до этого было дел невпроворот...","","False","0x00000078","",""
"","TEXT_VOICEMAN_05001_001170_EMETSELCH<tab>(SIGH)","TEXT_VOICEMAN_05001_001170_EMETSELCH<tab>(SIGH)","","False","0x00000079","",""
"","TEXT_VOICEMAN_05001_001180_EMETSELCH<tab>(-???-)Then again...with a soul such as that...","TEXT_VOICEMAN_05001_001180_EMETSELCH<tab>(-???-)Опять таки... С такой душой, как у <var 08 E905 ((неё)) ((него)) /var>...","","False","0x0000007A","",""
"","TEXT_VOICEMAN_05001_001190_EMETSELCH<tab>(-???-)Mayhap there is another way. One which does not require bloodshed...","TEXT_VOICEMAN_05001_001190_EMETSELCH<tab>(-???-)Вполне возможно, есть другой путь. Необязательно прибегать к кровопролитию...","","False","0x0000007B","",""
"","TEXT_VOICEMAN_05001_001200_WARRIOROFDARKNESS<tab>Not so long ago, here in the shadow of the northern ranges, lay the great Kingdom of Voeburt.","TEXT_VOICEMAN_05001_001200_WARRIOROFDARKNESS<tab>Не так давно до самых северных гор здесь простиралось великое королевство Вебурт.","","False","0x0000007C","",""
"","TEXT_VOICEMAN_05001_001210_WARRIOROFDARKNESS<tab>A nation with a proud history...that the sin eaters cut short. Just like all the rest.","TEXT_VOICEMAN_05001_001210_WARRIOROFDARKNESS<tab>Нация с долгой и богатой историей... но уничтоженная на корню пожирателями. Как и многое другое.","","False","0x0000007D","",""
"","TEXT_VOICEMAN_05001_001220_WARRIOROFDARKNESS<tab>Since that time, these lands have become a haven for fae folk.","TEXT_VOICEMAN_05001_001220_WARRIOROFDARKNESS<tab>С тех пор эти земли стали прибежищем для фей.","","False","0x0000007E","",""
"","TEXT_VOICEMAN_05001_001230_WARRIOROFDARKNESS<tab>Dreamers frolicking amidst the ruins of a forgotten realm.","TEXT_VOICEMAN_05001_001230_WARRIOROFDARKNESS<tab>Мечтатели, снующие среди руин забытого царства.","","False","0x0000007F","",""
"","TEXT_VOICEMAN_05001_001240_THANCRED<tab>We should be safe enough here.","TEXT_VOICEMAN_05001_001240_THANCRED<tab>Здесь должно быть безопасно.","","False","0x00000080","",""
"","TEXT_VOICEMAN_05001_001250_THANCRED<tab>It's good to see you again, my friends. I don't know about you, but it feels like <var 1A 02 /var>years<var 1A 01 /var> since last we met. Five of them, in my case.","TEXT_VOICEMAN_05001_001250_THANCRED<tab>Рад снова вас видеть, друзья мои. Не знаю насчёт вас, но для меня с нашей последней встречи прошли <var 1A 02 /var>годы<var 1A 01 /var>. Пять лет - в моём случае.","","False","0x00000081","",""
"","TEXT_VOICEMAN_05001_001260_ALISAIE<tab>Why, it only feels like <var 1A 02 /var>one<var 1A 01 /var> to me. But long enough to warrant a more convivial reunion, either way.","TEXT_VOICEMAN_05001_001260_ALISAIE<tab>По мне так <var 1A 02 /var>всего годик<var 1A 01 /var> пришёл. В любом случае, перерыв, требующий воссоединения в более спокойных обстоятельствах.","","False","0x00000082","",""
"","TEXT_VOICEMAN_05001_001270_ALISAIE<tab>What brought you to Laxan Loft?","TEXT_VOICEMAN_05001_001270_ALISAIE<tab>Что привело тебя в Мансарду?","","False","0x00000083","",""
"","TEXT_VOICEMAN_05001_001280_THANCRED<tab>The girl, Minfilia. She and I were traveling together, hunting sin eaters.","TEXT_VOICEMAN_05001_001280_THANCRED<tab>Девчонка, Минфилия. Мы с ней путешествовали вместе, сражались с пожирателями.","","False","0x00000084","",""
"","TEXT_VOICEMAN_05001_001290_THANCRED<tab>But as we were nearing Lakeland, she abruptly ran off on her own.","TEXT_VOICEMAN_05001_001290_THANCRED<tab>Но когда мы приближались к Озёрному краю, она неожиданно припустила вперёд, сама по себе.","","False","0x00000085","",""
"","TEXT_VOICEMAN_05001_001300_THANCRED<tab>I found her too late to stop the Eulmorans from taking her prisoner. And as I was considering rescue options, I observed that the Crystarium was on the move.","TEXT_VOICEMAN_05001_001300_THANCRED<tab>Я отыскал её слишком поздно - юлморцы уже успели взять её в плен. И пока я решал, как её вызволить, заметил, что Кристариум тоже зашевелился...","","False","0x00000086","",""
"","TEXT_VOICEMAN_05001_001310_THANCRED<tab>So I consulted the Exarch, who apprised me of the details of the operation─and issued me certain instructions.","TEXT_VOICEMAN_05001_001310_THANCRED<tab>Так что я поговорил с Экзархом, который и ввёл меня в курс дела по поводу операции - и даже сделал меня её частью.","","False","0x00000087","",""
"","TEXT_VOICEMAN_05001_001320_THANCRED<tab>Should the situation take a turn for the worse, I was to see you all safely to Il Mheg. And here we are.","TEXT_VOICEMAN_05001_001320_THANCRED<tab>Если ситуация обернётся к худшему, сказал он мне, я должен буду вывести вас в Ил Мегг. И вот... мы здесь.","","False","0x00000088","",""
"","TEXT_VOICEMAN_05001_001330_ALPHINAUD<tab>Urianger has called this place home for a while now.","TEXT_VOICEMAN_05001_001330_ALPHINAUD<tab>Кстати, Урианже тут живёт уже некоторое время.","","False","0x00000089","",""
"","TEXT_VOICEMAN_05001_001340_ALPHINAUD<tab>Yet we have never called upon him, I am ashamed to say. 'Twas only at the Crystarium that we met.","TEXT_VOICEMAN_05001_001340_ALPHINAUD<tab>Неудобно признавать, но мы его так ни разу и не навестили... только встретились разочек в Кристариуме.","","False","0x0000008A","",""
"","TEXT_VOICEMAN_05001_001350_THANCRED<tab>Hardly surprising. This is not the sort of place one visits on a whim.","TEXT_VOICEMAN_05001_001350_THANCRED<tab>Ничего удивительного. Это не то место, куда следует соваться просто так.","","False","0x0000008B","",""
"","TEXT_VOICEMAN_05001_001360_THANCRED<tab>Happily, having trespassed on Urianger's hospitality for a spell, Minfilia and I have an idea of how things work around here.","TEXT_VOICEMAN_05001_001360_THANCRED<tab>К счастью, нам приходилось бывать здесь и насладиться гостеприимством Урианже, так что мы с Минфилией приблизительно понимаем, что тут да как...","","False","0x0000008C","",""
"","TEXT_VOICEMAN_05001_001370_THANCRED<tab>Sooner or later, the Eulmorans will come after us. But before they do, the Exarch bids us accomplish two things.","TEXT_VOICEMAN_05001_001370_THANCRED<tab>Рано или поздно юлморцы пойдут за нами. К тому моменту Экзарх попросил нас сделать две вещи...","","False","0x0000008D","",""
"","TEXT_VOICEMAN_05001_001380_THANCRED<tab>First, rendezvous with Urianger.","TEXT_VOICEMAN_05001_001380_THANCRED<tab>Во-первых, встретиться с Урианже.","","False","0x0000008E","",""
"","TEXT_VOICEMAN_05001_001390_THANCRED<tab>And second, eliminate the Lightwarden of this land.","TEXT_VOICEMAN_05001_001390_THANCRED<tab>И во-вторых, устранить Стража Света этих земель.","","False","0x0000008F","",""
"","TEXT_VOICEMAN_05001_001400_ALISAIE<tab>So...Minfilia.","TEXT_VOICEMAN_05001_001400_ALISAIE<tab>Итак... Минфилия?","","False","0x00000090","",""
"","TEXT_VOICEMAN_05001_001410_ALISAIE<tab>What made you leave Thancred behind─if you don't mind me asking?","TEXT_VOICEMAN_05001_001410_ALISAIE<tab>Что заставило тебя оставить Танкреда?.. Если ты не против ответить на вопрос.","","False","0x00000091","",""
"","TEXT_VOICEMAN_05001_001420_RYNE<tab>You. The hero from another world.","TEXT_VOICEMAN_05001_001420_RYNE<tab>Ты. Герой из другого мира.","","False","0x00000092","",""
"","TEXT_VOICEMAN_05001_001430_RYNE<tab>I was asleep when I felt it. A presence. Someone I was meant to meet. They were close, and...and I knew I had to go to them.","TEXT_VOICEMAN_05001_001430_RYNE<tab>Я спала, когда внезапно почувствовала... Присутствие. Кто-то, с кем мне надо было встретиться. Этот кто-то был очень близко, я... знала, что должна добраться туда.","","False","0x00000093","",""
