"location","source","target","id","fuzzy","context","translator_comments","developer_comments"
"","TEXT_CTSHNT60RISKYMOBELPIS_00765_BASILDERE_000_001<tab>Well met, good <var 08 E905 ((lady)) ((sir)) /var>. I am Basildere, one of the foremost scholars in the field of comparative mythology. It has been my life's work to scrutinize the myths of peoples across the land and throughout the ages, trying to glimpse the truth that hides behind commonalities these timeless stories share.","TEXT_CTSHNT60RISKYMOBELPIS_00765_BASILDERE_000_001<tab>Well met, good <var 08 E905 ((lady)) ((sir)) /var>. I am Basildere, one of the foremost scholars in the field of comparative mythology. It has been my life's work to scrutinize the myths of peoples across the land and throughout the ages, trying to glimpse the truth that hides behind commonalities these timeless stories share.","","True","0x00000000","",""
"","TEXT_CTSHNT60RISKYMOBELPIS_00765_BASILDERE_000_002<tab>Well met, good <var 08 E905 ((lady)) ((sir)) /var>. As one of the foremost scholars in the field of comparative mythology, I have tasked the gleaners' guildship with procuring samples to prove my theory that the creatures described in myth are, in fact, quite real. I take it I have your interest...","TEXT_CTSHNT60RISKYMOBELPIS_00765_BASILDERE_000_002<tab>Well met, good <var 08 E905 ((lady)) ((sir)) /var>. As one of the foremost scholars in the field of comparative mythology, I have tasked the gleaners' guildship with procuring samples to prove my theory that the creatures described in myth are, in fact, quite real. I take it I have your interest...","","True","0x00000001","",""
"","TEXT_CTSHNT60RISKYMOBELPIS_00765_BASILDERE_000_003<tab>（★未使用／削除予定★）","TEXT_CTSHNT60RISKYMOBELPIS_00765_BASILDERE_000_003<tab>（★未使用／削除予定★）","","True","0x00000002","",""
"","TEXT_CTSHNT60RISKYMOBELPIS_00765_BASILDERE_Q1_000_000<tab>What will you ask?","TEXT_CTSHNT60RISKYMOBELPIS_00765_BASILDERE_Q1_000_000<tab>What will you ask?","","True","0x00000003","",""
"","TEXT_CTSHNT60RISKYMOBELPIS_00765_BASILDERE_A1_000_001<tab>Tell me about the rank B elite mark. (Shockmaw)","TEXT_CTSHNT60RISKYMOBELPIS_00765_BASILDERE_A1_000_001<tab>Tell me about the rank B elite mark. (Shockmaw)","","True","0x00000004","",""
"","TEXT_CTSHNT60RISKYMOBELPIS_00765_BASILDERE_A1_000_002<tab>Tell me about the rank B elite mark. (Yumcax)","TEXT_CTSHNT60RISKYMOBELPIS_00765_BASILDERE_A1_000_002<tab>Tell me about the rank B elite mark. (Yumcax)","","True","0x00000005","",""
"","TEXT_CTSHNT60RISKYMOBELPIS_00765_BASILDERE_A1_000_003<tab>Tell me about the rank A elite mark. (Petalodus)","TEXT_CTSHNT60RISKYMOBELPIS_00765_BASILDERE_A1_000_003<tab>Tell me about the rank A elite mark. (Petalodus)","","True","0x00000006","",""
"","TEXT_CTSHNT60RISKYMOBELPIS_00765_BASILDERE_A1_000_004<tab>Tell me about the rank A elite mark. (Gurangatch)","TEXT_CTSHNT60RISKYMOBELPIS_00765_BASILDERE_A1_000_004<tab>Tell me about the rank A elite mark. (Gurangatch)","","True","0x00000007","",""
"","TEXT_CTSHNT60RISKYMOBELPIS_00765_BASILDERE_A1_000_005<tab>Tell me about the rank S elite mark. (Ophioneus)","TEXT_CTSHNT60RISKYMOBELPIS_00765_BASILDERE_A1_000_005<tab>Tell me about the rank S elite mark. (Ophioneus)","","True","0x00000008","",""
"","TEXT_CTSHNT60RISKYMOBELPIS_00765_BASILDERE_A1_000_006<tab>Tell me about the rank S elite mark. (Ker)","TEXT_CTSHNT60RISKYMOBELPIS_00765_BASILDERE_A1_000_006<tab>Tell me about the rank S elite mark. (Ker)","","True","0x00000009","",""
"","TEXT_CTSHNT60RISKYMOBELPIS_00765_BASILDERE_A1_000_007<tab>Nothing.","TEXT_CTSHNT60RISKYMOBELPIS_00765_BASILDERE_A1_000_007<tab>Nothing.","","True","0x0000000A","",""
"","TEXT_CTSHNT60RISKYMOBELPIS_00765_BASILDERE_000_010<tab>Legends of a great whale that roams the skies have been passed down from generation to generation the world over. Bismarck, the white whale worshipped by the Vanu Vanu and said to dwell amongst Abalathia's clouds, is merely the best-known example.","TEXT_CTSHNT60RISKYMOBELPIS_00765_BASILDERE_000_010<tab>Legends of a great whale that roams the skies have been passed down from generation to generation the world over. Bismarck, the white whale worshipped by the Vanu Vanu and said to dwell amongst Abalathia's clouds, is merely the best-known example.","","True","0x0000000B","",""
"","TEXT_CTSHNT60RISKYMOBELPIS_00765_BASILDERE_000_011<tab>Perchance such tales originated solely in the mind─ancient peoples shuddering at the sight of a vast wavekin, and imagining what horrors would reign should one take to the skies. Or perhaps, in the distant past, a creature akin to the mythic Lord of the Mists truly did inhabit the clouds...","TEXT_CTSHNT60RISKYMOBELPIS_00765_BASILDERE_000_011<tab>Perchance such tales originated solely in the mind─ancient peoples shuddering at the sight of a vast wavekin, and imagining what horrors would reign should one take to the skies. Or perhaps, in the distant past, a creature akin to the mythic Lord of the Mists truly did inhabit the clouds...","","True","0x0000000C","",""
"","TEXT_CTSHNT60RISKYMOBELPIS_00765_BASILDERE_000_012<tab>I believe it so─yet I need proof. My research indicates that the ancient creature would most closely resemble the south sea isles' legendary “Shockmaw,” but even if I am wrong...I must know.","TEXT_CTSHNT60RISKYMOBELPIS_00765_BASILDERE_000_012<tab>I believe it so─yet I need proof. My research indicates that the ancient creature would most closely resemble the south sea isles' legendary “Shockmaw,” but even if I am wrong...I must know.","","True","0x0000000D","",""
"","TEXT_CTSHNT60RISKYMOBELPIS_00765_BASILDERE_000_020<tab>Ah, this one is most intriguing. There is a myth passed down in the far west─in the land known as the New World─that tells of a deity named Yumcax, believed to rule over agriculture.","TEXT_CTSHNT60RISKYMOBELPIS_00765_BASILDERE_000_020<tab>Ah, this one is most intriguing. There is a myth passed down in the far west─in the land known as the New World─that tells of a deity named Yumcax, believed to rule over agriculture.","","True","0x0000000E","",""
"","TEXT_CTSHNT60RISKYMOBELPIS_00765_BASILDERE_000_021<tab>In this legend, Yumcax is described as an enormous tree that not only levitates, but is also possessed of a singular eye. Though there are certain similarities with the species of seedkin we know as treants, the differences are too marked to ignore.","TEXT_CTSHNT60RISKYMOBELPIS_00765_BASILDERE_000_021<tab>In this legend, Yumcax is described as an enormous tree that not only levitates, but is also possessed of a singular eye. Though there are certain similarities with the species of seedkin we know as treants, the differences are too marked to ignore.","","True","0x0000000F","",""
"","TEXT_CTSHNT60RISKYMOBELPIS_00765_BASILDERE_000_022<tab>In the interest of respecting your time, I shall get right to the point─I believe Yumcax once existed, in a time before memory. Even should it be a mere twig or scrap of bark, I am counting on you to procure a sample that proves my theory.","TEXT_CTSHNT60RISKYMOBELPIS_00765_BASILDERE_000_022<tab>In the interest of respecting your time, I shall get right to the point─I believe Yumcax once existed, in a time before memory. Even should it be a mere twig or scrap of bark, I am counting on you to procure a sample that proves my theory.","","True","0x00000010","",""
"","TEXT_CTSHNT60RISKYMOBELPIS_00765_BASILDERE_000_030<tab>An Eorzean acquaintance of mine recently informed me of a most confounding incident. Evidently, a shark walking upon two legs assaulted the site of an annual faire! Though it defies reason, I cannot but feel...excited.","TEXT_CTSHNT60RISKYMOBELPIS_00765_BASILDERE_000_030<tab>An Eorzean acquaintance of mine recently informed me of a most confounding incident. Evidently, a shark walking upon two legs assaulted the site of an annual faire! Though it defies reason, I cannot but feel...excited.","","True","0x00000011","",""
"","TEXT_CTSHNT60RISKYMOBELPIS_00765_BASILDERE_000_031<tab>Why, you ask? As a matter of fact, a creature with the selfsame description appears in Nymian mythology─a creature known as the “petalodus.” I always found it an amusing thought, though of course the notion of a shark with ambulatory limbs beggars belief.","TEXT_CTSHNT60RISKYMOBELPIS_00765_BASILDERE_000_031<tab>Why, you ask? As a matter of fact, a creature with the selfsame description appears in Nymian mythology─a creature known as the “petalodus.” I always found it an amusing thought, though of course the notion of a shark with ambulatory limbs beggars belief.","","True","0x00000012","",""
"","TEXT_CTSHNT60RISKYMOBELPIS_00765_BASILDERE_000_032<tab>...Or does it? If we can verify that the petalodus once existed, I have my proof that certain Nymian myths must be founded in reality. And you shall have a charming story to share with your own friends, I'm sure.","TEXT_CTSHNT60RISKYMOBELPIS_00765_BASILDERE_000_032<tab>...Or does it? If we can verify that the petalodus once existed, I have my proof that certain Nymian myths must be founded in reality. And you shall have a charming story to share with your own friends, I'm sure.","","True","0x00000013","",""
"","TEXT_CTSHNT60RISKYMOBELPIS_00765_BASILDERE_000_040<tab>Though I am not proud of it, there was a period of time when I spent a fortune collecting Allagan tomestones, intent on scouring them for information pertaining to mythology.","TEXT_CTSHNT60RISKYMOBELPIS_00765_BASILDERE_000_040<tab>Though I am not proud of it, there was a period of time when I spent a fortune collecting Allagan tomestones, intent on scouring them for information pertaining to mythology.","","True","0x00000014","",""
"","TEXT_CTSHNT60RISKYMOBELPIS_00765_BASILDERE_000_041<tab>One such tomestone related a tale from the southern continent of Meracydia. It centers a spirit that resembles a crocodile─a spirit by the name of “Gurangatch.” Curiously, the myth claims that Gurangatch stands upright on its hind legs, roaming the land in search of...","TEXT_CTSHNT60RISKYMOBELPIS_00765_BASILDERE_000_041<tab>One such tomestone related a tale from the southern continent of Meracydia. It centers a spirit that resembles a crocodile─a spirit by the name of “Gurangatch.” Curiously, the myth claims that Gurangatch stands upright on its hind legs, roaming the land in search of...","","True","0x00000015","",""
"","TEXT_CTSHNT60RISKYMOBELPIS_00765_BASILDERE_000_042<tab>Never mind, that's not important. What matters is that I believe this to be more than a mere cautionary tale about the danger of crocodiles to their immediate community. Its inspiration must have been found in reality, and we are going to prove it!","TEXT_CTSHNT60RISKYMOBELPIS_00765_BASILDERE_000_042<tab>Never mind, that's not important. What matters is that I believe this to be more than a mere cautionary tale about the danger of crocodiles to their immediate community. Its inspiration must have been found in reality, and we are going to prove it!","","True","0x00000016","",""
"","TEXT_CTSHNT60RISKYMOBELPIS_00765_BASILDERE_000_050<tab>Comparative mythology is a field founded upon the close examination of myths of different cultures, with the aim of identifying any common traits they may share. Amongst these commonalities, one in particular has fascinated me─the multi-headed snake or dragon. ","TEXT_CTSHNT60RISKYMOBELPIS_00765_BASILDERE_000_050<tab>Comparative mythology is a field founded upon the close examination of myths of different cultures, with the aim of identifying any common traits they may share. Amongst these commonalities, one in particular has fascinated me─the multi-headed snake or dragon. ","","True","0x00000017","",""
"","TEXT_CTSHNT60RISKYMOBELPIS_00765_BASILDERE_000_051<tab>Ophioneus is just such a creature─a divine serpent found in several of the oldest legends that remain extant today.","TEXT_CTSHNT60RISKYMOBELPIS_00765_BASILDERE_000_051<tab>Ophioneus is just such a creature─a divine serpent found in several of the oldest legends that remain extant today.","","True","0x00000018","",""
"","TEXT_CTSHNT60RISKYMOBELPIS_00765_BASILDERE_000_052<tab>Initially, I believed it to be inspired by the hydra─a draconic creature bred artificially by the Allagans─until I discovered legends that predate even the Allagan Empire!","TEXT_CTSHNT60RISKYMOBELPIS_00765_BASILDERE_000_052<tab>Initially, I believed it to be inspired by the hydra─a draconic creature bred artificially by the Allagans─until I discovered legends that predate even the Allagan Empire!","","True","0x00000019","",""
"","TEXT_CTSHNT60RISKYMOBELPIS_00765_BASILDERE_000_053<tab>There is a distinct possibility that a multi-headed serpent─<var 1A 02 /var>this<var 1A 01 /var> multi-headed serpent─once lived. Also, it likely ate cloudkin eggs. Write that down.","TEXT_CTSHNT60RISKYMOBELPIS_00765_BASILDERE_000_053<tab>There is a distinct possibility that a multi-headed serpent─<var 1A 02 /var>this<var 1A 01 /var> multi-headed serpent─once lived. Also, it likely ate cloudkin eggs. Write that down.","","True","0x0000001A","",""
"","TEXT_CTSHNT60RISKYMOBELPIS_00765_BASILDERE_000_060<tab>Myths serve myriad purposes, but one of the more prominent sorts is cautionary tales. Among such stories, those of Ker may be the most terrifying.","TEXT_CTSHNT60RISKYMOBELPIS_00765_BASILDERE_000_060<tab>Myths serve myriad purposes, but one of the more prominent sorts is cautionary tales. Among such stories, those of Ker may be the most terrifying.","","True","0x0000001B","",""
"","TEXT_CTSHNT60RISKYMOBELPIS_00765_BASILDERE_000_061<tab>It is said that Ker appears on the battlefield to feast upon the souls of the dead, hunting down the living she lays eyes upon unto the ends of the earth. She brings naught but a swift demise to those who dream of glory.","TEXT_CTSHNT60RISKYMOBELPIS_00765_BASILDERE_000_061<tab>It is said that Ker appears on the battlefield to feast upon the souls of the dead, hunting down the living she lays eyes upon unto the ends of the earth. She brings naught but a swift demise to those who dream of glory.","","True","0x0000001C","",""
"","TEXT_CTSHNT60RISKYMOBELPIS_00765_BASILDERE_000_062<tab>If I was to postulate that Ker is not merely mythological─which I do─she must be some manner of ashkin. “Undead,” in layman's terms. This would explain how millennia can pass without a sighting...","TEXT_CTSHNT60RISKYMOBELPIS_00765_BASILDERE_000_062<tab>If I was to postulate that Ker is not merely mythological─which I do─she must be some manner of ashkin. “Undead,” in layman's terms. This would explain how millennia can pass without a sighting...","","True","0x0000001D","",""
"","TEXT_CTSHNT60RISKYMOBELPIS_00765_BASILDERE_000_063<tab>However, legend has it that her “shrouds” are ever in search of new prey for their mistress, so hope yet remains. Should you glimpse these spirits in reddened rags as you sheathe your own bloodied weapon, pray keep your wits about you...","TEXT_CTSHNT60RISKYMOBELPIS_00765_BASILDERE_000_063<tab>However, legend has it that her “shrouds” are ever in search of new prey for their mistress, so hope yet remains. Should you glimpse these spirits in reddened rags as you sheathe your own bloodied weapon, pray keep your wits about you...","","True","0x0000001E","",""
