"location","source","target","id","fuzzy","context","translator_comments","developer_comments"
"","TEXT_FESXMS2022OMAKE_00800_LAURENSSEN_000_000<tab>You are very good to accompany us, adventurer!","TEXT_FESXMS2022OMAKE_00800_LAURENSSEN_000_000<tab>Schön, dass du uns begleitest, <var 08 E905 ((Abenteurerin)) ((Abenteurer)) /var>!","","False","0x00000000","",""
"","TEXT_FESXMS2022OMAKE_00800_LAURENSSEN_000_001<tab>Our task is simple─we shall take Blitzen on a tour of Gridania and delight the children we meet with the Ghost of Starlight Present. ","TEXT_FESXMS2022OMAKE_00800_LAURENSSEN_000_001<tab>Unser Aufgabe ist einfach<var 1D /var>- wir werden Blitzen auf einen Rundgang durch Gridania mitnehmen und die Kinder, die wir treffen, mit dem Geist des Sternenlichtfests erfreuen.","","False","0x00000001","",""
"","TEXT_FESXMS2022OMAKE_00800_LAURENSSEN_000_002<tab>A red-clad army of little helpers will be circulating the city and distributing parcels of a more material nature, but I believe that our present mirage will provide the perfect skydrop to such gift-giving.","TEXT_FESXMS2022OMAKE_00800_LAURENSSEN_000_002<tab>Eine Schar von rot gekleideten Kleinen Helferlein wird durch die Stadt ziehen und Geschenke von etwas materiellerer Natur verteilen, doch ich glaube, dass unsere Illusion die perfekte Bühne für solch eine Geschenkausgabe zaubern wird.","","False","0x00000002","",""
"","TEXT_FESXMS2022OMAKE_00800_LAURENSSEN_000_003<tab>I was hoping to rely on your knowledge of the area to guide us in an appropriate direction. Does this sound acceptable?","TEXT_FESXMS2022OMAKE_00800_LAURENSSEN_000_003<tab>Ich hatte gehofft, mich auf deine Ortskenntnisse verlassen zu können, um uns in die richtige Richtung zu weisen. Klingt das akzeptabel?","","False","0x00000003","",""
"","TEXT_FESXMS2022OMAKE_00800_LAURENSSEN_000_004<tab>Marvelous! Now then, where shall we be off to?","TEXT_FESXMS2022OMAKE_00800_LAURENSSEN_000_004<tab>Großartig! Also dann, wohin sollen wir aufbrechen?","","False","0x00000004","",""
"","TEXT_FESXMS2022OMAKE_00800_Q1_000_000<tab>What will you say?","TEXT_FESXMS2022OMAKE_00800_Q1_000_000<tab>Was möchtest du sagen?","","False","0x00000005","",""
"","TEXT_FESXMS2022OMAKE_00800_A1_000_000<tab>The Greatloam Growery.","TEXT_FESXMS2022OMAKE_00800_A1_000_000<tab>Zur Ährenkranzkolonie.","","False","0x00000006","",""
"","TEXT_FESXMS2022OMAKE_00800_A1_000_001<tab>The Leatherworkers' Guild.","TEXT_FESXMS2022OMAKE_00800_A1_000_001<tab>Zur Gerbergilde.","","False","0x00000007","",""
"","TEXT_FESXMS2022OMAKE_00800_A1_000_002<tab>The markets.","TEXT_FESXMS2022OMAKE_00800_A1_000_002<tab>Zu den Marktständen.","","False","0x00000008","",""
"","TEXT_FESXMS2022OMAKE_00800_A1_000_003<tab>The Whistling Miller.","TEXT_FESXMS2022OMAKE_00800_A1_000_003<tab>Zum Trällernden Müller.","","False","0x00000009","",""
"","TEXT_FESXMS2022OMAKE_00800_A1_000_004<tab>Apkallu Falls.","TEXT_FESXMS2022OMAKE_00800_A1_000_004<tab>Zu den Apkallu-Fällen.","","False","0x0000000A","",""
"","TEXT_FESXMS2022OMAKE_00800_A1_000_005<tab>Never mind.","TEXT_FESXMS2022OMAKE_00800_A1_000_005<tab>Lass mich noch ein wenig darüber nachdenken.","","False","0x0000000B","",""
"","TEXT_FESXMS2022OMAKE_00800_LAURENSSEN_000_005<tab>Very well. Let us go spread our Starlight cheer!","TEXT_FESXMS2022OMAKE_00800_LAURENSSEN_000_005<tab>Also dann. Lass uns die Sternenlichtfreude verbreiten!","","False","0x0000000C","",""
"","TEXT_FESXMS2022OMAKE_00800_CHILDA00800_100_010<tab>Wow, a real reindeer! I've only ever seen them in books before!","TEXT_FESXMS2022OMAKE_00800_CHILDA00800_100_010<tab>Wow, ein echtes Rentier! Die habe ich bisher nur in Büchern gesehen!","","False","0x0000000D","",""
"","TEXT_FESXMS2022OMAKE_00800_LAURENSSEN_110_010<tab>On, Blitzen! Reveal the Ghost of Starlight Present to this studious young child!","TEXT_FESXMS2022OMAKE_00800_LAURENSSEN_110_010<tab>Oh, Blitzen! Offenbare diesen jungen Kindern den Geist des Sternenlichtfests!","","False","0x0000000E","",""
"","TEXT_FESXMS2022OMAKE_00800_CHILDA00800_120_010<tab>Aaah! The colors! The shine!","TEXT_FESXMS2022OMAKE_00800_CHILDA00800_120_010<tab>Aaah! Diese Farben! Wie das glänzt!","","False","0x0000000F","",""
"","TEXT_FESXMS2022OMAKE_00800_BEATINE_000_010<tab>Indeed─like the rich blush of freshly cut cedar! Happy Starlight, youngling. We, the little helpers of the Saint of Nymeia, have come bearing a gift of equal spectacle.","TEXT_FESXMS2022OMAKE_00800_BEATINE_000_010<tab>In der Tat<var 1D /var>- wie die tiefe Röte einer frisch geschnittenen Zeder! Frohes Sternenlichtfest, Jünglingen. Wir, die Kleinen Helferlein des Heiligen von Nymeia haben ähnlich spektakuläre Geschenke mitgebracht.","","False","0x00000010","",""
"","TEXT_FESXMS2022OMAKE_00800_FUFUCHA_000_011<tab>We hope you find it to your liking!","TEXT_FESXMS2022OMAKE_00800_FUFUCHA_000_011<tab>Es gibt genug für alle, also besteht kein Grund zur Sorge!","","False","0x00000011","",""
"","TEXT_FESXMS2022OMAKE_00800_CHILDA00800_000_012<tab>These are...hunks of wood.","TEXT_FESXMS2022OMAKE_00800_CHILDA00800_000_012<tab>Das sind ... Holzstücke.","","False","0x00000012","",""
"","TEXT_FESXMS2022OMAKE_00800_BEATINE_000_013<tab>It is a lumber set, child. Comprised of the finest selection of timber these forests can afford. You have your soft-grained maple, some supple ash, a stern oak... Cannot you hear the symphony?","TEXT_FESXMS2022OMAKE_00800_BEATINE_000_013<tab>Es ist ein Holzset, mein Kind. Bestehend aus der besten Auswahl an Holz, das in diesen Wälder zu finden ist. Sanft gemaserter Ahorn, etwas geschmeidige Esche, eine strenge Eiche<var 1D /var>... Hörst du nicht, wie es zu dir spricht?","","False","0x00000013","",""
"","TEXT_FESXMS2022OMAKE_00800_CHILDA00800_000_014<tab>Er... No, not really...","TEXT_FESXMS2022OMAKE_00800_CHILDA00800_000_014<tab>Äh ... Nein, eigentlich nicht ...","","False","0x00000014","",""
"","TEXT_FESXMS2022OMAKE_00800_FUFUCHA_000_015<tab>Those are building blocks, my dear. Made especially for you by the Carpenters' Guild!","TEXT_FESXMS2022OMAKE_00800_FUFUCHA_000_015<tab>Diese sind Bauklötze, meine Lieber. Von der Gerbergilde speziell für dich angefertigt!","","False","0x00000015","",""
"","TEXT_FESXMS2022OMAKE_00800_CHILDA00800_000_016<tab>Oh! I love blocks! Thank you, little helpers!","TEXT_FESXMS2022OMAKE_00800_CHILDA00800_000_016<tab>Oh! Ich liebe Klötze! Vielen Dank, Kleine Helferlein!","","False","0x00000016","",""
"","TEXT_FESXMS2022OMAKE_00800_BEATINE_000_017<tab>Curious that he should appreciate “blocks” over fine cross-sections of lumber. Puzzling indeed...","TEXT_FESXMS2022OMAKE_00800_BEATINE_000_017<tab>Eigenartig, dass er „Klötze“ einer feinen Auswahl an Holz vorzieht<var 1D /var>... Höchst sonderbar<var 1D /var>...","","False","0x00000017","",""
"","TEXT_FESXMS2022OMAKE_00800_FUFUCHA_000_018<tab><var 2C ((<var 29 EB02 /var>)) (( )) 02 /var>! What a pleasant surprise.","TEXT_FESXMS2022OMAKE_00800_FUFUCHA_000_018<tab><var 2C ((<var 29 EB02 /var>)) (( )) 02 /var>! Welch eine angenehme Überraschung.","","False","0x00000018","",""
"","TEXT_FESXMS2022OMAKE_00800_FUFUCHA_000_019<tab>Why, hello, adventurer! Are you this reindeer's friend?","TEXT_FESXMS2022OMAKE_00800_FUFUCHA_000_019<tab>Oh, hallo, <var 08 E905 ((Abenteurerin)) ((Abenteurer)) /var>! Bist du mit diesem Rentier befreundet?","","False","0x00000019","",""
"","TEXT_FESXMS2022OMAKE_00800_FUFUCHA_000_020<tab>As you can see, I'm one of the saint's little helpers today.","TEXT_FESXMS2022OMAKE_00800_FUFUCHA_000_020<tab>Wie du sehen kannst, bin ich heute eines der Kleinen Helferlein des Heiligen.","","False","0x0000001A","",""
"","TEXT_FESXMS2022OMAKE_00800_FUFUCHA_000_021<tab>Our gifts are a joint effort─Beatin's people at the Carpenters' Guild made some beautiful blocks out of the wood that my botanists gleaned during our forest maintenance.","TEXT_FESXMS2022OMAKE_00800_FUFUCHA_000_021<tab>Unsere Geschenke sind eine gemeinsame Anstrengung. Beatins Leute von der Gerbergilde haben wunderschöne Blöcke aus Holz angefertigt, das meine Gärtner während der Pflege des Waldes zu<var 16 /var>sammen<var 16 /var>getragen haben.","","False","0x0000001B","",""
"","TEXT_FESXMS2022OMAKE_00800_FUFUCHA_000_023<tab>I only hope these blocks will help plant seeds of inspiration within the hearts of our younglings, so that they mature into adults cognizant of nature's import. ...But enough of my vegetation metaphors─we have presents to distribute!","TEXT_FESXMS2022OMAKE_00800_FUFUCHA_000_023<tab>Ich kann nur hoffen, dass diese Blöcke eine Quelle der Inspiration für die Herzen der Kinder sein werden, sodass sie zu Erwachsenen heranwachsen, die sich der Bedeutung der Natur gewahr sind. Doch genug geredet, wir haben Geschenke zu verteilen!","","False","0x0000001C","",""
"","TEXT_FESXMS2022OMAKE_00800_FUFUCHA_000_024<tab>Let's go, Timbermaster Beatin! Needy tots await.","TEXT_FESXMS2022OMAKE_00800_FUFUCHA_000_024<tab>Lass uns gehen, Beatin! Die Kinder erwarten uns schon sehnsüchtig.","","False","0x0000001D","",""
"","TEXT_FESXMS2022OMAKE_00800_BEATINE_000_025<tab>Yes, yes. Let us use that little “blocks” joke from earlier─it seemed rather effective. Farewell, adventurer...and happy Starlight.","TEXT_FESXMS2022OMAKE_00800_BEATINE_000_025<tab>Ja, ja. Lass uns noch mal diesen Witz mit den kleinen Blöcken machen<var 1D /var>- der schien ziemlich gut anzukommen. Auf Wieder<var 16 /var>sehen, <var 08 E905 ((Abenteurerin)) ((Abenteurer)) /var><var 1D /var>... und frohes Sternenlichtfest!","","False","0x0000001E","",""
"","TEXT_FESXMS2022OMAKE_00800_CHILDB00800_100_030<tab>Oh! This is my first time meeting a reindeer─is he friendly?","TEXT_FESXMS2022OMAKE_00800_CHILDB00800_100_030<tab>Oh! Das ist das erste Mal, dass ich ein Rentier treffe<var 1D /var>- ist es freundlich?","","False","0x0000001F","",""
"","TEXT_FESXMS2022OMAKE_00800_LAURENSSEN_110_030<tab>On, Blitzen! Reveal the Ghost of Starlight Present to this merry moppet!","TEXT_FESXMS2022OMAKE_00800_LAURENSSEN_110_030<tab>Los, Blitzen! Offenbare diesen süßen Kleinen den Geist des Sternenlichtfests!","","False","0x00000020","",""
"","TEXT_FESXMS2022OMAKE_00800_CHILDB00800_120_030<tab>Goodness me! I've never seen anything so lovely!","TEXT_FESXMS2022OMAKE_00800_CHILDB00800_120_030<tab>Du meine Güte! So etwas Schönes habe ich ja noch nie gesehen!","","False","0x00000021","",""
"","TEXT_FESXMS2022OMAKE_00800_GEVA_000_030<tab>How about a present from the saint's little helper? Maybe not as sensational, but these will last you longer.","TEXT_FESXMS2022OMAKE_00800_GEVA_000_030<tab>Wie wär's mit ein paar Geschenken von dem Kleinen Helferlein des Heiligen? Sie sind vielleicht nicht ganz so sensationell, aber dafür halten sie länger.","","False","0x00000022","",""
"","TEXT_FESXMS2022OMAKE_00800_CHILDB00800_000_031<tab>Leather accessories!? How adorable! Thank you, little helper, thank you!","TEXT_FESXMS2022OMAKE_00800_CHILDB00800_000_031<tab>Leder-Accessoires!? Wie süß! Vielen Dank, Kleines Helferlein!","","False","0x00000023","",""
"","TEXT_FESXMS2022OMAKE_00800_GEVA_000_032<tab>Hmph. Darling little thing, eh?","TEXT_FESXMS2022OMAKE_00800_GEVA_000_032<tab>Hmpf. Bezaubernde kleine Kreaturen, was?","","False","0x00000024","",""
"","TEXT_FESXMS2022OMAKE_00800_GEVA_000_033<tab>...I trust you're fulfilling your Starlight duties with the dignity expected of you, yes?","TEXT_FESXMS2022OMAKE_00800_GEVA_000_033<tab>... Ich hoffe doch, du erfüllst deine Sternenlichtfest-Pflichten mit der gebotenen Würde, ja?","","False","0x00000025","",""
"","TEXT_FESXMS2022OMAKE_00800_GEVA_000_034<tab>I trust you're enjoying your work assisting this year's Starlight Celebration?","TEXT_FESXMS2022OMAKE_00800_GEVA_000_034<tab>Ich hoffe, du genießt deine Arbeit bei der Unterstützung des diesjährigen Sternenlichtfests?","","False","0x00000026","",""
"","TEXT_FESXMS2022OMAKE_00800_GEVA_000_035<tab>I too have volunteered my services this year. I thought it only right, seeing how much my own little ones delight in this season.","TEXT_FESXMS2022OMAKE_00800_GEVA_000_035<tab>Auch ich habe mich dieses Jahr als Freiwillige gemeldet. Nachdem ich gesehen habe, wie sehr meine eigenen Kinder diese Jahreszeit genießen, hielt ich das für angebracht.","","False","0x00000027","",""
"","TEXT_FESXMS2022OMAKE_00800_GEVA_000_036<tab>'Tis remarkable how the smile of any child can warm the heart surer than flame. That sort of honest purity is difficult to come by.","TEXT_FESXMS2022OMAKE_00800_GEVA_000_036<tab>Es ist bemerkenswert, wie das Lächeln eines Kindes einem das Herz erwärmen kann. Diese Art von aufrichtiger Reinheit sieht man nicht oft.","","False","0x00000028","",""
"","TEXT_FESXMS2022OMAKE_00800_GEVA_000_038<tab>Anyway, I must be off. Enjoy the rest of the festivities.","TEXT_FESXMS2022OMAKE_00800_GEVA_000_038<tab>Wie dem auch sei, ich muss los. Genieße den Rest der Feierlichkeiten.","","False","0x00000029","",""
"","TEXT_FESXMS2022OMAKE_00800_CHILDC00800_100_040<tab>Wow! Reindeer are massive! Look at him! He's massive!","TEXT_FESXMS2022OMAKE_00800_CHILDC00800_100_040<tab>Wow! Rentiere sind ja riesig! Sieh ihn dir an! Er ist riesengroß!","","False","0x0000002A","",""
"","TEXT_FESXMS2022OMAKE_00800_LAURENSSEN_110_040<tab>On, Blitzen! Reveal the Ghost of Christmas Present to this tiny tot!","TEXT_FESXMS2022OMAKE_00800_LAURENSSEN_110_040<tab>Los, Blitzen! Offenbare diesen kleinen Rackern den Geist des Sternenlichtfests!","","False","0x0000002B","",""
"","TEXT_FESXMS2022OMAKE_00800_CHILDC00800_120_040<tab>Nymeia's knickers! That's incredible!","TEXT_FESXMS2022OMAKE_00800_CHILDC00800_120_040<tab>Wahnsinn! Das ist ja unglaublich!","","False","0x0000002C","",""
"","TEXT_FESXMS2022OMAKE_00800_MIOUNNE_000_040<tab>(-???-)Happy Starlight, my child! This little helper has arrived with a gift for you.","TEXT_FESXMS2022OMAKE_00800_MIOUNNE_000_040<tab>Frohes Sternenlichtfest, Kinder! Euer Kleines Helferlein ist hier und hat Geschenke für euch alle mitgebracht.","","False","0x0000002D","",""
"","TEXT_FESXMS2022OMAKE_00800_CHILDC00800_000_041<tab>These are...cookies!? My favorite! Thank you, little helper! I can't wait to tuck in!","TEXT_FESXMS2022OMAKE_00800_CHILDC00800_000_041<tab>Das sind ... Kekse!? Die mag ich am liebsten! Ich werde sie gemütlich bei mir im Bett futtern!","","False","0x0000002E","",""
"","TEXT_FESXMS2022OMAKE_00800_MIOUNNE_000_042<tab>Well, if it isn't <var 09 E947 ((<var 2C ((<var 29 EB02 /var>)) (( )) 03 /var>)) ((<var 2C ((<var 29 EB02 /var>)) (( )) 02 /var>)) ((<var 2C ((<var 29 EB02 /var>)) (( )) 03 /var>)) /var>! Lending your assistance to the Starlight Celebration?","TEXT_FESXMS2022OMAKE_00800_MIOUNNE_000_042<tab>Na, wenn das nicht <var 09 E947 ((<var 2C ((<var 29 EB02 /var>)) (( )) 03 /var>)) ((<var 2C ((<var 29 EB02 /var>)) (( )) 02 /var>)) ((<var 2C ((<var 29 EB02 /var>)) (( )) 03 /var>)) /var> ist! Hilfst du bei den Feierlichkeiten zum Sternenlichtfest?","","False","0x0000002F","",""
"","TEXT_FESXMS2022OMAKE_00800_MIOUNNE_000_043<tab>I too have volunteered my services as a little helper this year.","TEXT_FESXMS2022OMAKE_00800_MIOUNNE_000_043<tab>Auch ich habe dieses Jahr meine Dienste als Kleines Helferlein angeboten.","","False","0x00000030","",""
"","TEXT_FESXMS2022OMAKE_00800_MIOUNNE_000_044<tab>The Carline Canopy is offering its support for the festivities as well. We have a special children's menu for the occasion and other festoonery besides. 'Tis the season, after all!","TEXT_FESXMS2022OMAKE_00800_MIOUNNE_000_044<tab>Das Hexenstübchen unterstützt die Feierlichkeiten ebenfalls. Wir haben ein spezielles Kindermenü für diesen Anlass und einiges an Festdekoration. Immerhin ist dies ein Zeit der Freude!","","False","0x00000031","",""
"","TEXT_FESXMS2022OMAKE_00800_MIOUNNE_000_045<tab>Now, while I would love to chat further, I must be off. I hope to see you again at the Canopy sometime!","TEXT_FESXMS2022OMAKE_00800_MIOUNNE_000_045<tab>Ich würde mich ja gerne noch etwas mit dir unterhalten, aber ich muss weiter. Ich hoffe, ich sehe dich mal wieder im Hexenstübchen!","","False","0x00000032","",""
"","TEXT_FESXMS2022OMAKE_00800_CHILDD00800_100_050<tab>Why good day, Mister Reindeer! You have quite an adorable face and snuffly nose at that!","TEXT_FESXMS2022OMAKE_00800_CHILDD00800_100_050<tab>Guten Tag, Rentier! Du hast aber ein hübsches Gesicht, und so eine süße Nase!","","False","0x00000033","",""
"","TEXT_FESXMS2022OMAKE_00800_LAURENSSEN_110_050<tab>On, Blitzen! Reveal the Ghost of Starlight Present to this little small!","TEXT_FESXMS2022OMAKE_00800_LAURENSSEN_110_050<tab>Los, Blitzen! Offenbare diesen Jünglingen den Geist des Sternenlichtfests!","","False","0x00000034","",""
"","TEXT_FESXMS2022OMAKE_00800_CHILDD00800_120_050<tab>What a beautiful spectacle of lights! Mister Reindeer, you are very kind indeed!","TEXT_FESXMS2022OMAKE_00800_CHILDD00800_120_050<tab>Welch ein wunderschönes Lichterspektakel! Rentier, du bist einfach spitze!","","False","0x00000035","",""
"","TEXT_FESXMS2022OMAKE_00800_AYMERIC_000_050<tab>(-???-)Is that a youngling enthralled by visions of Starlight? As the saint's little helper, I can think of none more deserving of this present from the far north...","TEXT_FESXMS2022OMAKE_00800_AYMERIC_000_050<tab>Was sehe ich dann da? Eine Gruppe Kinder, die von dem Geist des Sternenlichtfests bezaubert sind! Als Kleines Helferlein des Heiligen gibt es wohl niemand, der diese Geschenke aus dem fernen Norden mehr verdient hätte<var 1D /var>...","","False","0x00000036","",""
"","TEXT_FESXMS2022OMAKE_00800_CHILDD00800_000_051<tab>An Ishgardian coat? Oh, how downy and warm! I shall treasure it, little helper! Thank you with all my heart!","TEXT_FESXMS2022OMAKE_00800_CHILDD00800_000_051<tab>Ein Ishgarder Mantel? Oh, wie flauschig und warm! Den werde ich hüten wie einen Schatz, Kleines Helferlein! Vielen lieben Dank!","","False","0x00000037","",""
"","TEXT_FESXMS2022OMAKE_00800_AYMERIC_000_052<tab>What a pleasant surprise to meet you here, my friend! You are lending your capable hand to the observances, I take it?","TEXT_FESXMS2022OMAKE_00800_AYMERIC_000_052<tab>Welch eine angenehme Überraschung, dich hier zu treffen, <var 08 E905 ((meine Liebe)) ((mein Freund)) /var>! Du hilfst bei den Feierlichkeiten aus, nehme ich an?","","False","0x00000038","",""
"","TEXT_FESXMS2022OMAKE_00800_AYMERIC_000_053<tab>As a citizen of Starlight's birthplace, I felt compelled to volunteer my services in some way, however small. And thus I seem to have become a little helper.","TEXT_FESXMS2022OMAKE_00800_AYMERIC_000_053<tab>Als Bürger des Geburtsortes des Sternenlichtfests fühlte ich mich auch verpflichtet, meine Dienste irgendwie zur Verfügung zu stellen. Und so wurde aus mir wohl ein Kleines Helferlein.","","False","0x00000039","",""
"","TEXT_FESXMS2022OMAKE_00800_AYMERIC_000_054<tab>Of course, the more <var 1A 02 /var>official<var 1A 01 /var> matter of an audience with Kan-E-Senna calls me here as well, but I am glad it affords me the opportunity to bear witness to the bright smiles of Gridania's children.","TEXT_FESXMS2022OMAKE_00800_AYMERIC_000_054<tab>Natürlich habe ich <var 1A 02 /var>offizielle<var 1A 01 /var> Dinge bei einer Audienz mit Kan-E-Senna hier zu besprechen, doch ich bin froh, das Lächeln der Kindern von Gridania mit ansehen zu können.","","False","0x0000003A","",""
"","TEXT_FESXMS2022OMAKE_00800_AYMERIC_000_055<tab>Yes, I have always been quite fond of this season myself. Though I must confess that as colors go, I am somewhat partial to blue...","TEXT_FESXMS2022OMAKE_00800_AYMERIC_000_055<tab>Ja, ich mochte dieses Jahreszeit schon immer sehr gern. Aber was Farben angeht, ist mir Blau doch deutlich lieber<var 1D /var>...","","False","0x0000003B","",""
"","TEXT_FESXMS2022OMAKE_00800_AYMERIC_000_056<tab>...Hm? Why is it that I feel we have spoken of this before? Strange...","TEXT_FESXMS2022OMAKE_00800_AYMERIC_000_056<tab>... Hm? Warum nur habe ich das Gefühl, dass wir darüber schon mal geredet haben? Seltsam<var 1D /var>...","","False","0x0000003C","",""
"","TEXT_FESXMS2022OMAKE_00800_AYMERIC_000_057<tab>Anyway, I shall continue delivering my gifts until my other duties compel me away from the festivities. Until we meet again!","TEXT_FESXMS2022OMAKE_00800_AYMERIC_000_057<tab>Wie dem auch sei, ich werde weiter Geschenke ausliefern, bis meine anderen Pflichten von den Feierlichkeiten abhalten werden. Bis bald mal wieder!","","False","0x0000003D","",""
"","TEXT_FESXMS2022OMAKE_00800_CHILDE00800_100_060<tab>That...that's a big reindeer.","TEXT_FESXMS2022OMAKE_00800_CHILDE00800_100_060<tab>Das ... Das ist aber ein großes Rentier ...","","False","0x0000003E","",""
"","TEXT_FESXMS2022OMAKE_00800_LAURENSSEN_110_060<tab>On, Blitzen! Reveal the Ghost of Starlight Present to this rosy-cheeked cherub!","TEXT_FESXMS2022OMAKE_00800_LAURENSSEN_110_060<tab>Los, Blitzen! Offenbare diesen pausbäckigen Kleinen den Geist des Sternenlichtfests!","","False","0x0000003F","",""
"","TEXT_FESXMS2022OMAKE_00800_CHILDE00800_120_060<tab>Wah! What...what sparkling presents.","TEXT_FESXMS2022OMAKE_00800_CHILDE00800_120_060<tab>Woah! Wie ... Wie das funkelt ...","","False","0x00000040","",""
"","TEXT_FESXMS2022OMAKE_00800_EMMANELLAIN_000_060<tab>Starlight greetings, you precious poppet! I, the saint's little helper, have come bearing a gift of both sparkle <var 1A 02 /var>and<var 1A 01 /var> substance! Here you go!","TEXT_FESXMS2022OMAKE_00800_EMMANELLAIN_000_060<tab>Fröhliche Sternenlichtgrüße, meine lieben Kleinen! Ich, das Kleine Helferlein des Heiligen, bringe Geschenke, die nicht nur funkeln, sondern auch Substanz haben! Bitte sehr!","","False","0x00000041","",""
"","TEXT_FESXMS2022OMAKE_00800_CHILDE00800_000_061<tab>A lovely doll...with such pretty eyes. Thank you, little helper.","TEXT_FESXMS2022OMAKE_00800_CHILDE00800_000_061<tab>Eine süße Puppe ... mit so hübschen Augen. Vielen Dank, Kleines Helferlein.","","False","0x00000042","",""
"","TEXT_FESXMS2022OMAKE_00800_SICARD_000_062<tab>(-???-)Ha! Should've reckoned you wouldn't know a gift from a goobbue!","TEXT_FESXMS2022OMAKE_00800_SICARD_000_062<tab>(-???-)Ha! Ich hätte wissen sollen, dass du ein Geschenk nicht von einer Goobbue unterscheiden kannst!","","False","0x00000043","",""
"","TEXT_FESXMS2022OMAKE_00800_EMMANELLAIN_000_063<tab>Ruffian! What are <var 1A 02 /var>you<var 1A 01 /var> doing here!?","TEXT_FESXMS2022OMAKE_00800_EMMANELLAIN_000_063<tab>Leofard, du alter Raufbold! Was machst <var 1A 02 /var>du<var 1A 01 /var> denn hier!?","","False","0x00000044","",""
"","TEXT_FESXMS2022OMAKE_00800_SICARD_000_064<tab>The saint <var 1A 02 /var>personally<var 1A 01 /var> tasked me, his most accomplished little helper, with deliverin' this far superior gift. Here you are, young one.","TEXT_FESXMS2022OMAKE_00800_SICARD_000_064<tab>Der Heilige hat mich, sein herausragendstes Kleines Helferlein, <var 1A 02 /var>persönlich<var 1A 01 /var> damit beauftragt, diese weitaus überlegenen Geschenke auszuliefern. Hier, meine Kleine.","","False","0x00000045","",""
"","TEXT_FESXMS2022OMAKE_00800_CHILDE00800_000_065<tab>A little frypan...with such adorable forks and spoons. Thank you, little helper.","TEXT_FESXMS2022OMAKE_00800_CHILDE00800_000_065<tab>Eine kleine Bratpfanne ... mit solch süßen Gabeln und Löffeln. Vielen Dank, Kleines Helferlein.","","False","0x00000046","",""
"","TEXT_FESXMS2022OMAKE_00800_SICARD_000_066<tab>Heh! See? A gift that represents the glory and traditions of Limsa Lominsa's peerless culinary history! More thoughtful by far than some half-baked doll procured by some half-baked noble!","TEXT_FESXMS2022OMAKE_00800_SICARD_000_066<tab>Ha! Siehst du? Geschenke, die den Ruhm und die Traditionen der un<var 16 /var>ver<var 16 /var>gleich<var 16 /var>li<var 16 /var>chen kulinarischen Geschichte von Limsa Lominsa repräsentieren! Bei weitem einfallsreicher als eine unausgegorene Puppe, die von einem unausgegorenen Adligen beschafft wurde!","","False","0x00000047","",""
"","TEXT_FESXMS2022OMAKE_00800_EMMANELLAIN_000_069<tab>Take that back!","TEXT_FESXMS2022OMAKE_00800_EMMANELLAIN_000_069<tab>Nimm das zurück!","","False","0x00000048","",""
"","TEXT_FESXMS2022OMAKE_00800_SICARD_000_070<tab>Make me!","TEXT_FESXMS2022OMAKE_00800_SICARD_000_070<tab>Zwing mich doch!","","False","0x00000049","",""
"","TEXT_FESXMS2022OMAKE_00800_EMMANELLAIN_000_071<tab>I will not stoop to your level!","TEXT_FESXMS2022OMAKE_00800_EMMANELLAIN_000_071<tab>Ich werde mich nicht auf dein Niveau herablassen!","","False","0x0000004A","",""
"","TEXT_FESXMS2022OMAKE_00800_CHILDE00800_000_072<tab>With this lovely doll and this adorable silverware, I shall have a most wonderful time playing house. Hehehe! Thank you, little helpers!","TEXT_FESXMS2022OMAKE_00800_CHILDE00800_000_072<tab>Mit dieser hübschen Puppe und diesem entzückenden Silberbesteck werde ich eine wundervolle Zeit beim Spielen haben. Hihi! Danke, Kleine Helferlein!","","False","0x0000004B","",""
"","TEXT_FESXMS2022OMAKE_00800_SICARD_000_073<tab>...","TEXT_FESXMS2022OMAKE_00800_SICARD_000_073<tab>...","","False","0x0000004C","",""
"","TEXT_FESXMS2022OMAKE_00800_EMMANELLAIN_000_074<tab>...","TEXT_FESXMS2022OMAKE_00800_EMMANELLAIN_000_074<tab>...","","False","0x0000004D","",""
"","TEXT_FESXMS2022OMAKE_00800_SICARD_000_075<tab>...Well that's that, then.","TEXT_FESXMS2022OMAKE_00800_SICARD_000_075<tab>... Nun, damit wäre das wohl entschieden.","","False","0x0000004E","",""
"","TEXT_FESXMS2022OMAKE_00800_EMMANELLAIN_000_076<tab>...Quite.","TEXT_FESXMS2022OMAKE_00800_EMMANELLAIN_000_076<tab>... Sieht so aus.","","False","0x0000004F","",""
