"location","source","target","id","fuzzy","context","translator_comments","developer_comments"
"","This hall of learning was established in honor of the first Mitron, a scholar renowned for her exceptional contributions to our marine biosphere. It is here that many ichthyologists seek to follow in Mitron's footsteps, and engender sea creatures characterized by traits both unique and beneficial.<br>“Diversity is the key to a robust star. The ocean is the soup of life, and we must endeavor to enhance its richness.” <br>Such were the words of Mitron, and they guide our research to this day.","類まれな水棲生物の創造者として知られた、<br>初代「ミトロン」を記念して設立された「ミトロン院」。<br><br>ここでは、現在も多くの創造魔道士たちが、<br>独創的かつ有益な水棲生物の創造を続けています。<br><br>種の多様性こそが、星を豊かにする。<br>生命のスープたる海を、さらに多くの命で満たすこと。<br>その理念は、今もミトロン院に受け継がれているのです。","","False","0x0000003E","",""
"","Did you know that the original Halmarut, a man lauded for countless advancements in the field of phytobiology, was an avid landscape gardener? He was famed for botanical labyrinths of intricate design, the foliage of which he sought to protect from voracious pests with the inventive application of creation magicks─a recreational project said to have led to the evolution of the world's first carnivorous plants. <br>Students of his research later expanded upon those early techniques, and successfully developed an extended family of ambulatory flora. If you, too, wish to set down roots in this fertile field of study, hearken you to the Words of Halmarut and submit your application to the Akadaemia.","植物分野の創造において多大な貢献を果たした、<br>初代「ハルマルト」が造園家であったことを知っていますか？<br><br>美しい迷宮庭園の創り手として知られた彼は、<br>庭木を蝕む害虫を駆除するため、創造魔法を行使しました。<br>これが、世界初の食虫植物の創造だったと言われています。<br>以後、彼の門下生たちは植物の創造術を発展させ、<br>多種多様な移動性植物が、生み出されることとなったのです。<br>貴方が植物の創造を学びたいなら、当院の門扉を叩くべきでしょう。","","False","0x0000003F","",""
"","The instances of spontaneous creation occurring in the lands across the ocean are now a confirmed phenomenon. Seemingly unguided by conscious will, these aberrations are said to manifest as malformed “beasts” of nightmarish aspect and unrestrained ferocity. <br>High-ranking phantomologists have since been dispatched to afflicted areas, where they conducted the capture and transport of a single entity. This specimen, characterized by a disproportionately large maw, was dubbed “Archaeotania,” and investigations into its aetheric composition are ongoing. <br>A theory posited by the esteemed Lahabrea suggests that the shape these fiendish beings assume is not random, but rather an amalgamation of the fears which lurk beneath our rational minds. As of this writing, researchers have begun pursuing methods by which potent guardians of deliberate design might be engendered to stand against this mounting threat.","海向こうの大陸で、意図しない創造現象の発現が確認された。<br>それは、悪夢の産物とでも言うべき醜悪な姿を持つ、<br>獰猛な「獣」であったという。<br>幻想生物の創造を研究する「ラハブレア院」では、<br>直ちに職員を派遣、巨大な口を持つ「獣」の捕獲を行った。<br>我々は、これを「アルケオタニア」と命名、調査を行っている。<br>当代のラハブレアの見解によれば、この「獣」は、<br>人々の潜在意識下にある恐怖心の集合体ではないかとのこと。<br>現在、これに対抗するための強力な幻獣の創造方法を進めている。","","False","0x00000040","",""
"","若き日のシドが記した、<br>月の衛星「ダラガブ」の観測データのようだ。<br>几帳面な文字で、難解な数式と数字が羅列されている。<br>シドの推論によると「ダラガブ」は、太陽エネルギーを集積し、<br>波長を変えて送る機能を有している可能性が高いようだ。<br><br>受信設備が不十分な状態で「ダラガブ」を起動すれば、<br>数千年に亘って蓄積されてきた膨大なエネルギーが、<br>降り注ぎ重大事故が発生するであろう、と結論付けている。","若き日のシドが記した、<br>月の衛星「ダラガブ」の観測データのようだ。<br>几帳面な文字で、難解な数式と数字が羅列されている。<br>シドの推論によると「ダラガブ」は、太陽エネルギーを集積し、<br>波長を変えて送る機能を有している可能性が高いようだ。<br><br>受信設備が不十分な状態で「ダラガブ」を起動すれば、<br>数千年に亘って蓄積されてきた膨大なエネルギーが、<br>降り注ぎ重大事故が発生するであろう、と結論付けている。","","False","0x00000041","",""
"","Have you ever wondered whether your creation is a beneficial existence to the star? Wonder no more, for at Ktisis Hyperboreia, our mission is to determine the answer!<br>From temperate plains to tropical jungles, from smoldering volcanoes to frozen fields, we put creations to the proof in a wide range of meticulously recreated environments.<br>Will your creation be able to survive in the wider world? Or will it threaten the survival of other species? The answers to such questions and more, our highly trained staff will uncover!","創造した生物が、星にとって善き存在なのか、<br>心配になったことはありませんか？<br>そんなときは、私たち造物院にお任せください！<br>温暖な平原から熱帯の密林、<br>果ては灼熱の溶岩地帯や極寒の雪原まで……。<br>様々な環境で、あなたの創造生物を試すことができます。<br>美しき星の大自然に解き放たれたとき、<br>あなたの創造生物は、生き残ることができるのか。<br>予期せぬ危険性がないか熟練の職員が評価します！","","False","0x00000042","",""
"","According to Mistress Lyssa, her creation is based on a concept for a bipedal wolf. And indeed, it is impressively manlike in its gait. It is also highly intelligent, as is evidenced by its ability to employ tools, while the gleam in its eyes gives the impression that it comprehends our words. If this proves to be the case, it would be a shame that its throat isn't designed for speech. I must make mention of this in the next report.","リッサ氏から預かった創造生物は、<br>二足歩行する狼、というコンセプトで創ったものらしい。<br>たしかに、その歩行能力は目をみはるものがある。<br>道具を使うなど、知能も高い。<br>いや、知能が高すぎると言った方がいいだろう。<br>あの目つき、職員たちの会話を理解しているのでは？<br>そうなってくると、<br>喉の構造上、発話できないのが勿体ないように思う。<br>この点を、次回の報告書にまとめるとしよう。","","False","0x00000043","",""
"","The successful creation of migratory birds, which travel between continents with the seasons, came as a breath of fresh air to the long-stagnant realm of flying life-forms.<br>In the end, it was a relatively simple thing to grant creatures the ability to navigate by celestial bodies, but this method lacked the precision needed to guide them to the same location each time, as would be vital to their survival.<br>The breakthrough came in the form of magnetic fields, the use of which was discovered by the incumbent Fandaniel during his tenure as chief overseer of Elpis. A truly inspired idea that has brought lasting benefits to the star!","季節に応じて大陸間を移動する、<br>「渡り鳥」の創造成功は、停滞していた飛行生物界に、<br>文字通りの新風を吹き込むこととなった。<br>太陽と星から、おおよその方角を把握させることは、<br>さほど難しいことではなかった。<br>だが、それだけでは決して毎年同じ場所には渡れない。<br>最大の発見は、当代のファダニエルが、<br>エルピス所長時代に編み出した磁場の利用法だ。<br>アーテリスの磁場を鳥に読ませるとは、何たる創造性だろう！","","False","0x00000044","",""
"","Why do you ask such a question? Do you not see the plague and pestilence that consumes us? Ours is a world of rancid blood and rotting flesh, where death is the only remedy to suffering. There is no meaning to be found in such misery.<br>But it was not always thus... Beneath the waves we knew only peace and plenty. We wanted for not, and yet craved more, that our progeny might someday flourish as we never could. Eventually we ventured to the lands above bearing flame and iron, toppling any who dared oppose our might.<br>The world was ours for the taking.","なんと残酷な問いであろう。<br>身は腫れ上がり、傷は爛れ、血が腐り果てた我に、<br>それでも命の意味を問うのか、青き鳥よ。<br>その答えを知りたくば、我らの進みたる航路を知るべし。<br>我らは繁栄を求めてきた。<br>繁栄とはすなわち、子を産み育て、増えることである。<br>そのために我らは陸に上った。<br>そして、恐ろしき火すら従え、鉄を手に入れた。<br>鉄でよろわれた我らは、他を圧倒し、繁栄を極めたのだ。","","False","0x00000045","",""
"","This world is not the boundless paradise we were promised.<br>Our population quickly outstripped the habitable land, while seas we thought would shine forever blue ran dry, spoiled in forging the tools of conquest. Cramped homes turned to squalor, and then came the sickness.<br>Our undoing─and the final blessing this star has to offer.<br>We are no longer the fools we once were. Wheresoever life goes, death will follow. Indeed, existence is but the most painful path unto nothingness─and the wise embrace their obliteration wholeheartedly.","しかし、やがて我らは、<br>かつて我らが信じていたほど、世界は広くないと知った。<br>子を産み育てるに適した土地は、あまりに少なかった。<br>また無限に思えた海も、有限の水溜まりであると知った。<br>鉄のため火を燃やすほどに海は汚れ、<br>子の増えすぎた街では病がまたたく間に広がった。<br>かくして我らは、病によって滅びようとしている。<br>今ならわかる、命とは求めるほどに死を呼ぶものなり。<br>そして、死に向かう痛みと苦しみに満ちた過程である、と。","","False","0x00000046","",""
"","That otherworldly beings should first grace <var 1A 02 /var>us<var 1A 01 /var> with their presence is a sign. Indeed, they understand that we─the Global Community─are possessed of the wisdom and compassion needed to guide this star back to the path of righteousness!<br>Yet the Freedom Fighters dare to undermine us, inviting chaos to disrupt the order we labored so hard to build. They have forgotten the history of this star and its once myriad nations. The wars waged, the countless lives lost...<br><br>They must to be brought to heel, the world united under a single standard, no matter the cost.","異星より来る天使が、<br>最初の相互接触の対象として、我々世界連邦を選んだことは、<br>我々に正義あることの証左である。<br>自由の獲得という大義名分の下、<br>世界秩序を乱す自由連盟に裁きの鉄槌を振り下ろせ！<br>統一政体を維持してこそ、恒久的世界平和が実現するのである。<br>我々は、かつて分断された国の国民であり、<br>あらゆる違いを理由として、争い、戦い、殺し合った。<br>しかし、世界連邦の成立により、ひとつになったのである。","","False","0x00000047","",""
"","We constructed the Peacekeeper, the pinnacle of engineering and technology. This mighty war machine was designed to rid us of the Freedom Fighters, as well as any other potential threats to the peace we have so long pined for.<br>Its artificial intelligence ensures that this singular function is carried out with cold and calculating precision. Indeed, the 10,000 Peacekeeper units we created have now routed every threat to peace...including us. All that remains is to stand and fight.","ついに上層部が、ピースキーパーを起動した！<br>平和維持を目的に掲げて開発された、世界連邦の切り札、<br>武装蜂起したテロリストを、自動的に制圧する自律兵器である！<br>ところが、起動したピースキーパーの機械頭脳は、<br>人類こそが、世界平和の実現にとっての最大の障害と判断。<br>自由連盟のみならず、我々にも攻撃を開始したらしい。<br>全10000機を超えるピースキーパー群を停止させるには、<br>たとえ汚染のリスクがあろうとも、最終兵器を使うしかない。<br>命にかえても、機械どもを粉砕するのだ！","","False","0x00000048","",""
"","A curious traveler visited our star─a bird which proffered these questions: “What meaning does life hold? For what do you strive?”<br>I could find no satisfactory answers, only bittersweet memories of an age long past.<br>There was a time when we were lesser, and in our nescience sought purpose─struggled to justify life's worth. That was, of course, before we achieved perfection. Now, condemned to our paradise, we understand the fatuity of existence.<br>Like the fledglings we once were, the poor bird could not accept the truth. It asked us again and again─hoping, perhaps, our answer might change.","星を渡る鳥は、言った。<br>生きる理由とは、命の意味とは、何であるのかと。<br>その問いは、当個体に懐かしさとほろ苦さを感じさせた。<br>当個体と、全個体が未だに未成熟であった頃、<br>等しく生きる理由と、命の意味を求めた時代があったからだ。<br>しかし、成熟した今、その問いに意味がないことを知っている。<br>当個体は、星を渡る鳥に、<br>その問いの無意味さを伝えようとした。<br>しかし、鳥は未成熟ゆえに理解できず、同じ問いを繰り返した。","","False","0x00000049","",""
"","There was a time when we yearned to explore the heavens, found purpose in the hope of unveiling life's mysteries. A dream shattered when we reached enlightenment, and found it empty.<br><br>There was a time when we believed in our legacy, thought ourselves marking a worthy path our successors might follow. Efforts rendered futile when we discovered the keys to paradise and immortality.<br><br>As individuals we struggled to know what was right, yet in today's perfect unity there is naught left to question. We are infinity constricted by the finite, but no more─Ra-la shall grant us the mercy of annihilation.","かつて当個体と全個体は、<br>命を産み、育み、次世代に繋ぐことに意味を見出した。<br>しかし、不死を手にしたことで、増殖の意味は消失した。<br>かつて当個体と全個体は、<br>宇宙普遍の真理と正義の追求に意味を見出した。<br>しかし、完全なる相互理解に達し、正義の意味は消失した。<br>当個体は全個体となり、全個体が当個体となった今、<br>定命の宇宙で永遠の生を続けることに、意味は皆無なのである。<br>ゆえに全個体を消す、ラーラーを喚んだのである。","","False","0x0000004A","",""
