"location","source","target","id","fuzzy","context","translator_comments","developer_comments"
"","Though there is some debate as to whether or not Merlwyb Bloefhiswyn and her League of Lost Bastards were the first Eorzeans to discover the western continent, there is no denying that their navigational charts were instrumental in establishing the major trade routes of today.<br>Moreover, the accounts from their expedition are widely regarded as both informative and entertaining. Of particular note is their first encounter with the Mamool Ja, as well as other indigenous peoples and creatures which seemed curiously intent on their demise.<br>These travel journals have since inspired a legion of explorers and treasure hunters to retrace the League's journey. Yet in spite of their numbers, the existence of “a bleedin' city o' gold” remains unconfirmed...","シルバーサンド一家のメルウィブ・ブルーフィスウィンが、<br>西方の新大陸に至る、安全航路を発見したことは、<br>歴史的に見ても大きな意義を持つ。<br>これまで新大陸への航海は、まさに命がけであり、<br>運を天に頼むしかなかったからだ。<br>ただし、上陸してからも決して油断できない。<br>野蛮なマムージャ族をはじめ、原住民族には、<br>好戦的な者も少なくなく、魔物や野獣の脅威も強い。<br>しかし、私は必ずや伝説の「黄金郷」を見つけるつもりだ。","","False","0x00000022","",""
"","Beauty is ephemeral, but it needn't be. My lady Amandine knows this well, lovely creature that she is. Would that I could have the genuine article in my keeping...but alas, I shall have to settle for a pale imitation.<br><br>The vessel is not quite up to my usual standards, but beggars can't be choosers, as they say. I washed and anointed it per the instructions, then secured it to the bed with chains─wouldn't want her to get ideas above her station, oh no!<br>Gods, just the thought of it is enough to get my blood pumping! I can hardly wait to welcome my beloved succubus into this world!","美しい薔薇には棘があるとは、よく言ったものだ。<br>上位妖異のなんと妖しく美しいことか！<br>美の探求者として、これほど心震える存在はない。<br>多少、苦労したが、依り代は手に入れた。<br>後は術式を組んで、異界「ヴォイド」の美しい妖異を、<br>憑依させるだけ……。<br>召喚した妖異が暴れぬように、<br>すでに依り代は、鋼の鎖で寝台に固定した。<br>さあ、愛しのサキュバスよ、蜜月の時間の始まりだ！","","False","0x00000023","",""
"","The tentacles...so many tentacles! And the sound of it writhing on the bed! Gods, just listening to it is agony!<br><br>I've made a terrible mistake.","失敗した……。<br>今、私の寝台の上には、鎖で縛られたイカ頭の妖異が、<br>悩ましげにうねっている……。<br>何をどう間違えたのか、わからない。<br>どう処分すればいいのかも、わからない。<br><br>ただ、ひとつわかることといえば、<br>私の夢が、崩れ去ったというだけだ……。","","False","0x00000024","",""
"","The guardian statue stands motionless.","動かなくなった、守護者の彫像がある。","","False","0x00000025","",""
"","A closer inspection suggests that the scarlet-hued gems upon its hands and breast were responsible for breathing life into the stone.","胸元と両手にある赤い宝玉が、<br>石像を守護者と成す魔法の結節点となっていたらしい。","","False","0x00000026","",""
"","It would seem that whatever magicks animated the sculpture have been spent. It is unlikely to ever rise again.","魔力は消え去り、まったく動かない。<br>脅威は去ったと考えてよさそうだ……。","","False","0x00000027","",""
"","We departed Lesalia in high spirits, yet it was not long before our mirth turned to misgiving. We found ourselves struggling from the start and sadly obtained nothing of note. We have failed ourselves and you, and I pray our next errand meets with greater success.","悪い予感がしてたんだよ…。<br>この仕事は、かなりの腕力を必要とした。<br>そのため、作業は難航して…。<br>案の定、発掘することができなかった…。<br>よって、今回の仕事は失敗したといえる…。<br>次こそは、成功しよう！　今回の仕事の結果報告は、以上だ。","","False","0x00000028","",""
"","Our lives are as fleeting as a dream. What a somber thought.","人の夢と書いて儚（はかない）…何か物悲しいわね…。","","False","0x00000029","",""
"","Once upon a time, there lived a free-spirited boy who loved to play in the forest with his pet chocobo. But the forests were fraught with peril, and one day, a band of brigands ambushed the boy, spiriting him away to the harsh mountains of the north.<br>Yet there be dragons there, and as they rode up the mountain path, one of those majestic beasts came swooping down from the heavens. The boy's chocobo reared in fright, sending the boy tumbling down the mountainside to his nigh-certain demise.<br>And yet the gods saw fit to spare his life, if only meagerly so. As he lay there, battered and broken, all manner of foul beasts drew near, threatening to rip him limb from limb. Just as the boy was making his peace with the Twelve, another dragon appeared. A smaller creature, yes, but even a small dragon is a fearsome opponent indeed.<br>It was then that the strangest thing happened. With a mighty roar, the dragon turned upon the circling beasts and spit forth a burst of flames that reduced them to so much ash, saving the poor boy's life. With what half seemed a smile, the dragon approached the wounded child and gently raised him up to sit upon his back, and the two flew off to the gods know where.","むかしむかし、あるところに貧しいけれど心優しい少年がいました。<br>ところがある日、悪い人たちがやってきて、<br>少年をさらってしまったのです！<br>人さらいたちは、少年を山の奥に連れ去ろうとしましたが、<br>途中でドラゴンが現れて、崖下まで落とされてしまいます。<br>そこは、こわいこわい魔物がいっぱいいる場所でした。<br>少年は魔物に食べられそうになり、<br>とても怖い思いをしながら、逃げ惑いました。<br>そして隠れようと洞窟に逃げ込んだとき、出会ったのです。<br>それは、いじめられっ子の小さなドラゴンでした。<br>ふたりは助け合ううちに、いつしか友だちになり、<br>やがて大空を飛んで家へと戻ったのでした。","","False","0x0000002A","",""
"","Oh, but why must the gods curse me so! By what cruel trick of fate was I given this oversized, ungainly body and sent into this world where <var 1A 02 /var>you<var 1A 01 /var> abide─my princess, my goddess, my everything!<br>Your delicate hands, your shapely head, your dark eyes in which I would lose myself and never return! Yes, every aspect of your being strikes me to depths of the heart I knew not I had until the day you first appeared before me.<br>And yet, I am a Roegadyn. Could one of your kind ever love a lumbering brute such as me?<br>Good sense tells me that the answer is no, but my heart─nay, my very <var 1A 02 /var>soul<var 1A 01 /var> will not accept it! For bereft of your company, I fear I will wither away into a wretched husk of what was once a man.<br>O, have mercy on this poor soul, my goddess! Pray grace me with your presence when next your travels call you to Limsa.<br>My beloved Brayflox, just say the word and I am yours forever!","なぜ、私はルガディン族に生まれてしまったのだろうか。<br>そして、なぜ私は、あの娘に恋をしてしまったのか……。<br><br>短い手足、大きな頭、つぶらな瞳……！<br>すべてが狂おしいほど愛おしく、私の心を悩ませる。<br>種族の違いを超えるには、どうすればいいのだ？<br>会いたいよ、愛しい人。<br>君が買付でリムサ・ロミンサに来てくれる日を、<br>指折り数えて待つだけなんて、どうにかなってしまいそうだ！<br>愛しい人、ブレイフロクス！<br>早く私のところへ……。","","False","0x0000002B","",""
"","It is widely known that the Mamool Ja boast one of the most impressive indigenous societies to be found in the New World. It would be a mistake, however, to view the Mamool Ja as a single, uniform people.<br>A careful analysis of documents brought back by explorers reveals that the Mamool Ja are more accurately described as a federation or alliance of numerous distantly related tribes, each with distinguishing physical characteristics: the brown-scaled Hoobigo with their distinctively long combs, the large-eyed, blue-scaled Boonewa, and the mottled Doppro.<br>It is further said that although Mamool Ja rarely marry outside their own tribes, such unions do occur on the occasion of certain religious observances, and are known to produce two-headed offspring that are hailed as “blessed siblings” and groomed to be warlords from a young age. Indeed, the Autarch, ruler of all Mamool Ja kind, is known to be one of them...","新大陸において、もっとも強大にして広大な版図を誇るのが、<br>マムージャ族による巨大国家「マムージャ蕃国」である。<br>ただし、決して単一種族による国家ではない。<br>そもそも、「マムージャ族」とは、<br>姿形の異なる複数の種族によって構成される連合体なのだ。<br><br>茶褐色の鱗と長い鶏冠が特徴的な「フビゴ族」、<br>青味がかった鱗と大きな目を持つ「ブネワ族」、<br>まだらの鱗を持つ「ドプロ族」……。<br>これらの多種族を「連王」と呼ばれる、<br>双頭の王が強力な権力によって束ねているのだ。","","False","0x0000002C","",""
"","“From mutton to morel, oyster to orobon, eel to eft—Eorzea does not want for delicious and delightful ingredients to stimulate the senses of any culinarian. And yet how is it that we came to know that the flesh of these creatures would pleasure our palate so? The answer is self-evident: for every familiar ingredient, someone, at some point in our history, first took it upon him or herself to eat it!<br>And yet this answer raises another question: what wondrous flavors and textures remain undiscovered, just waiting for a brave soul to discover them? And so it was that I took it upon myself to investigate the culinary suitability of coblynflesh! Why coblyns, you ask? To which I say, good reader, why <var 1A 02 /var>not<var 1A 01 /var> coblyns!”<br>The above passage was composed by my elder brother. Sadly, they were the last words he ever wrote, for—as he soon discovered—coblyn feelers are poisonous. Armed with this knowledge and vowing that his sacrifice would not go to waste, I resolved to carry on his life's work...","我々は、山羊肉を嬉々として食す。<br>それは、山羊肉が美味いと知っているからだ。<br>では、なぜ我々「人」という種は、山羊肉の味を知り得たのか？<br>いわずもがな、最初に食べた人がいるからだ。<br>ここで私は、この論文を読んでる貴方に問いたい。<br>コブランは美味いのか、と。<br>ゆえに私は、エオルゼア料理史に確かな足跡を残すため、<br>最初の一歩を自らの足で……いや「舌」で踏み出すことにした。<br>我、いざ食の偉人とならん！<br>こうして兄は、帰らぬ人となりました。<br>よく知られているように、コブランの触手は有毒です。<br>未知の食材を試すときは、図書館でよく調べましょう。","","False","0x0000002D","",""
"","Proceedings of the 284th Convocation of the Amdapori Council of Magi<br><br>A Vote was called to settle on a Name for a potent and newly fashioned Healing-Spell.<br>Being that said Healing-Spell was an Augmentation of Curaga, erst the most potent Healing-Spell, the following Names were proposed by the Council.<br><br>Curago, Curaza, Curaja, Curagura<br><br>Finding the afore-written Names duly lacking in Gravity and the existing Hierarchy of Spell-Names needlessly abstruse, the Council did Vote by a margin of Seventeen to Three to do away with existing Naming-Conventions entirely and adopt a new system of numerical Spell-Names, as writ below, to be used henceforth.<br><br>Cure I, Cure II, Cure III, Cure IV<br><br>It is recorded.","第284回アムダプール白魔道士会大会議議事録<br>議題「ケアルガに次ぐ、高位治癒魔法の名称について」<br><br>この度、新たに編み出された高位治癒魔法の名称について、<br>「ケアルゴ」「ケアルザ」「ケアルジャ」「ケアルギョ」など、<br>複数案が各派によって提案されていた。<br>派閥ごとに弁論が行われた後、<br>投票が行われた結果、僅差で「ケアルギョ」を破り、<br>「ケアルジャ」が採択されたことを、ここに記す。","","False","0x0000002E","",""
"","Many scholars believe that the popular children's tale of the Boy and the Dragon Gay is, in fact, an adaptation of an older Ishgardian myth, one telling of which is transcribed below for the reader's reference.<br><br>In a bleak village on the outskirts of Coerthas there lived a shepherd boy, poor but kind of heart. One day a band of ruffians came and spirited the boy away, seeking to deliver him to a slave trader in hopes of earning some coin.<br>No sooner had they left the village than they were set upon by a great dragon. Down from the heavens it swooped, tearing the blackguards limb from limb and charring their carcasses with hellsfire.<br>But it was by no mere chance that the great wyrm had found them, no! The boy had befriended the great wyrm some time ago, and it had sensed the danger to its dear friend.<br>Alas, in the chaos, the boy had tumbled from the mountains, and lay half-dying at the base of the cliff. Seeing its dear friend lying there, battered and beaten, the dragon gave unto the child of its blood. So it was that the boy took to the skies as the wyrm's minion, flying off to only the gods know where...","クルザスの寒村に、貧しいが心優しい羊飼いの少年がいた。<br>ところがある日、奴隷商人に雇われた男たちがやって来て、<br>問答無用で襲いかかり、少年を拉致したという。<br>悪漢たちは、少年を奴隷商人に届けようとしたが、<br>その道中でドラゴン族に襲われ、蹴散らされることに……。<br>だがこれは、決して偶然の出来事ではない。<br>なぜなら、このドラゴンは少年の友であり、<br>危機を知って、助けるために飛来してきたのだから……。<br>問題は、戦いの最中に少年が崖下に落ちてしまったことだ。<br>瀕死の重傷を負った少年を助けるため、<br>ドラゴンは己の血を分け与え、飲ませることにした。<br>すると少年は、竜の眷属と化し、いずこかに飛び去ったという。","","False","0x0000002F","",""
"","Using the crude wooden spoon I was provided, I sip at the thin broth, wondering if it is lentils I taste. It is, of course. Lentil soup is all that I have eaten since arriving in this village more than a month ago (soup being a generous term for the pathetic puddle trying its best to cover the bottom of my equally crude bowl). Would that my hosts had even salt to flavor the lukewarm fare, but war erased any hope of trade caravans making it this far...not that these forsaken villagers have aught to trade. Soon their lot will succumb to hunger, and the desert will reclaim them and any memory of their existence. Such is life in times of peril.","粗末な木彫りのスプーンを差し出された私は<br>その豆だけのスープを口に運ぶ。<br>薄いがほんのわずかに豆の風味を感じることができる。<br>その正体は乾燥したレンズ豆の戻し汁だ。<br>しかも、わずかな豆に水を加えてはその汁だけを食す。<br>それを繰り替えすため、とにかく味が薄い。<br>この畏国の貧しい村では岩塩すら貴重なのだろう、<br>塩気を感じることはほとんどない。<br>聞けばこのスープですでに１ヶ月を過ごしているという。<br>村人の半数が餓死し、生き残った者もその寸前だ。<br>獅子戦争が終わった今となっても<br>戦渦の爪痕が消えることはないのだ。","","False","0x00000030","",""
"","Navigator's Log, Day 1<br>Too soon to fly, the others said, but prove them wrong, I will. Find our paradise, I must. Ayatlan...","目指すは、一族に伝わる幻の浮遊大陸……<br>失われた楽園「アヤトラン」。","","False","0x00000031","",""
"","...Filled with drones, the sky was. Swift and sure, their attacks were.<br>By some miracle I'm alive, but severely damaged, the airship was. Parts for repairs, I need...","だが、高高度を飛行中に、空賊に襲われて被弾。<br>漂流の末に、古代の遺跡らしき場所に辿り着いた。<br>この中に気球の修理に使える部材があればいいが……。","","False","0x00000032","",""
"","“Only in a leap will he prove his worth.”","飛び降りろ！","","False","0x00000033","",""
"","Lo, seeker in days unborn, god-blade bearer. Know you: this tower challenges the sky. Ware the watcher, the ward of the Three Waits, soul-hungry, unsated.","神々の剣を授かりし後世の探求者へ。<br>これなるは天に等しき高みへの塔、<br>…………を率いる守護者、汝の魂をむさぼり喰わんとす。","","False","0x00000034","",""
"","Multiples of three? 3, 6, 9, 12. Multiples of four? 4, 8, 12. A concept so simple a child─let alone the architect of the city's defense network─could grasp it. Or so one would think!","「倍数」とは、その数字を数倍にした数字。<br>3の倍数……3……6……9……12……<br>4の倍数……4……8……12……<br>こんな単純な数学すら間違えるヤツが、<br>守護者の設計などやるものだから、すぐに暴走するのだ！","","False","0x00000035","",""
"","A wise arithmetician once said the primes were the most lonesome of numbers. To that I say bollocks! 2, 3, 5, 7, 11, 13, 17, 19, 23, 29, 31...and on to eternity. There are enough digits here to start a fellowship!","「素数」とは、その数字自身と1でしか割り切れない数字。<br>2……3……5……7……まだまだ、ある。<br>素数を孤独だと言ったは、誰だったか？<br>11……13……17……19……23……29……31……<br>孤独なものか、同族が延々と後に続くではないか！","","False","0x00000036","",""
"","We have taken into our safekeeping twin spears of Eureka's forging─Orlasrach, the black, and Munderg, the white. Though physically separate, the weapons are aetherially linked, and are a single entity in all but form.","二槍一対のエウレカ製武器を発見、回収した。<br>黒の妖槍「オールラスラッハ」と白の妖槍「ムンジャルグ」、<br>これらは共鳴し、互いの力を増幅する性質を持つようだ。","","False","0x00000037","",""
"","When brought together, the power of one amplifies that of the other, and even should they be isolated, if one comes under threat, its counterpart will immediately teleport to its aid.","妖槍は、互いに惹かれ合う。<br>ゆえに片方が交戦状態に陥れば、危機を感じ取り、<br>もう一方が空間転移を実行するのだ。","","False","0x00000038","",""
"","Fortunately, this defensive mechanism can be defeated. They do not teleport when attacked simultaneously, and thus is it possible to prevent their reunion.","しかし、奴らの空間転移術とて万能ではない。<br>二振りの妖槍が、それぞれ別の場所で交戦状態に陥れば、<br>転移による合流を防ぐことができるのだ。","","False","0x00000039","",""
"","It cannot be stressed enough that these spears are a single entity. So long as one persists, the other will regenerate and return from apparent destruction. If they are to be eliminated permanently, they must be struck down at the exact same moment.","繰り返すが、二振りの妖槍は、一対の存在である。<br>したがって、一方が存在する限り、もう一方も存在を続ける。<br>完全な討滅を目指すなら、同時に滅するほかないだろう。","","False","0x0000003A","",""
"","<var 1A 02 /var>Our only hope lies in the Crystal Tower, though it did not yield its secrets easily. Even opening the doors was a monumental undertaking.<var 1A 01 /var><br><var 1A 02 /var>Without the founder's datalogs and the NOAH reports left by the Sons of Saint Coinach, we would never have stood a chance of succeeding.<var 1A 01 /var><br><var 1A 02 /var>None of us were prepared for the spectacle that awaited us when we first stepped into the tower. To be surrounded by the marvels of a lost age took our breath away. And there, at its center, we found him.<var 1A 01 /var>","滅びの運命に抗うためには、<br>封じられしクリスタルタワーの再起動しか道はない。<br>だが、簡単にあの扉は開いてはくれなかった。<br>我々に遺された手がかりは、<br>聖コイナク財団が遺した「ノアレポート」を始めとする、<br>初代「シド」が関与した、いくつかのデータログだけ。<br>だが、長年にわたる苦難の末に、ついに扉は開かれた。<br>そこで我々は、出会うことになる。<br>塔と共に、眠りについていた伝説の人物と……。","","False","0x0000003B","",""
"","<var 1A 02 /var>Our research into the Emperor's Throne is almost complete, as we now understand the methods used to open a doorway to the World of Darkness, otherwise known as the Thirteenth.<var 1A 01 /var><br><var 1A 02 /var>However, this is only the beginning of our plan. Even if we find a way to the First, it is already too late to prevent the Eighth Umbral Calamity. For that, we must travel not only to another world, but to another time.<var 1A 01 /var><br><var 1A 02 /var>Thankfully, the datalogs gathered over the years, detailing battles with various primals, pointed us in the right direction.<var 1A 01 /var>","かつて、闇の世界と呼ばれた「第十三世界」への門が拓かれた、<br>「始皇帝の玉座」の解析は、我々に大いなる知識をもたらした。<br>とはいえ、これだけでは目的の達成は遠い。<br>なぜなら、第八霊災と密接な関わりを持つ、<br>「第一世界」に渡るだけでは、歴史を変えられないからだ。<br>これに加え、時の逆行が必須事項なのである。<br>幾世代にも渡る研究の末、解析を完了させた、<br>時を超えし蛮神との戦いを記録した「データレコード」……<br>その知識を具現化するときが来たのだ！","","False","0x0000003C","",""
"","<var 1A 02 /var>Just as we thought the pieces were in place, we came to the realization that traversing time and space has its...difficulties. It is one thing to possess the technology necessary to enable such a feat, quite another to actually perform it.<var 1A 01 /var><br><var 1A 02 /var>The interdimensional rift, as it was called in the founder's datalogs, is what I can only describe as “infinite chaos.” To navigate it would take expertise far beyond our ken.<var 1A 01 /var><br><var 1A 02 /var>There was, however, once a being capable of exactly that: the one known as “Omega.” And yet, despite all of the research carried out, the mystery of how it was able to cross the rift remains unsolved.<var 1A 01 /var>","「異界」への移動と、「時間」の制御……<br>難題であった、このふたつの技術を確立してなお、<br>「次元の狭間」への潜行には、問題が多かった。<br>あらゆる時間と空間がもつれた次元の狭間では、<br>すべての事象が不確かで、まさに混沌と呼ぶべき状態だ。<br>この狭間を、正しく越えねば目的は達成できない。<br>過去、次元の狭間を完全に掌握した唯一の存在、<br>「オメガ」に関するデータログが、解決の糸口となるだろう。<br>これより、計画を最終段階へと移行する！","","False","0x0000003D","",""
