"location","source","target","id","fuzzy","context","translator_comments","developer_comments"
"","テストデータ","テストデータ","","False","0x00000000","",""
"","シュポシェのヒント（仮）","シュポシェのヒント（仮）","","False","0x00000001","",""
"","First Spear Rydel<br>Toto<var 1F /var>Rak Expedition Notes  (Day 1)<br>Strange lights sighted from just inside dungeon entrance. Creatures of the forest? Closer inspection reveals them to be man-made machines. Ashcrown Consortium technologist accompanying party believes them to be of Garlean design. Labels them “magitek photocells.” Collect for further study.","古ぼけた貼り紙がある。<br><br><br>“3:34<br>私は鬼哭隊壱番槍、探索班リデル。<br>後続隊へ向けメモを残す。”<br>“洞内に浮遊する緑の光を「魔導フォトセル」と命名。<br>収集を開始。”","","False","0x00000002","",""
"","First Spear Rydel<br>Toto<var 1F /var>Rak Expedition Notes  (Day 2)<br>Dramatic increase in light emitted by photocells observed upon collecting fourth. Dispatched two lancers to Gridania with orders to deliver the photocells to Stillglade Fane. Soon after their departure, received linkpearl transmission from pair reporting marked reduction in photocell glow as distance from Maws increased. Recalled lancers.","古ぼけた貼り紙がある。<br><br><br>“3:55<br>4つめの「魔導フォトセル」を回収すると、各々が振動を開始。<br>フォトセルを分析するため、洞外へ持ち出したところ消滅した。”","","False","0x00000003","",""
"","First Spear Rydel<br>Toto<var 1F /var>Rak Expedition Notes  (Day 3)<br>Lancer downed attempting to breach what Ashcrown technologist calls a “magitek field.” Technologist advises that there should be a device in the vicinity powering the barrier. No choice but to look for it. Divided party into four teams to expedite search. Whisperings of discontent? No. Just my imagination.","古ぼけた貼り紙がある。<br><br><br>“4:12<br>通路を遮断する青い光の壁を「魔導フィールド」と命名。<br>これは「魔導ターミナル」の起動によって消滅することを確認。”","","False","0x00000004","",""
"","First Spear Rydel<br>Toto<var 1F /var>Rak Expedition Notes  (Day 4)<br>Device located, but one team yet to return. Barrier terminal unresponsive until technologist suggests applying set of four photocells. How does he know these things? Watch him. Lancer suggests locating missing team. Decide to press on.","古ぼけた貼り紙がある。<br><br><br>“4:36<br>｢魔導フィールド｣が再度、出現した時のために記す。<br>｢魔導ターミナル｣は、4つのフォトセルの振動によって起動可能。”","","False","0x00000005","",""
"","First Spear Rydel<br>Toto<var 1F /var>Rak Expedition Notes  (Day 5)<br>Encountered sheer drop several yalms down passage. Rock face looks treacherous but descent should be possible with ropes. Return climb may be troublesome─especially with the technologist slowing us down. Lancers seem uncertain. After consulting with second officer, have decided to proceed. Will send scouts to find alternate route back to entrance.","5:03　この先で通路が落ち込み、分断されている。<br>おそらく下りたら戻れない。後続隊は注意されたし。","","False","0x00000006","",""
"","First Spear Rydel<br>Toto<var 1F /var>Rak Expedition Notes  (Day 6)<br>Discovered mangled bodies of the missing team beyond the drop. Have lost linkpearl contact with the two scouts sent to find alternate route out. Presumed lost or deserted. Will continue expedition for now, but must consider retreat if situation worsens.","古ぼけた貼り紙がある。<br><br><br>“5:45<br>再び強力な魔物と交戦。当方にも負傷者が出た。<br>これ以上の調査続行について、隊員と協議を続けている。”","","False","0x00000007","",""
"","First Spear Rydel<br>Toto<var 1F /var>Rak Expedition Notes  (Day 7)<br>Three lancers report difficulty breathing, as if something dank and heavy is clogging their lungs. Another two disappeared into the darkness, screaming. Technologist believes cause to be extreme levels of aetheric energy detected ahead. Lies. He has done something to us! The elementals warned me about him. Should have listened. Technologist suggests turning back. I see him for what he is now. Garlean worm is dead. Feel better. Pressing on.","古ぼけた貼り紙がある。<br><br><br>“6:22<br>咳き込む者、多数。原因は不明だが、私は撤退を決断。<br>メモはここまでとする。後続隊はくれぐれも注意されたし。”","","False","0x00000008","",""
"","You find a bloodstained scrap of parchment with a message scrawled upon it in faded ink.<br><br><var 1A 02 /var>“The Capten lykes his sees Bloo.”<var 1A 01 /var>","メモらしきものを見つけた。<br><br>船長は晴天の「青」い海原がお好き","","False","0x00000009","",""
"","You find a bloodstained scrap of parchment with a message scrawled upon it in faded ink.<br><br><var 1A 02 /var>“The Capten lykes his wyne Redd.”<var 1A 01 /var>","メモらしきものを見つけた。<br><br>船長は上物の「赤」ワインがお好き","","False","0x0000000A","",""
"","You find a bloodstained scrap of parchment with a message scrawled upon it in faded ink.<br><br><var 1A 02 /var>“The Capten lykes his cabege Green.”<var 1A 01 /var>","メモらしきものを見つけた。<br><br>船長は新鮮な「緑」の野菜がお好き","","False","0x0000000B","",""
"","I finally mustered the courage to speak with your hero, my love. <var 2C ((<var 29 EB02 /var>)) (( )) 02 /var> is as kind and wise as <var 08 E905 ((she)) ((he)) /var> is brave and strong. <var 08 E905 ((She)) ((He)) /var> listened attentively as I told <var 08 E905 ((her)) ((him)) /var> all about you─about us.<br><br>Though <var 08 E905 ((she)) ((he)) /var> is a <var 08 E905 ((woman)) ((man)) /var> of few words, or perhaps because <var 08 E905 ((she)) ((he)) /var> is, everything <var 08 E905 ((she)) ((he)) /var> said seemed to inspire me. Why, <var 08 E905 ((her)) ((his)) /var> gaze alone instilled me with a confidence I never knew I had. Truly, I feel better prepared to face the future for having met <var 08 E905 ((her)) ((him)) /var>. How right you were, my love.","あれから、何日が過ぎただろう。<br>今日、ウルダハのクイックサンドで、あの冒険者と会った。<br>わたしの最愛の人が気にかけていた冒険者だ。<br>わたしは、冒険者に思いの丈を伝えた。<br>そして自分に、前を向いて生きようと誓った。","","False","0x0000000C","",""
"","Scarcely a week has passed since we returned to the village, and already I cannot help thinking it was a mistake. There was a time when this place seemed just large enough. But having seen the wider world, it all feels so insufferably confined that I often find myself struggling for breath. I know that it is the same for you, my love.<br><br><br><br>The only time I feel truly alive is when I am adventuring with you. We are as caged birds in this backwater. So long as we remain here, we will never spread our wings and soar. So let us take to the road, and create a lifetime of wonderful memories together.","わたしとあの人が育った故郷に帰ってきた。<br>子どもの頃には広く感じた村も、<br>今では何だか、とても狭く感じる。<br>わたしが世界の広さを知ってしまったからだろう。<br>そう、わたしとあの人は、ともに夢見た。<br>広い世界での胸躍るような冒険を。<br>やっぱり、この狭苦しい村は、あの人に相応しくない。<br>冒険に出よう。<br>もう一度、あの人といっしょに。","","False","0x0000000D","",""
"","I could not have hoped for a more romantic first visit to Mor Dhona. The crystals that pierce the landscape glowed in all their majesty, as if to celebrate our future together. And as we lazed by Silvertear Lake, watching the waves lapping at the shore, the sun took its leave behind the horizon, that we might enjoy a moment of intimacy.<br><br><br><br>“I want us to be together forever.” You first said these words to me years ago, and you said them to me again tonight. I am so happy to be with you.","初めてのモードゥナ。<br>クリスタルに満ちた銀泪湖は美しく輝き、<br>まるで、わたしたちの訪れを祝福しているよう。<br>湖のほとりで、あの人と見つめ合う幸せな一時。<br>日が暮れるまで、ふたりきりの時間を過ごした。<br>これからもずっと一緒だ……あの人の言葉が嬉しかった。","","False","0x0000000E","",""
"","You have been looking deathly pale of late. The scorching heat of Thanalan does not agree with you. You were never fond of hot climes, and it was a mistake to come here. Let us make for Coerthas, where the bracing air will put roses on your cheeks.","最近なんだか、あの人の顔色が悪い。<br>やっぱり、ザナラーンに来たのが悪かったんだ。<br>あの人は熱いのが苦手だから。<br>凍てつくように寒いクルザスに行こう。<br>そうすれば、きっとあの人だって元気になる。<br>そうすれば、耳元で囁くこともやめてくれるはず。","","False","0x0000000F","",""
"","I know, I know─it is not easy being without a body. I promise to find one for you, but you must have patience. You are my husband<var 1F /var>to<var 1F /var>be, and there is nothing I would not do for you, so please, have faith in me. Give me time, my love, and I shall make you whole again, as you make me.","うん、わかってる。<br>わかってるよ、自由に動ける身体がいるよね。<br><br>うんうん、わかってる。<br>そんなに毎日毎日毎日、囁かないでもいいんだよ。<br>何も言わなくたって、あなたが言いたいことはわかるの。<br>だって、わたしはあなたのお嫁さんになるんだから。<br>だからもう、囁き続けるのはやめて。<br>あなたにふさわしい身体を見つけるから。","","False","0x00000010","",""
"","I am sorry to keep you waiting, my love, but we cannot afford to compromise─not where your new body is concerned. Ordinary adventurers die often enough, leaving their ordinary corpses, but if you are to be like <var 2C ((<var 29 EB02 /var>)) (( )) 02 /var>, we cannot settle for anything less than extraordinary.<br>But a strong body requires an equally strong soul─as I recently discovered. Now, you are probably worried that strong souls are rare, and so they are─but never fear, for we can create one ourselves! All we need is a plentiful supply of the weaker kind, and they are common indeed. Be patient just a little longer, my love, and all will be as you desire.","ごめんね、なかなか、あなたに合う身体が見つからないの。<br>あなたは、エオルゼアに名を馳せる冒険者になるのだから、<br>中途半端な身体じゃダメ。<br>それに、わたしわかってきたの。<br>身体だけあってもダメだって。<br>立派な冒険者には、立派な魂が必要なんだって。<br>強い身体には、強い魂がいる。<br>弱い魂しか見つからないなら、たくさんの魂が。<br>もう少しの辛抱だからね、待っててね、あなた。","","False","0x00000011","",""
"","With the nigh-endless supply of bodies here, I will make you well again, my love. Then we shall be wed as man and wife, and forever be joined as the gods intended. Of course, it is only fitting that a proper ceremony be held, with guests in attendance. I will send out invitations to all our friends. They will be so happy for us, I have no doubt they will jump at the chance to part with their souls.","ここには、からだがいっぱいあるの。<br>いっぱいいっぱいいっぱいいっぱいあるの。<br>だから、きっとあなたもげんきになるわ。<br>そうしたら、けっこんしきをあげようね。<br>わたしたちは、あたらしいせかいにたびだつの。<br><br>けっこんしきには、みんなもよぼうね。<br>きっとぱーてぃのみんなも、しゅくふくしてくれるよ。<br><br>あんなになかがよかったんだもの、<br>おくりものをもってかけつけてくれるよ。<br>きっと、たましいだってくれるはずよ。","","False","0x00000012","",""
"","To whoever reads this─if there is anyone left to read it─let it be known that I, Ser Pascaleret Neurtaille, bore witness to Dalamud's fall. The lesser moon's descent, the black doom which emerged from within, the flames which spread across the horizon, turning night to day─it shall haunt me for the rest of my days.<br>It is the dawn of the “Seventh Umbral Era,” according to some of the men. I told them to put no stock in the ravings of the prophetess, but even I do not know what to believe anymore.","降り注ぐ隕石、黒き影が放った炎。<br>私が体験したすべてを、後世に伝えるため、<br>騎士パスカルレー・ヌールタイユが記す。<br>まさしく、この世の終わりなのかもしれない。<br>兵たちは動揺し、「第七霊災」が到来したと騒いでいる。<br>これを読む者は、その真実を知っているのだろうか。","","False","0x00000013","",""
"","The engineers are still surveying the damage, but anyone with eyes can tell that the Dusk Vigil is beyond repair. Some walls are hardly fit to be called as such, piles of crumbling masonry as they are.<br><br>The officers have been pleading with Ser Yuhelmeric, asking him to order a withdrawal. He knows our position is untenable, yet he refuses. “We will hold it to the last, for we are the shields on the wall─the defenders of the Holy See,” he says. He is a brave, pious man. Less so, we who serve under him.","指揮官であるユヘルメリック卿からの指示で、<br>砦内の被害状況を調査したが、ひどいものだった。<br>堅牢を誇った城壁が、見るも無惨に崩れている。<br>兵たちは皇都への撤退を望んでいるが、<br>ユヘルメリック卿が下した決断は、砦の死守だった。<br>当然だ、ダスクヴィジルは皇都を守る盾なのだから。","","False","0x00000014","",""
"","The men we rescued from the collapsed wing have not fared well. Given our dwindling supplies and this seemingly endless blizzard, we may be forced to make difficult decisions soon.<br><br>This unseasonable weather grows worse with every passing day, and the toll it has taken on morale is plain. We have yet to receive reinforcements from the Holy See, and I fear none shall come. Nevertheless, Ser Yuhelmeric remains steadfast in his decision and will suffer no talk of withdrawal.<br>Ser Yuhelmeric's steward tells me he passes hours in the chapel, praying to the Fury for guidance... But I chanced to see him once, as he knelt before the statue. His eyes were transfixed upon the jewel in its helm, and he was whispering things I dare not write.","崩れた瓦礫を取り除き、懸命に救助活動をしたが、<br>助けることができたのは、わずかに数名のみだった。<br>その者らも、ここ数日の寒波で衰弱してきている。<br>季節外れの雪が舞うほどの寒さは、<br>傷つき、疲れ果てた我々から、体力を奪っていく。<br>だというのに、皇都からの救援は、未だにこない。","","False","0x00000015","",""
"","Ser Yuhelmeric has taken me into his confidence. He says I am an honest man. I wish I were a braver one.<br><br><br>The mutiny has been quelled. Among the starving, half-mad knights were Ser Yuhelmeric's most trusted officers. He wielded the axe himself.<br><br><br>Ser Yuhelmeric received me in the chapel afterwards. I told him we will not last a fortnight without food. He smiled and told me that the Fury has blessed us with a bounty of fresh meat, then returned to his prayers. I joined him.","雪と氷によって孤立した砦内で、反乱が起こった。<br>備蓄食料が底をつきつつあることを知った兵たちが、<br>ユヘルメリック卿に、撤退を進言したのがきっかけだ。<br>だが、卿は砦の維持に固執し、これを拒否。<br>凄惨な戦いになり、多くの命が失われてしまった。<br>唯一の救いは、新鮮な肉が手に入ったことだけか……。","","False","0x00000016","",""
"","O Halone, pray forgive Your humble servant. For too long have I let fear rule my heart, and in my cowardice have I been party to unspeakable acts.<br><br><br>I know now I shall never see my children again─nor would I want them to look upon their father's face...and what it has become.<br><br><br>I am outside Her grace.","私は罪を犯した。<br>穢らわしい罪だ……そう、罪なのだ。<br>だが、生きるためには必要だった……。<br>家族の元に帰るには、生き残らなくてはならない。<br>だが、生きるとは、いったい何なのだ？<br>奴らは、動いているではないか！　死んでいるはずなのに！","","False","0x00000017","",""
"","Exhibit I: Technology in Daily Life<br>This exhibit showcases the various scientific advances that allow Allagans to live lives of heretofore unheard-of ease and efficiency.","善良なアラグ帝国市民の豊かな生活に欠かせない、<br>魔科学製品の数々を展示、紹介しています。","","False","0x00000018","",""
"","Exhibit II: Technology in War<br>See the myriad marvels of Allagan military technology that have replaced flesh-and-blood soldiers, ensuring that no Allagan citizen need ever again lay down their life in battle.","魔科学の粋を集めて作られた、兵装群を紹介します。<br>帝国正規軍向け最新装備から、皇室親衛隊向け式典装備まで、<br>その種類は多種多様です！","","False","0x00000019","",""
"","Exhibit III: The Phantom Ray<br>Feast your eyes on this massive-yet-elegant automaton, designed to monitor─and if necessary, dispatch─potentially violent chimerical constructs.","機械兵器「ファントムレイ型」<br>暴走リスクの高いキメラ生物の指揮・監視目的で開発された、<br>多腕型戦闘指揮マシン。","","False","0x0000001A","",""
"","Exhibit IV: The Mirrorknight<br>A second-generation construct boasting the strength of a bear and the acute vision of an owl. As with many early efforts at synthesis, lack of intelligence and a proclivity for violence limited its practical use.","キメラ生物「ミラーナイト型」<br>強靱な熊の肉体に、梟の暗視能力を組合せた合成獣。<br>多くの第二世代型と同様、知性の面で課題が残ります。","","False","0x0000001B","",""
"","Exhibit VII: The Shabti<br>A fourth-generation construct, and one of the first to effectively employ cloning technology. With high intelligence and regenerative capacity, its development was hailed as a major breakthrough.","キメラ生物「シュワブチ型」<br>クローン技術を応用した第四世代型合成獣。<br>再生能力と知性を両立した、高性能モデルです。","","False","0x0000001C","",""
"","Exhibit VIII: The Naga<br>Among the first successful efforts in synthesizing a voidsent. Void research remains an emerging field, with future developments holding great promise.","人工妖異「ナーガ型」<br>妖異研究の一環で試作された人工妖異。<br>この分野は、今後の発展性の高さから注目を集めています。","","False","0x0000001D","",""
"","Exhibit IX: The Iksalion<br>A highly intelligent construct employed by Allagan engineers to perform maintenance tasks. Notable flaws include a weakness against the elements and certain genetic instabilities.","キメラ生物「イクサリオン型」<br>高い知性を有する、アラグ帝国空挺師団用合成獣。<br>環境変化に弱く、遺伝子異常が生じやすい欠点を持ちます。","","False","0x0000001E","",""
"","The rise of the Garlean Empire in the Year 1522 of the Sixth Astral Era led to significant changes in the structure of Garlean society. This is most evident in the adoption of titles which serve to indicate an individual's place within the social hierarchy.<br>The following information was compiled with the aid of informants within the Empire and has yet to be verified:<br>Royalty: Zos - The emperor; Yae - Member of the royal family in the line of succession; Wir - Member of the royal family with no claim to the throne.<br>Military: Van - Legatus; Tol - Tribunus laticlavius; Sas - Tribunus angusticlavius or Praefectus castrorum; Rem - Primus pilus or Pilus prior; Quo - Primi ordines or Centurion; Pyr - Optio, Tesserarius, or Decurion; Oen - Duplicarius or Legionarius.<br>Specialists: Nan - Chief engineer or engineer; Mal - Primus medicus or senior magitek technician; Lux - Chief medicus or magitek technician; Kir - Senior medicus or senior technician; Jen - Medicus or technician.","第六星暦1522年の帝政転換以来、<br>ガレマール帝国では、階級社会化が急速に進行している。<br>名に所属階級が含まれる点は、その深刻度を示す例といえよう。<br>国家元首たる皇帝は「ゾス」……<br>これに続く皇族は「イェー」、貴族は「ウィル」を名乗る。<br><br>軍人階級は、軍団長の「ヴァン」に始まり、<br>「トル」「サス」「レム」「クォ」「ピル」「エン」と続く。<br><br>魔導技術者は、筆頭機工師の「ナン」に始まり、<br>「マル」「ルクス」「キル」「ジェン」と続く。","","False","0x0000001F","",""
"","Public Officials: Iyl - Dictator or Princeps senatus; Het - Consul, Praetor, Tribunus plebis, Aedilis, or Quaestor; Goe - Censor; Fae - Unknown; Eir - Unknown; Dus - Lictor.<br><br>This hierarchy extends to the general populace as well, though it is far less complex. The majority of citizens bear the “Bas” title, and there is a smaller group which appears to be comprised of respected artisans who have adopted the “Cen” title.<br>The “Aan” title is bestowed upon the peoples of annexed territories and indicates that they lack even the most basic rights afforded to a citizen.<br>However, many Garleans view this as an opportunity rather than a condemnation, as citizenship may be granted to those who have demonstrated exceptional skills, as well as those who have contributed twenty or more years of military service.","公職は、独裁官および元老院主席の「イル」に始まり、<br>「ヘット」「ゴー」「フェー」「エイル」「ダス」と続く。<br><br>市民は「セン」と、二級市民の「バス」に別たれ、<br>最下位には市民権を持たぬ「アン」が位置する。<br><br>ガレマール帝国の軍事侵攻により、<br>属州化された地域では、その住人は多くが「アン」とされ、<br>奴隷として市民に仕える生活を強要されているようだ。<br>「アン」が市民権を得て「バス」や「セン」となるには、<br>帝国に対する「特別な貢献」を認められるか、<br>20年以上の過酷な兵役が必要となる。","","False","0x00000020","",""
"","Chapter I─The Six Nativities & Myriad Creation.<br>The spark of Lightning ignites when it strikes, and thus Fire is born.<br>The heat of Fire renders to ash all that it touches, and thus Earth is born.<br>The density of Earth shuns sun and harbors cold, and thus Ice is born.<br>The armor of Ice melts away, and thus Water is born.<br>The moistness of Water mists and rises, and thus Wind is born.<br>The gusts and sighs of Wind gather the clouds, and thus Lightning is born.<br><br>Chapter II─The Three Conquests, Boundless and Unwavering.<br>Earth grounds Lightning.<br>Water erodes Earth.<br>Lightning boils Water.<br>Chapter III─The Three Submissions, Timeless and Unending.<br>Fire is extinguished by Wind.<br>Ice is melted by Fire.<br>Wind is obstructed by Ice.","「廻りくる六つの生誕」……<br>雷は落ちて火を生み、火は燃えて土を生み、土は遮りて氷を生み<br>氷は溶けて水を生み、水は昇りて風を生み、風は曇りて雷を生んだ<br>「果てしなき三つの凱旋」……<br>土は雷を吸い尽くし、水は土を流し尽くし、雷は水を走り尽くした<br><br>「終わりなき三つの敗北」……<br>火は風に消され、氷は火に溶かされ、風は氷に防がれた<br><br>「揺るぎなき二つの支配」……<br>雷も火も土も氷も水も風も、すべては霊の上にあり、<br>すべては星の下にある……近いか遠いかただそれだけ……。","","False","0x00000021","",""
