"location","source","target","id","fuzzy","context","translator_comments","developer_comments"
"","","","","True","0x00000000","",""
"","<var 48 08 /var><var 49 04 /var>The rules of engagement on the Bozjan southern front are different than what you will have encountered before. The following pages contain a detailed explanation of what you may expect on the battlefield.<var 49 01 /var><var 48 01 /var><br><br><var 48 0F /var>Read and understand them well if you would gain the upper hand over the Empire's IVth Legion.<var 48 01 /var>","<var 48 08 /var><var 49 04 /var>Le Front sud de Bozja est une mission spéciale durant laquelle les joueurs doivent coopérer en grand nombre afin de soutenir les résistants dans leur lutte contre la 4e légion impériale.<var 49 01 /var><var 48 01 /var><br><br><var 48 0F /var>* Les pages suivantes expliquent les règles propres à cette mission.<br>Les lire vous permettront de profiter pleinement de cette mission de grande envergure.<var 48 01 /var>","","False","0x00000001","",""
"","<var 48 08 /var><var 49 04 /var>■Level Sync<var 49 01 /var><var 48 01 /var><br><br>Though it is possible to join the Bozjan southern front beginning at level 71, all players will be synced to level 80 while in duty. Item level will also be synced accordingly.<br><br><var 48 0F /var>* All job actions unlocked through level 80 will also be available while in duty.<var 48 01 /var>","<var 48 08 /var><var 49 04 /var>■ Synchronisation spéciale des jobs au niveau 80<var 1D /var>!<var 49 01 /var><var 48 01 /var><br><br>Le Front sud de Bozja est ouvert à tous les jobs de niveau 71 ou plus.<br>Une fois dans l'instance, les personnages sont tous synchronisés au niveau 80.<br>En outre, leur niveau d'objet est lui aussi synchronisé. Il n'est donc pas nécessaire de revêtir un équipement spécial pour profiter de cette mission.<br><br><var 48 0F /var>* Une fois sur le Front sud de Bozja, toutes les actions de jobs jusqu'au niveau 80 deviennent disponibles.<var 48 01 /var>","","False","0x00000002","",""
"","<var 48 08 /var><var 49 04 /var>■Resistance Rank<var 49 01 /var><var 48 01 /var><br><br>All players are subject to a separate leveling system while at the front, indicated by their “Resistance rank.” Performing admirably in large-scale battles such as skirmishes and critical engagements will increase your “mettle”─akin to experience points.<br><br><var 48 0F /var>* Simply defeating imperial troops and beasts is not enough to prove your mettle─you must participate in successful military operations.<var 48 01 /var>","<var 48 08 /var><var 49 04 /var>■ Faites grimper votre rang de résistant<var 08 E905 ((e)) (()) /var> en accumulant des points de faits d'armes<var 1D /var>!<var 49 01 /var><var 48 01 /var><br><br>Participer à des combats spéciaux, comme les escarmouches ou les af<var 16 /var>fron<var 16 /var>te<var 16 /var>ments cruciaux, permet d'obtenir des points de faits d'armes. Vous en recevez d'autant plus que l'évaluation de votre par<var 16 /var>ti<var 16 /var>ci<var 16 /var>pa<var 16 /var>tion à ces combats est élevée.<br><br><var 48 0F /var>* Vaincre des bêtes sauvages ou des troupes impériales n'octroie à eux seuls aucun point de faits d'armes.<var 48 01 /var>","","False","0x00000003","",""
"","If you demonstrate sufficient mettle upon reporting to the Resistance commander, your Resistance rank will climb. Those of higher rank will gain access to more areas of the front, as well as additional quests.<br><br><var 48 0F /var>* Your Resistance rank will not increase unless authorized by the commander, so don't forget to report for inspection!<var 48 01 /var>","Une fois que vous avez accumulé assez de points de faits d'armes, il suffit de parler à l'officier d'état-major du front sud pour qu'il vous octroie le rang de résistant<var 08 E905 ((e)) (()) /var> suivant. Un rang plus élevé permet d'étendre la zone de combat en repoussant les lignes ennemies, mais aussi de progresser dans la quête principale de Garde-la-Reine.<br><br><var 48 0F /var>* Votre rang de résistant<var 08 E905 ((e)) (()) /var> n'augmentera pas sans points de faits d'armes. Brillez sur le champ de bataille et rapportez vos exploits à l'état-major pour gagner du galon<var 1D /var>!<var 48 01 /var>","","False","0x00000004","",""
"","<var 48 08 /var><var 49 04 /var>■Job Leveling<var 49 01 /var><var 48 01 /var><br><br>Upon successful completion of a military operation, you will gain regular experience points in addition to mettle. This experience will be applied to your job level as normal, so it is recommended that you consider using a job that has not yet reached level 80 to take advantage of experience point gains.","<var 48 08 /var><var 49 04 /var>■ L'occasion parfaite de monter vos autres jobs<var 1D /var>!<var 49 01 /var><var 48 01 /var><br><br>Remporter des escarmouches ou des af<var 16 /var>fron<var 16 /var>te<var 16 /var>ments cruciaux permet aussi de gagner des points d'expérience et de passer des niveaux pour le job utilisé. Con<var 16 /var>trai<var 16 /var>re<var 16 /var>ment aux rangs de résistant, ces gains sont automatiques, et il n'est pas nécessaire de s'adresser à l'officier d'état-major pour les obtenir.<br><br>Profitez-en donc pour monter vos jobs qui ne sont pas encore au niveau 80<var 1D /var>!","","False","0x00000005","",""
"","<var 48 08 /var><var 49 04 /var>■But Wait...<var 49 01 /var><var 48 01 /var><br><br>More information is available from Sjeros in Gangos and your Resistance comrades at the southern front, so don't hesitate to converse with them!","<var 48 08 /var><var 49 04 /var>■ Des interrogations<var 1D /var>?<var 49 01 /var><var 48 01 /var><br><br>Si vous pensez ne pas avoir bien compris le fonc<var 16 /var>tion<var 16 /var>ne<var 16 /var>ment du Front sud de Bozja, Sjeros à Gangos et le guide de la résistance sur le front pourront vous renseigner. N'hésitez pas à leur demander des précisions, ils sont là pour ça<var 1D /var>!","","False","0x00000006","",""
"","<var 48 08 /var><var 49 04 /var>Duty Calls─A Dungeon Beckons!<var 49 01 /var><var 48 01 /var><br><br>Enlist the aid of <var 48 0F /var><var 49 10 /var>allied players<var 49 01 /var><var 48 01 /var> and <var 48 0F /var><var 49 10 /var>NPCs<var 49 01 /var><var 48 01 /var> alike to slay monsters, solve mysteries, and defeat the mighty boss lurking in the depths. Conquering <var 48 0F /var><var 49 10 /var>dungeons<var 49 01 /var><var 48 01 /var> is not only a time-honored tradition of adventurers, but it also <var 48 0F /var><var 49 10 /var>progresses the main scenario<var 49 01 /var><var 48 01 /var> and tests your prowess at a given class or job in a <var 48 0F /var><var 49 10 /var>timed environment.<var 49 01 /var><var 48 01 /var><br><br>Intimidated? Fear not, dear adventurer─for with a little guidance, you too shall be clearing <var 48 0F /var><var 49 10 /var>dungeons<var 49 01 /var><var 48 01 /var> with confidence in no time!","<var 48 08 /var><var 49 04 /var>Les donjons, une autre forme d'aventure<var 1D /var>!<var 49 01 /var><var 48 01 /var><br><br>Les donjons sont des lieux remplis de monstres à occire et de mécanismes à déjouer, à explorer en <var 48 0F /var><var 49 10 /var>coopération<var 49 01 /var><var 48 01 /var> avec <var 48 0F /var><var 49 10 /var>d'autres joueurs<var 49 01 /var><var 48 01 /var> ou des <var 48 0F /var><var 49 10 /var>PNJ alliés<var 49 01 /var><var 48 01 /var>. Au fond de chacun se trouve un <var 48 0F /var><var 49 10 /var>boss<var 49 01 /var><var 48 01 /var> qu'il vous faudra vaincre pour obtenir des <var 48 0F /var><var 49 10 /var>récompenses<var 49 01 /var><var 48 01 /var>.<br>Certains donjons devront être accomplis pour progresser dans l'<var 48 0F /var><var 49 10 /var>épopée<var 49 01 /var><var 48 01 /var>.<br>Les donjons doivent être accomplis en un temps donné. Qui plus est, vous ne pourrez pas changer de classe ou de job en cours de mission.<br>Lisez la page suivante pour savoir comment vous lancer dans l'exploration d'un donjon.","","False","0x00000007","",""
"","<var 48 08 /var><var 49 04 /var>Into the Depths: Two Ways to Adventure<var 49 01 /var><var 48 01 /var><br><br>You may challenge a <var 48 0F /var><var 49 10 /var>dungeon<var 49 01 /var><var 48 01 /var> via two different methods: by calling upon <var 48 0F /var><var 49 10 /var>the support of trusty NPCs<var 49 01 /var><var 48 01 /var>, or by <var 48 0F /var><var 49 10 /var>pooling your talent with other players<var 49 01 /var><var 48 01 /var>, be they best friend or first acquaintance. No matter how you form your party, the trials that await you will be comparable in difficulty and experience.","<var 48 08 /var><var 49 04 /var>Explorer un donjon ① Deux façons de se lancer<var 49 01 /var><var 48 01 /var><br><br>Il est possible d'explorer un donjon selon deux modalités différentes<var 1D /var>: en <var 48 0F /var><var 49 10 /var>solo<var 49 01 /var><var 48 01 /var>, avec l'aide de <var 48 0F /var><var 49 10 /var>PNJ alliés<var 49 01 /var><var 48 01 /var>, ou avec <var 48 0F /var><var 49 10 /var>d'autres joueurs<var 49 01 /var><var 48 01 /var>, trouvés à l'aide de la fonction de <var 48 0F /var><var 49 10 /var>grou<var 16 /var>page<var 49 01 /var><var 48 01 /var>. Bien sûr, il est également possible de s'enregistrer avec son équipe préalablement formée.<br>Les donjons peuvent être accomplis de la même façon, quelle que soit la modalité de par<var 16 /var>ti<var 16 /var>ci<var 16 /var>pa<var 16 /var>tion.","","False","0x00000008","",""
"","<var 48 08 /var><var 49 04 /var>Into the Depths: Duty Support<var 49 01 /var><var 48 01 /var><br><br>No matter how independent and capable you may be, a <var 48 0F /var><var 49 10 /var>dungeon<var 49 01 /var><var 48 01 /var> is too mighty a challenge to overcome on one's own. By choosing <var 48 0F /var><var 49 10 /var>Duty Support<var 49 01 /var><var 48 01 /var> when accessing the entrance of any applicable <var 48 0F /var><var 49 10 /var>dungeon<var 49 01 /var><var 48 01 /var>, you will summon a balanced <var 48 0F /var><var 49 10 /var>team of skilled NPCs<var 49 01 /var><var 48 01 /var> to support you on your path to glory. Just don't forget them once you're rich and famous, yes?","<var 48 08 /var><var 49 04 /var>Explorer un donjon ② Avec des PNJ alliés<var 49 01 /var><var 48 01 /var><br><br>Vous pouvez faire appel à des <var 48 0F /var><var 49 10 /var>PNJ alliés<var 49 01 /var><var 48 01 /var> pour explorer un donjon en <var 48 0F /var><var 49 10 /var>solo<var 49 01 /var><var 48 01 /var>, une fonctionnalité désignée sous le nom de “<var 48 0F /var><var 49 10 /var>Renforts<var 49 01 /var><var 48 01 /var>”.<br><br>Les donjons compatibles avec le système de renforts sont indiqués par un <var 48 0F /var><var 49 10 /var>icone<var 49 01 /var><var 48 01 /var> au niveau de leur entrée.","","False","0x00000009","",""
"","<var 48 08 /var><var 49 04 /var>Into the Depths: Duty Support, Continued<var 49 01 /var><var 48 01 /var><br><br>After choosing to challenge a <var 48 0F /var><var 49 10 /var>dungeon<var 49 01 /var><var 48 01 /var> with NPCs via <var 48 0F /var><var 49 10 /var>Duty Support<var 49 01 /var><var 48 01 /var>, a party that perfectly complements your <var 48 0F /var><var 49 10 /var>current class or job<var 49 01 /var><var 48 01 /var> will be automatically created for you. All that's left is to select <var 48 0F /var><var 49 10 /var>Register for Duty<var 49 01 /var><var 48 01 /var>, and you will be battling monsters in no time.","<var 48 08 /var><var 49 04 /var>Explorer un donjon ③ Avec des PNJ alliés (suite)<var 49 01 /var><var 48 01 /var><br><br>Cliquez sur l'entrée du donjon, puis choisissez l'<var 48 0F /var><var 49 10 /var>option<var 49 01 /var><var 48 01 /var> correspondante pour ouvrir la <var 48 0F /var><var 49 10 /var>fenêtre<var 49 01 /var><var 48 01 /var> des renforts.<br><br>Les <var 48 0F /var><var 49 10 /var>classes/jobs<var 49 01 /var><var 48 01 /var> des PNJ seront fixés en fonction de votre propre classe/job, de façon à former <var 48 0F /var><var 49 10 /var>au<var 16 /var>to<var 16 /var>ma<var 16 /var>ti<var 16 /var>que<var 16 /var>ment<var 49 01 /var><var 48 01 /var> l'équipe la mieux équilibrée possible.<br>Passez en revue les in<var 16 /var>for<var 16 /var>ma<var 16 /var>tions fournies, puis pressez le bouton “<var 48 0F /var><var 49 10 /var>Participer<var 49 01 /var><var 48 01 /var>” pour lancer la mission<var 1D /var>!","","False","0x0000000A","",""
"","<var 48 08 /var><var 49 04 /var>Into the Depths: Duty Finder<var 49 01 /var><var 48 01 /var><br><br>They say a burden shared is a burden halved, and with the <var 48 0F /var><var 49 10 /var>Duty Finder<var 49 01 /var><var 48 01 /var> you can split that burden amongst a team of players who smolder with the same passion for <var 48 0F /var><var 49 10 /var>adventure<var 49 01 /var><var 48 01 /var> as you do! No need to recruit such teammates yourself─the <var 48 0F /var><var 49 10 /var>Duty Finder<var 49 01 /var><var 48 01 /var>'s matching system will automatically group players according to chosen challenge and other criteria, guaranteeing a balanced and invigorating cooperative experience for all.","<var 48 08 /var><var 49 04 /var>Explorer un donjon ④ En formant une équipe de joueurs<var 49 01 /var><var 48 01 /var><br><br>Vous cherchez des <var 48 0F /var><var 49 10 /var>coéquipiers<var 49 01 /var><var 48 01 /var> pour explorer un donjon<var 1D /var>? Dans ce cas, facilitez-vous la tâche avec l'<var 48 0F /var><var 49 10 /var>outil de mission<var 49 01 /var><var 48 01 /var><var 1D /var>!<br><br>Cliquez sur l'entrée du donjon, puis choisissez l'<var 48 0F /var><var 49 10 /var>option<var 49 01 /var><var 48 01 /var> correspondante pour ouvrir la <var 48 0F /var><var 49 10 /var>fenêtre<var 49 01 /var><var 48 01 /var> de l'outil de mission.<br>Sélectionnez ensuite les <var 48 0F /var><var 49 10 /var>destinations<var 49 01 /var><var 48 01 /var> de votre choix et pressez le bouton <var 48 0F /var><var 49 10 /var>Participer<var 49 01 /var><var 48 01 /var>. Vous serez alors au<var 16 /var>to<var 16 /var>ma<var 16 /var>ti<var 16 /var>que<var 16 /var>ment <var 48 0F /var><var 49 10 /var>groupé(e)<var 49 01 /var><var 48 01 /var> avec d'autres joueurs désirant explorer les mêmes lieux.","","False","0x0000000B","",""
"","<var 48 08 /var><var 49 04 /var>Into the Depths: Duty Finder, Continued<var 49 01 /var><var 48 01 /var><br><br>Once you have been matched with a party, you will be notified by a <var 48 0F /var><var 49 10 /var>bracing sound<var 49 01 /var><var 48 01 /var> that the time for battle is at hand! Simply select <var 48 0F /var><var 49 10 /var>Commence<var 49 01 /var><var 48 01 /var>, and you and your comrades will be delivered unto the fray.<br><br>Remember─the adventurers with whom you are cooperating are fellow <var 48 0F /var><var 49 10 /var>players<var 49 01 /var><var 48 01 /var>. Take advantage of the full and varied strengths your group possesses by communicating respectfully and often. ","<var 48 08 /var><var 49 04 /var>Explorer un donjon ⑤ En formant une équipe de joueurs (suite)<var 49 01 /var><var 48 01 /var><br><br>Un <var 48 0F /var><var 49 10 /var>signal sonore<var 49 01 /var><var 48 01 /var> retentira une fois le grou<var 16 /var>page accompli.<br>Pressez alors le bouton <var 48 0F /var><var 49 10 /var>Commencer<var 49 01 /var><var 48 01 /var> pour lancer la mission<var 1D /var>!<br><br>Lorsque vous faites équipe avec <var 48 0F /var><var 49 10 /var>d'autres joueurs<var 49 01 /var><var 48 01 /var>, soyez courtois(e) et <var 48 0F /var><var 49 10 /var>coopérez<var 49 01 /var><var 48 01 /var> autant que possible pour assurer la réussite de la mission<var 1D /var>!","","False","0x0000000C","",""
"","<var 48 08 /var><var 49 04 /var>Dungeons Abound<var 49 01 /var><var 48 01 /var><br><br>As your journey progresses, more and more <var 48 0F /var><var 49 10 /var>dungeons<var 49 01 /var><var 48 01 /var> will become available, until you find yourself master of a sea of tribulations overcome. But don't let completion deter you from <var 48 0F /var><var 49 10 /var>challenging your favorite duties again<var 49 01 /var><var 48 01 /var>─simply open <var 48 0F /var><var 49 10 /var>Duty Support<var 49 01 /var><var 48 01 /var> to play through <var 48 0F /var><var 49 10 /var>dungeons you've cleared<var 49 01 /var><var 48 01 /var>, or use the <var 48 0F /var><var 49 10 /var>Duty Finder<var 49 01 /var><var 48 01 /var> to do the same with <var 48 0F /var><var 49 10 /var>dungeons not yet supported by the NPC party system.<var 49 01 /var><var 48 01 /var> No matter your craving, you're guaranteed to find an adventure to satisfy.","<var 48 08 /var><var 49 04 /var>Toujours plus de donjons à explorer<var 1D /var>!<var 49 01 /var><var 48 01 /var><br><br>À mesure que vous progresserez dans le jeu, vous aurez accès à de plus en plus de donjons.<br>Il se peut que certains soient <var 48 0F /var><var 49 10 /var>incompatibles<var 49 01 /var><var 48 01 /var> avec le système de renforts, auquel cas vous pourrez toujours les explorer en vous enregistrant via l'<var 48 0F /var><var 49 10 /var>outil de mission<var 49 01 /var><var 48 01 /var>.<br><br>Vous pourrez également revisiter les donjons déjà accomplis, aussi bien avec l'<var 48 0F /var><var 49 10 /var>outil de mission<var 49 01 /var><var 48 01 /var> que le système de <var 48 0F /var><var 49 10 /var>renforts<var 49 01 /var><var 48 01 /var> (tous deux accessibles à partir de la rubrique <var 48 0F /var><var 49 10 /var>Missions<var 49 01 /var><var 48 01 /var> du <var 48 0F /var><var 49 10 /var>menu principal<var 49 01 /var><var 48 01 /var>).","","False","0x0000000D","",""
"","<var 48 08 /var><var 49 04 /var>Need a Refresher?<var 49 01 /var><var 48 01 /var><br><br>While this introduction of <var 48 0F /var><var 49 10 /var>dungeons<var 49 01 /var><var 48 01 /var> has no doubt been immortalized within the hallowed halls of your mind, if you find yourself in need of a refresher, you may <var 48 0F /var><var 49 10 /var>access tutorial information<var 49 01 /var><var 48 01 /var> again by selecting the <var 48 0F /var><var 49 10 /var>?<var 49 01 /var><var 48 01 /var> icon in the <var 48 0F /var><var 49 10 /var>Duty Support<var 49 01 /var><var 48 01 /var> or <var 48 0F /var><var 49 10 /var>Duty Finder<var 49 01 /var><var 48 01 /var> windows.<br><br>A true adventurer knows the meaning of duty─secure your legacy by fulfilling yours!","<var 48 08 /var><var 49 04 /var>Besoin d'aide<var 1D /var>?<var 49 01 /var><var 48 01 /var><br><br>Dans la fenêtre de l'outil de mission ou des renforts, pressez le <var 48 0F /var><var 49 10 /var>bouton<var 1D /var>?<var 49 01 /var><var 48 01 /var> pour ouvrir l'aide correspondante.<br><br>L'outil de mission et le système de renforts sont des fonctionnalités incontournables pour progresser dans le jeu. Faites-en bon usage tout au long de votre aventure<var 1D /var>!","","False","0x0000000E","",""
