"location","source","target","id","fuzzy","context","translator_comments","developer_comments"
"","","","","True","0x00000000","",""
"","<var 48 08 /var><var 49 04 /var>The rules of engagement on the Bozjan southern front are different than what you will have encountered before. The following pages contain a detailed explanation of what you may expect on the battlefield.<var 49 01 /var><var 48 01 /var>

<var 48 0F /var>Read and understand them well if you would gain the upper hand over the Empire's IVth Legion.<var 48 01 /var>","<var 48 08 /var><var 49 04 /var>Правила ведения боя на южном фронте Бозьи отличаются от тех, с которыми вы сталкивались ранее. На следующих страницах содержится подробное объяснение того, что вас может ожидать на поле боя.<var 49 01 /var><var 48 01 /var>

<var 48 0F /var>Прочитайте и изучите их хорошо, если хотите одержать верх над IV легионом Империи.<var 48 01 /var>.","","False","0x00000001","",""
"","<var 48 08 /var><var 49 04 /var>■Level Sync<var 49 01 /var><var 48 01 /var>

Though it is possible to join the Bozjan southern front beginning at level 71, all players will be synced to level 80 while in duty. Item level will also be synced accordingly.

<var 48 0F /var>* All job actions unlocked through level 80 will also be available while in duty.<var 48 01 /var>","<var 48 08 /var><var 49 04 /var>■Синхронизация уровня<var 49 01 /var><var 48 01 /var>

Хотя на южный фронт Бозьи можно вступить, начиная с 71 уровня, все игроки будут синхронизированы к 80-му уровню во время несения службы. Уровень предметов также будет синхронизирован соответствующим образом.

<var 48 0F /var>* Все умения профессии, разблокированные к 80-му уровню, также будут доступны во время службы.
<var 48 01 /var>","","False","0x00000002","",""
"","<var 48 08 /var><var 49 04 /var>■Resistance Rank<var 49 01 /var><var 48 01 /var>

All players are subject to a separate leveling system while at the front, indicated by their “Resistance rank.” Performing admirably in large-scale battles such as skirmishes and critical engagements will increase your “mettle”─akin to experience points.

<var 48 0F /var>* Simply defeating imperial troops and beasts is not enough to prove your mettle─you must participate in successful military operations.<var 48 01 /var>","<var 48 08 /var><var 49 04 /var>■Ранг Сопротивления<var 49 01 /var><var 48 01 /var>

Все игроки, находясь на фронте, подчиняются отдельной системе повышения уровня, обозначаемой как «Рангом Сопротивления». Достойное участие в крупномасштабных схватках, таких как стычки и критические сражения, повысит вашу «храбрость», что равнозначно очкам опыта.

<var 48 0F /var>* Просто победить имперские войска и зверей недостаточно, чтобы доказать вашу храбрость — вы должны успешно завершать военные операции.<var 48 01 /var>.","","False","0x00000003","",""
"","If you demonstrate sufficient mettle upon reporting to the Resistance commander, your Resistance rank will climb. Those of higher rank will gain access to more areas of the front, as well as additional quests.

<var 48 0F /var>* Your Resistance rank will not increase unless authorized by the commander, so don't forget to report for inspection!<var 48 01 /var>","Если вы проявите достаточную храбрость, явившись к командиру Сопротивления, ваш ранг Сопротивления повысится. Обладатели более высокого ранга получат доступ к большему количеству участков фронта, а также дополнительные задания.

<var 48 0F /var>* Ваш ранг Сопротивления сам по себе не повысится, без отчёта командиру, поэтому не забывайте докладывать рапорты!
<var 48 01 /var>","","False","0x00000004","",""
"","<var 48 08 /var><var 49 04 /var>■Job Leveling<var 49 01 /var><var 48 01 /var>

Upon successful completion of a military operation, you will gain regular experience points in addition to mettle. This experience will be applied to your job level as normal, so it is recommended that you consider using a job that has not yet reached level 80 to take advantage of experience point gains.","<var 48 08 /var><var 49 04 /var>■Повышение уровней профессии<var 49 01 /var><var 48 01 /var>

После успешного завершения вооружённой операции вы получите обычные очки опыта в дополнение к храбрости. Этот опыт будет добавлен к уровню вашей текущей профессии, как обычно, поэтому рекомендуется использовать ту профессию, которая ещё не достигла 80-го уровня, чтобы воспользоваться преимуществами прироста очков опыта.","","False","0x00000005","",""
"","<var 48 08 /var><var 49 04 /var>■But Wait...<var 49 01 /var><var 48 01 /var>

More information is available from Sjeros in Gangos and your Resistance comrades at the southern front, so don't hesitate to converse with them!","<var 48 08 /var><var 49 04 /var>■Но подождите...<var 49 01 /var><var 48 01 /var>

Больше информации можно получить от Сьеры в Гангосе и прочих ваших товарищей по Сопротивлению на южном фронте, так что не стесняйтесь общаться с ними!","","False","0x00000006","",""
"","<var 48 08 /var><var 49 04 /var>Duty Calls─A Dungeon Beckons!<var 49 01 /var><var 48 01 /var>

Enlist the aid of <var 48 0F /var>allied players<var 48 01 /var> and <var 48 0F /var>NPCs<var 48 01 /var> alike to slay monsters, solve mysteries, and defeat the mighty boss lurking in the depths. Conquering <var 48 0F /var>dungeons<var 48 01 /var> is not only a time-honored tradition of adventurers, but it also <var 48 0F /var>progresses the main scenario<var 48 01 /var> and tests your prowess at a given class or job in a <var 48 0F /var>timed environment<var 48 01 /var>.

Intimidated? Fear not, dear adventurer─for with a little guidance, you too shall be clearing <var 48 0F /var>dungeons<var 48 01 /var> with confidence in no time!","<var 48 08 /var><var 49 04 /var>Миссия начинается — пора в подземелье!<var 49 01 /var><var 48 01 /var>

Заручитесь поддержкой других <var 48 0F /var>искателей приключений — игроков<var 48 01 /var> или <var 48 0F /var>группой дружественных NPC<var 48 01 /var> для победы над монстрами, разгадок тайн и сражений с мощными боссами, скрывающимися в их глубинах. <var 48 0F /var>Подземелья<var 48 01 /var> — это не только классическое времяпровождение искателей приключений, но ещё и порой <var 48 0F /var>сюжетная составляющая<var 48 01 /var>, а кроме всего прочего подвергнет ваши силы <var 48 0F /var>неплохому испытанию<var 48 01 /var>.
Страшно? Не дрейфь, славный искатель приключений! Парочка слов наставления — и ты будешь уверенно зачищать <var 48 0F /var>подземелья<var 48 01 /var> быстрее пули!","","False","0x00000007","",""
"","<var 48 08 /var><var 49 04 /var>Into the Depths: Two Ways to Adventure<var 49 01 /var><var 48 01 /var>

You may challenge a <var 48 0F /var>dungeon<var 48 01 /var> via two different methods: by calling upon <var 48 0F /var>the support of trusty NPCs<var 48 01 /var>, or by <var 48 0F /var>pooling your talent with other players<var 48 01 /var>, be they best friend or first acquaintance. No matter how you form your party, the trials that await you will be comparable in difficulty and experience.","<var 48 08 /var><var 49 04 /var>Подземелья: способы прохождения<var 49 01 /var><var 48 01 /var>

<var 48 0F /var>Подземелье<var 48 01 /var> можно пройти двумя способами: <var 48 0F /var>в компании дружественных NPC (неживых персонажей)<var 48 01 /var>, или, если уверены в своих талантах, <var 48 0F /var>плечом к плечу с другими игроками<var 48 01 /var> — и неважно, давний ли это ваш знакомый или человек, которого вы в первый раз видите. Вне зависимости от того, какой способ вы выберете, будьте уверены — в любом случае вас ждёт равнозначное испытание.","","False","0x00000008","",""
"","<var 48 08 /var><var 49 04 /var>Into the Depths: Duty Support<var 49 01 /var><var 48 01 /var>

No matter how independent and capable you may be, a <var 48 0F /var>dungeon<var 48 01 /var> is too mighty a challenge to overcome on one's own. By choosing <var 48 0F /var>Duty Support<var 48 01 /var> when accessing the entrance of any applicable <var 48 0F /var>dungeon<var 48 01 /var>, you will summon a balanced <var 48 0F /var>team of skilled NPCs<var 48 01 /var> to support you on your path to glory. Just don't forget them once you're rich and famous, yes?","<var 48 08 /var><var 49 04 /var>Подземелья: «Миссии с помощниками»<var 49 01 /var><var 48 01 /var>

Какими бы вы ни были умелыми и независимыми, <var 48 0F /var>подземелья<var 48 01 /var> чересчур сложны, чтобы соваться туда в одиночку. Функция <var 48 0F /var>Миссии с помощниками<var 48 01 /var> может быть задействована при взаимодействии с маркером <var 48 0F /var>на входе в подземелье<var 48 01 /var>, либо из подменю <var 48 0F /var>«Миссии с помощниками»<var 48 01 /var> раздела <var 48 0F /var>«Задачи»<var 48 01 /var> главного меню в любой момент и в любом месте. К вам на помощь придёт группа <var 48 0F /var>группа умелых NPC<var 48 01 /var>, сбалансированно подобранная в зависимости от ваших предпочтений. 
Когда станете богатыми, словно султана, а от вашей руки будут падать монстры размером с гору, вы вспомните об этих ребятах с улыбкой.","","False","0x00000009","",""
"","<var 48 08 /var><var 49 04 /var>Into the Depths: Duty Support, Continued<var 49 01 /var><var 48 01 /var>

After choosing to challenge a <var 48 0F /var>dungeon<var 48 01 /var> with NPCs via <var 48 0F /var>Duty Support<var 48 01 /var>, a party that perfectly complements your <var 48 0F /var>current class or job<var 48 01 /var> will be automatically created for you. All that's left is to select <var 48 0F /var>Register for Duty<var 48 01 /var>, and you will be battling monsters in no time.","<var 48 08 /var><var 49 04 /var>Подземелья: И ещё насчёт миссий с помощниками...<var 49 01 /var><var 48 01 /var>

Так вот, если выберете опцию прохождения <var 48 0F /var>подземелья<var 48 01 /var> с группой NPC, задействовав функцию <var 48 0F /var>Миссии с помощниками<var 48 01 /var>, группа будет идеально подходить к вашим <var 48 0F /var>текущим роли и классу<var 48 01 /var>. Осталось нажать на кнопочку <var 48 0F /var>«Начать»<var 48 01 /var>, и вскоре окажетесь по шею в монстрах! ...Шучу, всего лишь по пояс. Да помогут вам Двенадцать богов.","","False","0x0000000A","",""
"","<var 48 08 /var><var 49 04 /var>Into the Depths: Duty Finder<var 49 01 /var><var 48 01 /var>

They say a burden shared is a burden halved, and with the <var 48 0F /var>Duty Finder<var 48 01 /var> you can split that burden amongst a team of players who smolder with the same passion for <var 48 0F /var>adventure<var 48 01 /var> as you do! No need to recruit such teammates yourself─the <var 48 0F /var>Duty Finder<var 48 01 /var>'s matching system will automatically group players according to chosen challenge and other criteria, guaranteeing a balanced and invigorating cooperative experience for all.","<var 48 08 /var><var 49 04 /var>Подземелья: «Поиск миссий»<var 49 01 /var><var 48 01 /var>

Невозможная ноша станет возможной, если разделить её с другими, и <var 48 0F /var>Поиск миссий<var 48 01 /var> поможет вам в поисках других игроков, буквально кипящих, как и вы, жаждой приключений! И не нужно ничего нажимать и подбирать людей самостоятельно — <var 48 0F /var>Поиск миссий<var 48 01 /var> это автоматическая система, которая набирает игроков в соответствии с предстоящей задачей и прочими критериями; короче говоря, гарантирует сбалансированное и комфортное прохождение для каждого члена сформированной группы.","","False","0x0000000B","",""
"","<var 48 08 /var><var 49 04 /var>Into the Depths: Duty Finder, Continued<var 49 01 /var><var 48 01 /var>

Once you have been matched with a party, you will be notified by a <var 48 0F /var>bracing sound<var 48 01 /var> that the time for battle is at hand! Simply select <var 48 0F /var>Commence<var 48 01 /var>, and you and your comrades will be delivered unto the fray.

Remember─the adventurers with whom you are cooperating are fellow <var 48 0F /var>players<var 48 01 /var>. Take advantage of the full and varied strengths your group possesses by communicating respectfully and often. ","<var 48 08 /var><var 49 04 /var>Подземелья: Итак, прохождение с игроками...<var 49 01 /var><var 48 01 /var>

По истечении небольшого времени вы услышите характерный <var 48 0F /var>«БЗДЫНЬК»<var 48 01 /var>, и это будет означать, что пора в бой! Просто нажмите <var 48 0F /var>Начать<var 48 01 /var> в появившемся окошке, и совсем скоро окажетесь по шею в толпах кровожадных... ладно, сами знаете.
Главное, помните — искатели приключений, с которыми вы идёте в бой, будут такими же как вы, <var 48 0F /var>живыми игроками<var 48 01 /var>. В полной мере воспользуйтесь преимуществами такой группы — общайтесь и не стесняйтесь спрашивать, но помните о вежливости и уважайте чужое время.","","False","0x0000000C","",""
"","<var 48 08 /var><var 49 04 /var>Dungeons Abound<var 49 01 /var><var 48 01 /var>

As your journey progresses, more and more <var 48 0F /var>dungeons<var 48 01 /var> will become available, until you find yourself master of a sea of tribulations overcome. But don't let completion deter you from <var 48 0F /var>challenging your favorite duties again<var 48 01 /var>─simply open <var 48 0F /var>Duty Support<var 48 01 /var> to play through <var 48 0F /var>dungeons you've cleared<var 48 01 /var>, or use the <var 48 0F /var>Duty Finder<var 48 01 /var> to do the same with <var 48 0F /var>dungeons not yet supported by the NPC party system<var 48 01 /var>. No matter your craving, you're guaranteed to find an adventure to satisfy.","<var 48 08 /var><var 49 04 /var>Подземелья, сотни их!..<var 49 01 /var><var 48 01 /var>

Продолжайте своё путешествие, и вам будет открываться <var 48 0F /var>всё больше и больше подземелий<var 48 01 /var>;совсем скоро вы почувствуете себя весьма уверенно. Ничто, однако, не помешает вам при желании <var 48 0F /var>снова пройти уже выполненную миссию<var 48 01 /var> — точно так же выберите функцию <var 48 0F /var>Миссий с помощниками<var 48 01 /var> или <var 48 0F /var>Поиска миссий<var 48 01 /var> на выбор и снова пройдите <var 48 0F /var>подземелья, которые вы уже зачистили<var 48 01 /var>. Учтите, что в будущем вам могут попасться некоторые миссии, недоступные для прохождения с группой NPC.","","False","0x0000000D","",""
"","<var 48 08 /var><var 49 04 /var>Need a Refresher?<var 49 01 /var><var 48 01 /var>

While this introduction of <var 48 0F /var>dungeons<var 48 01 /var> has no doubt been immortalized within the hallowed halls of your mind, if you find yourself in need of a refresher, you may <var 48 0F /var>access tutorial information<var 48 01 /var> again by selecting the <var 48 0F /var>?<var 48 01 /var> icon in the <var 48 0F /var>Duty Support<var 48 01 /var> or <var 48 0F /var>Duty Finder<var 48 01 /var> windows.

A true adventurer knows the meaning of duty─secure your legacy by fulfilling yours!","<var 48 08 /var><var 49 04 /var>Ещё разок?<var 49 01 /var><var 48 01 /var>

Несомненно, данное руководство навеки врезалось в чертоги вашей памяти — да так, что не сотрёшь — но на всякий случай сообщаем, что его снова можно открыть, нажав значок <var 48 0F /var>?<var 48 01 /var> в окошках <var 48 0F /var>Миссий с помощниками<var 48 01 /var> или <var 48 0F /var>Поиска миссий<var 48 01 /var>.

Настоящий искатель приключений знает цену хорошей миссии, и увековечивает себя, подходя к её выполнению ответственно!","","False","0x0000000E","",""
"","<var 48 08 /var><var 49 04 /var>Variant Dungeons─A Matter of Choice<var 49 01 /var><var 48 01 /var>

<var 48 0F /var>Variant dungeons<var 48 01 /var> are a unique type of duty featuring <var 48 0F /var>branching paths<var 48 01 /var>. By exploring these choices alongside the quest character, you will gradually reveal new elements of the overarching story.

Unlocking certain branches may require some detective work! Whenever you complete a path, a new story entry will be added to the journal associated with the dungeon, so keep at it until you discover all the forks in the road.","<var 48 08 /var><var 49 04 /var>Variant Dungeons─A Matter of Choice<var 49 01 /var><var 48 01 /var>

<var 48 0F /var>Variant dungeons<var 48 01 /var> are a unique type of duty featuring <var 48 0F /var>branching paths<var 48 01 /var>. By exploring these choices alongside the quest character, you will gradually reveal new elements of the overarching story.

Unlocking certain branches may require some detective work! Whenever you complete a path, a new story entry will be added to the journal associated with the dungeon, so keep at it until you discover all the forks in the road.","","True","0x0000000F","",""
"","<var 48 08 /var><var 49 04 /var>Make It a Party or Go It Alone<var 49 01 /var><var 48 01 /var>

The difficulty of a variant dungeon is <var 48 0F /var>automatically adjusted<var 48 01 /var> to provide a challenge for parties of between one to four players. 

You can group up with friends, make use of the party matching option, or put your solo player skills to the test. Victory will require effort and attention, but it is entirely possible to complete these dungeons alone. ","<var 48 08 /var><var 49 04 /var>Make It a Party or Go It Alone<var 49 01 /var><var 48 01 /var>

The difficulty of a variant dungeon is <var 48 0F /var>automatically adjusted<var 48 01 /var> to provide a challenge for parties of between one to four players. 

You can group up with friends, make use of the party matching option, or put your solo player skills to the test. Victory will require effort and attention, but it is entirely possible to complete these dungeons alone. ","","True","0x00000010","",""
"","<var 48 08 /var><var 49 04 /var>Variant Actions<var 49 01 /var><var 48 01 /var>

To allow for greater freedom in role choices, variant dungeons grant players the use of special <var 48 0F /var>variant actions<var 48 01 /var>.

These actions mimic existing abilities such as <var 48 0F /var>Cure<var 48 01 /var> or <var 48 0F /var>Rampart<var 48 01 /var>, alleviating the need for dedicated tanks, DPS, or healers. Each player has two actions available for use during the dungeon, and these can be changed at any time in the Dungeon Finder window.","<var 48 08 /var><var 49 04 /var>Variant Actions<var 49 01 /var><var 48 01 /var>

To allow for greater freedom in role choices, variant dungeons grant players the use of special <var 48 0F /var>variant actions<var 48 01 /var>.

These actions mimic existing abilities such as <var 48 0F /var>Cure<var 48 01 /var> or <var 48 0F /var>Rampart<var 48 01 /var>, alleviating the need for dedicated tanks, DPS, or healers. Each player has two actions available for use during the dungeon, and these can be changed at any time in the Dungeon Finder window.","","True","0x00000011","",""
"","<var 48 08 /var><var 49 04 /var>Enter the Dungeon<var 49 01 /var><var 48 01 /var>

You can enter a variant dungeon via the <var 48 0F /var>V&C Dungeon Finder window<var 48 01 /var>, which is accessed by speaking with the <var 48 0F /var>NPC at the dungeon entrance<var 48 01 /var>, or by selecting the option from <var 48 0F /var>Duty<var 48 01 /var> in the main menu.

This standalone window serves all your variant dungeon needs, whether you wish to read story discoveries, set your variant actions, or make changes to the dungeon settings.","<var 48 08 /var><var 49 04 /var>Enter the Dungeon<var 49 01 /var><var 48 01 /var>

You can enter a variant dungeon via the <var 48 0F /var>V&C Dungeon Finder window<var 48 01 /var>, which is accessed by speaking with the <var 48 0F /var>NPC at the dungeon entrance<var 48 01 /var>, or by selecting the option from <var 48 0F /var>Duty<var 48 01 /var> in the main menu.

This standalone window serves all your variant dungeon needs, whether you wish to read story discoveries, set your variant actions, or make changes to the dungeon settings.","","True","0x00000012","",""
"","<var 48 08 /var><var 49 04 /var>Welcome to your new home in the southern seas─your own personal island sanctuary!<var 49 01 /var><var 48 01 /var>

Explore the wilds, build landmarks, grow crops, tend to animals, and enjoy everything this slice of paradise has to offer.","<var 48 08 /var><var 49 04 /var>Welcome to your new home in the southern seas─your own personal island sanctuary!<var 49 01 /var><var 48 01 /var>

Explore the wilds, build landmarks, grow crops, tend to animals, and enjoy everything this slice of paradise has to offer.","","True","0x00000013","",""
"","<var 48 08 /var><var 49 04 /var>■No Class/Job Restrictions<var 49 01 /var><var 48 01 /var>

Adventurers of all inclinations can enjoy island sanctuary life, regardless of crafting or gathering experience. Come as you are!","<var 48 08 /var><var 49 04 /var>■No Class/Job Restrictions<var 49 01 /var><var 48 01 /var>

Adventurers of all inclinations can enjoy island sanctuary life, regardless of crafting or gathering experience. Come as you are!","","True","0x00000014","",""
