"location","source","target","id","fuzzy","context","translator_comments","developer_comments"
"","TEXT_VOICEMAN_05505_002630_KANESENNA<tab>Esteemed guests. You honor us with your presence. As there is much to discuss, let us begin.","TEXT_VOICEMAN_05505_002630_KANESENNA<tab>Esteemed guests. You honor us with your presence. As there is much to discuss, let us begin.","","True","0x00000000","",""
"","TEXT_VOICEMAN_05505_002640_IXALICHIEFTAIN<tab>Information on our taken brethren you have, yes? Hear it we would!","TEXT_VOICEMAN_05505_002640_IXALICHIEFTAIN<tab>Information on our taken brethren you have, yes? Hear it we would!","","True","0x00000001","",""
"","TEXT_VOICEMAN_05505_002650_IXALICHIEFTAIN<tab>Beyond forgiveness these featherless ones are! With rivers of blood shall they pay! Freed our people must be!","TEXT_VOICEMAN_05505_002650_IXALICHIEFTAIN<tab>Beyond forgiveness these featherless ones are! With rivers of blood shall they pay! Freed our people must be!","","True","0x00000002","",""
"","TEXT_VOICEMAN_05505_002660_YSHTOLA<tab>We too would see your kin liberated, but ere we attempt their rescue, we must first find a means to negate the risk of tempering. Without that, we will be unable even to approach the towers, let alone contend with their defenders.","TEXT_VOICEMAN_05505_002660_YSHTOLA<tab>We too would see your kin liberated, but ere we attempt their rescue, we must first find a means to negate the risk of tempering. Without that, we will be unable even to approach the towers, let alone contend with their defenders.","","True","0x00000003","",""
"","TEXT_VOICEMAN_05505_002670_MERLWYB<tab>If all else fails, I've always found cannonballs quite effective...","TEXT_VOICEMAN_05505_002670_MERLWYB<tab>If all else fails, I've always found cannonballs quite effective...","","True","0x00000004","",""
"","TEXT_VOICEMAN_05505_002680_SAHAGINPRIEST<tab>And what of the prisoners!? Would you see them ssslaughtered!?","TEXT_VOICEMAN_05505_002680_SAHAGINPRIEST<tab>And what of the prisoners!? Would you see them ssslaughtered!?","","True","0x00000005","",""
"","TEXT_VOICEMAN_05505_002690_ZADA<tab>Think for a moment! Ponder, consider, think! If Merlwyb truly intended to bombard the towers, she would have done so by now. Remember, we came here to find a solution together, did we not?","TEXT_VOICEMAN_05505_002690_ZADA<tab>Think for a moment! Ponder, consider, think! If Merlwyb truly intended to bombard the towers, she would have done so by now. Remember, we came here to find a solution together, did we not?","","True","0x00000006","",""
"","TEXT_VOICEMAN_05505_002700_MERLWYB<tab>Y'shtola spoke of defenders. I but offered a means to clear a path, should you require it. ","TEXT_VOICEMAN_05505_002700_MERLWYB<tab>Y'shtola spoke of defenders. I but offered a means to clear a path, should you require it. ","","True","0x00000007","",""
"","TEXT_VOICEMAN_05505_002710_RAUBAHN<tab>Given the enemy's capabilities, we will all need to play our part if we are to have any chance of success. For if any here should give less than their best, it will be to the cost of every living being on this star.","TEXT_VOICEMAN_05505_002710_RAUBAHN<tab>Given the enemy's capabilities, we will all need to play our part if we are to have any chance of success. For if any here should give less than their best, it will be to the cost of every living being on this star.","","True","0x00000008","",""
"","TEXT_VOICEMAN_05505_002720_SAHAGINPRIEST<tab>A Paragon, the Empire, our very gods... How can we hope to prevail against sssuch odds?","TEXT_VOICEMAN_05505_002720_SAHAGINPRIEST<tab>A Paragon, the Empire, our very gods... How can we hope to prevail against sssuch odds?","","True","0x00000009","",""
"","TEXT_VOICEMAN_05505_002730_AYMERIC<tab>That our foe is formidable none would deny, but our strengths are many and varied. In this chamber, I see masters of strategy, masters of magic, masters of the land, the air, and the sea. And together, there is nothing in creation we cannot overcome.","TEXT_VOICEMAN_05505_002730_AYMERIC<tab>That our foe is formidable none would deny, but our strengths are many and varied. In this chamber, I see masters of strategy, masters of magic, masters of the land, the air, and the sea. And together, there is nothing in creation we cannot overcome.","","True","0x0000000A","",""
"","TEXT_VOICEMAN_05505_002740_SAHAGINPRIEST<tab>Krrrggghhhccchhh!","TEXT_VOICEMAN_05505_002740_SAHAGINPRIEST<tab>Krrrggghhhccchhh!","","True","0x0000000B","",""
"","TEXT_VOICEMAN_05505_002750_AYMERIC<tab>I beg your pardon?","TEXT_VOICEMAN_05505_002750_AYMERIC<tab>I beg your pardon?","","True","0x0000000C","",""
"","TEXT_VOICEMAN_05505_002760_SAHAGINPRIEST<tab>What is it, shorewalker? Do you not express your passion thusss?","TEXT_VOICEMAN_05505_002760_SAHAGINPRIEST<tab>What is it, shorewalker? Do you not express your passion thusss?","","True","0x0000000D","",""
"","TEXT_VOICEMAN_05505_002770_SAHAGINPRIEST<tab>A little tricky without gills, perhaps! Pshahaha! Sssuffice it to say, I am proud to be counted amongst Eorzea's finessst. We Sssahagin will play our part!","TEXT_VOICEMAN_05505_002770_SAHAGINPRIEST<tab>A little tricky without gills, perhaps! Pshahaha! Sssuffice it to say, I am proud to be counted amongst Eorzea's finessst. We Sssahagin will play our part!","","True","0x0000000E","",""
"","TEXT_VOICEMAN_05505_002780_ZADA<tab>We kobolds have not forgotten the crimes the overdwellers committed against us in the past. But today we look to the future, as allies united in purpose.","TEXT_VOICEMAN_05505_002780_ZADA<tab>We kobolds have not forgotten the crimes the overdwellers committed against us in the past. But today we look to the future, as allies united in purpose.","","True","0x0000000F","",""
"","TEXT_VOICEMAN_05505_002790_IXALICHIEFTAIN<tab>Make mock of the Ixal, the Paragon does! Turns kin into puppets, pits brother against brother! Free them from his grasp, we shall!","TEXT_VOICEMAN_05505_002790_IXALICHIEFTAIN<tab>Make mock of the Ixal, the Paragon does! Turns kin into puppets, pits brother against brother! Free them from his grasp, we shall!","","True","0x00000010","",""
"","TEXT_VOICEMAN_05505_002800_KANESENNA<tab>As Patriarch Za Da will attest, the Scions have granted us a means to free your brethren from their thralldom. This boon we will gladly share, that your people might never be enslaved again.","TEXT_VOICEMAN_05505_002800_KANESENNA<tab>As Patriarch Za Da will attest, the Scions have granted us a means to free your brethren from their thralldom. This boon we will gladly share, that your people might never be enslaved again.","","True","0x00000011","",""
"","TEXT_VOICEMAN_05505_002810_IXALICHIEFTAIN<tab>No subtitles. Report if displayed.","TEXT_VOICEMAN_05505_002810_IXALICHIEFTAIN<tab>No subtitles. Report if displayed.","","True","0x00000012","",""
"","TEXT_VOICEMAN_05505_002820_AMALJAACHIEFTAIN<tab>No subtitles. Report if displayed.","TEXT_VOICEMAN_05505_002820_AMALJAACHIEFTAIN<tab>No subtitles. Report if displayed.","","True","0x00000013","",""
"","TEXT_VOICEMAN_05505_002830_SAHAGINPRIEST<tab>No subtitles. Report if displayed.","TEXT_VOICEMAN_05505_002830_SAHAGINPRIEST<tab>No subtitles. Report if displayed.","","True","0x00000014","",""
"","TEXT_VOICEMAN_05505_002840_THANCRED<tab>It's taken a while, but I do believe we might be one step closer to a world without primals. Would that Minfilia were here to see it.","TEXT_VOICEMAN_05505_002840_THANCRED<tab>It's taken a while, but I do believe we might be one step closer to a world without primals. Would that Minfilia were here to see it.","","True","0x00000015","",""
"","TEXT_VOICEMAN_05505_002850_ALISAIE<tab>We still have a long way to go, and we're going to need a <var 1A 02 /var>lot<var 1A 01 /var> more porxies...but we're moving in the right direction.","TEXT_VOICEMAN_05505_002850_ALISAIE<tab>We still have a long way to go, and we're going to need a <var 1A 02 /var>lot<var 1A 01 /var> more porxies...but we're moving in the right direction.","","True","0x00000016","",""
"","TEXT_VOICEMAN_05505_002860_ALPHINAUD<tab>If I may have your attention, there is one other point I would like to raise. As we can all agree, freeing those held captive must take precedence over every other concern.","TEXT_VOICEMAN_05505_002860_ALPHINAUD<tab>If I may have your attention, there is one other point I would like to raise. As we can all agree, freeing those held captive must take precedence over every other concern.","","True","0x00000017","",""
"","TEXT_VOICEMAN_05505_002870_ALPHINAUD<tab>But experience has taught us that none save those with the capacity to resist tempering can hope to enter the towers unscathed. And even once inside, a still greater threat may yet await them: that which we call a primal.","TEXT_VOICEMAN_05505_002870_ALPHINAUD<tab>But experience has taught us that none save those with the capacity to resist tempering can hope to enter the towers unscathed. And even once inside, a still greater threat may yet await them: that which we call a primal.","","True","0x00000018","",""
"","TEXT_VOICEMAN_05505_002880_ALPHINAUD<tab>Needless to say, if we are to succeed, engaging with such foes can only ever be considered a last resort. And so I move that we seek to prevent them from being summoned in the first place.","TEXT_VOICEMAN_05505_002880_ALPHINAUD<tab>Needless to say, if we are to succeed, engaging with such foes can only ever be considered a last resort. And so I move that we seek to prevent them from being summoned in the first place.","","True","0x00000019","",""
"","TEXT_VOICEMAN_05505_002890_ZADA<tab>Yes! Both prayer and aether are needed for the ritual. Should either one be denied, the summoning would fail!","TEXT_VOICEMAN_05505_002890_ZADA<tab>Yes! Both prayer and aether are needed for the ritual. Should either one be denied, the summoning would fail!","","True","0x0000001A","",""
"","TEXT_VOICEMAN_05505_002900_ALPHINAUD<tab>Indeed. And so we must endeavor to discover the source of the aether on which the process depends. Do so, and it may present a way to halt the summonings─or perhaps even neutralize the towers entirely.","TEXT_VOICEMAN_05505_002900_ALPHINAUD<tab>Indeed. And so we must endeavor to discover the source of the aether on which the process depends. Do so, and it may present a way to halt the summonings─or perhaps even neutralize the towers entirely.","","True","0x0000001B","",""
"","TEXT_VOICEMAN_05505_002910_NANAMOULNAMO<tab>A promising proposal. While you are conducting your investigations, however, we will need to remain vigilant, lest the Telophoroi commit further abductions, and summon primals ere we have the means to prevent them.","TEXT_VOICEMAN_05505_002910_NANAMOULNAMO<tab>A promising proposal. While you are conducting your investigations, however, we will need to remain vigilant, lest the Telophoroi commit further abductions, and summon primals ere we have the means to prevent them.","","True","0x0000001C","",""
"","TEXT_VOICEMAN_05505_002920_NANAMOULNAMO<tab>To stand a better chance of keeping our enemy at bay, we would do well to coordinate our defensive efforts, sending reinforcements to assist our neighbors when needed.","TEXT_VOICEMAN_05505_002920_NANAMOULNAMO<tab>To stand a better chance of keeping our enemy at bay, we would do well to coordinate our defensive efforts, sending reinforcements to assist our neighbors when needed.","","True","0x0000001D","",""
"","TEXT_VOICEMAN_05505_002930_AMALJAACHIEFTAIN<tab>We Amalj'aa would have been overwhelmed were it not for our newfound allies. But say the word, and we shall come.","TEXT_VOICEMAN_05505_002930_AMALJAACHIEFTAIN<tab>We Amalj'aa would have been overwhelmed were it not for our newfound allies. But say the word, and we shall come.","","True","0x0000001E","",""
"","TEXT_VOICEMAN_05505_002940_AYMERIC<tab>I see we are all in accord.","TEXT_VOICEMAN_05505_002940_AYMERIC<tab>I see we are all in accord.","","True","0x0000001F","",""
"","TEXT_VOICEMAN_05505_002950_AYMERIC<tab>But what are we to call this proud fellowship of ours? I submit that the honor of naming it should go to the Scion whose brave efforts have done so much to unite Eorzea. What say you, my friend?","TEXT_VOICEMAN_05505_002950_AYMERIC<tab>But what are we to call this proud fellowship of ours? I submit that the honor of naming it should go to the Scion whose brave efforts have done so much to unite Eorzea. What say you, my friend?","","True","0x00000020","",""
"","TEXT_VOICEMAN_05505_Q1_000_001_NONE_VOICE<tab>What will you say?","TEXT_VOICEMAN_05505_Q1_000_001_NONE_VOICE<tab>What will you say?","","True","0x00000021","",""
"","TEXT_VOICEMAN_05505_A1_000_001_NONE_VOICE<tab>I would call it the Grand Company of Eorzea.","TEXT_VOICEMAN_05505_A1_000_001_NONE_VOICE<tab>I would call it the Grand Company of Eorzea.","","True","0x00000022","",""
"","TEXT_VOICEMAN_05505_A1_000_002_NONE_VOICE<tab>I would...call it... One moment, please.","TEXT_VOICEMAN_05505_A1_000_002_NONE_VOICE<tab>I would...call it... One moment, please.","","True","0x00000023","",""
"","TEXT_VOICEMAN_05505_002960_ALPHINAUD<tab>But that's the name I...","TEXT_VOICEMAN_05505_002960_ALPHINAUD<tab>But that's the name I...","","True","0x00000024","",""
"","TEXT_VOICEMAN_05505_002970_ALISAIE<tab>Might I suggest the Grand Company of Eorzea? I remember a certain someone pondering it once upon a time, and it seems as fitting a name as any.","TEXT_VOICEMAN_05505_002970_ALISAIE<tab>Might I suggest the Grand Company of Eorzea? I remember a certain someone pondering it once upon a time, and it seems as fitting a name as any.","","True","0x00000025","",""
"","TEXT_VOICEMAN_05505_002980_RAUBAHN<tab>A fine choice. For there is none here who does not love Eorzea!","TEXT_VOICEMAN_05505_002980_RAUBAHN<tab>A fine choice. For there is none here who does not love Eorzea!","","True","0x00000026","",""
"","TEXT_VOICEMAN_05505_002990_MERLWYB<tab>Aye! In that we shall ever be united!","TEXT_VOICEMAN_05505_002990_MERLWYB<tab>Aye! In that we shall ever be united!","","True","0x00000027","",""
"","TEXT_VOICEMAN_05505_003000_KANESENNA<tab>United in our gratitude for the realm that gave us life!","TEXT_VOICEMAN_05505_003000_KANESENNA<tab>United in our gratitude for the realm that gave us life!","","True","0x00000028","",""
"","TEXT_VOICEMAN_05505_003010_NANAMOULNAMO<tab>Then let it be recorded that on this day the Grand Company of Eorzea was born!","TEXT_VOICEMAN_05505_003010_NANAMOULNAMO<tab>Then let it be recorded that on this day the Grand Company of Eorzea was born!","","True","0x00000029","",""
"","TEXT_VOICEMAN_05505_003020_ALPHINAUD<tab>How long have we dreamed of this moment? And now that it's here, I... Forgive me. Might we speak outside?","TEXT_VOICEMAN_05505_003020_ALPHINAUD<tab>How long have we dreamed of this moment? And now that it's here, I... Forgive me. Might we speak outside?","","True","0x0000002A","",""
"","TEXT_VOICEMAN_05505_003030_FOURCHENAULT<tab>Elder Seedseer, I thank you for granting me this audience.","TEXT_VOICEMAN_05505_003030_FOURCHENAULT<tab>Elder Seedseer, I thank you for granting me this audience.","","True","0x0000002B","",""
"","TEXT_VOICEMAN_05505_003040_FOURCHENAULT<tab>I am Fourchenault Leveilleur, here in my capacity as representative of the Forum.","TEXT_VOICEMAN_05505_003040_FOURCHENAULT<tab>I am Fourchenault Leveilleur, here in my capacity as representative of the Forum.","","True","0x0000002C","",""
"","TEXT_VOICEMAN_05505_003050_KANESENNA<tab>It is I who should thank you, Master Fourchenault, for journeying so far, and so swiftly. Would that our first meeting could have been under happier circumstances.","TEXT_VOICEMAN_05505_003050_KANESENNA<tab>It is I who should thank you, Master Fourchenault, for journeying so far, and so swiftly. Would that our first meeting could have been under happier circumstances.","","True","0x0000002D","",""
"","TEXT_VOICEMAN_05505_003060_ALPHINAUD<tab>It has been too long, Father. You look well.","TEXT_VOICEMAN_05505_003060_ALPHINAUD<tab>It has been too long, Father. You look well.","","True","0x0000002E","",""
"","TEXT_VOICEMAN_05505_003070_FOURCHENAULT<tab>As do you both. Ameliance will be glad to hear that you are taking care of yourselves.","TEXT_VOICEMAN_05505_003070_FOURCHENAULT<tab>As do you both. Ameliance will be glad to hear that you are taking care of yourselves.","","True","0x0000002F","",""
"","TEXT_VOICEMAN_05505_003080_ALISAIE<tab>How is Mother?","TEXT_VOICEMAN_05505_003080_ALISAIE<tab>How is Mother?","","True","0x00000030","",""
"","TEXT_VOICEMAN_05505_003090_FOURCHENAULT<tab>She misses you terribly, of course, but is otherwise a picture of health.","TEXT_VOICEMAN_05505_003090_FOURCHENAULT<tab>She misses you terribly, of course, but is otherwise a picture of health.","","True","0x00000031","",""
"","TEXT_VOICEMAN_05505_003100_FOURCHENAULT<tab>Circumstances apart, I am grateful that our meeting has afforded me the chance to be reunited with my children at long last. And I believe I also owe you thanks for the hospitality you showed my father, Louisoix, during his sojourn in Eorzea.","TEXT_VOICEMAN_05505_003100_FOURCHENAULT<tab>Circumstances apart, I am grateful that our meeting has afforded me the chance to be reunited with my children at long last. And I believe I also owe you thanks for the hospitality you showed my father, Louisoix, during his sojourn in Eorzea.","","True","0x00000032","",""
"","TEXT_VOICEMAN_05505_003110_KANESENNA<tab>All thanks we owe to him. In the days prior to the Seventh Umbral Calamity, it was your father's tireless efforts which granted us a means to vanquish the primals.","TEXT_VOICEMAN_05505_003110_KANESENNA<tab>All thanks we owe to him. In the days prior to the Seventh Umbral Calamity, it was your father's tireless efforts which granted us a means to vanquish the primals.","","True","0x00000033","",""
"","TEXT_VOICEMAN_05505_003120_KANESENNA<tab>Were it not for him, our strength would have been quite spent by the time the Empire arrived. That Gridania still stands is in large part his achievement. He was a great man.","TEXT_VOICEMAN_05505_003120_KANESENNA<tab>Were it not for him, our strength would have been quite spent by the time the Empire arrived. That Gridania still stands is in large part his achievement. He was a great man.","","True","0x00000034","",""
"","TEXT_VOICEMAN_05505_003130_FOURCHENAULT<tab>He would doubtless have been moved to hear you say so. I must confess, however, that I opposed his decision to intervene.","TEXT_VOICEMAN_05505_003130_FOURCHENAULT<tab>He would doubtless have been moved to hear you say so. I must confess, however, that I opposed his decision to intervene.","","True","0x00000035","",""
"","TEXT_VOICEMAN_05505_003140_FOURCHENAULT<tab>And my position remains unchanged.","TEXT_VOICEMAN_05505_003140_FOURCHENAULT<tab>And my position remains unchanged.","","True","0x00000036","",""
"","TEXT_VOICEMAN_05505_003150_KANESENNA<tab>“To chart the course of history, not to change it.” I am familiar with the Sharlayans' stance.","TEXT_VOICEMAN_05505_003150_KANESENNA<tab>“To chart the course of history, not to change it.” I am familiar with the Sharlayans' stance.","","True","0x00000037","",""
"","TEXT_VOICEMAN_05505_003160_FOURCHENAULT<tab>It is more than that. It is our way of life. Who we are.","TEXT_VOICEMAN_05505_003160_FOURCHENAULT<tab>It is more than that. It is our way of life. Who we are.","","True","0x00000038","",""
"","TEXT_VOICEMAN_05505_003170_FOURCHENAULT<tab>But I came here not to deliver a lecture, but the Forum's answer to your request.","TEXT_VOICEMAN_05505_003170_FOURCHENAULT<tab>But I came here not to deliver a lecture, but the Forum's answer to your request.","","True","0x00000039","",""
"","TEXT_VOICEMAN_05505_003180_FOURCHENAULT<tab>Sharlayan will under no circumstances intervene in the conflict between Eorzea and the Garlean Empire.","TEXT_VOICEMAN_05505_003180_FOURCHENAULT<tab>Sharlayan will under no circumstances intervene in the conflict between Eorzea and the Garlean Empire.","","True","0x0000003A","",""
"","TEXT_VOICEMAN_05505_003190_KANESENNA<tab>...May I ask for what reason the Forum has come to this decision? The Final Days spell the end not only for Eorzea, but the entire world. ","TEXT_VOICEMAN_05505_003190_KANESENNA<tab>...May I ask for what reason the Forum has come to this decision? The Final Days spell the end not only for Eorzea, but the entire world. ","","True","0x0000003B","",""
"","TEXT_VOICEMAN_05505_003200_FOURCHENAULT<tab>The “Final Days”? Pray, spare me your hyperbole. This conflict is no more than the latest in a series of petty squabbles between yourselves and Garlemald. One in which Sharlayan will take no part. If the Final Days were truly upon us, we would know.","TEXT_VOICEMAN_05505_003200_FOURCHENAULT<tab>The “Final Days”? Pray, spare me your hyperbole. This conflict is no more than the latest in a series of petty squabbles between yourselves and Garlemald. One in which Sharlayan will take no part. If the Final Days were truly upon us, we would know.","","True","0x0000003C","",""
"","TEXT_VOICEMAN_05505_003210_ALPHINAUD<tab>Father, you must ask the Forum to reconsider.","TEXT_VOICEMAN_05505_003210_ALPHINAUD<tab>Father, you must ask the Forum to reconsider.","","True","0x0000003D","",""
"","TEXT_VOICEMAN_05505_003220_ALPHINAUD<tab>You may feel safe on your little island across the waves, but if you imagine the Telophoroi will leave you be, you are mistaken. They mean to kill us all, themselves included!","TEXT_VOICEMAN_05505_003220_ALPHINAUD<tab>You may feel safe on your little island across the waves, but if you imagine the Telophoroi will leave you be, you are mistaken. They mean to kill us all, themselves included!","","True","0x0000003E","",""
"","TEXT_VOICEMAN_05505_003230_ALISAIE<tab>Alphinaud is right. We have seen what the enemy is capable of, the lengths to which they'll go. This is no time to turn a blind eye.","TEXT_VOICEMAN_05505_003230_ALISAIE<tab>Alphinaud is right. We have seen what the enemy is capable of, the lengths to which they'll go. This is no time to turn a blind eye.","","True","0x0000003F","",""
"","TEXT_VOICEMAN_05505_003240_ALISAIE<tab>If Eorzea falls, so too will Sharlayan. So if you truly love our homeland, you will join us─now, before it's too late!","TEXT_VOICEMAN_05505_003240_ALISAIE<tab>If Eorzea falls, so too will Sharlayan. So if you truly love our homeland, you will join us─now, before it's too late!","","True","0x00000040","",""
"","TEXT_VOICEMAN_05505_003250_FOURCHENAULT<tab>No subtitles. Report if displayed.","TEXT_VOICEMAN_05505_003250_FOURCHENAULT<tab>No subtitles. Report if displayed.","","True","0x00000041","",""
"","TEXT_VOICEMAN_05505_003260_FOURCHENAULT<tab>I thought you knew better than to raise your voice to your elders. It seems I was wrong. Wrong to ever let you leave Sharlayan. I consoled myself that your time abroad would instill in you some hint of restraint, of discipline.","TEXT_VOICEMAN_05505_003260_FOURCHENAULT<tab>I thought you knew better than to raise your voice to your elders. It seems I was wrong. Wrong to ever let you leave Sharlayan. I consoled myself that your time abroad would instill in you some hint of restraint, of discipline.","","True","0x00000042","",""
"","TEXT_VOICEMAN_05505_003270_FOURCHENAULT<tab>But I see now that Eorzea has made fools of you both. Have you forgotten why it was that I so vehemently opposed your grandfather's departure?","TEXT_VOICEMAN_05505_003270_FOURCHENAULT<tab>But I see now that Eorzea has made fools of you both. Have you forgotten why it was that I so vehemently opposed your grandfather's departure?","","True","0x00000043","",""
"","TEXT_VOICEMAN_05505_003280_FOURCHENAULT<tab>For all his wisdom, his only solution was to go to war.","TEXT_VOICEMAN_05505_003280_FOURCHENAULT<tab>For all his wisdom, his only solution was to go to war.","","True","0x00000044","",""
"","TEXT_VOICEMAN_05505_003290_FOURCHENAULT<tab>Death. Devastation. Ruin. Even those who claim victory are scarred for life. What prize could ever justify such sacrifice?","TEXT_VOICEMAN_05505_003290_FOURCHENAULT<tab>Death. Devastation. Ruin. Even those who claim victory are scarred for life. What prize could ever justify such sacrifice?","","True","0x00000045","",""
"","TEXT_VOICEMAN_05505_003300_FOURCHENAULT<tab>It is the duty of the learned to avert such tragedy. By fanning the flames of war, you forsake all you once held dear.","TEXT_VOICEMAN_05505_003300_FOURCHENAULT<tab>It is the duty of the learned to avert such tragedy. By fanning the flames of war, you forsake all you once held dear.","","True","0x00000046","",""
"","TEXT_VOICEMAN_05505_Q2_000_001_NONE_VOICE<tab>What will you say?","TEXT_VOICEMAN_05505_Q2_000_001_NONE_VOICE<tab>What will you say?","","True","0x00000047","",""
"","TEXT_VOICEMAN_05505_A2_000_001_NONE_VOICE<tab>Better to fight and fail than wait for the axe to fall.","TEXT_VOICEMAN_05505_A2_000_001_NONE_VOICE<tab>Better to fight and fail than wait for the axe to fall.","","True","0x00000048","",""
"","TEXT_VOICEMAN_05505_A2_000_002_NONE_VOICE<tab>To ignore the plight of those one might conceivably save is not wisdom─it is indolence.","TEXT_VOICEMAN_05505_A2_000_002_NONE_VOICE<tab>To ignore the plight of those one might conceivably save is not wisdom─it is indolence.","","True","0x00000049","",""
"","TEXT_VOICEMAN_05505_A2_000_003_NONE_VOICE<tab>It is in your power to save us. Refuse and you condemn us all.","TEXT_VOICEMAN_05505_A2_000_003_NONE_VOICE<tab>It is in your power to save us. Refuse and you condemn us all.","","True","0x0000004A","",""
