"location","source","target","id","fuzzy","context","translator_comments","developer_comments"
"","TEXT_CTSMJICONTACTNPC_00807_OPERATORMAMMET_000_000<tab>Hello there! I have the proud duty of handling communications on the isle─particularly those from Mistress Tataru. I shall inform you the moment I have tidings to share.","TEXT_CTSMJICONTACTNPC_00807_OPERATORMAMMET_000_000<tab>Wenn du Post bekommen solltest, werde ich dir Bescheid sagen. Ansonsten lass mich einfach hier in der Sonne baden und beachte mich gar nicht weiter.","","False","0x00000000","",""
"","TEXT_CTSMJICONTACTNPC_00807_OPERATORMAMMET_000_010<tab>Should I hear word from Mistress Tataru again, you will be the first to know.","TEXT_CTSMJICONTACTNPC_00807_OPERATORMAMMET_000_010<tab>Wenn du noch mehr Post bekommen solltest, werde ich dir Bescheid sagen. Ansonsten lass mich wie bisher die Sonne genießen und beachte mich gar nicht!","","False","0x00000001","",""
"","TEXT_CTSMJICONTACTNPC_00807_OPERATORMAMMET_000_020<tab>Welcome to the island! I hope you enjoy your stay.","TEXT_CTSMJICONTACTNPC_00807_OPERATORMAMMET_000_020<tab>Herzlich willkommen auf unserer Insel! Bitte, genieße deinen Aufenthalt und bleibe, so lange du möchtest.","","False","0x00000002","",""
"","TEXT_CTSMJICONTACTNPC_00807_OPERATORMAMMET_000_030<tab>We have guests! I love it when we have guests!","TEXT_CTSMJICONTACTNPC_00807_OPERATORMAMMET_000_030<tab>Momentan empfangen wir Gäste auf unserer Insel! Ich hoffe, du zeigst dich von deiner besten Seite und bist <var 08 E905 ((eine zuvorkommende Gastgeberin)) ((ein zuvorkommender Gastgeber)) /var>.","","False","0x00000003","",""
"","TEXT_CTSMJICONTACTNPC_00807_OPERATORMAMMET_000_040<tab>Mistress Tataru told me to expect one last group of visitors. I shall notify you the moment she makes contact!","TEXT_CTSMJICONTACTNPC_00807_OPERATORMAMMET_000_040<tab>Tataru informierte mich bereits, dass sie noch eine Gruppe an Urlaubern herzubringen gedenkt. Dementsprechend warte ich nun sehnlichst auf ihre nächste Post. Jemand anderes schreibt uns ja scheinbar nicht.","","False","0x00000004","",""
"","TEXT_CTSMJICONTACTNPC_00807_OPERATORMAMMET_000_050<tab>No contact! No contact from Mistress Tataru! ...I suppose you'll just have to invite your own friends instead!","TEXT_CTSMJICONTACTNPC_00807_OPERATORMAMMET_000_050<tab>Keinerlei Post heute, <var 08 E905 ((Frau Pionierin)) ((Herr Pionier)) /var>! Warum lädst du dir nicht den ein oder anderen Kameraden ein? Ich weiß, dass es „einsame Insel“ heißt, aber werde mir nicht <var 1A 02 /var>zu<var 1A 01 /var> einsam, ja?","","False","0x00000005","",""

