"location","source","target","id","fuzzy","context","translator_comments","developer_comments"
"","TEXT_REGNOR4CLEARMELT_00587_KEEBOSTT_000_000<tab>Welcome, my friend, to Clearmelt! Our warm and soothing waters welcome all travelers seeking to soothe their weary bones and wash away the worries of the road. Should you have any questions about our baths, you need but say the word.","TEXT_REGNOR4CLEARMELT_00587_KEEBOSTT_000_000<tab>ようこそ「クリアメルト」へ！
ここの温泉は、自由に入ってくれて構わないぜ。
何かわからないことがあるなら、遠慮なく聞いてくれよな！","","False","0x00000000","",""
"","TEXT_REGNOR4CLEARMELT_00587_KEEBOSTT_000_010<tab>While I am as relieved as any that night has returned to the realm, it has presented difficulties as well. Why, it is all I can do to keep from slipping and falling into the water when making the rounds in the dark. I advise you to watch your footing as well. ","TEXT_REGNOR4CLEARMELT_00587_KEEBOSTT_000_010<tab>夜闇が戻って嬉しいけど、暗いと見張りがやりづらいな……。
温泉に浸かっているヤツらが、薄着のまま転ばなきゃいいが。","","False","0x00000001","",""
"","TEXT_REGNOR4CLEARMELT_00587_KEEBOSTT_000_030<tab>Welcome, friend. Did you, perchance, suffer a wound in the battle against the sin eaters? Many brave souls like yourself have come here to Clearmelt to partake in our healing waters. You are welcome to soak for as long as you wish.","TEXT_REGNOR4CLEARMELT_00587_KEEBOSTT_000_030<tab>いらっしゃい、アンタもあの大襲撃で負傷したのか？
襲撃直後は、傷を癒しに来た人たちで大賑わいだったが、
今はだいぶ落ち着いてきたんで、ゆっくり浸かれるはずだぜ。","","False","0x00000002","",""
"","TEXT_REGNOR4CLEARMELT_00587_KEEBOSTT_000_040<tab>And the endless day has returned. Though it makes it easier for me to watch over the baths, I must say I miss gazing up at the stars in the sky. But enough of my grumblings─what may I do for you today?","TEXT_REGNOR4CLEARMELT_00587_KEEBOSTT_000_040<tab>また明るくなっちゃったな……
見張りはしやすいけど、夜空が見えないのは残念だよ。
それで、何か気になることでもあるのか？","","False","0x00000003","",""
"","TEXT_REGNOR4CLEARMELT_00587_KEEBOSTT_000_050<tab>Welcome to Clearmelt! Our soothing waters are open to all travelers, night and day. If you've never taken a soak in the baths while gazing up at the brilliant night sky, you really must try it sometime. I can promise you it will heal both body and soul.","TEXT_REGNOR4CLEARMELT_00587_KEEBOSTT_000_050<tab>ようこそ「クリアメルト」へ！
ここの温泉は、昼夜を問わず利用できるよ！
星空を見上げながら、疲れを癒すなんてのも最高だぞ！","","False","0x00000004","",""
"","TEXT_REGNOR4CLEARMELT_00587_Q1_000_000<tab>What will you say?","TEXT_REGNOR4CLEARMELT_00587_Q1_000_000<tab>何を聞く？","","False","0x00000005","",""
"","TEXT_REGNOR4CLEARMELT_00587_A1_000_001<tab>What do you do here?","TEXT_REGNOR4CLEARMELT_00587_A1_000_001<tab>あなたのことを教えてほしい","","False","0x00000006","",""
"","TEXT_REGNOR4CLEARMELT_00587_A1_000_002<tab>What kind of place is this?","TEXT_REGNOR4CLEARMELT_00587_A1_000_002<tab>ここはどんなところだ？","","False","0x00000007","",""
"","TEXT_REGNOR4CLEARMELT_00587_A1_000_003<tab>Nothing.","TEXT_REGNOR4CLEARMELT_00587_A1_000_003<tab>キャンセル","","False","0x00000008","",""
"","TEXT_REGNOR4CLEARMELT_00587_KEEBOSTT_000_200<tab>I am in charge of watching over the baths and keeping our visitors safe. This involves driving off the occasional fiend, as well as waking up bathers who have fallen asleep in sheer bliss before they manage to drown themselves.","TEXT_REGNOR4CLEARMELT_00587_KEEBOSTT_000_200<tab>オレは、温泉の警備担当さ。
傷や疲れを癒すために、湯に浸かるのはいいんだが、
そのまま寝入っちまうと危険だから、見張ってるんだよ。","","False","0x00000009","",""
"","TEXT_REGNOR4CLEARMELT_00587_KEEBOSTT_000_201<tab>We even get the occasional stray sin eater, and I don't have to tell you they're not here for a relaxing soak. I must remain ever vigilant, that those under my watch are not struck down when they are at their most defenseless.","TEXT_REGNOR4CLEARMELT_00587_KEEBOSTT_000_201<tab>それに、はぐれ罪喰いや魔物が入り込む危険性もある。
ひとりでも湯治に来ているヤツがいるかぎり、
オレはここを動かず、監視を続けるさ。","","False","0x0000000A","",""
"","TEXT_REGNOR4CLEARMELT_00587_KEEBOSTT_000_210<tab>Though the horrors brought upon us by the Flood of Light have passed, the worries, aches, and pains we face in our daily lives will never fade away entirely. As long as people want for the succor of our waters, I will watch over the springs and keep them safe.","TEXT_REGNOR4CLEARMELT_00587_KEEBOSTT_000_210<tab>「光の氾濫」の恐れはなくなったそうだが、
日々の疲れや古傷がなくなるわけじゃないからな。
湯を求める客がいる限り、オレはここに立ち続けるさ。","","False","0x0000000B","",""
"","TEXT_REGNOR4CLEARMELT_00587_KEEBOSTT_000_400<tab>This is Clearmelt. Before the Flood, it was home to an inn famed throughout the land for the healing properties of its hot springs. Nowadays, it serves as a treatment facility for the Crystarium guard and travelers seeking to soothe their battered bodies and weary hearts.","TEXT_REGNOR4CLEARMELT_00587_KEEBOSTT_000_400<tab>ここ「クリアメルト」は、
「光の氾濫」以前は、温泉を名物とする宿場だったんだ。
今では、その設備を療養施設として利用してるってわけ。","","False","0x0000000C","",""
"","TEXT_REGNOR4CLEARMELT_00587_KEEBOSTT_000_402<tab>While there are hot spring baths in the city as well, I can assure you that the waters here are another thing entirely. The pristine meltwater that flows down from the surrounding snow-capped peaks is heated underground, bursting through to the surface in gushing founts.","TEXT_REGNOR4CLEARMELT_00587_KEEBOSTT_000_402<tab>温泉なら街でも入れるが、ここの湯は格別だぜ！
周囲の山々から流れ出る雪解け水が、地下で温められて、
湧き出したもんで、切り傷や関節痛に効能アリなのさ！","","False","0x0000000D","",""
"","TEXT_REGNOR4CLEARMELT_00587_KEEBOSTT_000_403<tab>Our baths are known to have a wide variety of healing properties. Soothing wounds, loosening joints, revitalizing the skin─these are but a few of the benefits you will enjoy. Needless to say, it's also a wonderful place to relax and forget your worries for a moment.","TEXT_REGNOR4CLEARMELT_00587_KEEBOSTT_000_403<tab>なもんで「透明な雪解け水」を意味する、
「クリアメルト」って呼ばれてるんだよ。
へへ、ためになっただろ？","","False","0x0000000E","",""
"","TEXT_REGNOR4CLEARMELT_00587_KEEBOSTT_000_410<tab>The other night, as I was soaking in the baths and gazing up at the starry skies, a thought came to me. Much as night has returned to our realm, perhaps ordinary life will once again return to the ruins of Lakeland.","TEXT_REGNOR4CLEARMELT_00587_KEEBOSTT_000_410<tab>……この間さ、見張りがてらに星空を見上げて思ったんだ。
空に夜闇が戻ってきたように、レイクランドの廃墟にも、
人の暮らしが戻ってきたら……ってさ。","","False","0x0000000F","",""
"","TEXT_REGNOR4CLEARMELT_00587_KEEBOSTT_000_411<tab>Perhaps one day Clearmelt will once again thrive and flourish as an inn, and welcome weary travelers from all corners of the realm. A man can dream, can he not?","TEXT_REGNOR4CLEARMELT_00587_KEEBOSTT_000_411<tab>少し前までは考えられない話だったけど、
今では、ここが宿場町として栄えることだって夢じゃない……。
これからのことを考えると、ワクワクが止まらないんだ！","","False","0x00000010","",""
"","TEXT_REGNOR4CLEARMELT_00587_TALK_ACTOR<tab>","TEXT_REGNOR4CLEARMELT_00587_TALK_ACTOR<tab>（★未使用／削除予定★）","","False","0x00000011","",""

