"location","source","target","id","fuzzy","context","translator_comments","developer_comments"
"","TEXT_CMNDEFRELICWEAPON025NOTETALK_00170_GJUSANA_000_000<tab>The Trials of the Braves is a nine-volume work of literature which tells of the heroic feats of the Zodiac Braves.","TEXT_CMNDEFRELICWEAPON025NOTETALK_00170_GJUSANA_000_000<tab>Ephemeriden ... Diesen Namen tragen altertümliche Tafeln aus dem Osten, die von den Abenteuern legendärer Krieger und ihren leuchtenden Waffen berichten. Du interessierst dich dafür? Dann kann dir geholfen werden!","","False","0x00000000","",""
"","TEXT_CMNDEFRELICWEAPON025NOTETALK_00170_GJUSANA_000_001<tab>As I mentioned earlier, I'm willing to part with each book for the discounted price of 100 <var 31 ((Item)) 04 ((　28)) 0302 /var>.","TEXT_CMNDEFRELICWEAPON025NOTETALK_00170_GJUSANA_000_001<tab>Jede Ephemeridensammlung besteht aus neun Tafeln, die du nacheinander bei mir erwerben kannst. Und das zum Freund<var 16 /var>schaftspreis von 100 <var 32 ((Item)) 06 ((　28)) 030402 /var> pro Tafel, weil du auf Empfehlung von Rowena hier bist.","","False","0x00000001","",""
"","TEXT_CMNDEFRELICWEAPON025NOTETALK_00170_SYSTEM_000_010<tab>By defeating all the foes listed within a book of the Trials of the Braves, your relic weapon atma will gain in attributes.","TEXT_CMNDEFRELICWEAPON025NOTETALK_00170_SYSTEM_000_010<tab>Wenn du alle Gegner besiegst, die auf einer Ephemeridentafel verzeichnet sind, steigt die Seelenkraft deiner Atma-Waffe.","","False","0x00000002","",""
"","TEXT_CMNDEFRELICWEAPON025NOTETALK_00170_SYSTEM_000_011<tab>Distinct sets of Trials of the Braves exist for each relic. A set is comprised of nine books, of which only four are available for exchange at first.","TEXT_CMNDEFRELICWEAPON025NOTETALK_00170_SYSTEM_000_011<tab>Für jede Atma-Waffe existieren neun Tafeln, von denen dir zu Beginn vier Sorten zum Verkauf angeboten werden.","","False","0x00000003","",""
"","TEXT_CMNDEFRELICWEAPON025NOTETALK_00170_SYSTEM_000_012<tab>A paladin's set comprises seven books for Curtana, and two for the Holy Shield. Only six of these are available for exchange at first.","TEXT_CMNDEFRELICWEAPON025NOTETALK_00170_SYSTEM_000_012<tab>Für Paladine gibt es sieben Tafeln, die dem Schwert, und zwei Tafeln, die dem Schild gewidmet sind. Zu Beginn werden dir davon sechs Sorten zum Verkauf angeboten.","","False","0x00000004","",""
"","TEXT_CMNDEFRELICWEAPON025NOTETALK_00170_SYSTEM_000_013<tab>Each book can be purchased from G'jusana. Please note, however, that you can possess only one at any given time.","TEXT_CMNDEFRELICWEAPON025NOTETALK_00170_SYSTEM_000_013<tab>Wenn du alle Gegner, die auf einer Tafel verzeichnet sind, besiegt hast, kannst du bei G'jusana die nächste Tafel erwerben.","","False","0x00000005","",""
"","TEXT_CMNDEFRELICWEAPON025NOTETALK_00170_SYSTEM_000_014<tab>You must complete all of the objectives in a book before you may purchase another.","TEXT_CMNDEFRELICWEAPON025NOTETALK_00170_SYSTEM_000_014<tab>Beachte, dass du jeweils nur eine Tafel besitzen kannst.","","False","0x00000006","",""
"","TEXT_CMNDEFRELICWEAPON025NOTETALK_00170_SYSTEM_000_015<tab>Alternately, you may also dispose of it by speaking with G'jusana, or via the Key Items menu.","TEXT_CMNDEFRELICWEAPON025NOTETALK_00170_SYSTEM_000_015<tab>Wenn du eine neue erwerben möchtest, musst du deine aktuelle entweder vervollständigen oder sie wegwerfen. Der Fortschritt einer weggeworfenen Tafel geht verloren.","","False","0x00000007","",""
"","TEXT_CMNDEFRELICWEAPON025NOTETALK_00170_SYSTEM_000_016<tab>This concludes the explanation of the enhancement process. May your relic drink deep of the souls of your enemies!","TEXT_CMNDEFRELICWEAPON025NOTETALK_00170_SYSTEM_000_016<tab>Deine aktuelle Ephemeridentafel kannst du entweder in der Kategorie „Schlüsselgegenstände“ deines Inventars wegwerfen oder sie G'jusana zurückgeben und von ihr entsorgen lassen.","","False","0x00000008","",""
