"location","source","target","id","fuzzy","context","translator_comments","developer_comments"
"","TEXT_REGLAKWARRINGTRIADNOTE_00328_Q1_000_000<tab>Which entry will you read?","TEXT_REGLAKWARRINGTRIADNOTE_00328_Q1_000_000<tab>Chronik der Kriegstriade","","False","0x00000000","",""
"","TEXT_REGLAKWARRINGTRIADNOTE_00328_A1_000_010<tab>The Warring Triad: The Awakening.","TEXT_REGLAKWARRINGTRIADNOTE_00328_A1_000_010<tab>Einleitung","","False","0x00000001","",""
"","TEXT_REGLAKWARRINGTRIADNOTE_00328_A1_000_020<tab>Chapter 1: Sephirot.","TEXT_REGLAKWARRINGTRIADNOTE_00328_A1_000_020<tab>Kapitel 1: Sephirot","","False","0x00000002","",""
"","TEXT_REGLAKWARRINGTRIADNOTE_00328_A1_000_030<tab>Chapter 2: A Persistent Foe.","TEXT_REGLAKWARRINGTRIADNOTE_00328_A1_000_030<tab>Kapitel 2: Erzfeinde","","False","0x00000003","",""
"","TEXT_REGLAKWARRINGTRIADNOTE_00328_A1_000_040<tab>Chapter 3: Sophia.","TEXT_REGLAKWARRINGTRIADNOTE_00328_A1_000_040<tab>Kapitel 3: Sophia","","False","0x00000004","",""
"","TEXT_REGLAKWARRINGTRIADNOTE_00328_A1_000_050<tab>Chapter 4: Zurvan.","TEXT_REGLAKWARRINGTRIADNOTE_00328_A1_000_050<tab>Kapitel 4: Zurvan","","False","0x00000005","",""
"","TEXT_REGLAKWARRINGTRIADNOTE_00328_A1_000_100<tab>Cancel.","TEXT_REGLAKWARRINGTRIADNOTE_00328_A1_000_100<tab>Chronik schließen.","","False","0x00000006","",""
"","TEXT_REGLAKWARRINGTRIADNOTE_00328_TRIADLORE_000_010<tab>(-The Warring Triad: The Awakening-)<var 1A 02 /var>The Warring Triad is the collective term for three immensely powerful eikons that were brought into existence during the twilight of the Third Astral Era. Summoned by the native tribes of Meracydia, these entities were set against the encroaching forces of the Allagan Empire.<var 1A 01 /var>","TEXT_REGLAKWARRINGTRIADNOTE_00328_TRIADLORE_000_010<tab>(-Einleitung-)Die Kriegstriade ist eine göttliche Dreifaltigkeit aus drei Ikonen, mächtige Primae, die von den Völkern des südlichen Kontinents Meracydia angebetet und um Hilfe gegen die allagischen Invasoren angefleht wurden.","","False","0x00000007","",""
"","TEXT_REGLAKWARRINGTRIADNOTE_00328_TRIADLORE_000_011<tab>(-The Warring Triad: The Awakening-)<var 1A 02 /var>The strength of a primal is determined by the fervent prayers of its faithful. And as the Meracydians' prayers called for saviors with the power to throw back an imperial invasion, the resulting incarnations were perforce imbued with nigh-incalculable might.<var 1A 01 /var>","TEXT_REGLAKWARRINGTRIADNOTE_00328_TRIADLORE_000_011<tab>(-Einleitung-)Die Stärke eines Primae ergibt sich aus den Gebeten seiner Glaubensanhänger. Die Völker von Meracydia flehten inbrünstig, vor den Allagern gerettet zu werden, und so entstanden unvorstellbar mächtige Inkarnationen.","","False","0x00000008","",""
"","TEXT_REGLAKWARRINGTRIADNOTE_00328_TRIADLORE_000_012<tab>(-The Warring Triad: The Awakening-)<var 1A 02 /var>That the Allagans were capable of conquering such godlike beings well illustrates the incredible heights to which their technology had ascended. The implacable empire subdued and imprisoned the Warring Triad─shackled them to machinery that sustained the eikons' forms whilst at the same time leeching away their infinite energies.<var 1A 01 /var>","TEXT_REGLAKWARRINGTRIADNOTE_00328_TRIADLORE_000_012<tab>(-Einleitung-)Die Tatsache, dass die Allager in der Lage waren, diese göttlichen Wesen dennoch zu überwältigen, zeugt von der Überlegenheit der allagischen Technologie. Die Allager zwangen die Kriegstriade in eine euflische Maschine, in der sie gleichzeitig ihre physische Form stabilisierten und ihre Energie anzapften.","","False","0x00000009","",""
"","TEXT_REGLAKWARRINGTRIADNOTE_00328_TRIADLORE_000_013<tab>(-The Warring Triad: The Awakening-)<var 1A 02 /var>For five millennia did the Warring Triad languish thus in dreaming servitude, their slumber undisturbed until Archbishop Thordan VII of Ishgard rattled the bars of their cage.<var 1A 01 /var>","TEXT_REGLAKWARRINGTRIADNOTE_00328_TRIADLORE_000_013<tab>(-Einleitung-)Fünftausend Jahre lang vegetierten die Ikonen regungslos in einem traumähnlichen Zustand, weder lebend noch tot, bis der Papst von Ishgard nach Azys Lla kam.","","False","0x0000000A","",""
"","TEXT_REGLAKWARRINGTRIADNOTE_00328_TRIADLORE_000_014<tab>(-The Warring Triad: The Awakening-)<var 1A 02 /var>The archbishop had come to Azys Lla seeking to absorb the three's power and make of himself a god without rival. It was fortunate, then, that the Warrior of Light and <var 08 E905 ((her)) ((his)) /var> companions thwarted Thordan before he realized his tyrannical ambitions─but the victory was not without consequence.<var 1A 01 /var>","TEXT_REGLAKWARRINGTRIADNOTE_00328_TRIADLORE_000_014<tab>(-Einleitung-)Denn Papst Thordan VII. war nach Azys Lla gekommen, um sich die Macht der Kriegstriade zu eigen zu machen.","","False","0x0000000B","",""
"","TEXT_REGLAKWARRINGTRIADNOTE_00328_TRIADLORE_000_015<tab>(-The Warring Triad: The Awakening-)<var 1A 02 /var>The violence of the battle cracked the seals that keep the Triad in torpor, and the eikons have begun to stir. Worse, the Garlean Empire and their heavy-handed efforts to plunder the secrets of Azys Lla threaten to drag them into full wakefulness.<br>These terrible entities must be destroyed before they arise in all their cataclysmic splendor.<var 1A 01 /var>","TEXT_REGLAKWARRINGTRIADNOTE_00328_TRIADLORE_000_015<tab>(-Einleitung-)<var 08 E905 ((Die Kriegerin)) ((Der Krieger)) /var> des Lichts und <var 08 E905 ((ihre)) ((seine)) /var> Gefährten konnten den Größenwahnsinnigen aufhalten, doch die durch den Kampf verursachten Erschütterungen haben das Siegel der Triaden-Konstriktion gebrochen. Nun regen sich die Ikonen der Kriegstriade und stehen kurz vorm Erwachen. Zu allem Übel sind auch noch die Garlear in Azys Lla eingedrungen, um die Maschinen zur Kontrolle von Primae zu erobern. Dabei nehmen sie billigend in Kauf, die Ikonen endgültig aus dem Schlaf zu reißen. Das muss um jeden Preis verhindert werden!","","False","0x0000000C","",""
"","TEXT_REGLAKWARRINGTRIADNOTE_00328_TRIADLORE_000_020<tab>(-Chapter 1: Sephirot-)<var 1A 02 /var>The Warrior of Light has toppled the first of the Warring Triad.<br>We knew little of Sephirot other than that he was the chief deity of a tribe of treelike beings─a sacred tree ascended to godhood. Allagan histories discovered upon the event of his destruction, however, have brought fascinating new facts to light.<var 1A 01 /var>","TEXT_REGLAKWARRINGTRIADNOTE_00328_TRIADLORE_000_020<tab>(-Kapitel 1: Sephirot-)<var 08 E905 ((Die Kriegerin)) ((Der Krieger)) /var> des Lichts hat die erste Ikone der Kriegstriade besiegt, und dabei ist etwas Interessantes zutage getreten. Vorher wussten wir über Sephirot nur, dass er auf dem südlichen Kontinent Meracydia von einem Volk von baumähnlichen Wesen angebetet wurde. Nun wurde in Azys Lla ein Allagischer Stein gefunden, in dem Informationen der Allager über Sephirot gespeichert sind.","","False","0x0000000D","",""
"","TEXT_REGLAKWARRINGTRIADNOTE_00328_TRIADLORE_000_021<tab>(-Chapter 1: Sephirot-)<var 1A 02 /var>These recordings attribute to Sephirot the ability to “induce spontaneous growth in living organisms through the manipulation of ambient aetheric energy.” It is noted that the eikon did not hesitate to direct this ability upon himself.<var 1A 01 /var>","TEXT_REGLAKWARRINGTRIADNOTE_00328_TRIADLORE_000_021<tab>(-Kapitel 1: Sephirot-)Darin ist beschrieben, dass Sephirot zunächst ein heiliger Baum war, der erst durch Gebete zu einem Gott wurde. Er ist in der Lage, die Kräfte der Natur zu manipulieren und Leben zu erschaffen und zu verändern. Diese Macht hat er angeblich auch auf sich selbst angewendet.","","False","0x0000000E","",""
"","TEXT_REGLAKWARRINGTRIADNOTE_00328_TRIADLORE_000_022<tab>(-Chapter 1: Sephirot-)<var 1A 02 /var>Sephirot grew to gigantic proportions during his conflict with the armies of Allag, using his own colossal limbs to cut great swaths of devastation through their ranks. He was eventually overwhelmed, however, and his abilities contained.<var 1A 01 /var>","TEXT_REGLAKWARRINGTRIADNOTE_00328_TRIADLORE_000_022<tab>(-Kapitel 1: Sephirot-)Sephirot wuchs während des Kriegs gegen die Allager zu gigantischer Größe an und mähte mit seinen mächtigen Armen durch die Reihen seiner Feinde. Letztendlich wurde er jedoch von den Allagern übermannt und eingesperrt.","","False","0x0000000F","",""
"","TEXT_REGLAKWARRINGTRIADNOTE_00328_TRIADLORE_000_023<tab>(-Chapter 1: Sephirot-)<var 1A 02 /var>The Allagans performed experiments upon the captured eikon, siphoning his growth-inducing energies into the cultivation of numerous chimerical monstrosities─one unnatural existence propagating countless others.<var 1A 01 /var>","TEXT_REGLAKWARRINGTRIADNOTE_00328_TRIADLORE_000_023<tab>(-Kapitel 1: Sephirot-)Die Allager führten grausame Experimente mit der Ikone durch und nutzten ihre lebensverändernde Kraft für die Züchtung verschiedener Chimären.","","False","0x00000010","",""
"","TEXT_REGLAKWARRINGTRIADNOTE_00328_TRIADLORE_000_024<tab>(-Chapter 1: Sephirot-)<var 1A 02 /var>When one believes one's control unbreakable however, a single, overlooked flaw inevitably leads to catastrophe. I know of at least one civilization that collapsed under the weight of such hubris...<var 1A 01 /var>","TEXT_REGLAKWARRINGTRIADNOTE_00328_TRIADLORE_000_024<tab>(-Kapitel 1: Sephirot-)Jedoch ist niemand unfehlbar und Überheblichkeit führt unweigerlich in den Untergang. Zumindest eine Zivilisation ist mir bekannt, der es so ergangen ist.","","False","0x00000011","",""
"","TEXT_REGLAKWARRINGTRIADNOTE_00328_TRIADLORE_000_030<tab>(-Chapter 2: A Persistent Foe-)<var 1A 02 /var>The Garlean Empire's VIth Legion has breached the core laboratories of Azys Lla's research facility. Seeking to prevent the imperials from extracting the Genesis Expression, the Warrior of Light and <var 08 E905 ((her)) ((his)) /var> allies pursued the legatus and his soldiers, and succeeded in denying him the vital formula.<var 1A 01 /var>","TEXT_REGLAKWARRINGTRIADNOTE_00328_TRIADLORE_000_030<tab>(-Kapitel 2: Erzfeinde-)Soldaten der VI. Legion sind in das Ätherochemische For<var 16 /var>schungs<var 16 /var>labor von Azys Lla eingedrungen, um das Geheimnis der Äthertransformation für das Garleische Kaiserreich zu beanspruchen und dadurch Macht über die Primae zu erlangen.","","False","0x00000012","",""
"","TEXT_REGLAKWARRINGTRIADNOTE_00328_TRIADLORE_000_031<tab>(-Chapter 2: A Persistent Foe-)<var 1A 02 /var>The Garleans claim their interest in primal-harnessing technology comes from a desire to constrain the entities' wanton destruction. But while this purpose seems perfectly noble, such control would place the power of gods in the hands of a select group of men.<var 1A 01 /var>","TEXT_REGLAKWARRINGTRIADNOTE_00328_TRIADLORE_000_031<tab>(-Kapitel 2: Erzfeinde-)Die Garlear behaupten, sie wollten diese Macht nutzen, um die Primae einzusperren. Das klingt zunächst vernünftig, doch kann man den Mächtigen wirklich vertrauen?","","False","0x00000013","",""
"","TEXT_REGLAKWARRINGTRIADNOTE_00328_TRIADLORE_000_032<tab>(-Chapter 2: A Persistent Foe-)<var 1A 02 /var>Who then might oppose the emperor should he wish to sunder the world? And what guarantee prevents error and happenstance from setting the primals free? Ever would the threat of their accidental awakening loom above our heads.<var 1A 01 /var>","TEXT_REGLAKWARRINGTRIADNOTE_00328_TRIADLORE_000_032<tab>(-Kapitel 2: Erzfeinde-)Macht bedeutet Kontrolle und wer die Primae kontrolliert, ist eine Bedrohung für die gesamte Welt. Ebenso besteht die Gefahr, dass die Primae durch eine Unachtsamkeit befreit werden und daraufhin blutige Rache üben.","","False","0x00000014","",""
"","TEXT_REGLAKWARRINGTRIADNOTE_00328_TRIADLORE_000_033<tab>(-Chapter 2: A Persistent Foe-)<var 1A 02 /var>By “harnessing” a primal, one is also condensing and concentrating its vast energies. Upon the being's release, its long-suppressed power and simmering rancor explodes with unimaginable violence.<var 1A 01 /var>","TEXT_REGLAKWARRINGTRIADNOTE_00328_TRIADLORE_000_033<tab>(-Kapitel 2: Erzfeinde-)Um die Primae einzusperren, muss ihr Äther über einen langen Zeitraum unterdrückt werden. In dem Augenblick, in dem sich die Fesseln lösen, wird sich der aufgestaute Äther explosionsartig und mit ungeahnter Kraft ausbreiten.","","False","0x00000015","",""
"","TEXT_REGLAKWARRINGTRIADNOTE_00328_TRIADLORE_000_034<tab>(-Chapter 2: A Persistent Foe-)<var 1A 02 /var>With their potency increased far beyond that of the typical beastman-summoned deity, the defeat of harnessed entities becomes exponentially more arduous. Such might can only be overcome with more might.<var 1A 01 /var>","TEXT_REGLAKWARRINGTRIADNOTE_00328_TRIADLORE_000_034<tab>(-Kapitel 2: Erzfeinde-)Dann wäre es kaum noch möglich, die Primae zu überwältigen. Sie wären viel stärker als in ihrer von den Wilden Stämmen beschworenen Form. In dem Fall bliebe bloß noch die Möglichkeit, Feuer mit Feuer zu bekämpfen, indem eine noch größere Macht aufgeboten wird.","","False","0x00000016","",""
"","TEXT_REGLAKWARRINGTRIADNOTE_00328_TRIADLORE_000_035<tab>(-Chapter 2: A Persistent Foe-)<var 1A 02 /var>...But ultimately, the battle has no victor. When powers of this magnitude collide, they consume immense reservoirs of aether. The star will be drained of life before the clash can be decided, and all will crumble into oblivion.<var 1A 01 /var>","TEXT_REGLAKWARRINGTRIADNOTE_00328_TRIADLORE_000_035<tab>(-Kapitel 2: Erzfeinde-)Dieser Kampf wäre nicht zu gewinnen. Die gewaltigen aufeinanderprallenden Äthermengen würden den Untergang unserer Welt bedeuten.","","False","0x00000017","",""
"","TEXT_REGLAKWARRINGTRIADNOTE_00328_TRIADLORE_000_040<tab>(-Chapter 3: Sophia-)<var 1A 02 /var>The Goddess has fallen, and only one pillar of the Warring Triad remains. According to the records we discovered upon Sophia's destruction, the eikon had once schemed to bring the Allagan Empire to ruin from within.<var 1A 01 /var>","TEXT_REGLAKWARRINGTRIADNOTE_00328_TRIADLORE_000_040<tab>(-Kapitel 3: Sophia-)Sophia ist besiegt und damit die Kriegstriade auf eine letzte Ikone reduziert. Bei dem Einsatz wurden alte Aufzeichnungen sichergestellt, die Sophias vor langer Zeit gefassten Plan beschreiben, das Allagische Reich von innen heraus zu vernichten.","","False","0x00000018","",""
"","TEXT_REGLAKWARRINGTRIADNOTE_00328_TRIADLORE_000_041<tab>(-Chapter 3: Sophia-)<var 1A 02 /var>The histories also spoke of her followers, and how they perceived the ever-expanding imperials as anathema to the world's balance.<var 1A 01 /var>","TEXT_REGLAKWARRINGTRIADNOTE_00328_TRIADLORE_000_041<tab>(-Kapitel 3: Sophia-)Als die Allager den südlichen Kontinent Meracydia überfielen, sahen die Einwohner nicht nur ihre Freiheit, sondern das Gleichgewicht der Welt gefährdet.","","False","0x00000019","",""
"","TEXT_REGLAKWARRINGTRIADNOTE_00328_TRIADLORE_000_042<tab>(-Chapter 3: Sophia-)<var 1A 02 /var>Equilibrium is Sophia's domain. Her worshipers saw the righting of the scales as their sacred duty, and thus did they resist the Allagans' invasion with holy fervor. Never mind that the summoning of an eikon did upset their precious balance all the more.<var 1A 01 /var>","TEXT_REGLAKWARRINGTRIADNOTE_00328_TRIADLORE_000_042<tab>(-Kapitel 3: Sophia-)Sophia wurde als Göttin der ausgleichenden Gerechtigkeit verehrt, und so rief man sie im Kampf gegen die Eindringlinge zu Hilfe. Tragischerweise brachte die Primae-Beschwörung das Gleichgewicht noch mehr ins Wanken.","","False","0x0000001A","",""
"","TEXT_REGLAKWARRINGTRIADNOTE_00328_TRIADLORE_000_043<tab>(-Chapter 3: Sophia-)<var 1A 02 /var>The concept of balance is, however, of great interest to my master. A world must have both Light and Darkness, and a sudden surge of either will endanger its very existence.<var 1A 01 /var>","TEXT_REGLAKWARRINGTRIADNOTE_00328_TRIADLORE_000_043<tab>(-Kapitel 3: Sophia-)Das Konzept des Gleichgewichts liegt auch meinem Herrn sehr am Herzen. Eine Welt braucht Licht und Dunkelheit. Ein starkes Übergewicht des einen oder des anderen bedroht die Grundfesten ihrer Existenz.","","False","0x0000001B","",""
"","TEXT_REGLAKWARRINGTRIADNOTE_00328_TRIADLORE_000_044<tab>(-Chapter 3: Sophia-)<var 1A 02 /var>Upon our first meeting, my master spoke thus: I am not the Light's servant, but for the present I must serve. One cannot arbitrate equilibrium if one is not fluid of stance.<var 1A 01 /var>","TEXT_REGLAKWARRINGTRIADNOTE_00328_TRIADLORE_000_044<tab>(-Kapitel 3: Sophia-)Bei unserem ersten Treffen sprach mein Herr: „Ich bin kein Diener des Lichts, doch im Augenblick muss ich ihm dienen. Nur wer gewillt ist, seine Haltung an die Umstände anzupassen, kann das Gleichgewicht bewahren.“","","False","0x0000001C","",""
"","TEXT_REGLAKWARRINGTRIADNOTE_00328_TRIADLORE_000_045<tab>(-Chapter 3: Sophia-)<var 1A 02 /var>The tenets of our justice are found not in Light nor Darkness nor the grey shades in between. We but seek to enforce that which prevents the visitation of oblivion. To moderate the endless waves of war such that neither side claims victory...that is our charge.<var 1A 01 /var>","TEXT_REGLAKWARRINGTRIADNOTE_00328_TRIADLORE_000_045<tab>(-Kapitel 3: Sophia-)„Endgültige Gerechtigkeit erfahren wir weder im Licht noch in der Dunkelheit, doch auch nicht im Halbschatten dazwischen. Gerecht ist alles, was uns vor dem Untergang bewahrt. Den endlosen Krieg so zu lenken, dass niemand den Sieg davonträgt ... das ist unsere Bestimmung.","","False","0x0000001D","",""
"","TEXT_REGLAKWARRINGTRIADNOTE_00328_TRIADLORE_000_050<tab>(-Chapter 4: Zurvan-)<var 1A 02 /var>The followers of Zurvan were broken from their slumber─likely the doing of Sophia's worshipers─and immediately began attempting to rouse their master in the fullness of his power. We found ourselves in an unexpected alliance with the forces of the VIth Legion, and rushed inside the research facility to put a stop to the thralls' ambitions.<var 1A 01 /var>","TEXT_REGLAKWARRINGTRIADNOTE_00328_TRIADLORE_000_050<tab>(-Kapitel 4: Zurvan-)Im Ätherochemischen For<var 16 /var>schungs<var 16 /var>labor war nun auch noch Zurvan kurz davor, wieder zu erwachen. Seine Untertanen, ihrerseits von Sophias Dienern aufgeweckt, arbeiteten fieberhaft an seiner Erweckung. Doch die Garlear, von deren Eindringen wir zuerst voll Sorge hörten, wurden uns unverhofft zu Verbündeten.","","False","0x0000001E","",""
"","TEXT_REGLAKWARRINGTRIADNOTE_00328_TRIADLORE_000_051<tab>(-Chapter 4: Zurvan-)<var 1A 02 /var>Although we succeeded in this initial endeavor, the effort cost the lives of many imperial soldiers, including that of Regula van Hydrus himself. Seizing the opportunity their sacrifice bought for us, the Warrior of Light led a company of echo-blessed champions against the half-woken Demon, and cast down the final pillar of the Warring Triad.<var 1A 01 /var>","TEXT_REGLAKWARRINGTRIADNOTE_00328_TRIADLORE_000_051<tab>(-Kapitel 4: Zurvan-)Regula van Hydrus, dem wir einst als Feind gegenübergestanden hatten, teilte nun unsere Ansicht: Zurvan musste aufgehalten werden. Er war mit seiner VI. Legion vorgestürmt, doch er benötigte unsere Hilfe, unsere Gabe des Transzendierens, um die Ikone zu bezwingen.","","False","0x0000001F","",""
"","TEXT_REGLAKWARRINGTRIADNOTE_00328_TRIADLORE_000_052<tab>(-Chapter 4: Zurvan-)<var 1A 02 /var>Upon discovering the flaws apparent in the Allagans' technology, the legatus chose to abandon its acquisition, and looked to recruit the aid of the Scions with nary a moment's hesitation. His was a decision motivated not by glory, but by loyalty to his emperor. Above all, he strove to enforce the will of his childhood friend, and ensure that the primal threat hanging over this star would be eradicated.<var 1A 01 /var>","TEXT_REGLAKWARRINGTRIADNOTE_00328_TRIADLORE_000_052<tab>(-Kapitel 4: Zurvan-)Gemeinsam traten wir dem erwachenden Gott gegenüber. Am Ende war der Sieg unser, doch Regula fiel - als Held. In der tiefen Überzeugung, dass der Primae bezwungen werden muss - wenn nicht von ihm, dann von uns - opferte er sich, um mich zu retten.","","False","0x00000020","",""
"","TEXT_REGLAKWARRINGTRIADNOTE_00328_TRIADLORE_000_053<tab>(-Chapter 4: Zurvan-)<var 1A 02 /var>Over the course of our quest to eliminate the Warring Triad, the meddling of the Garlean Empire has been our greatest obstacle. That an officer so lofty within its ranks should recognize the danger and make such a rational choice is a significant development in our war against the primals.<var 1A 01 /var>","TEXT_REGLAKWARRINGTRIADNOTE_00328_TRIADLORE_000_053<tab>(-Kapitel 4: Zurvan-)Regula war zu der Überzeugung gelangt, dass die allagische Technologie der Primaefesselung eine gefährliche Fehlentwicklung ist. Er war nun nicht mehr an ihrer Erforschung interessiert, sondern an ihrer Vernichtung. Wenn Garlemald somit seinen Blick von den allagischen Relikten abwenden würde, wäre das äußerst bedeutsam für uns.","","False","0x00000021","",""
"","TEXT_REGLAKWARRINGTRIADNOTE_00328_TRIADLORE_000_054<tab>(-Chapter 4: Zurvan-)<var 1A 02 /var>Ere the star upon which I was born became the void, the champions who lived upon it chose to embrace self-destruction rather than cease their infernal conflict. They became lost within their own ambitions, strangling the life from one another even as the flood of Darkness swallowed them whole...<var 1A 01 /var>","TEXT_REGLAKWARRINGTRIADNOTE_00328_TRIADLORE_000_054<tab>(-Kapitel 4: Zurvan-)Auch in meiner Heimatwelt, die in Eorzea das „Nichts“ genannt wird, gab es Helden, die die Primae bekämpften; doch sie wählten den falschen Weg. Sie rangen miteinander um Äther, bis die Dunkelheit überhandnahm und schließlich alles verschlang, sodass nichts zurückblieb als ein wüster, ätherleerer Raum.","","False","0x00000022","",""
"","TEXT_REGLAKWARRINGTRIADNOTE_00328_TRIADLORE_000_055<tab>(-Chapter 4: Zurvan-)<var 1A 02 /var>Here on Hydaelyn, the power of Light is not so feeble. This world will survive while the balance holds, but we must also take care that the scales do not swing too far in Light's favor.<var 1A 01 /var>","TEXT_REGLAKWARRINGTRIADNOTE_00328_TRIADLORE_000_055<tab>(-Kapitel 4: Zurvan-)In dieser Welt aber ist das Licht stark. Wenn die Balance zwischen Licht und Dunkelheit gewahrt werden kann, wird sie weiter blühen und gedeihen. Nimmt jedoch eine der beiden Kräfte überhand, so droht auch ihr der Untergang<var 1D /var>...","","False","0x00000023","",""
"","TEXT_REGLAKWARRINGTRIADNOTE_00328_TRIADLORE_000_056<tab>(-Chapter 4: Zurvan-)<var 1A 02 /var>As we fight on the side of Light, we must trust that our companions will steer us away from the lure of extremity, and help guide us along the narrow path to salvation. It is the actions of men such as Regula van Hydrus that give me hope that the future of this star is not beyond redemption.<var 1A 01 /var>","TEXT_REGLAKWARRINGTRIADNOTE_00328_TRIADLORE_000_056<tab>(-Kapitel 4: Zurvan-)Ich weiß nicht, ob mein Weg der richtige ist, doch ich werde mit <var 08 E905 ((der Kriegerin)) ((dem Krieger)) /var> des Lichts und <var 08 E905 ((ihren)) ((seinen)) /var> Gefährten weiterkämpfen. Gegenseitig werden wir uns führen, wenn einer nicht mehr weiterweiß. Und dann werden wir diese Welt retten, so entschlossen, wie Regula van Hydrus es uns mit seiner Heldentat vorgelebt hat.","","False","0x00000024","",""
