"location","source","target","id","fuzzy","context","translator_comments","developer_comments"
"","TEXT_FESXMS2017GUIDE_00440_GUIDEXMS2017_000_000<tab>Spinner's blessings! I am here to spread the word of the Starlight Celebration. Should you have any questions, please feel free to ask away!","TEXT_FESXMS2017GUIDE_00440_GUIDEXMS2017_000_000<tab>Frohes Fest! Als Verwalter des Sternenlichtfest-Komitees stehe ich dir gerne Rede und Antwort. Was möchtest du über das Sternenlichtfest wissen?","","False","0x00000000","",""
"","TEXT_FESXMS2017GUIDE_00440_Q1_000_001<tab>What will you ask?","TEXT_FESXMS2017GUIDE_00440_Q1_000_001<tab>Was möchtest du fragen?","","False","0x00000001","",""
"","TEXT_FESXMS2017GUIDE_00440_A1_000_001<tab>What is the Starlight Celebration?","TEXT_FESXMS2017GUIDE_00440_A1_000_001<tab>Worum geht es beim Sternenlichtfest?","","False","0x00000002","",""
"","TEXT_FESXMS2017GUIDE_00440_A1_000_002<tab>What's your task in all this?","TEXT_FESXMS2017GUIDE_00440_A1_000_002<tab>Was macht ihr hier?","","False","0x00000003","",""
"","TEXT_FESXMS2017GUIDE_00440_A1_000_003<tab>Nothing.","TEXT_FESXMS2017GUIDE_00440_A1_000_003<tab>Nichts.","","False","0x00000004","",""
"","TEXT_FESXMS2017GUIDE_00440_GUIDEXMS2017_000_010<tab>The Starlight Celebration can be traced back to ancient Ishgard. Long ago, a terrible battle claimed countless lives, leaving thousands of children orphaned in the harsh cold weather of Coerthas.","TEXT_FESXMS2017GUIDE_00440_GUIDEXMS2017_000_010<tab>Es begab sich zu einer Zeit, als die Stadt<var 16 /var>staaten in einen bitteren Krieg verwickelt waren. Um ihren Hunger und die bittere Kälte zu vergessen, begannen die armen Waisenkinder in Ishgard, die Sterne am Himmelszelt zu zählen.","","False","0x00000005","",""
"","TEXT_FESXMS2017GUIDE_00440_GUIDEXMS2017_000_011<tab>Unable to bear their suffering, Ishgardian knights would offer these children board and lodging within their barracks. Of course, this was expressly forbidden, but the knights devised a plan to sneak them in, disguising the children in jackets of their scarlet uniforms.","TEXT_FESXMS2017GUIDE_00440_GUIDEXMS2017_000_011<tab>Ishgarder Ritter hatten Mitleid mit den Kindern und gewährten ihnen Zuflucht in ihrer Kaserne. Das war streng verboten, also hüllten sie die Kinder in ihre Mäntel und schmuggelten sie heimlich ins Warme.","","False","0x00000006","",""
"","TEXT_FESXMS2017GUIDE_00440_GUIDEXMS2017_000_012<tab>Owing to their generosity, the children survived the winter and lived to pay forward the kindness they had received. The former orphans would adorn themselves in scarlet uniforms, delivering gifts to children on the coldest week of the year. Thus, the Starlight Celebration was born.","TEXT_FESXMS2017GUIDE_00440_GUIDEXMS2017_000_012<tab>Dieser Akt der Nächstenliebe schlug hohe Wellen im ganzen Reich und so machten es sich die Bewohner zur Angewohnheit, in der Winterzeit das Sternenlichtfest zu begehen und den Kindern mit Geschenken von den Sternen kleine Freuden zu bereiten.","","False","0x00000007","",""
"","TEXT_FESXMS2017GUIDE_00440_GUIDEXMS2017_000_013<tab>Over the years, the celebration has undergone gradual changes. The snowy-bearded captain of the kind-hearted knights has become known as the “Saint of Nymeia,” and children believe that he delivers their hopes and prayers directly to the goddess Herself.","TEXT_FESXMS2017GUIDE_00440_GUIDEXMS2017_000_013<tab>Im Laufe der Jahre gab es ein paar kleinere Änderungen bei den Feierlichkeiten. Der Kommandant der gütigen Ritter mit seinem schneeweißen Bart wurde als „Heiliger von Nymeia“ bekannt, und die Kinder glauben, dass er ihre Hoffnungen und Gebete direkt zu ihrer Göttin trägt.","","False","0x00000008","",""
"","TEXT_FESXMS2017GUIDE_00440_GUIDEXMS2017_000_014<tab>Similarly, his red-jacketed knights have become the “saint's little helpers.” They are particularly beloved by the younglings, for it is their role to bring gifts to every child who sends a prayer to the Spinner.","TEXT_FESXMS2017GUIDE_00440_GUIDEXMS2017_000_014<tab>Die in Rot gekleideten Ritter wurden zu den „Kleinen Helferlein des Heiligen“. Sie werden besonders von den Jüngeren innig geliebt, da es ihre Rolle ist, die Geschenke an Kinder zu verteilen, die einen Brief an Nymeia geschrieben haben.","","False","0x00000009","",""
"","TEXT_FESXMS2017GUIDE_00440_GUIDEXMS2017_000_020<tab>My scarlet-clad colleagues and I have been charged by the Adventurers' Guild with running the Starlight Celebration. The festival spans the entire realm of Eorzea, and we have little helpers stationed in the cities of Gridania, Limsa Lominsa, and Ul'dah.","TEXT_FESXMS2017GUIDE_00440_GUIDEXMS2017_000_020<tab>Meine scharlachroten Kollegen und ich wurden von der Aben<var 16 /var>teurer<var 16 /var>gilde mit der Ausrichtung des diesjährigen Sternenlichtfests beauftragt. Die Feierlichkeiten erstrecken sich über ganz Eorzea und wir haben Kleine Helferlein in den Stadt<var 16 /var>staaten Gridania, Limsa Lominsa und Ul'dah.","","False","0x0000000A","",""
"","TEXT_FESXMS2017GUIDE_00440_GUIDEXMS2017_000_021<tab>This year, we plan to incorporate the Adventurers' Guild's trained bears into the proceedings. They've been taught a Starlight-themed trick sure to bring a smile to all─especially the younglings!","TEXT_FESXMS2017GUIDE_00440_GUIDEXMS2017_000_021<tab>In diesem Jahr wollen wir dressierte Bären der Aben<var 16 /var>teurer<var 16 /var>gilde in das Fest einbinden. Sie haben extra zum Fest ein neues Kunststück gelernt, das besonders den Kindern gefallen wird.","","False","0x0000000B","",""
"","TEXT_FESXMS2017GUIDE_00440_GUIDEXMS2017_000_022<tab>We've had a few hiccups so far and might need adventurers such as yourself to assist in the smooth running of the festival. If all goes according to plan, I'm sure this year's festivities will be the best ever! ","TEXT_FESXMS2017GUIDE_00440_GUIDEXMS2017_000_022<tab>Ehrlich gesagt laufen die Vor<var 16 /var>bereitungen nicht ganz reibungslos, aber mit der Hilfe von euch Abenteurern wird es schon klappen. Das wird das großartigste Sternenlichtfest aller Zeiten!","","False","0x0000000C","",""
"","TEXT_FESXMS2017GUIDE_00440_TALK_ACTOR<tab>","TEXT_FESXMS2017GUIDE_00440_TALK_ACTOR<tab>（★未使用／削除予定★）","","False","0x0000000D","",""
