"location","source","target","id","fuzzy","context","translator_comments","developer_comments"
"","TEXT_CMNCNTWEEKLYBINGO_00372_KHLOEALIAPOF_000_220<tab>Aunt Rowena gives Khloe all sorts of special things 'cause I'm her bestest helper, you know? And Khloe is happy to give these things to you! As long as you give Khloe stories. That's fair, don't you think? Daddy always tells me I should be fair.","TEXT_CMNCNTWEEKLYBINGO_00372_KHLOEALIAPOF_000_220<tab>Lorsque vous aurez accumulé suf<var 16 /var>fi<var 16 /var>sam<var 16 /var>ment d'anecdotes, revenez me rendre le carnet et je vous donnerai une rrrécompense bien méritée<var 1D /var>!","","False","0x00000036","",""
"","TEXT_CMNCNTWEEKLYBINGO_00372_KHLOEALIAPOF_000_221<tab>Khloe likes all stories, of course! But Khloe <var 1A 02 /var>really<var 1A 01 /var> likes it when stories go just right together, because that helps me think of new stories of my own! So if you give me <var 1A 02 /var>those<var 1A 01 /var> kind of stories, I'll be really, really, happy! You understand, don't you, <var 2C ((<var 29 EB02 /var>)) (( )) 02 /var>?","TEXT_CMNCNTWEEKLYBINGO_00372_KHLOEALIAPOF_000_221<tab>N'oubliez pas d'essayer de relier les anecdotes entre elles pour une récompense encore plus fourrrnie, hé hé<var 1D /var>!","","False","0x00000037","",""
"","TEXT_CMNCNTWEEKLYBINGO_00372_KHLOEALIAPOF_000_222<tab>But...but! Mommy always said Khloe has a good memory, right? But still Khloe can still only remember nine stories at once! I tried to remember ten once, but...poof! It just disappeared! Khloe felt so bad... So promise me you won't bring <var 1A 02 /var>too<var 1A 01 /var> many stories at once, okay?","TEXT_CMNCNTWEEKLYBINGO_00372_KHLOEALIAPOF_000_222<tab>En revanche, n'essayez pas de remplir le carnet de fond en comble. Il y aurait trop d'éléments et je ne m'en sortirais pas<var 1D /var>! Neuf anecdotes d'aventures différentes devraient faire l'affaire. Merrrci d'avance<var 1D /var>!","","False","0x00000038","",""
"","TEXT_CMNCNTWEEKLYBINGO_00372_SYSTEM_000_223<tab>Each Wondrous Tails journal contains a four-by-four grid, in which you can record stories by completing duties of your choice from a total set of sixteen. In each journal, a maximum of nine stories can be recorded.","TEXT_CMNCNTWEEKLYBINGO_00372_SYSTEM_000_223<tab>Le carnet contient seize objectifs différents répartis sur une grille de 4x4 cases. Il est possible d'en valider jusqu'à neuf parmi les seize disponibles. À chaque fois qu'un objectif a été validé, une vignette est apposée sur la case correspondante.","","False","0x00000039","",""
"","TEXT_CMNCNTWEEKLYBINGO_00372_SYSTEM_000_224<tab>Complete the conditions described within─for example, marking off nine squares, marking off four squares in a row, and so forth─and deliver your marked journal to Khloe Aliapoh, and the story-loving Miqo'te child will reward you accordingly.","TEXT_CMNCNTWEEKLYBINGO_00372_SYSTEM_000_224<tab>En remplissant certaines conditions, comme par exemple apposer neuf vignettes ou quatre vignettes formant une rangée, des récompenses peuvent être obtenues auprès de Khloe Aliapoh après lui avoir rendu son carnet.","","False","0x0000003A","",""
"","TEXT_CMNCNTWEEKLYBINGO_00372_SYSTEM_000_225<tab>You can review the stories you have recorded at any time by using the Wondrous Tails journal from the Key Items menu.","TEXT_CMNCNTWEEKLYBINGO_00372_SYSTEM_000_225<tab>Le carnet est consultable à tout moment dans l'inventaire des objets-clefs. Il est possible d'y vérifier le nombre de vignettes apposées ou la date limite pour remplir les objectifs.","","False","0x0000003B","",""
"","TEXT_CMNCNTWEEKLYBINGO_00372_KHLOEALIAPOF_000_230<tab>So, I'm collecting stories because I want to make my <var 1A 02 /var>own<var 1A 01 /var> stories, right? Then I want to tell these stories to my best friend. So it's really hard! It takes time to make stories, but I hate to keep my friend waiting...","TEXT_CMNCNTWEEKLYBINGO_00372_KHLOEALIAPOF_000_230<tab>Vous savez, mon amie est tellement malheureuse qu'elle a besoin d'avoir l'esprit occupé aussi souvent que possible. C'est pour ça que je dois ré<var 16 /var>gu<var 16 /var>liè<var 16 /var>re<var 16 /var>ment lui raconter une nouvelle histoirrre.","","False","0x0000003C","",""
"","TEXT_CMNCNTWEEKLYBINGO_00372_KHLOEALIAPOF_000_231<tab>So, Khloe knows that adventurers like you are really, really busy, right? But Khloe has to give you a do-date. Rowena always tells Khloe that all important work has a do-date! So, if you <var 1A 02 /var>do<var 1A 01 /var> the job before the <var 1A 02 /var>date<var 1A 01 /var> in the journal, it'll make Khloe so happy. You want to make me happy, right?","TEXT_CMNCNTWEEKLYBINGO_00372_KHLOEALIAPOF_000_231<tab>Voilà pourquoi je vous impose une date limite pour me rendre mon carnet. Si vous voulez tout savoir, c'est madame Rowena qui m'a conseillé de faire ça<var 1D /var>! Je ne vais tout de même pas désobéirrr à ma patronne, ce n'est pas mon genre<var 1D /var>!","","False","0x0000003D","",""
"","TEXT_CMNCNTWEEKLYBINGO_00372_SYSTEM_000_232<tab>Each Wondrous Tails journal has a deadline, by which time you must submit it to Khloe Aliapoh to be eligible to receive a reward. You may review deadlines at any time by using the Wondrous Tails journal from the Key Items menu.","TEXT_CMNCNTWEEKLYBINGO_00372_SYSTEM_000_232<tab>Pour obtenir une récompense, il est nécessaire de rendre le carnet de Khloe avant la date limite.","","False","0x0000003E","",""

