"location","source","target","id","fuzzy","context","translator_comments","developer_comments"
"","TEXT_CTSOPN60WANDERINGMINSTREL_00728_CFC_TO_INSTANCE_CONTENT<tab><var 28 ((ContentFinderCondition)) E80204 /var>","TEXT_CTSOPN60WANDERINGMINSTREL_00728_CFC_TO_INSTANCE_CONTENT<tab><var 28 ((ContentFinderCondition)) E80204 /var>","","True","0x00000000","",""
"","TEXT_CTSOPN60WANDERINGMINSTREL_00728_MINSTREL_GREETING_000<tab>Greetings, my friend. If you have a tale to share, this minstrel is all ears!","TEXT_CTSOPN60WANDERINGMINSTREL_00728_MINSTREL_GREETING_000<tab>Oh, <var 2C ((<var 29 EB02 /var>)) (( )) 02 /var>! Was für ein <var 1A 02 /var>Zufall<var 1A 01 /var>, dass wir uns hier treffen! Das muss ein Wink des Schicksals sein. Ich war gerade auf der Suche nach Inspiration für ein neues Meisterwerk. Du hast nicht vielleicht etwas Spannendes auf Lager, das ich abkupf... ich meine als <var 1A 02 /var>Grundlage<var 1A 01 /var> für mein nächstes Lied nehmen könnte?","","True","0x00000001","",""
"","TEXT_CTSOPN60WANDERINGMINSTREL_00728_Q1_000_001<tab>What will you talk about?","TEXT_CTSOPN60WANDERINGMINSTREL_00728_Q1_000_001<tab>Was sagst du?","","True","0x00000002","",""
"","TEXT_CTSOPN60WANDERINGMINSTREL_00728_MINSTREL_MENU_CANCEL<tab>Take your leave.","TEXT_CTSOPN60WANDERINGMINSTREL_00728_MINSTREL_MENU_CANCEL<tab>Ich muss noch dringend wohin<var 1D /var>...","","True","0x00000003","",""
"","TEXT_CTSOPN60WANDERINGMINSTREL_00728_MINSTREL_NOSELECT_000<tab>Oh, leaving so soon? I would be lying were I to say I wasn't disappointed, but I appreciate that a hero such as you has great demands upon <var 08 E905 ((her)) ((his)) /var> time. I shall look forward to hearing your adventures when you have a spare moment.","TEXT_CTSOPN60WANDERINGMINSTREL_00728_MINSTREL_NOSELECT_000<tab>Wie, du willst mich armen Tropf hängen lassen? Aber was soll ich ohne meine Muse nur tun?! <seufz> Schätze, da kann man nichts machen. Also gut, geh hinaus und rette die Welt, o <var 08 E905 ((große Heldin)) ((großer Held)) /var>!","","True","0x00000004","",""
"","TEXT_CTSOPN60WANDERINGMINSTREL_00728_MINSTREL_NOCONTENT_000<tab>...Nothing for now? Not to put undue pressure upon you, but the folk here are quite taken by the songs inspired by your tales. They await the next with bated breath, and I hope to be able to deliver ere long─with inspiration from your good self.","TEXT_CTSOPN60WANDERINGMINSTREL_00728_MINSTREL_NOCONTENT_000<tab>Ich verstehe, zu früh kommt mein Gesuch nach neuer Inspiration. Selbst <var 08 E905 ((die größte Heldin)) ((der größte Held)) /var> kann die Welt nicht jeden Tag retten, was? Dann muss ich wohl all die armen Kinder da draußen vorerst mit alten Kamellen vertrösten.","","True","0x00000005","",""
"","TEXT_CTSOPN60WANDERINGMINSTREL_00728_WANDERINGMINSTREL_000_000<tab>Oho, what manner of thrilling adventure might this be?","TEXT_CTSOPN60WANDERINGMINSTREL_00728_WANDERINGMINSTREL_000_000<tab>Haben meine zarten Ohren das richtig gehört? Ein Kampf mit <var 1A 02 /var>Zodiark<var 1A 01 /var>, dem Gott der Dunkelheit höchstselbst? Unglaublich, erzähl mir alles und spare kein Detail aus!","","True","0x00000006","",""
"","TEXT_CTSOPN60WANDERINGMINSTREL_00728_WANDERINGMINSTREL_000_001<tab>Good gods, a battle on the moon with Zodiark, eldest and mightiest of primals... I pride myself on my imagination, but your feats transcend aught my mind could possibly conceive.","TEXT_CTSOPN60WANDERINGMINSTREL_00728_WANDERINGMINSTREL_000_001<tab>Ich fasse es nicht. Du hast also eine uralte Gottheit niedergerungen, die von einer längst vergangenen Zivilisation beschworen wurde? Und dazu noch auf unserem <var 1A 02 /var>Mond<var 1A 01 /var>?! Wenn ich dich nicht besser kennen würde, müsste ich dich für verrückt erklären! Wahrlich, deine Abenteuer übersteigen mal wieder alles, was ich in meinen kühnsten Fantasien je erträumen könnte.","","True","0x00000007","",""
"","TEXT_CTSOPN60WANDERINGMINSTREL_00728_WANDERINGMINSTREL_000_002<tab>Against all odds, you struck down the puissant being, yet triumph quickly turned to tragedy, for Zodiark's fall proved to be the trigger for the Final Days...","TEXT_CTSOPN60WANDERINGMINSTREL_00728_WANDERINGMINSTREL_000_002<tab>Und diese unglaubliche Wendung in der Geschichte: Du ringst Zodiark nieder, in dem Glauben, die Welt vor dem Untergang zu bewahren und im letzten Moment verrät dir ein verrückt gewordener <var 1A 02 /var>Seelenwanderer<var 1A 01 /var>, dass es der Tod des dunklen Gottes ist, der direkt in den Weltuntergang führt? Das ist der Stoff eines Epos, <var 08 E905 ((meine Gute)) ((mein Freund)) /var><var 1D /var>...","","True","0x00000008","",""
"","TEXT_CTSOPN60WANDERINGMINSTREL_00728_WANDERINGMINSTREL_000_003<tab>...Yes. Yes, the words well up within me. Pray lend them an ear.","TEXT_CTSOPN60WANDERINGMINSTREL_00728_WANDERINGMINSTREL_000_003<tab>Oh, ja, ich spüre es<var 1D /var>... Mein Geist rast und Worte der Poesie wallen in mir auf! Nichts ist epischer als ein Konflikt, bei dem das Schicksal aller Existenz auf dem Spiel steht!","","True","0x00000009","",""
"","TEXT_CTSOPN60WANDERINGMINSTREL_00728_WANDERINGMINSTREL_000_004<tab>Born of ancient men, a divinity was freed,♪
Their hopes unrequited, they knew no reprieve.♪","TEXT_CTSOPN60WANDERINGMINSTREL_00728_WANDERINGMINSTREL_000_004<tab>„Ein uralter Gott geschaffen in Not, befreit aus seinem Kerker auf dem Mond. Ward alsbald bezwungen von mutigem Herzen im Morgenrot. Und so sprach der Bösewicht: besiegt hast du mich wohl, aber gewonnen hast du nicht! Denn deine Welt soll enden und keiner wird verschont. Deine Welt soll enden und keiner wird verschont!“","","False","0x0000000A","",""
"","TEXT_CTSOPN60WANDERINGMINSTREL_00728_WANDERINGMINSTREL_000_005<tab>Born of mortal men, a champion did arise,♪
Ascending to the heavens, ruination to defy.♪","TEXT_CTSOPN60WANDERINGMINSTREL_00728_WANDERINGMINSTREL_000_005<tab>„Und in allen Landen erhoben sich Helden, beflügelt von Drachenmut. Um die Türme zu stürzen und das Joch zu brechen, schritten sie entschlossen durch feurige Glut. Vereint im Willen, die Welt zu retten, riefen sie auf den Tod gefeit: Unser Wille zu leben ist ungebrochen, unser Blutes Lohn, ist die Ewigkeit! Unser Blutes Lohn, ist die Ewigkeit!“","","False","0x0000000B","",""
"","TEXT_CTSOPN60WANDERINGMINSTREL_00728_WANDERINGMINSTREL_000_006<tab>That the ancients should sacrifice half their number to save the star... The strength of their resolve makes me tremble in admiration.","TEXT_CTSOPN60WANDERINGMINSTREL_00728_WANDERINGMINSTREL_000_006<tab>Zodiark. Ich kann immer noch nicht glauben, dass ein Volk die Hälfte seiner Brüder und Schwestern opfern würde, um sein Gestirn zu retten. Was für ein Handel!","","True","0x0000000C","",""
"","TEXT_CTSOPN60WANDERINGMINSTREL_00728_WANDERINGMINSTREL_000_007<tab>Even as it saddens me to think that one of their own would seek to lay it all to waste, so deep was his despair...","TEXT_CTSOPN60WANDERINGMINSTREL_00728_WANDERINGMINSTREL_000_007<tab>Ich bekomme eine Gänsehaut, wenn ich nur daran denke, was für eine unglaubliche Macht, welch eiserner Wille diese Ascians beseelt haben muss, über ganze Zeitalter hinweg einen solch verrückten Plan zu verfolgen. Und dieser Fandaniel<var 1D /var>... wie verbittert muss seine Seele gewesen sein, wie tief die Enttäuschung<var 1D /var>...","","True","0x0000000D","",""
"","TEXT_CTSOPN60WANDERINGMINSTREL_00728_WANDERINGMINSTREL_000_008<tab>Not having lived their lives, I feel decidedly unworthy to speak of their hearts. Better that the whole truth remain with you, and you alone.","TEXT_CTSOPN60WANDERINGMINSTREL_00728_WANDERINGMINSTREL_000_008<tab>Aber das überlassen wir der Fantasie. Es gibt gewisse Dinge, die man der Welt besser nicht preisgibt. Nicht alle Seelen vertragen die Wahrheit, nicht jeder hat die Kraft in den Abgrund zu blicken und die richtigen Schlüsse zu ziehen. Es reicht, wenn wir <var 08 E905 ((Heldinnen)) ((Helden)) /var> wie dich haben, die stark genug sind, an unser statt zu tun, was nötig ist.","","True","0x0000000E","",""
"","TEXT_CTSOPN60WANDERINGMINSTREL_00728_WANDERINGMINSTREL_000_009<tab>Let it suffice for me to honor a fragment of their hopes and dreams in song, that their lives and sacrifice may ever be remembered.","TEXT_CTSOPN60WANDERINGMINSTREL_00728_WANDERINGMINSTREL_000_009<tab>Ich habe nicht alles von dieser unglaublichen Geschichte verstanden, die du mir da offenbart hast, aber ich denke, es reicht, wenn wir uns auch an ihr Opfer erinnern. Wenn wir nicht vergessen, dass es einst dieses stolze Volk gab<var 1D /var>...","","True","0x0000000F","",""
"","TEXT_CTSOPN60WANDERINGMINSTREL_00728_WANDERINGMINSTREL_000_010<tab>Hm-hm, this promises to be a most rousing adventure!","TEXT_CTSOPN60WANDERINGMINSTREL_00728_WANDERINGMINSTREL_000_010<tab>Jetzt hast du mich aber am Wickel, <var 2C ((<var 29 EB02 /var>)) (( )) 02 /var>! Lass hören, welch unerhörte Abenteuer du wieder erlebt hast!","","True","0x00000010","",""
"","TEXT_CTSOPN60WANDERINGMINSTREL_00728_WANDERINGMINSTREL_000_011<tab>In order to prove your readiness to avert the Final Days, you undertook a trial imposed by no less a being than the will of the star, Hydaelyn Herself...","TEXT_CTSOPN60WANDERINGMINSTREL_00728_WANDERINGMINSTREL_000_011<tab>Eine Prüfung vom Willen des Gestirns an <var 08 E905 ((die größte Heldin)) ((den größten Helden)) /var> unserer Zeit. Was muss das für ein Gefühl gewesen sein, als du Hydaelyn gegenübergetreten bist. Ich meine, du erlebst Abenteuer um Abenteuer, aber <var 1A 02 /var>das<var 1A 01 /var><var 1D /var>...","","True","0x00000011","",""
"","TEXT_CTSOPN60WANDERINGMINSTREL_00728_WANDERINGMINSTREL_000_012<tab>It staggers the mind to imagine such an encounter, to say naught of the thousands of years that Venat had resolved to wait.","TEXT_CTSOPN60WANDERINGMINSTREL_00728_WANDERINGMINSTREL_000_012<tab>Man stelle sich vor. Ein unglaublich mächtiges Geschöpf, das Jahrtausende existierte. Die Verkörperung unseres gesamten Planeten!","","True","0x00000012","",""
"","TEXT_CTSOPN60WANDERINGMINSTREL_00728_WANDERINGMINSTREL_000_013<tab>...Yes, I daresay I have a song. You will listen to it now, of course?","TEXT_CTSOPN60WANDERINGMINSTREL_00728_WANDERINGMINSTREL_000_013<tab>Und sie fordert dich zur ultimativen Prüfung. Es ist der Kern aller epischen Erzählungen. <var 08 E905 ((Eine Heldin)) ((Ein Held)) /var>, <var 08 E905 ((die)) ((der)) /var> aufbricht, um ein hehres Ziel zu erreichen. Auf <var 08 E905 ((ihren)) ((seinen)) /var> Reisen muss <var 08 E905 ((sie)) ((er)) /var> zahllose Abenteuer bestehen. Und dann, wenn <var 08 E905 ((sie)) ((er)) /var> gestählt aus diesem Schmelztiegel des Heldentums hervortritt, erwartet <var 08 E905 ((sie)) ((ihn)) /var> eine letzte göttliche Prüfung für Fleisch und Geist. Ja<var 1D /var>... ich sehe es vor mir<var 1D /var>... Ich höre den Klang der Verse<var 1D /var>...","","True","0x00000013","",""
"","TEXT_CTSOPN60WANDERINGMINSTREL_00728_WANDERINGMINSTREL_000_014<tab>Though eons apart, two kindred souls met,♪
Apart they would walk, all life to protect.♪","TEXT_CTSOPN60WANDERINGMINSTREL_00728_WANDERINGMINSTREL_000_014<tab>„Ein junger lebensfroher Stern begann einst seine Reise zu Ruhm und Ehr. Nach langer Pilgerfahrt traf er schließlich auf seine uralte und unendlich weise Schwester. In ihrer Güte gewährte das weise Gestirn dem jungen Licht ein Herz prall mit Energie und Lebensmut. Geprüft sollst du sein und geprüft sollst du werden, sprach sie. Denn Leben heißt sterben und ohne Leid kann es keine Freude geben. Nur an Prüfungen wirst du wachsen!“","","False","0x00000014","",""
"","TEXT_CTSOPN60WANDERINGMINSTREL_00728_WANDERINGMINSTREL_000_015<tab>Eons thence, their paths would converge,♪
As goddess and mortal, to silence the dirge.♪","TEXT_CTSOPN60WANDERINGMINSTREL_00728_WANDERINGMINSTREL_000_015<tab>„So geprüft reiste der junge Stern zum Rande des Universums, wo keine Sonne scheint und keine Hoffnung haust, im Gepäck ein gestähltes Herz und den unbeugsamen Willen zu leben. Dort hörte er das Requiem des dunklen Vogels, spürte das geballte Leid der Hoffnungslosen und dachte: Nun bin ich so weit gereist, habe so viel erlebt, bin so sehr gewachsen. Die Freude auf den nächsten Sonnenaufgang nimmt mir keiner.“","","False","0x00000015","",""
"","TEXT_CTSOPN60WANDERINGMINSTREL_00728_WANDERINGMINSTREL_000_016<tab>For time beyond counting, Hydaelyn waited for you in patience and faith. And when at last you were reunited, even as She desperately wished for you to surpass Her, She knew She could not hold back─and did not.","TEXT_CTSOPN60WANDERINGMINSTREL_00728_WANDERINGMINSTREL_000_016<tab>Du bist gesegnet und der Wille des Gestirns hat dir ein letztes Geschenk gemacht. Um den Untergang unserer Welt, ja allen Seins zu verhindern, gab sie nicht nur sich selbst auf, sondern schenkte dir die Kraft diese letzte Prüfung zu bestehen. Was gibt es Nobleres, als das eigene Leben zur Rettung anderer zu geben?","","True","0x00000016","",""
"","TEXT_CTSOPN60WANDERINGMINSTREL_00728_WANDERINGMINSTREL_000_017<tab>Hers was an unenviable burden...and a noble sacrifice. Tears well in my eyes to imagine the hardships She has had to endure.","TEXT_CTSOPN60WANDERINGMINSTREL_00728_WANDERINGMINSTREL_000_017<tab>Seit Jahrhunderten - wenn nicht Jahrtausenden - wartete sie geduldig am Sternengrund, hütete all die guten Seelen. Vermachte anderen ihre Kraft und ihre Herzensgüte. Voller Liebe und doch nie geliebt. Ihre wärmende Hand schenkte Zuversicht und gleichzeitig war ihr die Wärme anderer versagt. Hach<var 1D /var>...","","True","0x00000017","",""
"","TEXT_CTSOPN60WANDERINGMINSTREL_00728_WANDERINGMINSTREL_000_018<tab>But it comforts me to know that Her long journey was not in vain. That Her hopes passed on to you.","TEXT_CTSOPN60WANDERINGMINSTREL_00728_WANDERINGMINSTREL_000_018<tab>Oh, nein, nein. Das sind keine Tränen, die du da siehst! Mir ist nur eine Fliege ins Auge geflogen. Garstige Biester! Ähem<var 1D /var>...","","True","0x00000018","",""
"","TEXT_CTSOPN60WANDERINGMINSTREL_00728_WANDERINGMINSTREL_000_019<tab>This tale is an epic among epics, and full honored am I to have been given the chance to weave a song for it. From the bottom of my heart, I thank you.","TEXT_CTSOPN60WANDERINGMINSTREL_00728_WANDERINGMINSTREL_000_019<tab>Damit wäre eine weitere Geschichte für die Götter erzählt, eine weitere Sage für die Ewigkeit. Ich fühle mich wahrlich geehrt, dass du diese Erfahrung mit mir geteilt hast, <var 2C ((<var 29 EB02 /var>)) (( )) 02 /var>. Es erfüllt mich mit<var 1D /var>... Hoffnung.","","True","0x00000019","",""
"","TEXT_CTSOPN60WANDERINGMINSTREL_00728_WANDERINGMINSTREL_000_020<tab>The Dragonsong War, you say?","TEXT_CTSOPN60WANDERINGMINSTREL_00728_WANDERINGMINSTREL_000_020<tab>Hört, hört. Dir ist also danach, alten Erinnerungen an den Drachenkrieg zu frönen?","","False","0x0000001A","",""
"","TEXT_CTSOPN60WANDERINGMINSTREL_00728_WANDERINGMINSTREL_000_021<tab>Quite some time has passed since that conflict drew to a close.","TEXT_CTSOPN60WANDERINGMINSTREL_00728_WANDERINGMINSTREL_000_021<tab>Das kann ich nur befürworten. So viel Zeit auch verstreichen mag, die Lehren selbst lang zurückliegender Abenteuer verlieren niemals ihren Wert.","","False","0x0000001B","",""
"","TEXT_CTSOPN60WANDERINGMINSTREL_00728_WANDERINGMINSTREL_000_022<tab>But having now survived the threat of the Final Days, I believe we may reflect more deeply upon the emotions that had driven man and dragon both. By all means, recount the tale for me.","TEXT_CTSOPN60WANDERINGMINSTREL_00728_WANDERINGMINSTREL_000_022<tab>Nun, da du auf deiner Reise dem Ende der Welt selbst in den Schlund geblickt hast, ist dies eine gute Gelegenheit, das Vergangene Revue passieren zu lassen. Hie und da mögen sich dir neue Erkenntnisse offenbaren, die auch meiner Kreativität den nötigen Anreiz geben. Nur zu, ich bin ganz Ohr.","","False","0x0000001C","",""
"","TEXT_CTSOPN60WANDERINGMINSTREL_00728_WANDERINGMINSTREL_000_023<tab>I see. I see...","TEXT_CTSOPN60WANDERINGMINSTREL_00728_WANDERINGMINSTREL_000_023<tab>Ah, richtig. Ich erinnere mich wieder<var 1D /var>...","","False","0x0000001D","",""
"","TEXT_CTSOPN60WANDERINGMINSTREL_00728_WANDERINGMINSTREL_000_024<tab>I profess to weave words for a living...but on this occasion, they utterly fail me.","TEXT_CTSOPN60WANDERINGMINSTREL_00728_WANDERINGMINSTREL_000_024<tab>Ein Epos, das seinesgleichen sucht<var 1D /var>... Entschuldige. Als Mann des gewählten Wortes sollte mir ein besserer Kommentar dazu einfallen, doch meine Zunge würde der schieren Größe deines Abenteuers nicht gerecht werden.","","False","0x0000001E","",""
"","TEXT_CTSOPN60WANDERINGMINSTREL_00728_WANDERINGMINSTREL_000_025<tab>Yet this much, I will say: like an unwatched fire, pain and loss mustn't be left untended. For they were the embers that kindled a thousand-year conflict.","TEXT_CTSOPN60WANDERINGMINSTREL_00728_WANDERINGMINSTREL_000_025<tab>Eines ist jedoch sicher: Jede deiner Erinnerungen an diesen Krieg ist ein wertvolles Andenken an die Gefühle all jener, die in den tausend Jahren seines Wütens kämpften, starben, oder bis zum Schluss überdauerten.","","False","0x0000001F","",""
"","TEXT_CTSOPN60WANDERINGMINSTREL_00728_WANDERINGMINSTREL_000_026<tab>Tell me, my friend. Have you ever dwelled on that dark moment? Dwelled on what may have come to pass if the life which was lost was spared instead?","TEXT_CTSOPN60WANDERINGMINSTREL_00728_WANDERINGMINSTREL_000_026<tab>Sag, ist dir je durch den Kopf gegangen, was hätte sein können? Ob die Zukunft eine andere wäre, hätte die Schlacht ein dir bedeutsames Leben verschont?","","False","0x00000020","",""
"","TEXT_CTSOPN60WANDERINGMINSTREL_00728_WANDERINGMINSTREL_000_027<tab>'Tis said that there are no ifs in history, yet man is wont to cast his mind towards the path not walked.","TEXT_CTSOPN60WANDERINGMINSTREL_00728_WANDERINGMINSTREL_000_027<tab>Der Marsch der Geschichte treibt uns auf einem einzigen Pfad stetig voran. Und doch liegt es in unserer Natur, unzählige Gedanken darauf zu verwenden, wohin uns eine andere Abzweigung hätte führen können.","","False","0x00000021","",""
"","TEXT_CTSOPN60WANDERINGMINSTREL_00728_WANDERINGMINSTREL_000_028<tab>In acknowledgement of this, I would sing of alternate eventualities...","TEXT_CTSOPN60WANDERINGMINSTREL_00728_WANDERINGMINSTREL_000_028<tab>Ich wäre kein fahrender Sänger, kämen mir da nicht sogleich eine Fülle an Strophen in den Sinn, die das Geschehen dieses Epos in einem anderen Licht besingen<var 1D /var>...","","False","0x00000022","",""
"","TEXT_CTSOPN60WANDERINGMINSTREL_00728_WANDERINGMINSTREL_000_029<tab>By naught but vigilance may silver mail endure,
Javelin's point never touch a comrade pure.♪","TEXT_CTSOPN60WANDERINGMINSTREL_00728_WANDERINGMINSTREL_000_029<tab>„Des Speeres Spitze zum Durchbohr'n bereit
Doch verfehlt sie Freundesbrust um Haaresbreit'.“","","False","0x00000023","",""
"","TEXT_CTSOPN60WANDERINGMINSTREL_00728_WANDERINGMINSTREL_000_030<tab>Look back upon the paths we failed to take,
And prepare for the trials that lie in wait.♪","TEXT_CTSOPN60WANDERINGMINSTREL_00728_WANDERINGMINSTREL_000_030<tab>„Allein der Blick aufs Gestern erklärt das bitt're Versagen
Für dessen Umkehr wir aufs Neue die Prüfung wagen.“","","False","0x00000024","",""
"","TEXT_CTSOPN60WANDERINGMINSTREL_00728_WANDERINGMINSTREL_000_031<tab>As you may have noticed, I drew inspiration from the words the Archon Louisoix wrote in his journals in allusion to the Dragonsong War.","TEXT_CTSOPN60WANDERINGMINSTREL_00728_WANDERINGMINSTREL_000_031<tab>Kommen dir diese Verse bekannt vor? Die Inspiration dafür zog ich aus den Worten des weisen Louisoix höchstselbst, wie er sie uns in seinen Schriften über den Drachenkrieg hinterließ.","","False","0x00000025","",""
"","TEXT_CTSOPN60WANDERINGMINSTREL_00728_WANDERINGMINSTREL_000_032<tab>Some may dismiss the exercise as wishful pining. But by thus reflecting upon the past, I believe that we shall be better braced for the future.","TEXT_CTSOPN60WANDERINGMINSTREL_00728_WANDERINGMINSTREL_000_032<tab>Die meisten würden solch Gedankenspiel als töricht betrachten, ändert es doch nichts an den Ereignissen, die damals unsere Geschichte prägten. Ich aber behaupte, nur, wer über alte Fehler nachsinnt und versteht, wie sie zustande kamen, ist wahrlich für die Zukunft gerüstet.","","False","0x00000026","",""
"","TEXT_CTSOPN60WANDERINGMINSTREL_00728_WANDERINGMINSTREL_000_033<tab>So when you have a quiet moment, perhaps you too might look back and imagine it─the tale as it might have unfolded...","TEXT_CTSOPN60WANDERINGMINSTREL_00728_WANDERINGMINSTREL_000_033<tab>Gerade dir als Held<var 08 E905 ((in)) (()) /var> kann ich diese Herangehensweise nur ans Herz legen. Sicher fändest du einen mit neuen Lektionen gespickten Weg, der das Ruder des Schicksals an jenem Tag in eine andere Richtung gerissen hätte<var 1D /var>...","","False","0x00000027","",""
"","TEXT_CTSOPN60WANDERINGMINSTREL_00728_WANDERINGMINSTREL_000_040<tab>A battle at the edge of existence, you say? Against a fearsome being known as the Endsinger...","TEXT_CTSOPN60WANDERINGMINSTREL_00728_WANDERINGMINSTREL_000_040<tab>Ein Kampf am Rande des Universums? Gegen jene, die das Ende besungen hat?","","False","0x00000028","",""
"","TEXT_CTSOPN60WANDERINGMINSTREL_00728_WANDERINGMINSTREL_000_041<tab>It goes without saying that I should like to hear about this! Pray, recount to me the tale of your mission from beginning to end!","TEXT_CTSOPN60WANDERINGMINSTREL_00728_WANDERINGMINSTREL_000_041<tab>Das klingt nach einer wahrlich außer<var 16 /var>ge<var 16 /var>wöhn<var 16 /var>lichen Geschichte! Erzähle sie mir von Anfang bis Ende.","","False","0x00000029","",""
"","TEXT_CTSOPN60WANDERINGMINSTREL_00728_WANDERINGMINSTREL_000_042<tab>Good gods... I had known about the chaos of the Final Days, but never could I have imagined the events which brought them about.","TEXT_CTSOPN60WANDERINGMINSTREL_00728_WANDERINGMINSTREL_000_042<tab>Bei den Göttern! Ich hatte von den Letzten Tagen gehört, aber die Hintergründe waren mir unbekannt.","","False","0x0000002A","",""
"","TEXT_CTSOPN60WANDERINGMINSTREL_00728_WANDERINGMINSTREL_000_043<tab>I do wonder, though... Where might this Ultima Thule be located?","TEXT_CTSOPN60WANDERINGMINSTREL_00728_WANDERINGMINSTREL_000_043<tab>Aber ich verstehe nicht, wo sich dieses Ultima Thule befinden soll.","","False","0x0000002B","",""
"","TEXT_CTSOPN60WANDERINGMINSTREL_00728_WANDERINGMINSTREL_000_044<tab>Lest you misunderstand, I speak not of its physical location. If we wished to know that, I daresay we could have the coordinates from the Loporrits.","TEXT_CTSOPN60WANDERINGMINSTREL_00728_WANDERINGMINSTREL_000_044<tab>Ich meine nicht seine Position im Sternenmeer. Die Koordinaten könnten uns die Loporrit geben.","","False","0x0000002C","",""
"","TEXT_CTSOPN60WANDERINGMINSTREL_00728_WANDERINGMINSTREL_000_045<tab>Nay, my friend. What I speak of, rather, is its essence.","TEXT_CTSOPN60WANDERINGMINSTREL_00728_WANDERINGMINSTREL_000_045<tab>Ich spreche von seiner Essenz.","","False","0x0000002D","",""
"","TEXT_CTSOPN60WANDERINGMINSTREL_00728_WANDERINGMINSTREL_000_046<tab>According to your description, 'tis a space where emotions dictate reality. It seems to me that, in such a place, it would be nigh impossible to draw a line between what is real and what is felt.","TEXT_CTSOPN60WANDERINGMINSTREL_00728_WANDERINGMINSTREL_000_046<tab>Ein Ort, an dem Emotionen bestimmen, was Realität ist. Wie soll man an solch einem Ort entscheiden, was echt ist und was gefühlt?","","False","0x0000002E","",""
"","TEXT_CTSOPN60WANDERINGMINSTREL_00728_WANDERINGMINSTREL_000_047<tab>In nature, there is a phenomenon wherein the structure of a massive object may resemble that of something diminutive.","TEXT_CTSOPN60WANDERINGMINSTREL_00728_WANDERINGMINSTREL_000_047<tab>In der Welt gibt es Muster, die man sowohl im Allergrößten als auch im Allerkleinsten wiederfindet.","","False","0x0000002F","",""
"","TEXT_CTSOPN60WANDERINGMINSTREL_00728_WANDERINGMINSTREL_000_048<tab>Might it not be possible, then, that the structure of the sea of stars resembles that of the heart and mind─of the complex mechanisms that govern our feelings?","TEXT_CTSOPN60WANDERINGMINSTREL_00728_WANDERINGMINSTREL_000_048<tab>Ist es denn dann undenkbar, dass die Struktur des Sternenmeers denen des Herzens und des Geistes gleicht? Dass die komplexen Mechanismen dahinter ein und dieselben sind?","","False","0x00000030","",""
"","TEXT_CTSOPN60WANDERINGMINSTREL_00728_WANDERINGMINSTREL_000_049<tab>On the assumption that it is so, I am led to wonder: what was the true nature of the Endsinger?","TEXT_CTSOPN60WANDERINGMINSTREL_00728_WANDERINGMINSTREL_000_049<tab>Man muss sich fragen: Was war die wahre Natur der Endsängerin?","","False","0x00000031","",""
"","TEXT_CTSOPN60WANDERINGMINSTREL_00728_WANDERINGMINSTREL_000_050<tab>What was it exactly that you defied at the edge of existence?","TEXT_CTSOPN60WANDERINGMINSTREL_00728_WANDERINGMINSTREL_000_050<tab>Was hast du in Ultima Thule wirklich besiegt?","","False","0x00000032","",""
"","TEXT_CTSOPN60WANDERINGMINSTREL_00728_WANDERINGMINSTREL_000_051<tab>Haha, these are just the wild ramblings of a minstrel. Pray do not lose sleep over it.","TEXT_CTSOPN60WANDERINGMINSTREL_00728_WANDERINGMINSTREL_000_051<tab>Ahaha, ich denke nur laut. Lass dich nicht von meinen Gedanken verunsichern.","","False","0x00000033","",""
"","TEXT_CTSOPN60WANDERINGMINSTREL_00728_WANDERINGMINSTREL_000_052<tab>Still, I must say that the idea of an entity that hoards despair has quite roused my imagination. For instance...","TEXT_CTSOPN60WANDERINGMINSTREL_00728_WANDERINGMINSTREL_000_052<tab>Aber ein Wesen, das auf einem Hort verzweifelter Emotionen sitzt, regt nun einmal den Geist eines Poeten an.","","False","0x00000034","",""
