"location","source","target","id","fuzzy","context","translator_comments","developer_comments"
"","TEXT_CTSOPN60WANDERINGMINSTREL_00728_WANDERINGMINSTREL_000_125<tab>From selfsame shade did rise a dark knight,♪
A void-kissed child now graced by the Light.♪
'Twas she who dared to defy her fate,♪
And by her hand damnation's wheel break.♪","TEXT_CTSOPN60WANDERINGMINSTREL_00728_WANDERINGMINSTREL_000_125<tab>♪ Engel im dunklen Mantel, was ist dein Begehr? ♪
♪ Das Licht, es löscht den Durst der Trauer, voll Finsternis nicht mehr ♪
♪ Paladin einer neuen Zeit, deine Welt du willst zurück ♪
♪ Reichst selbst Sündern deine Hand, auch im Nichts glaubst du ans Glück ♪","","False","0x0000006D","",""
"","TEXT_CTSOPN60WANDERINGMINSTREL_00728_WANDERINGMINSTREL_000_126<tab>For a mercy, it seems Zero has found a way to save not only her voidsent kin, but her home as well. And while Golbez may have committed terrible deeds, that he yet lives means that he may yet do good.","TEXT_CTSOPN60WANDERINGMINSTREL_00728_WANDERINGMINSTREL_000_126<tab>Indem sie Golbez' Pläne, den Nichts<var 16 /var>gesand<var 16 /var>ten Erlösung von ihrem ewigen Zyklus der Wiedergeburt zu gewähren, vereitelte, hat sie die Gelegenheit, aber auch die Pflicht, einen anderen Pfad zur Rettung ihrer Welt und deren Bewohner aufzutun.","","False","0x0000006E","",""
"","TEXT_CTSOPN60WANDERINGMINSTREL_00728_WANDERINGMINSTREL_000_127<tab>The nigh-fathomless Darkness of Zeromus contained within the memoria crystal shall pave a path of newfound hope.","TEXT_CTSOPN60WANDERINGMINSTREL_00728_WANDERINGMINSTREL_000_127<tab>Eine Pflicht, eine <var 1A 02 /var>Bestimmung<var 1A 01 /var> von solch gewaltigen Ausmaßen<var 1D /var>... Eine so große Last ist unmöglich allein zu schultern. Aber das muss sie auch nicht mehr.","","False","0x0000006F","",""
"","TEXT_CTSOPN60WANDERINGMINSTREL_00728_WANDERINGMINSTREL_000_128<tab>An arduous path, to be sure, but one they shall walk together. And at journey's end, I pray, the Thirteenth will flourish with life once more.","TEXT_CTSOPN60WANDERINGMINSTREL_00728_WANDERINGMINSTREL_000_128<tab>Sie und ihre neuen Verbündeten aus jener Welt sollen fortan Licht und Dunkelheit miteinander teilen<var 1D /var>... Um das, was zerstört worden ist, wieder ganz zu machen<var 1D /var>... Ich hoffe inständig, sie werden ihrer beider Welten die ersehnte Erlösung bringen.","","False","0x00000070","",""

