"location","source","target","id","fuzzy","context","translator_comments","developer_comments"
"","TEXT_FESXMS2020LETTER_00698_LETTER_000_130<tab>(-Letter from a Distant World-)How do you fare, friend? Feo Ul tells me there is a festival known as “Starlight” in your world that you celebrate this time of year. Why, just hearing stories of entire cities bedecked in ornaments that twinkle and glimmer like the night sky─I would give anything to see it with my own eyes!","TEXT_FESXMS2020LETTER_00698_LETTER_000_130<tab>(-異世界の巫女からの手紙-)お元気ですか？　フェオさんから、そちらの話を伺いました。<br>そちらでは、星芒祭というお祭が催されているのだとか。<br>夜闇に瞬く星々を模した飾りつけ……とっても素敵ですね！","","True","0x00000033","",""
"","TEXT_FESXMS2020LETTER_00698_LETTER_000_131<tab>(-Letter from a Distant World-)As for us, we too are making preparations for a festival of our own─one to celebrate the return of the night and the rebuilding of our realm. I've tasked Gaia with procuring supplies─she turned up her nose at performing any manual labor─and she seems to be rather enjoying herself zipping about hither and yon on her skyslipper.","TEXT_FESXMS2020LETTER_00698_LETTER_000_131<tab>(-異世界の巫女からの手紙-)私たちも、復興を記念したお祭の準備を進めています。<br>ガイアは力仕事が苦手なので、資材の仕入れ交渉の担当を。<br>ホバー船でいろんな地域を訪れるのが楽しいみたい。","","True","0x00000034","",""
"","TEXT_FESXMS2020LETTER_00698_LETTER_000_132<tab>(-Letter from a Distant World-)There is much still to be done, but if we can put smiles on the faces of the little ones here as you have done in your world, it will have more than been worth it. Till we meet again, <var 2C ((<var 29 EB02 /var>)) (( )) 02 /var>.","TEXT_FESXMS2020LETTER_00698_LETTER_000_132<tab>(-異世界の巫女からの手紙-)私たちの力で、いつまでも輝く笑顔をもたらせたら……。<br>夜空の星を見て、みなさんとの旅を思い出しながら、<br>これからも、ふたりで頑張っていきます！","","True","0x00000035","",""
"","TEXT_FESXMS2020LETTER_00698_LETTER_000_140<tab>(-Letter from Menphina's Arms-)The Starlight Celebration! Why, is there any better time of year? Not for the children here at the Arms, that's for certain! Why, even now they toss and turn in their beds, in hope that the saint will show up at any moment!","TEXT_FESXMS2020LETTER_00698_LETTER_000_140<tab>(-孤児院の運営者からの手紙-)星芒祭……なんて素敵な響きなんでしょう……！<br>「メネフィナの家」の子どもたちは、<br>星神の聖人様が来るのを、今か今かと、心待ちにしていますよー！","","True","0x00000036","",""
"","TEXT_FESXMS2020LETTER_00698_LETTER_000_141<tab>(-Letter from Menphina's Arms-)Adkiragh whipped up a batch of ore fruitcakes to celebrate the season, and guess what he did for Zhloe? He put in pineapple as a special treat! Why, it was so scrumptious that the kids and I gobbled it all up straightaway!","TEXT_FESXMS2020LETTER_00698_LETTER_000_141<tab>(-孤児院の運営者からの手紙-)星芒祭の準備中は、シュトレンというパンを食べるそうですね。<br>日持ちがするから、毎日少しずつスライスして食べるのだとか。","","True","0x00000037","",""
"","TEXT_FESXMS2020LETTER_00698_LETTER_000_142<tab>(-Letter from Menphina's Arms-)Have you ever had fruitcake? If not, you simply must try it! Rowena tells me she's selling it for─and I quote─the “almost <var 1A 02 /var>insultingly<var 1A 01 /var> low” price of only 300 scrips. Feel free to buy a whole batch─it keeps better than pineapple pudding, so you can carry it around for weeks before it goes stale. Speaking of which, I probably should clean out the kitchen...","TEXT_FESXMS2020LETTER_00698_LETTER_000_142<tab>(-孤児院の運営者からの手紙-)ロウェナ商会が、スクリップ300枚と交換してくれるそうなので、<br>非常食として、いーっぱい貯蔵しておきたいと思います。<br>素敵なごはんが食べられる、星芒祭に感謝です！","","True","0x00000038","",""
