"location","source","target","id","fuzzy","context","translator_comments","developer_comments"
"","TEXT_CMNGSCCHOCOBORACEGETFOAL_00236_TALK_ACTOR<tab>Collecting a fledgling, are we? I'll need to see the proof of covering...","TEXT_CMNGSCCHOCOBORACEGETFOAL_00236_TALK_ACTOR<tab>Du bist hier, um deinen Jung-Chocobo abzuholen? Warte, ich schau mal nach<var 1D /var>...","","False","0x00000000","",""
"","TEXT_CMNGSCCHOCOBORACEGETFOAL_00236_001_01<tab>Well, well! I see someone is ready to run! Here's your fledgling's registration form─the rest I leave to you.","TEXT_CMNGSCCHOCOBORACEGETFOAL_00236_001_01<tab>Sieh doch nur! Was für ein lebendiger kleiner Racker! Wenn du ihn bei der Rennleiterin registrierst, steht seinem Debüt als Rennvogel nichts mehr im Wege. Viel Erfolg!","","False","0x00000001","",""
"","TEXT_CMNGSCCHOCOBORACEGETFOAL_00236_ERROR_001_01<tab>What's that? No proof of covering? <sigh> What did I just say?","TEXT_CMNGSCCHOCOBORACEGETFOAL_00236_ERROR_001_01<tab>Aber ... du hast ja gar <var 32 ((Item)) 05F22558020502 /var>! Bist du sicher, dass du eine Paarung in Auftrag gegeben hast? Oder hast du den Nachweis über die Paarung gar verlegt? Ohne darf ich dir leider keinen Renn-Chocobo aushändigen, da kennt die Rennleitung keine Ausnahmen.","","False","0x00000002","",""
"","TEXT_CMNGSCCHOCOBORACEGETFOAL_00236_ERROR_001_02<tab>To collect your newborn fledgling, you must present the proof of covering to Katering.","TEXT_CMNGSCCHOCOBORACEGETFOAL_00236_ERROR_001_02<tab>Um einen Jung-Chocobo zu erhalten, benötigst du <var 32 ((Item)) 02F22558020502 /var>. Der Ausweis bestätigt, dass du eine Paarung in Auftrag gegeben hast.","","False","0x00000003","",""
"","TEXT_CMNGSCCHOCOBORACEGETFOAL_00236_ERROR_002_01<tab>Someone's awfully eager─too eager, that is. These things take time, in case you've forgotten.","TEXT_CMNGSCCHOCOBORACEGETFOAL_00236_ERROR_002_01<tab>Du wirst dich noch ein bisschen gedulden müssen ... Chocobos fallen ja schließlich nicht einfach so vom Baum. Komm doch später noch einmal vorbei, wenn deiner flügge geworden ist.","","False","0x00000004","",""
"","TEXT_CMNGSCCHOCOBORACEGETFOAL_00236_ERROR_002_02<tab>You cannot collect your fledgling prior to the date specified on your proof of covering.","TEXT_CMNGSCCHOCOBORACEGETFOAL_00236_ERROR_002_02<tab>Bitte warte bis zum Zeitpunkt, der auf <var 32 ((Item)) 03F22558020402 /var> angegeben ist, und starte die Konversation erneut.","","False","0x00000005","",""
