"location","source","target","id","fuzzy","context","translator_comments","developer_comments"
"","TEXT_VOICEMAN_06000_002130_YSHTOLA<tab>Those who are─the researchers involved in this secretive work─are not permitted to walk freely in the city, and are instead required to live in isolated quarters.","TEXT_VOICEMAN_06000_002130_YSHTOLA<tab>Pour s'assurer que le secret soit gardé au mieux, les rares élus qui y ont accès sont même logés dans des éta<var 16 /var>blis<var 16 /var>se<var 16 /var>ments spéciaux servant à limiter leurs contacts avec le reste de la population.","","True","0x000000DF","",""
"","TEXT_VOICEMAN_06000_002140_ALPHINAUD<tab>What could a facility subject to such strict security protocols possibly need with a hornbill? An...an experiment?","TEXT_VOICEMAN_06000_002140_ALPHINAUD<tab>En résumé, vous êtes en train de nous dire que ces gens ont besoin d'animaux pour leurs recherches top secrètes<var 1D /var>? Je me demande bien pourquoi...","","True","0x000000E0","",""
"","TEXT_VOICEMAN_06000_002150_ERENVILLE<tab>Possibly. I wasn't afforded an explanation.","TEXT_VOICEMAN_06000_002150_ERENVILLE<tab>Qui sait ce que le Conseil a en tête<var 1D /var>? Moi, on ne m'a rien dit.","","True","0x000000E1","",""
"","TEXT_VOICEMAN_06000_002160_ERENVILLE<tab>But judging by the requisition list given to me and my colleagues, I doubt it's for any kind of advanced research.","TEXT_VOICEMAN_06000_002160_ERENVILLE<tab>Mais si vous voulez mon avis, ce n'est pas avec ce qu'il y a sur ma liste que nos savants vont faire de la recherche de pointe.","","True","0x000000E2","",""
"","TEXT_VOICEMAN_06000_002170_ERENVILLE<tab>I'd be more inclined to believe we were making preparations to migrate to the south. Meracydia or thereabouts.","TEXT_VOICEMAN_06000_002170_ERENVILLE<tab>J'ai plutôt l'impression qu'on est en train de préparer ces spécimens à faire un long voyage vers le continent austral, mais je peux me tromper.","","True","0x000000E3","",""
"","TEXT_VOICEMAN_06000_002180_ALISAIE<tab>What? Why would you say that?","TEXT_VOICEMAN_06000_002180_ALISAIE<tab>J'ai du mal à suivre...","","True","0x000000E4","",""
"","TEXT_VOICEMAN_06000_002190_ERENVILLE<tab>Much of the flora and fauna we were asked to procure could serve as reliable sources of sustenance.","TEXT_VOICEMAN_06000_002190_ERENVILLE<tab>Il se trouve que les animaux et végétaux qui figurent sur cette liste sont idéaux pour servir de réserve de nourriture sur une période relativement longue.","","True","0x000000E5","",""
"","TEXT_VOICEMAN_06000_002200_ERENVILLE<tab>They're comparatively hardy species, too. Able to endure harsh climates. And among them are specimens known to be effective in improving soil quality and purifying water.","TEXT_VOICEMAN_06000_002200_ERENVILLE<tab>Quant aux graines, il s'agit uniquement de celles faites pour supporter des changements climatiques soudains et résister à des conditions météorologiques difficiles, tout en fertilisant les sols et en améliorant la qualité de l'eau des nappes phréatiques.","","True","0x000000E6","",""
"","TEXT_VOICEMAN_06000_002210_ALISAIE<tab>When you put it that way, migration does sound like a reasonable assumption.","TEXT_VOICEMAN_06000_002210_ALISAIE<tab>Dit comme ça, ça a toutes les apparences d'un nouvel exode...","","True","0x000000E7","",""
"","TEXT_VOICEMAN_06000_002220_ERENVILLE<tab>That's all it is, though─an assumption. Through our tasks, we gleaners glimpse only bits and pieces of the Forum's plans.","TEXT_VOICEMAN_06000_002220_ERENVILLE<tab>Veuillez ne pas prendre mes conjectures pour argent comptant. Je ne fais qu'émettre une hypothèse bien naturelle pour un glaneur, et je me garderai bien de prétendre connaître la vérité.","","True","0x000000E8","",""
"","TEXT_VOICEMAN_06000_002230_ERENVILLE<tab>Our prime concern is that our requisitions, be they living or otherwise, are properly preserved for the knowledge of future generations.","TEXT_VOICEMAN_06000_002230_ERENVILLE<tab>Après tout, notre travail n'est-il pas simplement de préserver les êtres vivants comme les choses inanimées pour les transformer en branches de l'arbre à con<var 16 /var>nais<var 16 /var>san<var 16 /var>ces<var 1D /var>?","","True","0x000000E9","",""
"","TEXT_VOICEMAN_06000_002240_ERENVILLE<tab>Now, I really must be going. I regret that I cannot reward you as you deserve.","TEXT_VOICEMAN_06000_002240_ERENVILLE<tab>Excusez-moi, il faut que j'y aille. Désolé de ne pouvoir vous remercier comme vous le méritez, mais le cœur y est<var 1D /var>!","","True","0x000000EA","",""
"","TEXT_VOICEMAN_06000_002250_YSHTOLA<tab>Perhaps you might reward us after a fashion, then? It is imperative that we reach the lower levels.","TEXT_VOICEMAN_06000_002250_YSHTOLA<tab>Dites, juste au cas où... si vous étiez à notre place et que vous cherchiez un moyen de descendre, comment vous y prendriez-vous<var 1D /var>?","","True","0x000000EB","",""
"","TEXT_VOICEMAN_06000_002260_YSHTOLA<tab>And seeing as you are already set to descend with your assigned cargo, mayhap we could accompany you as your...assistants?","TEXT_VOICEMAN_06000_002260_YSHTOLA<tab>Pensez-vous qu'il serait raisonnable de demander à un glaneur de nous indiquer le chemin à suivre lors de sa prochaine livraison, par exemple<var 1D /var>?","","True","0x000000EC","",""
"","TEXT_VOICEMAN_06000_002270_ERENVILLE<tab>I am afraid that won't be possible. Once the animals have been prepared for transport, we send them down separately via the lift.","TEXT_VOICEMAN_06000_002270_ERENVILLE<tab>Je vois où vous voulez en venir, mais ça me paraît difficile. Je ne fais qu'envoyer les spécimens via un ascenseur, et je n'ai aucune idée du chemin qu'il prend pour parvenir à sa destination.","","True","0x000000ED","",""
"","TEXT_VOICEMAN_06000_002280_ERENVILLE<tab>I will, of course, follow after to make my report, but I can hardly pass you off as porters when there is nothing left to carry.","TEXT_VOICEMAN_06000_002280_ERENVILLE<tab>Et certes, je passe rapidement en bas faire mon rapport, mais je doute que vous vouliez vous glisser dans une de mes caisses et servir de cobayes.","","True","0x000000EE","",""
"","TEXT_VOICEMAN_06000_002290_YSHTOLA<tab>...Indeed. Pray forget I said anything.","TEXT_VOICEMAN_06000_002290_YSHTOLA<tab>Je crois que nous avons d'autres projets en effet, mais merci quand même pour votre offre.","","True","0x000000EF","",""
"","TEXT_VOICEMAN_06000_002300_ERENVILLE<tab>How do you feel about climbing? If you've strength and the courage to brave it, then there is another way down.","TEXT_VOICEMAN_06000_002300_ERENVILLE<tab>En y réfléchissant bien, il se pourrait que je connaisse un autre moyen de descendre... Enfin, ça relève plus du parcours d'athlète.","","True","0x000000F0","",""
"","TEXT_VOICEMAN_06000_002310_ERENVILLE<tab>This path leads to the thirty-third facet─a mineshaft excavated during one of our expansions of Labyrinthos.","TEXT_VOICEMAN_06000_002310_ERENVILLE<tab>Vous voyez le sentier, là-bas<var 1D /var>? Il mène à La trente-troisième Facette. C'est une zone très riche en pierres et métaux précieux qui a été découverte lors de l'agrandissement du Labyrinthos.","","True","0x000000F1","",""
"","TEXT_VOICEMAN_06000_002320_ERENVILLE<tab>While I cannot guarantee that the passage is safe to traverse, it should provide access to the Medial Circuit below.","TEXT_VOICEMAN_06000_002320_ERENVILLE<tab>La route y est assez dangereuse, mais vous m'avez l'air suf<var 16 /var>fi<var 16 /var>sam<var 16 /var>ment en forme pour tenter l'aventure. Une fois arrivés au bout, vous vous trouverez dans le Circuit médian.","","True","0x000000F2","",""
"","TEXT_VOICEMAN_06000_002330_KRILE<tab>I never even knew such a place existed! Thank you, this is the perfect solution.","TEXT_VOICEMAN_06000_002330_KRILE<tab>Vraiment<var 1D /var>!? Même moi, c'est la première fois que j'entends parler d'un tel passage secret<var 1D /var>! Merci beaucoup, Erenville<var 1D /var>!","","True","0x000000F3","",""
"","TEXT_VOICEMAN_06000_002340_ERENVILLE<tab>You're quite welcome, but consider yourselves warned. If the going proves too treacherous, you'd do well to turn back. I bid you good day.","TEXT_VOICEMAN_06000_002340_ERENVILLE<tab>Pas de souci, je vous dois bien ça<var 1D /var>! Mais je préfère vous prévenir une nouvelle fois<var 1D /var>: si vous décidez d'y aller, c'est à vos risques et périls. Sur ce, à la prochaine<var 1D /var>!","","True","0x000000F4","",""
"","TEXT_VOICEMAN_06000_002350_ALISAIE<tab>Well, turning back is hardly an option, not when we've come this far. Let's go and take a look at this mineshaft.","TEXT_VOICEMAN_06000_002350_ALISAIE<tab>Personne n'aurait l'idée saugrenue de jouer les mauviettes, n'est-ce pas<var 1D /var>? Puisqu'il n'y a pas d'objection, en route, et que ça saute<var 1D /var>!","","True","0x000000F5","",""
"","TEXT_VOICEMAN_06000_002360_BOTANISTMAN<tab>(-???-)Hard to look away, isn't it?","TEXT_VOICEMAN_06000_002360_BOTANISTMAN<tab>(-???-)Ces fleurs ont attiré votre attention, je me trompe<var 1D /var>?","","True","0x000000F6","",""
"","TEXT_VOICEMAN_06000_002370_BOTANISTMAN<tab>But they're more than pretty flowers. “Heartblooms” are attuned to ambient emotion.","TEXT_VOICEMAN_06000_002370_BOTANISTMAN<tab>Il faut avouer que cette variété est magnifique. Par ici, on la surnomme “le miroir des cœurs”.","","True","0x000000F7","",""
"","TEXT_VOICEMAN_06000_002380_BOTANISTMAN<tab>No subtitles. Report if displayed.","TEXT_VOICEMAN_06000_002380_BOTANISTMAN<tab>(soupire)","","True","0x000000F8","",""
"","TEXT_VOICEMAN_06000_002390_BOTANISTMAN<tab>You don't seem convinced. But believe me, it's true.","TEXT_VOICEMAN_06000_002390_BOTANISTMAN<tab>Heh, ça vous paraît cer<var 16 /var>tai<var 16 /var>ne<var 16 /var>ment incroyable, mais pourtant, c'est vrai.","","True","0x000000F9","",""
"","TEXT_VOICEMAN_06000_002400_BOTANISTMAN<tab>This ashen grey, for instance. It mirrors the anxiety and urgency of those working nearby as they rush to fulfill sudden orders.","TEXT_VOICEMAN_06000_002400_BOTANISTMAN<tab>Comme vous pouvez le constater, celles-ci sont un peu grises... J'imagine que ça reflète l'anxiété et l'incompréhension des botanistes comme moi qui travaillent ici. Il se trouve qu'on nous a récemment donné de nouveaux ordres sans raison claire...","","True","0x000000FA","",""
"","TEXT_VOICEMAN_06000_002410_BOTANISTMAN<tab>Intense feelings like those spur the petals to change color. Bright, glowing hues in the presence of joy. Dark, subdued shades for frustration or despair.","TEXT_VOICEMAN_06000_002410_BOTANISTMAN<tab>Elles prennent toujours un aspect maussade lorsqu'elles ressentent de l'irritation ou de la déprime en nous. À l'inverse, si tout le monde était de bonne humeur, elles seraient cer<var 16 /var>tai<var 16 /var>ne<var 16 /var>ment d'une couleur plus claire et lumineuse.","","True","0x000000FB","",""
"","TEXT_VOICEMAN_06000_002420_BOTANISTMAN<tab>Yet even with the collected wisdom of Sharlayan at our disposal, we've yet to identify the underlying principle of this empathic effect.","TEXT_VOICEMAN_06000_002420_BOTANISTMAN<tab>Vous vous demandez peut-être ce qui cause ce phénomène. Eh bien, même les plus grands savants sharlayanais l'ignorent...","","True","0x000000FC","",""
"","TEXT_VOICEMAN_06000_002430_BOTANISTMAN<tab>And there are other mysteries besides. Although the flower is extraordinarily long-lived, its low reproductive rate has made it difficult to find younger populations growing in the wild.","TEXT_VOICEMAN_06000_002430_BOTANISTMAN<tab>Et ce n'est pas tout, car cette fleur recèle bien d'autres mystères. Figurez-vous que malgré sa très longue espérance de vie, elle ne semble se reproduire qu'avec beaucoup de peine. Par conséquent, on n'en trouve pas souvent dans la nature.","","True","0x000000FD","",""
"","TEXT_VOICEMAN_06000_002440_BOTANISTMAN<tab>With too few sightings to map its distribution, and no closely related species to track, we've been unable to pinpoint its land of origin.","TEXT_VOICEMAN_06000_002440_BOTANISTMAN<tab>Certains botanistes ont bien tenté de tracer une carte des lieux où on pouvait la trouver, mais ils n'y sont jamais parvenus. De plus, elle ne ressemble de près à aucune autre plante connue, ce qui nous empêche de former des hypothèses sur son origine.","","True","0x000000FE","",""
"","TEXT_VOICEMAN_06000_002450_BOTANISTMAN<tab>To further complicate matters, every culture even dimly aware of its existence has given it a different name and mythos. Our attempts to study it via the historical record have been an exercise in frustration.","TEXT_VOICEMAN_06000_002450_BOTANISTMAN<tab>Pour être franc avec vous, si nous l'appelons “le miroir des cœurs”, c'est avant tout parce que nous ne connaissons pas son vrai nom. Nous avons beau chercher, aucun d'entre nous n'a encore découvert de mention de cette fleur dans nos archives.","","True","0x000000FF","",""
"","TEXT_VOICEMAN_06000_002460_BOTANISTMAN<tab>As an avid botanist myself, I should one day like to unravel the heartbloom's secrets...but I'm afraid other duties must take precedence. I will leave you to your thoughts.","TEXT_VOICEMAN_06000_002460_BOTANISTMAN<tab>C'est le rêve de tout botaniste sharlayanais qui se respecte de révéler les secrets de cette merveille de la nature au grand jour. Mais avant de songer à le réaliser, je dois d'abord acheminer cette caisse jusqu'à sa destination. Sur ce, bon vent à vous...","","True","0x00000100","",""
"","TEXT_VOICEMAN_06000_002470_YSHTOLA<tab>Have you learned aught of interest?","TEXT_VOICEMAN_06000_002470_YSHTOLA<tab>Vue de loin, votre con<var 16 /var>ver<var 16 /var>sa<var 16 /var>tion avait l'air pas<var 16 /var>sion<var 16 /var>nan<var 16 /var>te. Vous parliez de quoi<var 1D /var>?","","True","0x00000101","",""
"","TEXT_VOICEMAN_06000_002480_YSHTOLA<tab>A flower that reacts to one's feelings? Strange... I must say, I have never heard of such a thing.","TEXT_VOICEMAN_06000_002480_YSHTOLA<tab>Une fleur qui lit dans le cœur des gens<var 1D /var>? C'est bien la première fois que j'entends parler d'un tel prodige... Quelque part, ça ne m'étonne pas de découvrir son existence à Sharlayan.","","True","0x00000102","",""
"","TEXT_VOICEMAN_06000_002490_ALISAIE<tab>This is all very fascinating, but as it stands, we've failed to gain any significant insight into the Forum's undertaking.","TEXT_VOICEMAN_06000_002490_ALISAIE<tab>C'est bien joli tout ça, surtout quand il s'agit de fleurs, mais ça ne nous avance pas beaucoup à propos des objectifs secrets du Conseil...","","True","0x00000103","",""
"","TEXT_VOICEMAN_06000_002500_ALPHINAUD<tab>Indeed... While there is certainly enough activity to support Erenville's supposition that a priority has been placed on improving food production...","TEXT_VOICEMAN_06000_002500_ALPHINAUD<tab>Ce n'est pas comme si nous n'avions rien appris. N'oublions pas que l'hypothèse d'Erenville s'est révélée juste<var 1D /var>: il y a bien un effort général d'augmentation de la production de nourriture.","","True","0x00000104","",""
"","TEXT_VOICEMAN_06000_002510_ALPHINAUD<tab>Unfortunately for our investigation, these workers were never informed as to how their duties serve the master plan.","TEXT_VOICEMAN_06000_002510_ALPHINAUD<tab>Mais ef<var 16 /var>fec<var 16 /var>ti<var 16 /var>ve<var 16 /var>ment, nous ne savons toujours pas dans quel but...","","True","0x00000105","",""
"","TEXT_VOICEMAN_06000_002520_ALISAIE<tab>Ugh. If only we could interrogate the Forum members directly.","TEXT_VOICEMAN_06000_002520_ALISAIE<tab>Haah... Si seulement on pouvait juste attacher un membre du Conseil à une chaise et lui tirer les vers du nez avec une pincette<var 1D /var>!","","True","0x00000106","",""
"","TEXT_VOICEMAN_06000_002530_ALISAIE<tab>Isn't that the entrance to the Archeion?","TEXT_VOICEMAN_06000_002530_ALISAIE<tab>Eh, c'est bien les portes de l'Archéion, là-bas<var 1D /var>!?","","True","0x00000107","",""
"","TEXT_VOICEMAN_06000_002540_ALISAIE<tab>Look, there... I think that's Erenville.","TEXT_VOICEMAN_06000_002540_ALISAIE<tab>Tiens tiens... Ce serait pas Erenville<var 1D /var>?","","True","0x00000108","",""
"","TEXT_VOICEMAN_06000_002550_ALPHINAUD<tab>A little difficult to tell from here, but...but I think you're right. He did say he was coming down to make his report.","TEXT_VOICEMAN_06000_002550_ALPHINAUD<tab>C'est bien lui, on dirait... Après tout, il avait dit qu'il descendrait pour faire son rapport.","","True","0x00000109","",""
"","TEXT_VOICEMAN_06000_002560_YSHTOLA<tab>Erenville receives his orders from the Forum. Would it not follow, then, that the superior to whom he reports is a Forum member─or at least a close associate?","TEXT_VOICEMAN_06000_002560_YSHTOLA<tab>Si ses employeurs sont des membres du Conseil, est-ce qu'il n'aurait pas rendez-vous avec l'un d'entre eux, par hasard<var 1D /var>?","","True","0x0000010A","",""
"","TEXT_VOICEMAN_06000_002570_ALPHINAUD<tab>You mean to eavesdrop on their conversation!? What of the risks?","TEXT_VOICEMAN_06000_002570_ALPHINAUD<tab>Y'shtola<var 1D /var>! Ne me dis pas que tu as l'intention d'espionner leur con<var 16 /var>ver<var 16 /var>sa<var 16 /var>tion<var 1D /var>!","","True","0x0000010B","",""
"","TEXT_VOICEMAN_06000_002580_YSHTOLA<tab>Ours alone to bear. We won't interfere with Erenville's work, nor will he be implicated as an accomplice.","TEXT_VOICEMAN_06000_002580_YSHTOLA<tab>Je vais simplement faire une petite promenade, rien de bien méchant<var 1D /var>! Je ne gênerai personne, et j'irais même jusqu'à dire que je serai la plus discrète possible...","","True","0x0000010C","",""
"","TEXT_VOICEMAN_06000_002590_YSHTOLA<tab>If you're not comfortable taking part, I can do this alone.","TEXT_VOICEMAN_06000_002590_YSHTOLA<tab>Qui m'aime me suive, mais si vous préférez rester en retrait, je ne vous en voudrai pas.","","True","0x0000010D","",""
"","TEXT_VOICEMAN_06000_002600_ALPHINAUD<tab>Nay. I said myself that I wished to know Father's intentions. And no answers will be forthcoming should we simply ask nicely.","TEXT_VOICEMAN_06000_002600_ALPHINAUD<tab>Très bien, je viens avec toi. J'ai dit que je voulais découvrir ce que mijotait mon père, alors je ne vais cer<var 16 /var>tai<var 16 /var>ne<var 16 /var>ment pas me défiler aussi tôt. De toute manière, ce n'est pas maintenant que je risque d'obtenir quelque information que ce soit de sa bouche.","","True","0x0000010E","",""
"","TEXT_VOICEMAN_06000_002610_ALISAIE<tab>We can apologize later should it come to it. Right now, we need every crumb of information we can get our hands on. Consequences be damned.","TEXT_VOICEMAN_06000_002610_ALISAIE<tab>Si les choses tournent mal pour nous et qu'il l'apprend, on n'aura qu'à aller lui présenter nos excuses. Pour le moment, il faut absolument qu'on se renseigne du mieux qu'on peut.","","True","0x0000010F","",""
"","TEXT_VOICEMAN_06000_002620_YSHTOLA<tab>It might be best if you came along as well. In fact, we should all...","TEXT_VOICEMAN_06000_002620_YSHTOLA<tab>Ce serait bien que tu nous accompagnes, et Krile aussi, d'ailleurs.","","True","0x00000110","",""
"","TEXT_VOICEMAN_06000_002630_YSHTOLA<tab>Krile?","TEXT_VOICEMAN_06000_002630_YSHTOLA<tab>... Krile<var 1D /var>?","","True","0x00000111","",""
"","TEXT_VOICEMAN_06000_002640_KRILE<tab>No subtitles. Report if displayed.","TEXT_VOICEMAN_06000_002640_KRILE<tab>(petit cri de stupeur)","","True","0x00000112","",""
"","TEXT_VOICEMAN_06000_002650_KRILE<tab>Oh! Yes! That certainly sounds like a plan!","TEXT_VOICEMAN_06000_002650_KRILE<tab>Hein<var 1D /var>!? Euh, oui, oui bien sûr<var 1D /var>! Je suis tout à fait d'accord<var 1D /var>!","","True","0x00000113","",""
"","TEXT_VOICEMAN_06000_002660_YSHTOLA<tab>I'm glad you agree...","TEXT_VOICEMAN_06000_002660_YSHTOLA<tab>Dans ce cas, tout va bien... je suppose...","","True","0x00000114","",""
"","TEXT_VOICEMAN_06000_002670_ALISAIE<tab>Quickly, Erenville is on the move. We need to get closer before we lose him!","TEXT_VOICEMAN_06000_002670_ALISAIE<tab>Erenville a l'air de s'activer. Venez, faut qu'on se rapproche<var 1D /var>!","","True","0x00000115","",""
"","TEXT_VOICEMAN_06000_002680_KRILE<tab>Almost. I can almost reach you...","TEXT_VOICEMAN_06000_002680_KRILE<tab>Encore un tout petit peu... et je pourrai te cueillir...","","True","0x00000116","",""
"","TEXT_VOICEMAN_06000_002700_REQUESTEDLEGISLATOR<tab>I trust you will find your compensation to be more than satisfactory. We wish to make clear that we are pleased with the efficiency and thoroughness of your work.","TEXT_VOICEMAN_06000_002700_REQUESTEDLEGISLATOR<tab>... Et voilà votre dû. Cette transaction est terminée, mais sachez que nous sommes très satisfaits de vos services et que nous ne rechignerions pas à les utiliser de nouveau.","","True","0x00000117","",""
"","TEXT_VOICEMAN_06000_002710_REQUESTEDLEGISLATOR<tab>So much so that we have come bearing new tasks in need of your competent hand.","TEXT_VOICEMAN_06000_002710_REQUESTEDLEGISLATOR<tab>Vous avez fait de l'excellent travail jusqu'à présent. Que diriez-vous de continuer sur cette lancée en prenant en charge dès maintenant notre requête suivante<var 1D /var>?","","True","0x00000118","",""
"","TEXT_VOICEMAN_06000_002720_ERENVILLE<tab>Another lengthy list.","TEXT_VOICEMAN_06000_002720_ERENVILLE<tab>J'ai l'impression que cette liste est encore plus longue que la précédente...","","True","0x00000119","",""
"","TEXT_VOICEMAN_06000_002730_ERENVILLE<tab>If I may speak frankly. The gleaners have been pushed to the point of collapse by your unending demands.","TEXT_VOICEMAN_06000_002730_ERENVILLE<tab>Dites, ce serait quand même pas mal de nous donner la raison concrète de tout ce remue-ménage, vous ne croyez pas<var 1D /var>? Nous autres glaneurs sommes com<var 16 /var>plè<var 16 /var>te<var 16 /var>ment débordés depuis quelque temps, et la fatigue se lit sur les visages.","","True","0x0000011A","",""
"","TEXT_VOICEMAN_06000_002740_ERENVILLE<tab>We are not familiars to be exploited. We are Sharlayan scholars, and we deserve an explanation for this unseemly treatment. What warrants such urgency?","TEXT_VOICEMAN_06000_002740_ERENVILLE<tab>Nous ne sommes pas vos familiers ou des machines, que je sache, mais des Sharlayanais tout aussi épris de savoir que vous. Avant d'accepter votre offre, j'aimerais bien savoir pourquoi vous nous surchargez de travail à ce point.","","True","0x0000011B","",""
"","TEXT_VOICEMAN_06000_002750_REQUESTEDLEGISLATOR<tab>...In an age long past, Sharlayan was charged with a momentous duty.","TEXT_VOICEMAN_06000_002750_REQUESTEDLEGISLATOR<tab>... Sharlayan a une mission de la plus haute importance à remplir. Elle nous a été confiée il y a d'innombrables lunes, et nous avons fait le serment de nous en acquitter.","","True","0x0000011C","",""
"","TEXT_VOICEMAN_06000_002760_REQUESTEDLEGISLATOR<tab>And now that word of the Final Days hangs heavy in the air, the time has come for us to fulfill that charge.","TEXT_VOICEMAN_06000_002760_REQUESTEDLEGISLATOR<tab>Maintenant que la menace de l'apocalypse plane à nouveau au-dessus de nos têtes, le moment est venu d'accomplir notre destin.","","True","0x0000011D","",""
"","TEXT_VOICEMAN_06000_002770_REQUESTEDLEGISLATOR<tab>I can say no more, but I promise you this: all will be revealed in due course. And when it has, you will understand that your toil was in service to the greatest good.","TEXT_VOICEMAN_06000_002770_REQUESTEDLEGISLATOR<tab>C'est tout ce que je peux vous dire pour l'instant, mais n'ayez crainte<var 1D /var>: tout s'éclaircira en temps et en heure, et vous, les glaneurs, pouvez être certains que vous œuvrez pour le bien de l'humanité.","","True","0x0000011E","",""
"","TEXT_VOICEMAN_06000_002780_ERENVILLE<tab>Then I will do your bidding. For now.","TEXT_VOICEMAN_06000_002780_ERENVILLE<tab>Très bien, je ferai ce que vous me demandez... mais n'allez pas croire que vous m'avez entièrement convaincu.","","True","0x0000011F","",""
"","TEXT_VOICEMAN_06000_002790_ERENVILLE<tab>But unless you wish the gleaners to rise up in protest, I advise you to offer tangible improvements for our working conditions. Your promised revelation does nothing to address present circumstances.","TEXT_VOICEMAN_06000_002790_ERENVILLE<tab>Si vous ne dévoilez pas tous vos petits secrets très bientôt, de moins en moins de glaneurs accepteront de jouer les coursiers pour vous. Faites-moi confiance, je sais de quoi je parle.","","True","0x00000120","",""
"","TEXT_VOICEMAN_06000_002800_REQUESTEDLEGISLATOR<tab>A fair point. Your concerns will be conveyed to the Forum.","TEXT_VOICEMAN_06000_002800_REQUESTEDLEGISLATOR<tab>Message reçu. Le Conseil compte sur vous, Erenville.","","True","0x00000121","",""
"","TEXT_VOICEMAN_06000_002810_ERENVILLE<tab>I hope that was informative. You may consider my debt to you repaid in full.","TEXT_VOICEMAN_06000_002810_ERENVILLE<tab>Regardez qui voilà... En tout cas, nous voilà quittes maintenant.","","True","0x00000122","",""
"","TEXT_VOICEMAN_06000_002820_ERENVILLE<tab>While I do have my reservations about the Forum, I want to believe that they have our best interests at heart.","TEXT_VOICEMAN_06000_002820_ERENVILLE<tab>Je ne suis peut-être pas toujours d'accord avec la manière d'agir du Conseil, mais quand ils nous disent qu'ils veulent préserver la vie sous toutes ses formes, je les crois sur parole.","","True","0x00000123","",""
