"location","source","target","id","fuzzy","context","translator_comments","developer_comments"
"","TEXT_VOICEMAN_06000_004140_ALPHINAUD<tab>Thank you for the splendid clothes, Mother. Stylish, comfortable, and eminently practical!","TEXT_VOICEMAN_06000_004140_ALPHINAUD<tab>Merci beaucoup, Maman. C'est confortable et pratique à la fois. En un mot, la tenue idéale<var 1D /var>!","","True","0x000001AB","",""
"","TEXT_VOICEMAN_06000_004150_AMELIANCE<tab>I am so glad you like them. They are, however, missing one final touch.","TEXT_VOICEMAN_06000_004150_AMELIANCE<tab>Je suis contente que ça te plaise, mon fils. Mais figure-toi que tu n'es pas au bout de tes surprises...","","True","0x000001AC","",""
"","TEXT_VOICEMAN_06000_004160_EMPLOYEEWOMAN<tab>If you would allow me, Master Alphinaud...","TEXT_VOICEMAN_06000_004160_EMPLOYEEWOMAN<tab>Messire Alphinaud, si vous le permettez...","","True","0x000001AD","",""
"","TEXT_VOICEMAN_06000_004170_ALPHINAUD<tab>Wait, are these...!?","TEXT_VOICEMAN_06000_004170_ALPHINAUD<tab>Maman... C'est bien ce que je crois<var 1D /var>?","","True","0x000001AE","",""
"","TEXT_VOICEMAN_06000_004180_AMELIANCE<tab>...A sage's tools of the trade. They belonged to your father.","TEXT_VOICEMAN_06000_004180_AMELIANCE<tab>Eh oui, des noulithes, l'arme de prédilection des sages de Sharlayan. Ils appartenaient autrefois à ton père, mais ça fait bien longtemps qu'ils n'ont pas servi.","","True","0x000001AF","",""
"","TEXT_VOICEMAN_06000_004190_AMELIANCE<tab>Though he may as well be chained to his desk these days, as a student, he was often called upon to venture into the field.","TEXT_VOICEMAN_06000_004190_AMELIANCE<tab>Peu de gens pourraient le deviner à première vue, mais Fourchenault n'a pas toujours passé ses journées derrière un bureau. Quand nous étions tous les deux étudiants, il lui arrivait souvent de partir en mission sur le terrain.","","True","0x000001B0","",""
"","TEXT_VOICEMAN_06000_004200_AMELIANCE<tab>He wielded those armaments, both to heal and to harm, in no few battles. None so fierce as those you two have braved, perhaps, but battles nonetheless.","TEXT_VOICEMAN_06000_004200_AMELIANCE<tab>Il ne s'agissait pas de batailles d'une envergure comparable aux vôtres, mais à l'époque, il utilisait cette tenue et cette arme de sage pour combattre, ainsi que pour soigner ses blessures tout comme celles de ses camarades.","","True","0x000001B1","",""
"","TEXT_VOICEMAN_06000_004210_AMELIANCE<tab>Thus did I pull them out of storage─to show you that he was not always the man who stands in vehement opposition to you now.","TEXT_VOICEMAN_06000_004210_AMELIANCE<tab>Je n'ignore pas vos divergences d'opinion avec votre père, mais j'aimerais vous faire comprendre qu'il n'a pas toujours été l'homme que vous connaissez aujourd'hui. Vous transmettre ces quelques objets me semble être le meilleur moyen d'y parvenir.","","True","0x000001B2","",""
"","TEXT_VOICEMAN_06000_004220_AMELIANCE<tab>And also because it would be a terrible waste of ridiculously expensive, House Leveilleur-commissioned artistry.","TEXT_VOICEMAN_06000_004220_AMELIANCE<tab>Et puis, ça reste un ensemble fabriqué sur commande pour la famille Leveilleur, ce qui n'est tout de même pas n'importe quoi<var 1D /var>!","","True","0x000001B3","",""
"","TEXT_VOICEMAN_06000_004230_AMELIANCE<tab>I am told these devices are quite difficult to master, but someone of your extensive experience should soon have them darting about with grace and aplomb.","TEXT_VOICEMAN_06000_004230_AMELIANCE<tab>J'ai entendu dire que le maniement d'une telle arme n'était pas donné à tout le monde, mais je suis certaine que le brave combattant que tu es devenu saura utiliser toutes ses capacités à bon escient.","","True","0x000001B4","",""
"","TEXT_VOICEMAN_06000_004240_AMELIANCE<tab>May the wisdom in that crystal serve you well. And please, try to find common ground with your father, that you might come and go without need for this awful subterfuge.","TEXT_VOICEMAN_06000_004240_AMELIANCE<tab>Ce cristal d'âme renferme le savoir des sages d'antan. Puisse-t-il te protéger et guider chacun de tes pas, mon chéri. J'espère que tu reviendras en vainqueur à la maison, et que tu te réconcilieras pour de bon avec ton père.","","True","0x000001B5","",""
"","TEXT_VOICEMAN_06000_004250_ALPHINAUD<tab>We will, Mother, I promise!","TEXT_VOICEMAN_06000_004250_ALPHINAUD<tab>Oui... je te le promets<var 1D /var>!","","True","0x000001B6","",""
"","TEXT_VOICEMAN_06000_004260_AMELIANCE<tab>My final gifts to you, before you run off, are an observation and a suggestion.","TEXT_VOICEMAN_06000_004260_AMELIANCE<tab>Voilà pour les cadeaux<var 1D /var>! Je crois qu'il ne me reste plus qu'à vous souhaiter bonne chance, mais pas avant de vous avoir donné quelques conseils.","","True","0x000001B7","",""
"","TEXT_VOICEMAN_06000_004270_AMELIANCE<tab>Firstly, Fourchenault has ever been a serious man, but it was only after you were born that he truly lost himself in his work.","TEXT_VOICEMAN_06000_004270_AMELIANCE<tab>D'abord, essayez d'être aussi compréhensifs que possible avec votre père. Il a toujours fait preuve de beaucoup de sérieux, mais il ne s'est consacré corps et âme à son travail de membre du Conseil qu'après votre naissance.","","True","0x000001B8","",""
"","TEXT_VOICEMAN_06000_004280_AMELIANCE<tab>I may not know the Forum's inner workings, but I know your father's. The timing of that change in him holds some significance.","TEXT_VOICEMAN_06000_004280_AMELIANCE<tab>Il n'a pas le droit d'en parler ouvertement, même à moi, sa propre femme, mais croyez-moi quand je vous dis qu'il a de bonnes raisons d'agir comme il le fait.","","True","0x000001B9","",""
"","TEXT_VOICEMAN_06000_004290_AMELIANCE<tab>Secondly, do not seek to best your father with words.","TEXT_VOICEMAN_06000_004290_AMELIANCE<tab>Et si j'emploie le mot “agir”, ce n'est pas pour rien. Fourchenault est un homme qui n'accorde que peu de crédit aux paroles, alors ne pensez pas le convaincre avec de simples mots.","","True","0x000001BA","",""
"","TEXT_VOICEMAN_06000_004300_AMELIANCE<tab>Far better that you simply show him─let him discover the merit of your actions <var 1A 02 /var>after<var 1A 01 /var> they cannot be undone!","TEXT_VOICEMAN_06000_004300_AMELIANCE<tab>Il est têtu mais juste, alors prouvez-lui par les résultats de vos actes que vous êtes dignes de son respect, et tout s'arrangera aussitôt<var 1D /var>!","","True","0x000001BB","",""
"","TEXT_VOICEMAN_06000_004305_ALPHINAUD<tab>No subtitles. Report if displayed.","TEXT_VOICEMAN_06000_004305_ALPHINAUD<tab>(petit rire)","","True","0x000001BC","",""
"","TEXT_VOICEMAN_06000_004307_ALISAIE<tab>No subtitles. Report if displayed.","TEXT_VOICEMAN_06000_004307_ALISAIE<tab>(petit rire)","","True","0x000001BD","",""
"","TEXT_VOICEMAN_06000_004310_ALISAIE<tab>Oh, Mother...","TEXT_VOICEMAN_06000_004310_ALISAIE<tab>Maman, t'es vraiment pas croyable...","","True","0x000001BE","",""
"","TEXT_VOICEMAN_06000_004320_ALPHINAUD<tab>We shall take your wisdom to heart. Thank you again for these gifts, and farewell for now!","TEXT_VOICEMAN_06000_004320_ALPHINAUD<tab>Merci de nous avoir remonté le moral, Maman. À présent, il faut qu'on y aille. On se reverra très bientôt<var 1D /var>!","","True","0x000001BF","",""
"","TEXT_VOICEMAN_06000_004330_AMELIANCE<tab>Safe travels, my children. Eat well, stay warm, and keep your friends close.","TEXT_VOICEMAN_06000_004330_AMELIANCE<tab>Faites bien attention à vous, mes petits. Et n'oubliez pas de m'écrire, d'accord<var 1D /var>?","","True","0x000001C0","",""
"","TEXT_VOICEMAN_06000_004340_KYTTE<tab>Right, we're all set!","TEXT_VOICEMAN_06000_004340_KYTTE<tab>... Et voilà<var 1D /var>! J'espère que vous êtes fin prêts, parce que moi oui<var 1D /var>!","","True","0x000001C1","",""
"","TEXT_VOICEMAN_06000_004350_KYTTE<tab>Just the four of you, was it?","TEXT_VOICEMAN_06000_004350_KYTTE<tab>Vous partez tous les quatre ensemble, c'est bien ça<var 1D /var>?","","True","0x000001C2","",""
"","TEXT_VOICEMAN_06000_004360_ESTINIEN<tab>Three. I am already attuned to the crystal in Thavnair.","TEXT_VOICEMAN_06000_004360_ESTINIEN<tab>Inutile de surcharger le courant éthéré, je peux faire bande à part. Je me suis déjà harmonisé avec l'éthérite de Thavnair.","","True","0x000001C3","",""
"","TEXT_VOICEMAN_06000_004370_KYTTE<tab>You are? Oh. I would have preferred more test subjects...","TEXT_VOICEMAN_06000_004370_KYTTE<tab>Ah bon<var 1D /var>? Dommage, ça fait un sujet de moins pour l'expérience...","","True","0x000001C4","",""
"","TEXT_VOICEMAN_06000_004380_KYTTE<tab>Oh well, never mind. If our three travelers could line up here, please?","TEXT_VOICEMAN_06000_004380_KYTTE<tab>Enfin, c'est vous qui décidez, hein<var 1D /var>? Sur ce, les trois <var 08 E905 ((messieurs-dames)) ((messieurs)) /var> restants, vous pouvez vous aligner ici, s'il vous plaît<var 1D /var>?","","True","0x000001C5","",""
"","TEXT_VOICEMAN_06000_004390_KYTTE<tab>Yes, right there is fine! Take a deep breath, and I'll soon have you soaring through the aether.","TEXT_VOICEMAN_06000_004390_KYTTE<tab>Voilà, comme ça c'est parfait<var 1D /var>! Respirez un bon coup et détendez-vous, je lance le transfert dans un instant<var 1D /var>!","","True","0x000001C6","",""
"","TEXT_VOICEMAN_06000_004400_KYTTE<tab>Oh, and one last thing!","TEXT_VOICEMAN_06000_004400_KYTTE<tab>... Zut, j'ai oublié de vous dire<var 1D /var>!","","True","0x000001C7","",""
"","TEXT_VOICEMAN_06000_004410_KYTTE<tab>You might experience a teensy-weensy touch of violent aetherial sickness. Good luck!","TEXT_VOICEMAN_06000_004410_KYTTE<tab>Cette technologie étant encore en développement, l'éther risque de vous rendre un petit peu patraques à l'arrivée<var 1D /var>! Mais ne vous inquiétez pas, ça ne sera que temporaire<var 1D /var>! Bon voyage et amusez-vous bien<var 1D /var>!","","True","0x000001C8","",""
"","TEXT_VOICEMAN_06000_004420_THANCRED<tab>Wha─?","TEXT_VOICEMAN_06000_004420_THANCRED<tab>Oh non, pas encore<var 1D /var>!","","True","0x000001C9","",""
"","TEXT_VOICEMAN_06000_004430_EMETSELCH<tab>Thavnair, home to city-state Radz<var 1F /var>at<var 1F /var>Han.","TEXT_VOICEMAN_06000_004430_EMETSELCH<tab>L'île de Thavnair, et sa glorieuse capitale Radz-at-Han...","","True","0x000001CA","",""
"","TEXT_VOICEMAN_06000_004440_EMETSELCH<tab>Rising from the southeast waters of the Bounty, this isle of plenty served as the battleground for a conflict between two peoples.","TEXT_VOICEMAN_06000_004440_EMETSELCH<tab>Trônant au sud-est de la mer de l'Abondance, cette oasis à la végétation luxuriante<br>a longtemps été le théâtre d'af<var 16 /var>fron<var 16 /var>te<var 16 /var>ments réguliers entre tribus rivales.","","True","0x000001CB","",""
"","TEXT_VOICEMAN_06000_004450_EMETSELCH<tab>Their cultures bled into one another until a unique amalgamation was distilled from the chaos, in a process not unlike their precious alchemy.","TEXT_VOICEMAN_06000_004450_EMETSELCH<tab>Les conflits provoquent immanquablement des mélanges culturels, et la population locale<br>a acquis au fil du temps des con<var 16 /var>nais<var 16 /var>san<var 16 /var>ces uniques au monde, notamment en alchimie.","","True","0x000001CC","",""
"","TEXT_VOICEMAN_06000_004460_EMETSELCH<tab>Once solidified as a single nation, an adamant stance of neutrality would hold invaders at bay. For a time.","TEXT_VOICEMAN_06000_004460_EMETSELCH<tab>La volonté farouche de Thavnair de conserver son indépendance politique en a fait le lieu de neutralité par excellence...","","True","0x000001CD","",""
"","TEXT_VOICEMAN_06000_004470_EMETSELCH<tab>Now across this vibrant isle creeps a fog of malice. What choice do you have...","TEXT_VOICEMAN_06000_004470_EMETSELCH<tab>Hélas, cela n'a pas empêché ses couleurs chatoyantes d'être récemment ternies par une ombre,<br>qui s'étend davantage chaque jour qui passe...","","True","0x000001CE","",""
"","TEXT_VOICEMAN_06000_004480_EMETSELCH<tab>...what chance...","TEXT_VOICEMAN_06000_004480_EMETSELCH<tab>Vous êtes son dernier espoir...","","True","0x000001CF","",""
"","TEXT_VOICEMAN_06000_004490_EMETSELCH<tab>...against such an insidious foe?","TEXT_VOICEMAN_06000_004490_EMETSELCH<tab>... mais serez-vous à la hauteur<var 1D /var>?","","True","0x000001D0","",""
"","TEXT_VOICEMAN_06000_004500_ESTINIEN<tab>I've seen fairer faces after a bout of bad shellfish.","TEXT_VOICEMAN_06000_004500_ESTINIEN<tab>Une technologie “en développement”, hein... Plutôt dans ses balbutiements.","","True","0x000001D1","",""
"","TEXT_VOICEMAN_06000_004510_ESTINIEN<tab>Let me bring you something to drink. That should help settle your bellies.","TEXT_VOICEMAN_06000_004510_ESTINIEN<tab>Ne bougez pas d'ici, même au cas où un miracle ferait pousser des ailes dans votre dos. Je vais vous chercher quelque chose à boire.","","True","0x000001D2","",""
"","TEXT_VOICEMAN_06000_004520_THANCRED<tab>There was a note...with Krile's instructions...","TEXT_VOICEMAN_06000_004520_THANCRED<tab>Krile... Dans ses directives... elle a été très claire... au sujet d'Estinien...","","True","0x000001D3","",""
"","TEXT_VOICEMAN_06000_004530_THANCRED<tab>Don't let Estinien roam the markets alone... He's alarmingly bad with coin...","TEXT_VOICEMAN_06000_004530_THANCRED<tab>Il a aucun sens de la valeur de l'argent... alors il vaut mieux pas le laisser... faire des courses tout seul...","","True","0x000001D4","",""
"","TEXT_VOICEMAN_06000_004540_THANCRED<tab>No subtitles. Report if displayed.","TEXT_VOICEMAN_06000_004540_THANCRED<tab>(bruit de nausée)","","True","0x000001D5","",""
"","TEXT_VOICEMAN_06000_004550_NIDHANA<tab>(-Arkasodara Alchemist-)Mmm...","TEXT_VOICEMAN_06000_004550_NIDHANA<tab>Mfff... Mfffff...","","True","0x000001D6","",""
"","TEXT_VOICEMAN_06000_004560_ESTINIEN<tab>What happened here?","TEXT_VOICEMAN_06000_004560_ESTINIEN<tab>Qu'est-ce qui a bien pu leur arriver<var 1D /var>?","","True","0x000001D7","",""
"","TEXT_VOICEMAN_06000_004570_THANCRED<tab>Their dress marks them as alchemists. I see no evidence of injury or poison.","TEXT_VOICEMAN_06000_004570_THANCRED<tab>Vu leur accoutrement, il s'agit sans doute des alchimistes que nous recherchons. En y regardant de plus près, ils n'ont pas l'air d'avoir été blessés, ni même empoisonnés...","","True","0x000001D8","",""
"","TEXT_VOICEMAN_06000_004580_URIANGER<tab>Thinkest thou they but slumber?","TEXT_VOICEMAN_06000_004580_URIANGER<tab>Vous voulez dire... qu'ils sont simplement endormis<var 1D /var>?","","True","0x000001D9","",""
"","TEXT_VOICEMAN_06000_004590_THANCRED<tab>I believe so. Whether it is by <var 1A 02 /var>choice<var 1A 01 /var> is another question entirely.","TEXT_VOICEMAN_06000_004590_THANCRED<tab>Per<var 16 /var>son<var 16 /var>nel<var 16 /var>le<var 16 /var>ment, je ne vois pas d'autre possibilité. Reste à découvrir si c'est volontaire de leur part, ou s'ils ont piqué un roupillon malgré eux...","","True","0x000001DA","",""
"","TEXT_VOICEMAN_06000_004600_VARSHAHN<tab>(-???-)Oh, we have guests.","TEXT_VOICEMAN_06000_004600_VARSHAHN<tab>(-???-)Oh, des invités...","","True","0x000001DB","",""
"","TEXT_VOICEMAN_06000_004610_VARSHAHN<tab>(-???-)You must excuse the poor welcome. Long days and longer nights have taken their toll, as you can see...","TEXT_VOICEMAN_06000_004610_VARSHAHN<tab>(-???-)Euh... Excusez-moi, si j'avais su que vous étiez attendus, je serais venu faire mon travail plus tôt...","","True","0x000001DC","",""
"","TEXT_VOICEMAN_06000_004620_VARSHAHN<tab>I am Varshahn. Servant to the satrap. My task was, in fact, to wake these good men and women. If you will allow.","TEXT_VOICEMAN_06000_004620_VARSHAHN<tab>Mon nom est Varshahn, je suis au service de Son Excellence Ahewann, satrape de Radz-at-Han. Il m'a envoyé ici réveiller ces dormeurs qui en ont bien besoin.","","True","0x000001DD","",""
"","TEXT_VOICEMAN_06000_004630_VARSHAHN<tab>People of the Great Work! I come bearing new scales!","TEXT_VOICEMAN_06000_004630_VARSHAHN<tab>Ouvrez grand vos oreilles<var 1D /var>! Je vous ai ramené de nouvelles écailles<var 1D /var>!","","True","0x000001DE","",""
"","TEXT_VOICEMAN_06000_004640_NIDHANA<tab>(-Arkasodara Alchemist-)Mmm... Scales...?","TEXT_VOICEMAN_06000_004640_NIDHANA<tab>Des... Des écailles...<var 1D /var>?","","True","0x000001DF","",""
"","TEXT_VOICEMAN_06000_004650_NIDHANA<tab>(-Arkasodara Alchemist-)We have new scales!?","TEXT_VOICEMAN_06000_004650_NIDHANA<tab>De nouvelles écailles<var 1D /var>!?","","True","0x000001E0","",""
"","TEXT_VOICEMAN_06000_004660_VARSHAHN<tab>Yes, my friends. Gather round. I have them right here.","TEXT_VOICEMAN_06000_004660_VARSHAHN<tab>Oui<var 1D /var>! Désolé d'avoir été un peu long, mais elles sont enfin là<var 1D /var>!","","True","0x000001E1","",""
"","TEXT_VOICEMAN_06000_004670_ALCHEMISTOFTHEGREATWORKA<tab>Oh, happy day! Now I can continue my experiment!","TEXT_VOICEMAN_06000_004670_ALCHEMISTOFTHEGREATWORKA<tab>Regardez<var 1D /var>! Nous allons enfin pouvoir continuer nos recherches<var 1D /var>!","","True","0x000001E2","",""
"","TEXT_VOICEMAN_06000_004680_ALCHEMISTOFTHEGREATWORKB<tab>Many thanks!","TEXT_VOICEMAN_06000_004680_ALCHEMISTOFTHEGREATWORKB<tab>Comme elles sont belles<var 1D /var>!","","True","0x000001E3","",""
"","TEXT_VOICEMAN_06000_004690_ALCHEMISTOFTHEGREATWORKC<tab>One for me!","TEXT_VOICEMAN_06000_004690_ALCHEMISTOFTHEGREATWORKC<tab>Moi aussi, j'en veux une<var 1D /var>!","","True","0x000001E4","",""
"","TEXT_VOICEMAN_06000_004700_ESTINIEN<tab>Those are dragon scales.","TEXT_VOICEMAN_06000_004700_ESTINIEN<tab>Dis-moi, Varshahn... Ce sont des écailles de dragon que tu leur ramènes, n'est-ce pas<var 1D /var>?","","True","0x000001E5","",""
"","TEXT_VOICEMAN_06000_004710_VARSHAHN<tab>Yes─such materials are vital to their most pressing research.","TEXT_VOICEMAN_06000_004710_VARSHAHN<tab>Oui<var 1D /var>! Les alchimistes du Grand Œuvre en ont constamment besoin pour leurs expériences.","","True","0x000001E6","",""
"","TEXT_VOICEMAN_06000_004720_NIDHANA<tab>(-Arkasodara Alchemist-)And we are fortunate to have them. Our experiments are so close to bearing fruit...","TEXT_VOICEMAN_06000_004720_NIDHANA<tab>Tout à fait<var 1D /var>! Grâce à ces écailles, nous allons parvenir au but que nous nous sommes fixé, moi et tous mes collègues...","","True","0x000001E7","",""
"","TEXT_VOICEMAN_06000_004730_NIDHANA<tab>(-Arkasodara Alchemist-)Soon we will have a talisman capable of nullifying the aetheric emissions from that accursed tower!","TEXT_VOICEMAN_06000_004730_NIDHANA<tab>Fabriquer les talismans qui nous protégeront de l'éther néfaste de la tour de l'apocalypse<var 1D /var>!","","True","0x000001E8","",""
"","TEXT_VOICEMAN_06000_004740_NIDHANA<tab>(-Arkasodara Alchemist-)Did...did I say something wrong? Are you not here with Varshahn? Wait, who <var 1A 02 /var>are<var 1A 01 /var> you people?","TEXT_VOICEMAN_06000_004740_NIDHANA<tab>Hmm, attendez une seconde... Je croyais que vous accompagniez Varshahn, mais on dirait que non. Peut-on savoir qui vous êtes<var 1D /var>?","","True","0x000001E9","",""
"","TEXT_VOICEMAN_06000_004750_NIDHANA<tab>(-Arkasodara Alchemist-)Of course! You're the one Krile sent─the “Warrior of Light” we've been waiting for!","TEXT_VOICEMAN_06000_004750_NIDHANA<tab>Alors c'est toi, l'ami<var 08 E905 ((e)) (()) /var> de Krile qui possède le pouvoir de l'Écho<var 1D /var>! D'accord, je comprends tout maintenant<var 1D /var>!","","True","0x000001EA","",""
"","TEXT_VOICEMAN_06000_004760_ALCHEMISTOFTHEGREATWORKA<tab>This is a day of celebration! Praise be to Cinduruva!","TEXT_VOICEMAN_06000_004760_ALCHEMISTOFTHEGREATWORKA<tab>Quelle journée miraculeuse<var 1D /var>! Louées soient les sœurs Magus<var 1D /var>!","","True","0x000001EB","",""
"","TEXT_VOICEMAN_06000_004770_ALCHEMISTOFTHEGREATWORKB<tab>The winds have shifted. I feel it! The end to our toil is near!","TEXT_VOICEMAN_06000_004770_ALCHEMISTOFTHEGREATWORKB<tab>Nous touchons au but... Les talismans seront bientôt au point, peut-être même plus vite que prévu<var 1D /var>!","","True","0x000001EC","",""
"","TEXT_VOICEMAN_06000_004780_ALCHEMISTOFTHEGREATWORKC<tab>I feel it, too. My head hasn't been this clear in days...","TEXT_VOICEMAN_06000_004780_ALCHEMISTOFTHEGREATWORKC<tab>On dirait bien<var 1D /var>! Quoi qu'il en soit, cette sieste m'a franchement requinqué. J'suis motivé comme jamais<var 1D /var>!","","True","0x000001ED","",""
"","TEXT_VOICEMAN_06000_004790_ESTINIEN<tab>Tell me, how did you acquire those scales?","TEXT_VOICEMAN_06000_004790_ESTINIEN<tab>On peut savoir d'où elles viennent, ces écailles<var 1D /var>?","","True","0x000001EE","",""
"","TEXT_VOICEMAN_06000_004800_VARSHAHN<tab>Curious that it concerns you so.","TEXT_VOICEMAN_06000_004800_VARSHAHN<tab>Ça vous intéresse vraiment<var 1D /var>? C'est rare qu'on me pose cette question, vous savez...","","True","0x000001EF","",""
"","TEXT_VOICEMAN_06000_004810_VARSHAHN<tab>But worry not. They were freely given by the dragon with whom our satrap has forged a lawful pact.","TEXT_VOICEMAN_06000_004810_VARSHAHN<tab>Mais vous n'avez pas à vous inquiéter, nous n'avons rien fait de mal pour nous les procurer. Notre satrape les reçoit directement d'un dragon avec lequel il a noué un pacte.","","True","0x000001F0","",""
"","TEXT_VOICEMAN_06000_004820_ESTINIEN<tab>...That is well.","TEXT_VOICEMAN_06000_004820_ESTINIEN<tab>... Content de voir que les humains et les dragons fraternisent chez vous aussi.","","True","0x000001F1","",""
"","TEXT_VOICEMAN_06000_004830_ALCHEMISTOFTHEGREATWORKA<tab>You must be quite familiar with dragonkin, yes?","TEXT_VOICEMAN_06000_004830_ALCHEMISTOFTHEGREATWORKA<tab>Dites... Vous avez l'air de vous y connaître en dragons, non<var 1D /var>?","","True","0x000001F2","",""
"","TEXT_VOICEMAN_06000_004840_ALCHEMISTOFTHEGREATWORKB<tab>Is this their congealed blood I see on your weapon?","TEXT_VOICEMAN_06000_004840_ALCHEMISTOFTHEGREATWORKB<tab>Et les traces rouges sur votre lance, là... Ce serait pas du sang draconique coagulé, par hasard<var 1D /var>?","","True","0x000001F3","",""
"","TEXT_VOICEMAN_06000_004850_ALCHEMISTOFTHEGREATWORKC<tab>Hrm... Speaking of dragon blood...you yourself have been infused with it, have you not?","TEXT_VOICEMAN_06000_004850_ALCHEMISTOFTHEGREATWORKC<tab>En parlant de sang draconique, je serais pas étonné de découvrir que vous vous baignez ré<var 16 /var>gu<var 16 /var>liè<var 16 /var>re<var 16 /var>ment dedans pour conserver toute votre force et votre jeunesse<var 1D /var>!","","True","0x000001F4","",""
"","TEXT_VOICEMAN_06000_004860_ALCHEMISTOFTHEGREATWORKC<tab>I should like to draw a phial or two, if so!","TEXT_VOICEMAN_06000_004860_ALCHEMISTOFTHEGREATWORKC<tab>Oh oui, c'est même certain<var 1D /var>! Ça vous dérangerait qu'on vous fasse une petite prise de sang pour l'analyser<var 1D /var>? Juste une toute petite, vous ne sentirez rien, c'est promis<var 1D /var>! Allez, venez avec nous par ici<var 1D /var>!","","True","0x000001F5","",""
"","TEXT_VOICEMAN_06000_004870_ESTINIEN<tab>Now, see here...!","TEXT_VOICEMAN_06000_004870_ESTINIEN<tab>Quoi<var 1D /var>!? Laissez-moi tranquille<var 1D /var>!","","True","0x000001F6","",""
"","TEXT_VOICEMAN_06000_004880_ALCHEMISTOFTHEGREATWORKA<tab>Come along, come along! I must <var 1A 02 /var>insist<var 1A 01 /var> that you visit our laboratory!","TEXT_VOICEMAN_06000_004880_ALCHEMISTOFTHEGREATWORKA<tab>C'est bon, on le tient<var 1D /var>! Chevalier dragon, vous êtes of<var 16 /var>fi<var 16 /var>ciel<var 16 /var>le<var 16 /var>ment notre invité<var 1D /var>!","","True","0x000001F7","",""
"","TEXT_VOICEMAN_06000_004890_ESTINIEN<tab>Cease your shoving, or so help me...!","TEXT_VOICEMAN_06000_004890_ESTINIEN<tab>Lâchez-moi im<var 16 /var>mé<var 16 /var>dia<var 16 /var>te<var 16 /var>ment, vous m'entendez<var 1D /var>!?","","True","0x000001F8","",""
"","TEXT_VOICEMAN_06000_004900_NIDHANA<tab>(-Arkasodara Alchemist-)Oh dear, your poor companion. What with the new scales and your timely arrival, my colleagues are a little giddy with excitement.","TEXT_VOICEMAN_06000_004900_NIDHANA<tab>Ne vous en faites pas pour votre ami, il ne lui arrivera rien. Il faut comprendre mes confrères<var 1D /var>: entre la nouvelle fournée d'écailles et votre soudaine arrivée parmi nous, ils sont un peu... surexcités.","","True","0x000001F9","",""
"","TEXT_VOICEMAN_06000_004910_NIDHANA<tab>(-Arkasodara Alchemist-)No harm will come to him, I promise! Meanwhile, shall we find a quiet place to talk?","TEXT_VOICEMAN_06000_004910_NIDHANA<tab>Ils vont pro<var 16 /var>ba<var 16 /var>ble<var 16 /var>ment lui faire une petite prise de sang, mais c'est pour la bonne cause, je vous assure<var 1D /var>! Pendant ce temps, que diriez-vous si nous allions discuter dans un lieu plus confortable<var 1D /var>?","","True","0x000001FA","",""
"","TEXT_VOICEMAN_06000_004920_NIDHANA<tab>As you may have guessed, I am Nidhana─the alchemist who sent the request to your Mistress Krile. We have workshops across the nation collaborating on this research project, but it is here─at the Great Work─where I collate our results.","TEXT_VOICEMAN_06000_004920_NIDHANA<tab>Au fait, je me présente<var 1D /var>! Je suis Nidhana, l'alchimiste dont Krile vous a parlé. Nos recherches actuelles exigent la col<var 16 /var>la<var 16 /var>bo<var 16 /var>ra<var 16 /var>tion de plusieurs ateliers, répartis dans tout le pays, mais le chef-lieu des opérations se trouve ici, au Grand Œuvre.","","True","0x000001FB","",""
"","TEXT_VOICEMAN_06000_004930_NIDHANA<tab>Come with me, all of you, and I can explain the crux of the situation.","TEXT_VOICEMAN_06000_004930_NIDHANA<tab>En tout cas, je suis ravie que vous nous ayez rejoints aussi vite. Suivez-moi, nous allons faire con<var 16 /var>nais<var 16 /var>san<var 16 /var>ce<var 1D /var>!","","True","0x000001FC","",""
