"location","source","target","id","fuzzy","context","translator_comments","developer_comments"
"","Ours has been a long road, but we have reached our destination. We have completed the reconstruction of the Firmament. And though this is by any measure a remarkable feat, we have not simply rebuilt structures. We have rebuilt lives. And beside the honor of working with such a gathering of fine folk, this is what fills me with the greatest pride.

We could not have accomplished this without the tireless efforts of all involved. No words will suffice to express my gratitude, but I wish to thank you from the bottom of my heart. Till fate next sees fit to bring us together again, I wish you every success.

Francel de Haillenarte

～Addendum～
Supplies are ever needed in the running of the district, and we will continue to welcome your kind donations.<tab>","J'ai l'insigne honneur de déclarer Azurée reconstruit<var 1D /var>!

En ce jour à marquer d'une pierre blanche, mes pensées se tournent vers celles et ceux à qui nous devons ce miracle. Un monument leur a été dédié, mais je tiens personnellement à leur offrir mes plus sincères re<var 16 /var>mer<var 16 /var>cie<var 16 /var>ments.
Vos mains nous ont offert le ciel<var 1D /var>! Merci infiniment<var 1D /var>!

PS<var 1D /var>: Nous acceptons toujours vos donations, et nous continuerons de vous récompenser pour celles-ci.

Francel de Haillenarte, superviseur général du projet de recon<var 16 /var>struc<var 16 /var>tion<tab>","","False","0x00000057","",""
"","The Skyrise Celebration is underway!<tab>Francel","La Grande Célébration d'Azurée bat son plein<var 1D /var>!<tab>Francel","","False","0x00000058","",""
"","Owing to the tireless efforts of our esteemed skybuilders, the Firmament stands completed in all its resplendent glory. To mark this most momentous of occasions, and to bid welcome to visitors from lands near and far to our new home, we are presently hosting a festival─the Skyrise Celebration.

Chief among the amusements at the festival are diverting games known as fêtes, and attractive prizes await those who participate. We hope that you will find a moment to join us in the revelry.

Francel<tab>","Grâce aux artisans et récolteurs de tous horizons qui ont apporté leur con<var 16 /var>tri<var 16 /var>bu<var 16 /var>tion à notre projet, la recon<var 16 /var>struc<var 16 /var>tion d'Azurée est enfin achevée.

Pour fêter cet événement d'importance et souhaiter la bienvenue à tous les futurs visiteurs de notre nouveau quartier, nous organisons ac<var 16 /var>tu<var 16 /var>el<var 16 /var>le<var 16 /var>ment la “Grande Célébration d'Azurée”<var 1D /var>!

À cette occasion, nous vous invitons à participer à des “festes”, des activités ludiques qui se tiennent ré<var 16 /var>gu<var 16 /var>liè<var 16 /var>re<var 16 /var>ment et ne manqueront pas de vous divertir. Et bien sûr, il y a des récompenses à la clef<var 1D /var>!

Je vous souhaite à tous de passer un agréable moment.

Francel de Haillenarte, superviseur général du projet de recon<var 16 /var>struc<var 16 /var>tion<tab>","","False","0x00000059","",""
"","Fêtes are large-scale games held at regular intervals as part of the Skyrise Celebration.

During an event period, several fêtes are held in succession and offer rewards to participants.

We look forward to seeing artisans of all persuasions out there taking part in these light-hearted challenges.<tab>","Les festes sont des activités ludiques de grande envergure organisées à intervalles réguliers durant la Grande Célébration d'Azurée.

Elles se déroulent par séries de cinq en divers endroits à travers le quartier et offrent des récompenses à celles et ceux qui y prennent part.

Nous espérons que vous prendrez plaisir à y participer, et n'oubliez pas, l'essentiel est de s'amuser<var 1D /var>!<tab>","","False","0x0000005A","",""
